ticker,title,url,time_published,source,summary,sentiment_score,sentiment_label,ticker_sentiment_score,ticker_sentiment_label,relevance_score,category,ai_keywords_found
CSCO,Virtual Power Plant Market Size to Hit USD 6.74 Billion by 2028 | Exhibit a CAGR of 32.89%,https://www.benzinga.com/pressreleases/22/04/g26805502/virtual-power-plant-market-size-to-hit-usd-6-74-billion-by-2028-exhibit-a-cagr-of-32-89,20220426T081159,Benzinga,"Pune, India, April  26, 2022   ( GLOBE NEWSWIRE )  -- The global virtual power plant market size is expected to grow from USD 0.88 billion in 2021 to USD 6.47 billion by 2028, exhibiting a CAGR of 32.89% during the forecast period. The market size stood at USD 0.71 billion in 2020. The increasing ac",-0.117932,Neutral,0.028271,Neutral,0,broad,
CSCO,Cisco Systems  ( CSCO )  Outpaces Stock Market Gains: What You Should Know,https://www.zacks.com/stock/news/1907395/cisco-systems-csco-outpaces-stock-market-gains-what-you-should-know,20220425T214519,Zacks Commentary,"Cisco Systems (CSCO) closed the most recent trading day at $51.94, moving +1.13% from the previous trading session.",0.023542,Neutral,0.519002,Neutral,0,focused,AI
CSCO,Carrier  ( CARR )  to Report Q1 Earnings: What's in the Cards?,https://www.zacks.com/stock/news/1907194/carrier-carr-to-report-q1-earnings-whats-in-the-cards,20220425T160500,Zacks Commentary,"Carrier Global's (CARR) Q1 results are likely to reflect strength across residential HVAC and light commercial businesses. Yet, supply-chain constraints might have been a negative.",0.089317,Neutral,0.171688,Neutral,0,focused,AI
CSCO,KLA Corp.  ( KLAC )  to Report Q3 Earnings: What's in Store?,https://www.zacks.com/stock/news/1907189/kla-corp-klac-to-report-q3-earnings-whats-in-store,20220425T160100,Zacks Commentary,"KLA Corp.'s (KLAC) fiscal Q3 results might reflect the gains from strong momentum in core markets and strength in wafer fabrication equipment. Yet, supply chain constraints might have been a concern.",0.018654,Neutral,0.173832,Neutral,0,focused,AI
CSCO,TE Connectivity  ( TEL )  to Post Q2 Earnings: What's in Store?,https://www.zacks.com/stock/news/1907271/te-connectivity-tel-to-post-q2-earnings-whats-in-store,20220425T155800,Zacks Commentary,"TE Connectivity's (TEL) fiscal second-quarter results are expected to reflect gains from strength across the Transportation, Industrial and Communication segments.",0.022482,Neutral,0.164282,Neutral,0,focused,AI
CSCO,PayPal  ( PYPL )  to Post Q1 Earnings: What's in the Offing?,https://www.zacks.com/stock/news/1907249/paypal-pypl-to-post-q1-earnings-whats-in-the-offing,20220425T154400,Zacks Commentary,PayPal's (PYPL) first-quarter results are expected to reflect strength across Venmo and Checkout experiences.,0.07597,Neutral,0.165522,Neutral,0,broad,
CSCO,Ultra Clean  ( UCTT )  to Report Q1 Earnings: What's in Store?,https://www.zacks.com/stock/news/1907245/ultra-clean-uctt-to-report-q1-earnings-whats-in-store,20220425T153900,Zacks Commentary,Ultra Clean's (UCTT) first-quarter 2022 results are likely to reflect benefits from the strong demand for semiconductor products and the upward trajectory of the WFE market.,0.044694,Neutral,0.244436,Neutral,0,broad,
CSCO,Virtual Desktop Infrastructure  ( VDI )  Market revenue to cross USD 55 Bn by 2028: Global Market Insights Inc.,https://www.prnewswire.com/news-releases/virtual-desktop-infrastructure-vdi-market-revenue-to-cross-usd-55-bn-by-2028-global-market-insights-inc-301531776.html,20220425T110300,PR Newswire,The extensive penetration of cloud computing services and enhancements in virtualization technologies are set to fuel the VDI market expansion. VDI infrastructure has hybrid & multi-cloud deployment options along with rapid provisioning capabilities. The rising demand to manage the accessibility of multiple software and applications over digital workspaces can be addressed by deploying Virtual Desktop Infrastructure  ( VDI )  platforms.,0.057046,Neutral,0.04881,Neutral,0,broad,
CSCO,A Trapezoid? Conference tables change shape in hybrid-work era,https://www.business-standard.com/article/companies/a-trapezoid-conference-tables-change-shape-in-hybrid-work-era-122042300884_1.html,20220423T153800,Business Standard,"As employees embrace hybrid work, companies need to reevaluate meeting spaces when some attendees are in the office and others dial in",0.068297,Neutral,0.078354,Neutral,0,broad,
CSCO,MaxLinear  ( MXL )  to Report Q1 Earnings: What's in the Cards?,https://www.zacks.com/stock/news/1905466/maxlinear-mxl-to-report-q1-earnings-whats-in-the-cards,20220422T145400,Zacks Commentary,"MaxLinear's (MXL) first-quarter 2022 results are expected to reflect strength across broadband access, connectivity, infrastructure and industrial multi-markets.",0.037737,Neutral,0.174545,Neutral,0,broad,
CSCO,Teradyne  ( TER )  to Report Q1 Earnings: What's in the Cards?,https://www.zacks.com/stock/news/1905381/teradyne-ter-to-report-q1-earnings-whats-in-the-cards,20220422T144500,Zacks Commentary,"Teradyne (TER) is likely to have benefited from strength in test and industrial automation businesses in Q1. Yet, a challenging supply environment might have hurt its performance.",0.025874,Neutral,0.189918,Neutral,0,focused,automation
CSCO,Garmin  ( GRMN )  to Report Q1 Earnings: What's in the Cards?,https://www.zacks.com/stock/news/1905375/garmin-grmn-to-report-q1-earnings-whats-in-the-cards,20220422T143800,Zacks Commentary,"Garmin's (GRMN) first-quarter 2022 results are likely to reflect strength across marine, automotive and outdoor segments. Yet, mounting expenses might have been a concern.",0.082656,Neutral,0.15462,Neutral,0,broad,
CSCO,What's in Store for United Microelectronics'  ( UMC )  Q1 Earnings?,https://www.zacks.com/stock/news/1905371/whats-in-store-for-united-microelectronics-umc-q1-earnings,20220422T133700,Zacks Commentary,"United Microelectronics (UMC) first-quarter 2022 results will likely reflect benefits from a robust demand environment related to 5G, and artificial intelligence of things.",0.081456,Neutral,0.221414,Neutral,0,focused,artificial intelligence
CSCO,"CSCO: Cisco Systems vs. Calix, Inc: Which Communication Equipment Stock is a Better Buy?",https://stocknews.com/news/csco-calx-cisco-systems-vs-calix-inc-which-communication-equipment-stock-is/,20220422T132227,Stocknews.com,"Cisco Systems, Inc.  (  CSCO  )  in San Jose, Calif., and Calix, Inc.  (  CALX  )  in Petaluma, Calif., are two prominent players in the communication equipment industry. CSCO designs and manufactures Internet Protocol  (  IP  )  based networking products and services related to communications and information technology worldwide. It sells its products and services directly and through systems integrators, service providers, resellers, and distributors. In comparison, CALX is a provider of cloud and software platforms, systems, and services focused on the access network-the portion of the network that governs available bandwidth and determines the range of services offered to subscribers. It develops and markets its cloud and software platforms, systems, and services to broadband service providers  (  BSPs  )  through its direct sales force as well as select resellers.",0.053395,Neutral,0.581666,Neutral,0,focused,AI
CSCO,"This will be a year for stock market traders - here are 12 companies to favor, says 40-year investing veteran Bob Doll",https://www.marketwatch.com/story/this-will-be-a-year-for-stock-market-traders-here-are-12-companies-to-favor-says-40-year-investing-veteran-bob-doll-11650630237,20220422T122300,MarketWatch,"Own value, energy, financials and old-school technology until a recession arrives in 2023.",-0.076569,Neutral,0.059474,Neutral,0,broad,
CSCO,Is iShares MSCI USA Multifactor ETF  ( LRGF )  a Strong ETF Right Now?,https://www.zacks.com/stock/news/1905100/is-ishares-msci-usa-multifactor-etf-lrgf-a-strong-etf-right-now,20220422T102007,Zacks Commentary,Smart Beta ETF report for LRGF,0.031084,Neutral,0.112427,Neutral,0,focused,smart
CSCO,What's in the Cards for Texas Instruments'  ( TXN )  Q1 Earnings?,https://www.zacks.com/stock/news/1904499/whats-in-the-cards-for-texas-instruments-txn-q1-earnings,20220421T160500,Zacks Commentary,Texas Instruments' (TXN) first-quarter 2022 results are likely to reflect gains from solid momentum across Analog and Embedded Processing segments.,0.074013,Neutral,0.182139,Neutral,0,focused,AI
CSCO,IoT Middleware Market was Valued at USD 10.1 Billion in 2020 and Projected to Grow at a CAGR of 18.3% by 2028 - Report by Market Research Future  ( MRFR ) ,https://www.benzinga.com/pressreleases/22/04/g26742155/iot-middleware-market-was-valued-at-usd-10-1-billion-in-2020-and-projected-to-grow-at-a-cagr-of-18,20220421T153000,Benzinga,"New York, US, April  21, 2022   ( GLOBE NEWSWIRE )  -- Market Overview: According to a comprehensive research report by Market Research Future  ( MRFR ) , ""IoT Middleware Market information by Platform Type, by Organization Size, by Vertical and Region - forecast to 2028"" market size to grow at a co",0.036348,Neutral,0.029363,Neutral,0,broad,
CSCO,Online Education Market Size to Surpass USD 197.64 Billion with 22.7% CAGR by 2030 - Report by Market Research Future  ( MRFR ) ,https://www.benzinga.com/pressreleases/22/04/g26732862/online-education-market-size-to-surpass-usd-197-64-billion-with-22-7-cagr-by-2030-report-by-market,20220421T111000,Benzinga,"New York, US, April  21, 2022   ( GLOBE NEWSWIRE )  -- Market Overview: According to a comprehensive research report by Market Research Future  ( MRFR ) , ""Online Education Market information by Learning Type, by Components, by Vertical and Region - forecast to 2030"" market size to reach USD 197.64 ",0.0363,Neutral,0.031755,Neutral,0,broad,
CSCO,Tech Wage Inflation Puts Pressure on Companies,https://www.wsj.com/articles/tech-wage-inflation-puts-pressure-on-companies-11650533400,20220421T093000,Wall Street Journal,"Wage inflation in the technology sector is accelerating, pressuring companies to boost compensation for key roles by 20% or more as they compete for a limited pool of workers skilled in areas such as cloud computing and data science.",0.060536,Neutral,0.071357,Neutral,0,focused,data science
CSCO,EVs can store power for our homes and the grid --- Why 'vehicle-to-everything' technology is a must-follow investing theme,https://www.marketwatch.com/story/evs-can-store-power-for-our-homes-and-the-grid-why-vehicle-to-everything-technology-is-a-must-follow-investing-theme-11650485693,20220420T201400,MarketWatch,"The Biden administration joins private sector to push ""vehicle-to-everything"" technology. V2X is a growth area for EVs, as well as chips and other tech.",0.105348,Neutral,0.094762,Neutral,0,broad,
CSCO,IBD 50 Stocks To Watch: Why Cloud Networking Company Is Among Best Stocks,https://www.investors.com/research/best-stocks-arista-networks-ibd-50-member-cloud-networking-company-in-bullish-pattern/,20220420T195200,Investors Business Daily,Best Stocks: This IBD 50 Member And Cloud Networking Company Is In A Bullish Pattern Investor's Business Daily,0.152813,Somewhat-Bullish,0.2138,Neutral,0,focused,AI
CSCO,Advanced Optics Market to Worth USD 477.42 Billion by  ( 2021-2028 )  | Advanced Optics Industry CAGR of 9.62%,https://www.benzinga.com/pressreleases/22/04/g26714872/advanced-optics-market-to-worth-usd-477-42-billion-by-2021-2028-advanced-optics-industry-cagr-of-9,20220420T142202,Benzinga,"Pune, India, April  20, 2022   ( GLOBE NEWSWIRE )  -- The global advanced optics market size was USD 242.45 billion in 2020. The market is expected to grow from USD 250.93 billion in 2021 to USD 477.42 billion by 2028, exhibiting a CAGR of 9.62% during the forecast period. The rising awareness regar",0.036136,Neutral,0.029367,Neutral,0,broad,
CSCO,Smart Manufacturing Market Worth $446.24 Billion by 2029- Exclusive Report by Meticulous Research®,https://www.benzinga.com/pressreleases/22/04/g26709350/smart-manufacturing-market-worth-446-24-billion-by-2029-exclusive-report-by-meticulous-research,20220420T121634,Benzinga,"Redding,  California, April  20, 2022   ( GLOBE NEWSWIRE )  -- According to a new market research report titled, 'Smart Manufacturing Market by Technology  ( Robotics, AI, IIoT, Cloud, AR/VR ) , Application  ( Machine Inspection, Energy; Quality, and Warehouse Management; Planning, Surveillance, Opt",0.019154,Neutral,0.017052,Neutral,0,focused,"AI, smart"
CSCO,Moxo Named to 2022 WealthTech100,https://www.prnewswire.com/news-releases/moxo-named-to-2022-wealthtech100-301528791.html,20220420T120000,PR Newswire,"""In today's digital-first world, we're extremely proud to support wealth management companies with technology that enables them to provide access to high-value services quickly and efficiently,"" said Leena Iyar, Chief Brand Officer for Moxo. ""Moxo is committed to continually providing an innovative client management solution to ensure businesses can build and support meaningful client interactions through modern digital automation.""",0.155378,Somewhat-Bullish,0.068035,Neutral,0,focused,"AI, automation"
CSCO,Cisco Systems  ( CSCO )  Gains But Lags Market: What You Should Know,https://www.zacks.com/stock/news/1902596/cisco-systems-csco-gains-but-lags-market-what-you-should-know,20220419T214522,Zacks Commentary,"Cisco Systems (CSCO) closed the most recent trading day at $51.83, moving +1.41% from the previous trading session.",0.044425,Neutral,0.571381,Neutral,0,focused,AI
CSCO,Tesla Goes on Offensive in California Race Discrimination Suit,https://www.thestreet.com/investing/tesla-racism-lawsuit,20220419T161900,The Street,"Elon Musk has been busy with Twitter in recent weeks, but a new filing suggests there are problems with Tesla.",-0.301252,Somewhat-Bearish,0.98136,Somewhat-Bearish,0,broad,
CSCO,"Down 8.7% in 4 Weeks, Here's Why You Should You Buy the Dip in Cisco  ( CSCO ) ",https://www.zacks.com/stock/news/1902172/down-87-in-4-weeks-heres-why-you-should-you-buy-the-dip-in-cisco-csco,20220419T133504,Zacks Commentary,"The heavy selling pressure might have exhausted for Cisco (CSCO) as it is technically in oversold territory now. In addition to this technical measure, strong agreement among Wall Street analysts in revising earnings estimates higher indicates that the stock is ripe for a trend reversal.",-0.07929,Neutral,0.480818,Neutral,0,broad,
CSCO,Entelar Signs Reseller Agreement with Radware,https://www.benzinga.com/pressreleases/22/04/g26682192/entelar-signs-reseller-agreement-with-radware,20220419T100000,Benzinga,"AUCKLAND, New Zealand and MAHWAH, N.J., April  19, 2022   ( GLOBE NEWSWIRE )  -- Radware®  ( NASDAQ:RDWR ) , a leading provider of cyber security and application delivery solutions, and Entelar announced today that they have signed a reseller agreement. As part of the agreement, Entelar is expanding",0.129154,Neutral,0.050759,Bullish,0,broad,
CSCO,Entelar Signs Reseller Agreement with Radware,https://www.globenewswire.com/news-release/2022/04/19/2424160/8980/en/Entelar-Signs-Reseller-Agreement-with-Radware.html,20220419T100000,GlobeNewswire,Entelar to offer Radware's application and network security solutions Entelar to offer Radware's application and network security solutions,0.101045,Neutral,0.051993,Neutral,0,broad,
CSCO,Tesla Facing 'Open Investigation' By US Federal Agency,https://www.benzinga.com/government/22/04/26680747/tesla-faces-federal-open-investigation-over-racism-allegations-what-you-should-know,20220419T045746,Benzinga,"Tesla Inc  ( NASDAQ: TSLA )  is facing an ""open investigation"" by a U.S. federal agency, Bloomberg News reported on Monday, citing the EV maker's state court filing in Oakland.
What Happened: Elon Musk-led Tesla linked the investigation by the U.S. Equal Employment Opportunity Commission  ( EEOC )  ",-0.179741,Somewhat-Bearish,0.291818,Somewhat-Bearish,0,broad,
CSCO,Global Internet of Things  ( IoT )  Analytics Market to Reach $72 Billion by 2026,https://www.prnewswire.com/news-releases/global-internet-of-things-iot-analytics-market-to-reach-72-billion-by-2026-301526449.html,20220418T153500,PR Newswire,• Access to our digital archives and MarketGlass Research Platform,0.009241,Neutral,0.202479,Neutral,0,broad,
CSCO,MarketsandMarkets releases 360 Quadrant's Top Cybersecurity Companies for Q1 2022,https://www.prnewswire.com/news-releases/marketsandmarkets-releases-360-quadrants-top-cybersecurity-companies-for-q1-2022-301526974.html,20220418T150000,PR Newswire,"CHICAGO, April 18, 2022 /PRNewswire/ -- MarketsandMarkets has released 360 Quadrant for Top Cybersecurity companies to help businesses make quicker and more informed decisions. Companies' product portfolios and business strategies are used to construct ranking quadrants, which will be revised every six months based on market and regional studies and advancements in the cybersecurity industry. Data Loss Prevention  ( DLP ) , Antivirus/Antimalware, Encryption, Identity and Access Management, Firewall, Intrusion Detection/Intrusion Prevention System  ( IDS/IPS ) , Disaster Recovery, Distributed Denial of Service  ( DDoS )  Mitigation, and Advanced Persistent Threat  ( APT )  protection were the top criteria for company evaluation out of 132 parameters.",0.060966,Neutral,0.069636,Neutral,0,broad,
CSCO,Can Modest Revenue Growth Buoy Verizon's  ( VZ )  Q1 Earnings?,https://www.zacks.com/stock/news/1901592/can-modest-revenue-growth-buoy-verizons-vz-q1-earnings,20220418T143200,Zacks Commentary,"Verizon (VZ) is expected to have recorded higher aggregate revenues year over year in first-quarter 2022, primarily due to the positive momentum in its core wireless business.",0.178,Somewhat-Bullish,0.05054,Somewhat-Bullish,0,broad,
CSCO,Out With The Old - Why Arista Networks Is Crushing Cisco,https://www.forbes.com/sites/jonmarkman/2022/04/14/out-with-the-old---why-arista-networks-is-crushing-cisco/,20220414T152842,Forbes,"Investors should focus on Arista Networks (ANET), one of those competitors. The big attraction is Arista's CloudVision software. The platform facilitates cloud-based, network virtualization. This is a fancy way of saying software services like security can be bolted on at scale with little fuss.",0.057369,Neutral,0.398419,Neutral,0,broad,
CSCO,Cisco Systems  ( CSCO )  Gains But Lags Market: What You Should Know,https://www.zacks.com/stock/news/1898926/cisco-systems-csco-gains-but-lags-market-what-you-should-know,20220413T214520,Zacks Commentary,"Cisco Systems (CSCO) closed at $52.15 in the latest trading session, marking a +0.64% move from the prior day.",-0.024502,Neutral,0.616996,Neutral,0,focused,AI
CSCO,Cisco Systems Whale Trades For April 13,https://www.benzinga.com/markets/options/22/04/26621325/cisco-systems-whale-trades-for-april-13,20220413T180407,Benzinga,"Someone with a lot of money to spend has taken a bearish stance on Cisco Systems  ( NASDAQ:CSCO ) .
And retail traders should know.
We noticed this today when the big position showed up on publicly available options history that we track here at Benzinga.
Whether this is an institution or just a wea",-0.026179,Neutral,0.81909,Neutral,0,focused,AI
CSCO,Zoom is transforming its platform as hybrid work becomes permanent,https://www.marketwatch.com/story/zoom-is-transforming-its-platform-as-hybrid-work-becomes-permanent-11649868639,20220413T165000,MarketWatch,"As Zoom Video Communications Inc. Chief Financial Officer Kelly Steckelberg sees it, the hybrid work model is here to stay --- which means Zoom needs to constantly change the way it looks to customers.",0.075106,Neutral,0.346157,Neutral,0,broad,
CSCO,What's Behind The Recent Dow Jones Stock Market Performance?,https://www.forbes.com/sites/qai/2022/04/13/whats-behind-the-recent-dow-jones-stock-market-performance/,20220413T142925,Forbes,"The Dow Jones Industrial Average kicked off this week with additional losses, egged on by declines in the tech sector. Here's what  you should know.",-0.33461,Somewhat-Bearish,0.057991,Somewhat-Bearish,0,broad,
CSCO,Tech Sell-Off: 2 Unstoppable Stocks to Buy Right Now,https://www.fool.com/investing/2022/04/13/tech-sell-off-2-unstoppable-stocks-to-buy-now/,20220413T112500,Motley Fool,Digital transformation should be a tailwind for these businesses.,0.222842,Somewhat-Bullish,0.051774,Neutral,0,focused,AI
CSCO,Public Safety Market to record USD 26.21 Bn incremental growth | Europe to occupy 39% global market share | Discover Company Insights in Technavio,https://www.prnewswire.com/news-releases/public-safety-market-to-record-usd-26-21-bn-incremental-growth--europe-to-occupy-39-global-market-share--discover-company-insights-in-technavio-301522654.html,20220413T064500,PR Newswire,"Market Dynamics

The market is driven by factors such as the adoption of machine learning and AI-based public safety solution, governmental regulation",0.018289,Neutral,0.051886,Neutral,0,focused,"machine learning, AI"
CSCO,Dow Jones Falls As Inflation Hits 40-Year High; This Warren Buffett Stock Spikes As Oil Jumps,https://www.investors.com/market-trend/stock-market-today/dow-jones-falls-as-inflation-hits-40-year-high-warren-buffett-stock-spikes-as-oil-jumps/,20220412T201900,Investors Business Daily,Dow Jones Falls As Inflation Hits 40-Year High; Warren Buffett Stock Spikes As Oil Jumps Investor's Business Daily,-0.030722,Neutral,0.081942,Bearish,0,focused,AI
CSCO,Indexes See Gains Fade; Why This Breakout REIT Is Worth Considering,https://www.investors.com/market-trend/stock-market-today/dow-jones-nasdaq-see-gains-wither-oil-moves-higher-while-this-reit-breaks-out/,20220412T180700,Investors Business Daily,"Dow Jones, Nasdaq Rise But Trade Near Intraday Lows; Oil Moves Higher While This REIT Breaks Out Investor's Business Daily",-0.300204,Somewhat-Bearish,0.123621,Bearish,0,focused,AI
CSCO,"Stocks making the biggest moves midday: Chipotle, PG&E, Marathon Oil and CarMax",https://www.cnbc.com/2022/04/12/stocks-making-the-biggest-moves-midday-chipotle-pge-marathon-oil-and-carmax.html,20220412T162624,CNBC,These are the stocks posting the largest moves in midday trading.,-0.19895,Somewhat-Bearish,0.111955,Bearish,0,broad,
CSCO,"Cisco, HPE Downgraded On Worries Over Competition, Supply Chain Constraints",https://www.investors.com/news/technology/csco-stock-hpe-stock-downgraded-on-worries-over-competition-supply-chain-constraints/,20220412T161900,Investors Business Daily,"Cisco, HPE Downgraded On Worries Over Competition, Supply Chain Constraints Investor's Business Daily",-0.071508,Neutral,0.78775,Neutral,0,focused,AI
CSCO,Stock Market Gains Despite Hotter Than Expected Inflation; Consumer Discretionary Stocks Lead,https://www.investors.com/market-trend/stock-market-today/stock-market-gains-despite-hotter-than-expected-inflation-consumer-discretionary-stocks-lead/,20220412T161800,Investors Business Daily,Stock Market Gains Despite Hotter Than Expected Inflation; Consumer Discretionary Stocks Lead Investor's Business Daily,-0.044609,Neutral,0.173666,Bearish,0,focused,AI
CSCO,"Zoom  ( ZM )  Introduces New Features, Improves Virtual Education",https://www.zacks.com/stock/news/1897932/zoom-zm-introduces-new-features-improves-virtual-education,20220412T150700,Zacks Commentary,Zoom (ZM) introduces new features for Chromebooks to enhance the hybrid learning experience for students and educators.,0.19698,Somewhat-Bullish,0.053521,Bullish,0,broad,
CSCO,"Stock Market Today: Dow Jones, S&P 500 Up On Key Inflation Data; Beyond Meat Expands Its Chicken Tenders To Over 8,000 Retailers",https://stockmarket.com/featured/stock-market-today-dow-jones-s-beyond-meat-expands-its-chicken-tenders-to-over-8000-retailers-2022-04-12,20220412T142347,StockMarket.com,"Markets rose on Tuesday as core inflation is slightly less than expected.
The post Stock Market Today: Dow Jones, S&P 500 Up On Key Inflation Data; Beyond Meat Expands Its Chicken Tenders To Over 8,000 Retailers appeared first on Stock Market News, Quotes, Charts and Financial Information | StockMar",0.05948,Neutral,0.119078,Neutral,0,focused,AI
CSCO,"Stock Market News for Apr 12, 2022",https://www.zacks.com/stock/news/1897878/stock-market-news-for-apr-12-2022,20220412T131600,Zacks Commentary,"Wall Street ended lower on Monday, led by a decline in rate-sensitive growth stocks.",-0.413673,Bearish,0.148685,Neutral,0,broad,
CSCO,Wi-Fi 6 Market worth $26.2 billion by 2027 - Exclusive Report by MarketsandMarkets™,https://www.prnewswire.com/news-releases/wi-fi-6-market-worth-26-2-billion-by-2027--exclusive-report-by-marketsandmarkets-301523591.html,20220412T130000,PR Newswire,"CHICAGO, April 12, 2022 /PRNewswire/ -- According to a research report ""Wi-Fi 6 Market with COVID-19 Impact Analysis, by Offering  ( Hardware, Solution, and Services ) , Location Type  ( Indoor and Outdoor ) , Organization Size, Vertical  ( Education, Healthcare, Government, Manufacturing )  and Region - Global Forecast to 2027"", published by MarketsandMarkets™, the global Wi-Fi 6 Market size is expected to grow from USD 11.5 billion in 2022 to USD 26.2 billion by 2027, at a Compound Annual Growth Rate  ( CAGR )  of 17.9% during the forecast period.",0.04229,Neutral,0.040018,Neutral,0,broad,
CSCO,Futures Higher Ahead Of Key Inflation Report,https://www.investors.com/market-trend/stock-market-today/dow-jones-futures-rise-ahead-of-key-inflation-report-2/,20220412T120800,Investors Business Daily,Dow Jones Futures Rise Ahead Of Key Inflation Report After Monday's Market Sell-Off Investor's Business Daily,-0.16302,Somewhat-Bearish,0.073693,Somewhat-Bearish,0,focused,AI
CSCO,"Stock Market Today - 4/12: Stocks Edge Higher As Inflation Data Looms; Treasury Yields, Dollar Climb",https://www.thestreet.com/investing/stock-market-today-4-12-stocks-edge-higher-inflation-data-looms,20220412T114900,The Street,Wall Street is looking at a cautious open Tuesday as traders brace for what could be a market-shaking reading of March consumer price inflation.,-0.110986,Neutral,0.261453,Neutral,0,broad,
