ticker,title,url,time_published,source,summary,sentiment_score,sentiment_label,ticker_sentiment_score,ticker_sentiment_label,relevance_score,category,ai_keywords_found
CSCO,Apple Gets Its Bell Rung As Investor Fears Increase,https://www.benzinga.com/news/earnings/22/05/27168975/apple-gets-its-bell-rung-as-investor-fears-increase,20220512T155102,Benzinga,"This post contains sponsored advertising content. This content is for informational purposes only and not intended to be investing advice. ( Thursday Market Open ) Before the market open, the S&P 500 futures were trading below the 3,950 level, which some technical analysts saw as support for the i",-0.203525,Somewhat-Bearish,0.058824,Neutral,0,focused,AI
CSCO,MSFT: 3 Stocks to Buy as the Metaverse Continues to Grow,https://stocknews.com/news/msft-csco-tsm-3-stocks-to-buy-as-the-metaverse-continues-to-grow/,20220512T144947,Stocknews.com,"Surging inflation and concerns over the Fed's aggressive interest rate increases to bring prices down have been driving massive stock market sell-offs. However, this could be an opportune time for investors who bet on a company's long-term growth prospects based on its fundamental strengths and ...",0.08229,Neutral,0.188633,Neutral,0,broad,
CSCO,AMD Collaborates With Meta to Help Make Metaverse a Reality,https://www.zacks.com/stock/news/1923419/amd-collaborates-with-meta-to-help-make-metaverse-a-reality,20220512T141100,Zacks Commentary,Advanced Micro Devices (AMD) partners with Meta Platforms (FB) to build Evenstar radio units to make broadband more accessible worldwide and help in connecting people in the Metaverse.,0.038847,Neutral,0.190567,Neutral,0,broad,
CSCO,Sea Limited  ( SE )  to Report Q1 Earnings: What's in Store?,https://www.zacks.com/stock/news/1923373/sea-limited-se-to-report-q1-earnings-whats-in-store,20220512T132500,Zacks Commentary,Sea Limited's (SE) first-quarter 2022 results are likely to reflect strong momentum in digital entertainment and e-commerce business.,-0.00741,Neutral,0.156106,Neutral,0,focused,AI
CSCO,Take Two  ( TTWO )  to Report Q4 Earnings: What's in the Cards?,https://www.zacks.com/stock/news/1923354/take-two-ttwo-to-report-q4-earnings-whats-in-the-cards,20220512T131000,Zacks Commentary,Take Two (TTWO) is expected to have witnessed strength in popular franchises and expansion of its gaming portfolio despite stiff competition in the fiscal fourth quarter.,0.042033,Neutral,0.140594,Neutral,0,broad,
CSCO,Radcom  ( RDCM )  Surpasses Q1 Earnings and Revenue Estimates,https://www.zacks.com/stock/news/1923143/radcom-rdcm-surpasses-q1-earnings-and-revenue-estimates,20220512T121511,Zacks Commentary,"Radcom (RDCM) delivered earnings and revenue surprises of 500% and 1.18%, respectively, for the quarter ended March 2022. Do the numbers hold clues to what lies ahead for the stock?",0.000927,Neutral,0.189126,Neutral,0,broad,
CSCO,Jim Cramer Likes This Stock Over KKR,https://www.benzinga.com/trading-ideas/long-ideas/22/05/27156629/jim-cramer-likes-this-stock-over-kkr,20220512T121020,Benzinga,"On CNBC's ""Mad Money Lightning Round,"" Jim Cramer said he likes Blackstone Inc. ( NYSE: BX ) over KKR & Co. Inc. ( NYSE: Full story available on Benzinga.com",-0.045472,Neutral,0.778291,Neutral,0,focused,AI
CSCO,"The Zacks Analyst Blog Highlights Broadcom, PepsiCo, Cisco Systems, Medtronic, and Pioneer Natural Resources",https://www.zacks.com/stock/news/1923111/the-zacks-analyst-blog-highlights-broadcom-pepsico-cisco-systems-medtronic-and-pioneer-natural-resources,20220512T104400,Zacks Commentary,"Broadcom, PepsiCo, Cisco Systems, Medtronic, and Pioneer Natural Resources are part of Zacks top Analyst Blog.",-0.084045,Neutral,0.118725,Somewhat-Bearish,0,broad,
CSCO,Global 2000 List 2022: The Top 200,https://www.forbes.com/sites/forbesstaff/2022/05/12/forbes-global-2000-list-2022-the-top-200/,20220512T101500,Forbes,"War, pandemic and sluggish markets hit the world's billionaires this year. There are 2,668 of them on Forbes' 36th-annual ranking of the planet's richest people-87 fewer than a year ago. They're worth a collective $12.7 trillion-$400 billion less than in 2021.",0.010745,Neutral,0.009638,Neutral,0,focused,AI
CSCO,Cramer's lightning round: I like Blackstone over KKR,https://www.cnbc.com/2022/05/11/cramers-lightning-round-i-like-blackstone-over-kkr.html,20220511T233313,CNBC,"""Mad Money"" host Jim Cramer rings the lightning round bell, which means he's giving his answers to callers' stock questions at rapid speed.",0.022729,Neutral,0.479385,Somewhat-Bearish,0,broad,
CSCO,AAPL: Apple vs. Cisco: Which Dow Jones Stock is a Better Buy the Dip Candidate?,https://stocknews.com/news/aapl-csco-apple-vs-cisco-which-dow-jones-stock-is-a-better/,20220511T205437,Stocknews.com,"On Tuesday, the Dow Jones Industrial Average wiped out a 500-point gain, hitting a session-low of roughly 350 points, a fourth straight down day due to the concerns surrounding high inflation, the Russia-Ukraine war, lock-downs in China, and aggressive interest rate hikes.",0.028361,Neutral,0.518267,Neutral,0,focused,AI
CSCO,"Top Analyst Reports for Broadcom, Pepsi, & Cisco",https://www.zacks.com/research-daily/1922658/top-analyst-reports-for-broadcom-pepsi-cisco,20220511T202800,Zacks Commentary,"Today's Research Daily features new research reports on 16 major stocks, including Broadcom Inc. (AVGO), PepsiCo, Inc. (PEP), and Cisco Systems, Inc. (CSCO).",0.131755,Neutral,0.222633,Neutral,0,focused,AI
CSCO,Cisco Systems  ( CSCO )  Reports Next Week: Wall Street Expects Earnings Growth,https://www.zacks.com/stock/news/1922909/cisco-systems-csco-reports-next-week-wall-street-expects-earnings-growth,20220511T190005,Zacks Commentary,Cisco (CSCO) possesses the right combination of the two key ingredients for a likely earnings beat in its upcoming report. Get prepared with the key expectations.,0.013704,Neutral,0.333107,Neutral,0,broad,
CSCO,"Why Pete Najarian Is Buying Call Options In Bank of America, Cisco, Nvidia And These Under-The-Radar Stocks",https://www.benzinga.com/trading-ideas/long-ideas/22/05/27144105/why-pete-najarian-is-buying-call-options-in-bank-of-america-cisco-nvidia-and-these-under,20220511T182418,Benzinga,"Market Rebellion co-founder Pete Najarian is anticipating more volatility ahead for the markets, but that isn't stopping him from loading call options on stocks with a common theme.
Najarian's Approach: He's seeking out stocks that have been dragged down with the overall markets and are also a bit u",-0.119843,Neutral,0.309864,Neutral,0,broad,
CSCO,15 Stocks Moved By Traders on 'Fast Money: Halftime Report',https://www.benzinga.com/media/22/05/27144899/15-stocks-moved-by-traders-on-fast-money-halftime-report,20220511T175251,Benzinga,"CNBC's ""Fast Money: Halftime Report"" delivers market-moving news to investors.
The commentary delivered by hosts of the show often moves the stocks mentioned. The information is collected and refined using Benzinga Pro's News Tool. Benzinga Pro users can access this information by using the News too",-0.036038,Neutral,1.0,Neutral,0,broad,
CSCO,"Unity Software  ( U )  Posts Loss in Q1, Revenues Increase Y/Y",https://www.zacks.com/stock/news/1922886/unity-software-u-posts-loss-in-q1-revenues-increase-yy,20220511T163500,Zacks Commentary,"Unity Software's (U) first-quarter 2022 results reflect robust performance from Create Solutions segment. However, gross margin contracted in the reported quarter.",-0.073353,Neutral,0.27704,Neutral,0,broad,
CSCO,Peak Or Persist? Investors Parse April's Hotter-than-Expected 8.3% Inflation Jump,https://www.benzinga.com/news/earnings/22/05/27143374/peak-or-persist-investors-parse-aprils-hotter-than-expected-8-3-inflation-jump,20220511T163013,Benzinga,"This post contains sponsored advertising content. This content is for informational purposes only and not intended to be investing advice.
 ( Wednesday Market Open )  Stocks turned lower at the open and yields nudged higher after April's 8.3% Consumer Price Index  ( CPI )  gain convinced investors i",-0.190592,Somewhat-Bearish,0.071698,Neutral,0,focused,AI
CSCO,Alibaba  ( BABA )  to Report Q4 Earnings: What's in the Cards?,https://www.zacks.com/stock/news/1922840/alibaba-baba-to-report-q4-earnings-whats-in-the-cards,20220511T152300,Zacks Commentary,Alibaba's (BABA) fourth-quarter fiscal 2022 results are expected to reflect gains from e-commerce and the cloud business amid the pandemic-related concerns.,0.08648,Neutral,0.162145,Neutral,0,focused,AI
CSCO,Healthcare Information Software Market - 41% of Growth to Originate from North America | Driven by Increasing Adoption of EHRs | Technavio,https://www.prnewswire.com/news-releases/healthcare-information-software-market---41-of-growth-to-originate-from-north-america--driven-by-increasing-adoption-of-ehrs--technavio-301544090.html,20220511T151500,PR Newswire,"Read the 120-page report with TOC on ""Healthcare Information Software Market Analysis Report by Application  ( HIS and PIS ) , Deployment  ( On-premises and Cloud-based ) , and Geography  ( North America, Europe, APAC, South America, and the Middle East and Africa ) , and the Segment Forecasts,2022-2026"". Gain competitive intelligence about market leaders. Track key industry opportunities, trends, and threats. Information on marketing, brand, strategy and market development, sales, and supply functions.",0.004754,Neutral,0.039353,Neutral,0,focused,AI
CSCO,"Avaya  ( AVYA )  Q2 Earnings Miss Estimates, Revenues Fall Y/Y",https://www.zacks.com/stock/news/1922796/avaya-avya-q2-earnings-miss-estimates-revenues-fall-yy,20220511T145900,Zacks Commentary,Avaya (AVYA) fiscal second-quarter results reflect solid adoption of One Cloud solutions as the company transforms from a one-time revenue model to a recurring one.,-0.042976,Neutral,0.203045,Neutral,0,broad,
CSCO,Insights on the Oil and Gas Data Management Global Market to 2030 - Increasing Popularity of Real-Time Analysis and Predictive Analytics Solutions is Driving Growth,https://www.prnewswire.com/news-releases/insights-on-the-oil-and-gas-data-management-global-market-to-2030---increasing-popularity-of-real-time-analysis-and-predictive-analytics-solutions-is-driving-growth-301544901.html,20220511T124500,PR Newswire,"DUBLIN, May 11, 2022 /PRNewswire/ -- The ""Oil and Gas Data Management Market by Type, Deployment Model, and Application: Global Opportunity Analysis and Industry Forecast, 2021-2030"" report has been added to ResearchAndMarkets.com's offering.",-0.005997,Neutral,0.042976,Neutral,0,focused,predictive analytics
CSCO,"The Zacks Analyst Blog Highlights Olaplex Holdings, Cisco Systems, Analog Devices, Ross Stores, and Costco Wholesale",https://www.zacks.com/stock/news/1922534/the-zacks-analyst-blog-highlights-olaplex-holdings-cisco-systems-analog-devices-ross-stores-and-costco-wholesale,20220511T113500,Zacks Commentary,"Olaplex Holdings, Cisco Systems, Analog Devices, Ross Stores, and Costco Wholesale are part of Zacks Top Analyst Blog.",0.14292,Neutral,0.348479,Neutral,0,broad,
CSCO,"Hyperscale Data Center Market Size to Grow by USD 129.16 billion | Find Future Trends, Analysis, and Insights | Technavio",https://www.prnewswire.com/news-releases/hyperscale-data-center-market-size-to-grow-by-usd-129-16-billion--find-future-trends-analysis-and-insights--technavio-301543950.html,20220511T091500,PR Newswire,Find additional market insights by Technavio to help your organization foster innovation and make effective decisions. View our Exclusive Sample Report,0.001027,Neutral,0.154455,Neutral,0,broad,
CSCO,Nova Measuring Instruments  ( NVMI )  to Post Q1 Earnings: What's Up?,https://www.zacks.com/stock/news/1922122/nova-measuring-instruments-nvmi-to-post-q1-earnings-whats-up,20220510T161300,Zacks Commentary,Nova Measuring Instruments (NVMI) first-quarter 2022 performance is likely to have benefited from the steady adoption of its solutions and services across all major segments in the addressable market.,0.034591,Neutral,0.152724,Neutral,0,broad,
CSCO,Progress In Europe Is Now Measured By Degrees Of Pessimism,https://www.benzinga.com/news/earnings/22/05/27114892/progress-in-europe-is-now-measured-by-degrees-of-pessimism,20220510T155921,Benzinga,"This post contains sponsored advertising content. This content is for informational purposes only and not intended to be investing advice.
 ( Tuesday Market Open )  Stocks look to bounce back as the Cboe Market Volatility Index  ( VIX )  moved back near 33, prompted by a 110-basis-point drop in the ",-0.193321,Somewhat-Bearish,0.054359,Neutral,0,focused,AI
CSCO,"RingCentral  ( RNG )  Q1 Earnings Top Estimates, Revenues Up Y/Y",https://www.zacks.com/stock/news/1922110/ringcentral-rng-q1-earnings-top-estimates-revenues-up-yy,20220510T150200,Zacks Commentary,RingCentral's (RNG) first-quarter 2022 results reflect solid demand for RingCentral's cloud-based communication platform.,0.031828,Neutral,0.247523,Neutral,0,broad,
CSCO,Location-Based Services Market Is Expected To Reach $114 Billion By 2026 Due To The Upsurge In The Use Of Smartphone And GPS Enabled Devices,https://www.prnewswire.com/news-releases/location-based-services-market-is-expected-to-reach-114-billion-by-2026-due-to-the-upsurge-in-the-use-of-smartphone-and-gps-enabled-devices-301540827.html,20220510T150000,PR Newswire,"TBRC's market research report covers location-based services market size, location-based services market forecasts, major location-based services companies and their market share, key strategies to undertake, and more.",0.002499,Neutral,0.073411,Neutral,0,focused,smart
CSCO,Fiverr  ( FVRR )  to Report Q1 Earnings: What's in the Cards?,https://www.zacks.com/stock/news/1922075/fiverr-fvrr-to-report-q1-earnings-whats-in-the-cards,20220510T144900,Zacks Commentary,Fiverr's (FVRR) first-quarter 2022 results are likely to reflect the impact of its portfolio strength and international expansion.,0.112775,Neutral,0.171892,Neutral,0,broad,
CSCO,"Microchip  ( MCHP )  Q4 Earnings Top Estimates, Revenues Rise Y/Y",https://www.zacks.com/stock/news/1922038/microchip-mchp-q4-earnings-top-estimates-revenues-rise-yy,20220510T143500,Zacks Commentary,Microchip's (MCHP) fiscal fourth-quarter results reflect continued momentum in both analog and microcontroller businesses.,0.006696,Neutral,0.243376,Neutral,0,broad,
CSCO,"Cannabis Movers & Shakers: Curaleaf Names New CEO, iAnthus, High Tide & Root & Bloom Announce Appointments",https://www.benzinga.com/markets/cannabis/22/05/27102175/cannabis-movers-shakers-curaleaf-names-new-ceo-ianthus-high-tide-each-announce-appointments,20220510T135928,Benzinga,"Curaleaf Holdings Names Matt Darin As CEO, Joe Bayern To Run New CPG-Based Business Model
Curaleaf Holdings, Inc.  ( CSE: CURA )   ( OTCQX: CURLF )  tapped Matt Darin to serve as its new CEO on Monday.
Current CEO Joe Bayern agreed to launch and run a new division of Curaleaf and develop a new CPG-b",0.066724,Neutral,0.09958,Neutral,0,broad,
CSCO,Integrated Building Management Systems Market Value to grow by USD 10 Billion | Huge growth opportunities in Europe | Technavio,https://www.prnewswire.com/news-releases/integrated-building-management-systems-market-value-to-grow-by-usd-10-billion--huge-growth-opportunities-in-europe--technavio-301542638.html,20220510T121500,PR Newswire,• Introduction and a brief overview of the in-depth analysis included in the full report.,0.02119,Neutral,0.338317,Neutral,0,broad,
CSCO,Amdocs  ( DOX )  to Report Q2 Earnings: What's in the Offing?,https://www.zacks.com/stock/news/1921804/amdocs-dox-to-report-q2-earnings-whats-in-the-offing,20220510T115300,Zacks Commentary,Amdocs' (DOX) second-quarter performance is expected to have benefited from the increased demand for its cloud-managed services and continuous deal wins from major telecom companies.,0.020645,Neutral,0.212954,Neutral,0,broad,
CSCO,5 Stocks to Buy Ahead of Earnings Results This Month,https://www.zacks.com/stock/news/1921686/5-stocks-to-buy-ahead-of-earnings-results-this-month,20220510T101200,Zacks Commentary,"Five companies with a favorable Zacks Rank will report earnings results this month. These are: OLPX, CSCO, ADI, ROST, COST.",0.222349,Somewhat-Bullish,0.173184,Somewhat-Bullish,0,broad,
CSCO,Cisco Systems  ( CSCO )  Stock Moves -0.75%: What You Should Know,https://www.zacks.com/stock/news/1921464/cisco-systems-csco-stock-moves--075-what-you-should-know,20220509T214509,Zacks Commentary,"Cisco Systems (CSCO) closed at $48.96 in the latest trading session, marking a -0.75% move from the prior day.",0.005983,Neutral,0.564747,Neutral,0,broad,
CSCO,Himax  ( HIMX )  to Report Q1 Earnings: What's in the Cards?,https://www.zacks.com/stock/news/1921355/himax-himx-to-report-q1-earnings-whats-in-the-cards,20220509T170400,Zacks Commentary,"Himax's (HIMX) Q1 results are likely to benefit from the growing monitor, notebook and automotive driver businesses.",0.08689,Neutral,0.184975,Neutral,0,broad,
CSCO,GlobalFoundries  ( GFS )  to Post Q1 Earnings: What's in Store?,https://www.zacks.com/stock/news/1921351/globalfoundries-gfs-to-post-q1-earnings-whats-in-store,20220509T163000,Zacks Commentary,GlobalFoundries' (GFS) first-quarter results are likely to reflect solid demand for pervasive semiconductor solutions and rising wafer shipments.,0.042621,Neutral,0.206099,Neutral,0,broad,
CSCO,Factors to Note Ahead of Sonos  ( SONO )  Q2 Earnings Release,https://www.zacks.com/stock/news/1921174/factors-to-note-ahead-of-sonos-sono-q2-earnings-release,20220509T153700,Zacks Commentary,"Sonos' (SONO) Q2 performance is likely to have gained from increased product demand. However, supply-chain constraints and increasing operating costs are likely to have acted as headwinds.",0.138706,Neutral,0.236224,Neutral,0,focused,AI
CSCO,Unity Software  ( U )  to Post Q1 Earnings: What's in the Cards?,https://www.zacks.com/stock/news/1921229/unity-software-u-to-post-q1-earnings-whats-in-the-cards,20220509T150100,Zacks Commentary,Unity Software's (U) Q1 performance is expected to have gained from increased demand for its software solutions boosted by an expanding client base and product portfolio.,0.017825,Neutral,0.154752,Neutral,0,focused,AI
CSCO,"Public Cloud Market Estimated to Reach USD 1386.14 Billion by 2030, Growing at a 21.4% CAGR - Report by Market Research Future  ( MRFR ) ",https://www.benzinga.com/pressreleases/22/05/g27075252/public-cloud-market-estimated-to-reach-usd-1386-14-billion-by-2030-growing-at-a-21-4-cagr-report-b,20220509T131902,Benzinga,"New York, May  09, 2022   ( GLOBE NEWSWIRE )  -- Public Cloud Market Overview: According to a comprehensive research report by Market Research Future  ( MRFR ) , ""Public Cloud Market"" information by Cloud Computing, by Organization Size, by Services, by Industry and Region - Forecast to 2030"" market",0.019062,Neutral,0.17941,Neutral,0,broad,
CSCO,"IT Market in Saudi Arabia: 5.11% Y-O-Y Growth Rate in 2022 | Key Drivers, Trends, and Market Forecasts|17000+ Technavio Research Reports",https://www.prnewswire.com/news-releases/it-market-in-saudi-arabia-5-11-y-o-y-growth-rate-in-2022--key-drivers-trends-and-market-forecasts17000-technavio-research-reports-301541816.html,20220509T131000,PR Newswire,"IT Market in Saudi Arabia: 5.11% YOY Growth Rate in 2022 | Key Drivers, Trends, and Market Forecasts|17000+ Technavio Research Reports USA - English PR Newswire",0.021681,Neutral,0.055097,Neutral,0,broad,
CSCO,What's in the Cards for Blink Charging's  ( BLNK )  Q1 Earnings?,https://www.zacks.com/stock/news/1918047/whats-in-the-cards-for-blink-chargings-blnk-q1-earnings,20220506T163000,Zacks Commentary,"Blink Charging's (BLNK) first-quarter fiscal 2022 results are likely to reflect growth in revenues, courtesy of increased demand for its global EV Charging infrastructure and higher service revenues.",0.057985,Neutral,0.141851,Neutral,0,broad,
CSCO,Upstart  ( UPST )  to Report Q1 Earnings: What's in the Offing?,https://www.zacks.com/stock/news/1918046/upstart-upst-to-report-q1-earnings-whats-in-the-offing,20220506T162900,Zacks Commentary,Upstart's (UPST) first-quarter 2022 results are likely to reflect benefits from the Upstart-powered loans and an expanding partner base.,0.09375,Neutral,0.136577,Neutral,0,broad,
CSCO,"Massachusetts Cannabis Co. Root & Bloom Names CEO, Gets Green Light To Launch Operations",https://www.benzinga.com/markets/cannabis/22/05/27047948/massachusetts-cannabis-co-root-bloom-names-ceo-gets-green-light-to-launch-operations,20220506T140243,Benzinga,"Root & Bloom announced that the board of directors has unanimously chosen Tom Regan to serve as CEO.
Regan, who has been working as a strategic advisor to the Salisbury, Massachusetts-based company, will assume the new role immediately.
He brings a wealth of expertise to this role, having served in ",-0.0598,Neutral,0.262381,Neutral,0,broad,
CSCO,Root & Bloom Appoints Tom Regan as CEO,https://www.prnewswire.com/news-releases/root--bloom-appoints-tom-regan-as-ceo-301541048.html,20220506T123400,PR Newswire,"SALISBURY, Mass., May 6, 2022 /PRNewswire/ -- Root & Bloom, a cannabis cultivation, extraction, and manufacturing operation, announced today that the Board of Directors has unanimously chosen Tom Regan to be Chief Executive Officer. Tom, who has been working as a strategic advisor to the company, will assume the new role immediately.",0.19524,Somewhat-Bullish,0.092927,Somewhat-Bullish,0,broad,
CSCO,"Cognizant  ( CTSH )  Q1 Earnings Beat Estimates, Revenues Up Y/Y",https://www.zacks.com/stock/news/1917004/cognizant-ctsh-q1-earnings-beat-estimates-revenues-up-yy,20220505T151300,Zacks Commentary,Cognizant's (CTSH) first-quarter 2022 results benefit from strong digital revenues and robust contribution from acquisitions.,0.01314,Neutral,0.206818,Neutral,0,broad,
CSCO,NetScout Systems  ( NTCT )  Surpasses Q4 Earnings and Revenue Estimates,https://www.zacks.com/stock/news/1916668/netscout-systems-ntct-surpasses-q4-earnings-and-revenue-estimates,20220505T130509,Zacks Commentary,"NetScout (NTCT) delivered earnings and revenue surprises of 38.10% and 1.08%, respectively, for the quarter ended March 2022. Do the numbers hold clues to what lies ahead for the stock?",0.019158,Neutral,0.188193,Neutral,0,broad,
CSCO,Cisco says its new technology can predict enterprise network issues before they happen | The Financial Express,https://www.financialexpress.com/industry/technology/cisco-says-its-new-technology-can-predict-enterprise-network-issues-before-they-happen/2513555/,20220505T050818,The Financial Express,The technology will be applied to a broad range of Cisco products and services over the next few years.,0.045757,Neutral,0.182921,Neutral,0,broad,
CSCO,"The Global Cyber Security Market is expected to reach a value of USD 390,000.01 Million by 2027, at a CAGR of 10.10% over the forecast period  ( 2021 - 2027 )  - SkyQuest Technology",https://www.benzinga.com/pressreleases/22/05/g26998418/the-global-cyber-security-market-is-expected-to-reach-a-value-of-usd-390-000-01-million-by-2027-at,20220504T170836,Benzinga,"Westford, USA, May  04, 2022   ( GLOBE NEWSWIRE )  --  Computer security, also known as cyber security or information technology security, is the protecting of computer systems and networks against information disclosure, theft or damage to their hardware, software, or electronic data, as well as di",-0.00491,Neutral,0.123304,Neutral,0,focused,AI
CSCO,What's in the Store for MercadoLibre's  ( MELI )  Q1 Earnings?,https://www.zacks.com/stock/news/1915793/whats-in-the-store-for-mercadolibres-meli-q1-earnings,20220504T161200,Zacks Commentary,MercadoLibre's (MELI) first-quarter performance is expected to have benefited from its fintech and logistics offerings amid the pandemic.,0.034464,Neutral,0.172795,Neutral,0,broad,
CSCO,Things to Consider as Goodyear  ( GT )  Gears Up for Q1 Earnings,https://www.zacks.com/stock/news/1915768/things-to-consider-as-goodyear-gt-gears-up-for-q1-earnings,20220504T154300,Zacks Commentary,"The Zacks Consensus Estimate for Goodyear's (GT) Q1 earnings and revenues is pegged at 18 cents per share and $4.89 billion, respectively.",-0.114534,Neutral,0.186919,Neutral,0,broad,
CSCO,"Skyworks'  ( SWKS )  Q2 Earnings Top Estimates, Revenues Up Y/Y",https://www.zacks.com/stock/news/1915662/skyworks-swks-q2-earnings-top-estimates-revenues-up-yy,20220504T144000,Zacks Commentary,Skyworks' (SWKS) fiscal second-quarter fiscal 2022 results reflect rapid 5G deployment and strength in overall broad markets.,0.042796,Neutral,0.248915,Neutral,0,broad,
CSCO,New Cisco Technology Can Predict Network Issues Before They Happen,https://www.newswire.ca/news-releases/new-cisco-technology-can-predict-network-issues-before-they-happen-876706642.html,20220504T120000,Canada Newswire,Customer Trials Show IT Teams Can Predict and Avoid Issues with High Accuracy,0.078867,Neutral,0.838673,Neutral,0,broad,
CSCO,New Cisco Technology Can Predict Network Issues Before They Happen,https://www.prnewswire.com/news-releases/new-cisco-technology-can-predict-network-issues-before-they-happen-301539397.html,20220504T120000,PR Newswire,Customer Trials Show IT Teams Can Predict and Avoid Issues with High Accuracy,0.078005,Neutral,0.838021,Neutral,0,broad,
CSCO,"Wireless LAN Security Market Estimated to Garner USD 8.4 Billion, at a CAGR of 19.05% by 2027 - Report by Market Research Future  ( MRFR ) ",https://www.benzinga.com/pressreleases/22/05/g26982111/wireless-lan-security-market-estimated-to-garner-usd-8-4-billion-at-a-cagr-of-19-05-by-2027-report,20220504T023500,Benzinga,"New York US, May  03, 2022   ( GLOBE NEWSWIRE )  -- Market Overview: According to a comprehensive research report by Market Research Future  ( MRFR ) , ""Wireless LAN Security Market"" information by Security Type, by Technology, by Deployment, by End-User and Region - Forecast to 2027"" market size to",0.034114,Neutral,0.027091,Neutral,0,broad,
