ticker,title,url,time_published,source,summary,sentiment_score,sentiment_label,ticker_sentiment_score,ticker_sentiment_label,relevance_score,category,ai_keywords_found
CSCO,Jaguar Health  ( NASDAQ:JAGX )  Now Covered by Analysts at StockNews.com,https://www.defenseworld.net/2022/05/20/jaguar-health-nasdaqjagx-now-covered-by-analysts-at-stocknews-com.html,20220520T052049,Stocknews.com,"StockNews.com initiated coverage on shares of Jaguar Health ( NASDAQ:JAGX - Get Rating ) in a report released on Friday. The brokerage set a ""hold"" rating on the biotechnology company's stock. Separately, Zacks Investment Research lowered Jaguar Health from a ""hold"" rating to a ""sell"" rating in ...",0.014917,Neutral,0.093689,Neutral,0,broad,
CSCO,StockNews.com Begins Coverage on Jaguar Health  ( NASDAQ:JAGX ) ,https://www.defenseworld.net/2022/05/20/stocknews-com-begins-coverage-on-jaguar-health-nasdaqjagx.html,20220520T052049,Stocknews.com,StockNews.com initiated coverage on shares of Jaguar Health ( NASDAQ:JAGX - Get Rating ) in a research note published on Friday morning. The firm issued a hold rating on the biotechnology company's stock.,0.011671,Neutral,0.09186,Neutral,0,broad,
CSCO,Liberty Global  ( NASDAQ:LBTYK )  Upgraded at StockNews.com,https://www.defenseworld.net/2022/05/20/liberty-global-nasdaqlbtyk-upgraded-at-stocknews-com.html,20220520T052049,Stocknews.com,"StockNews.com upgraded shares of Liberty Global ( NASDAQ:LBTYK - Get Rating ) from a sell rating to a hold rating in a research note issued to investors on Friday morning. Separately, TheStreet cut shares of Liberty Global from a b- rating to a c rating in a report on Friday, May 6th.",0.02453,Neutral,0.06471,Neutral,0,broad,
CSCO,StockNews.com Downgrades Amneal Pharmaceuticals  ( NASDAQ:AMRX )  to Hold,https://www.defenseworld.net/2022/05/20/stocknews-com-downgrades-amneal-pharmaceuticals-nasdaqamrx-to-hold.html,20220520T052048,Stocknews.com,"Amneal Pharmaceuticals ( NASDAQ:AMRX - Get Rating ) was downgraded by StockNews.com from a ""buy"" rating to a ""hold"" rating in a report released on Friday. NASDAQ:AMRX opened at $3.47 on Friday. Amneal Pharmaceuticals has a 52 week low of $3.08 and a 52 week high of $6.21.",-0.016982,Neutral,0.111333,Neutral,0,broad,
CSCO,StockNews.com Downgrades Glacier Bancorp  ( NASDAQ:GBCI )  to Sell,https://www.defenseworld.net/2022/05/20/stocknews-com-downgrades-glacier-bancorp-nasdaqgbci-to-sell.html,20220520T052047,Stocknews.com,"Glacier Bancorp ( NASDAQ:GBCI - Get Rating ) was downgraded by StockNews.com from a ""hold"" rating to a ""sell"" rating in a research report issued to clients and investors on Friday. Separately, Zacks Investment Research downgraded Glacier Bancorp from a ""buy"" rating to a ""hold"" rating in a ...",-0.0086,Neutral,0.081248,Neutral,0,broad,
CSCO,"Glacier Bancorp  ( NASDAQ:GBCI )  Lowered to ""Sell"" at StockNews.com",https://www.defenseworld.net/2022/05/20/glacier-bancorp-nasdaqgbci-lowered-to-sell-at-stocknews-com.html,20220520T052047,Stocknews.com,"StockNews.com downgraded shares of Glacier Bancorp ( NASDAQ:GBCI - Get Rating ) from a hold rating to a sell rating in a report released on Friday morning. Separately, Zacks Investment Research downgraded shares of Glacier Bancorp from a buy rating to a hold rating in a report on Tuesday, ...",0.013796,Neutral,0.066487,Neutral,0,broad,
CSCO,Heat Biologics  ( NASDAQ:HTBX )  Receives New Coverage from Analysts at StockNews.com,https://www.defenseworld.net/2022/05/20/heat-biologics-nasdaqhtbx-receives-new-coverage-from-analysts-at-stocknews-com.html,20220520T052047,Stocknews.com,"StockNews.com initiated coverage on shares of Heat Biologics ( NASDAQ:HTBX - Get Rating ) in a report issued on Friday. The firm set a ""sell"" rating on the stock. Heat Biologics has a fifty-two week low of $2.07 and a fifty-two week high of $10.85.",0.017144,Neutral,0.131212,Neutral,0,broad,
CSCO,Heat Biologics  ( NASDAQ:HTBX )  Coverage Initiated by Analysts at StockNews.com,https://www.defenseworld.net/2022/05/20/heat-biologics-nasdaqhtbx-coverage-initiated-by-analysts-at-stocknews-com.html,20220520T052047,Stocknews.com,StockNews.com began coverage on shares of Heat Biologics ( NASDAQ:HTBX - Get Rating ) in a research report report published on Friday morning. The firm issued a sell rating on the stock. Heat Biologics has a twelve month low of $2.07 and a twelve month high of $10.85.,0.017416,Neutral,0.130855,Neutral,0,broad,
CSCO,"StockNews.com Upgrades DXP Enterprises  ( NASDAQ:DXPE )  to ""Strong-Buy""",https://www.defenseworld.net/2022/05/20/stocknews-com-upgrades-dxp-enterprises-nasdaqdxpe-to-strong-buy.html,20220520T051642,Stocknews.com,"DXP Enterprises ( NASDAQ:DXPE - Get Rating ) was upgraded by StockNews.com from a ""buy"" rating to a ""strong-buy"" rating in a research report issued to clients and investors on Friday.",0.006677,Neutral,0.078175,Neutral,0,broad,
CSCO,Epizyme  ( NASDAQ:EPZM )  Research Coverage Started at StockNews.com,https://www.defenseworld.net/2022/05/20/epizyme-nasdaqepzm-research-coverage-started-at-stocknews-com.html,20220520T051642,Stocknews.com,"StockNews.com started coverage on shares of Epizyme ( NASDAQ:EPZM - Get Rating ) in a report issued on Friday. The brokerage set a ""sell"" rating on the biopharmaceutical company's stock. Other analysts have also recently issued reports about the company.",0.027154,Neutral,0.07782,Neutral,0,broad,
CSCO,Calithera Biosciences  ( NASDAQ:CALA )  Coverage Initiated at StockNews.com,https://www.defenseworld.net/2022/05/20/calithera-biosciences-nasdaqcala-coverage-initiated-at-stocknews-com.html,20220520T051642,Stocknews.com,"StockNews.com assumed coverage on shares of Calithera Biosciences ( NASDAQ:CALA - Get Rating ) in a research report issued to clients and investors on Friday. The firm set a ""hold"" rating on the biotechnology company's stock.",0.004267,Neutral,0.072853,Neutral,0,broad,
CSCO,Catalyst Pharmaceuticals  ( NASDAQ:CPRX )  Rating Increased to Strong-Buy at StockNews.com,https://www.defenseworld.net/2022/05/20/catalyst-pharmaceuticals-nasdaqcprx-rating-increased-to-strong-buy-at-stocknews-com.html,20220520T051642,Stocknews.com,"Catalyst Pharmaceuticals ( NASDAQ:CPRX - Get Rating ) was upgraded by StockNews.com from a ""buy"" rating to a ""strong-buy"" rating in a research report issued to clients and investors on Friday. Other equities analysts also recently issued research reports about the stock.",0.040329,Neutral,0.063408,Neutral,0,broad,
CSCO,StockNews.com Downgrades Telefonaktiebolaget LM Ericsson  ( publ )   ( NASDAQ:ERIC )  to Buy,https://www.defenseworld.net/2022/05/20/stocknews-com-downgrades-telefonaktiebolaget-lm-ericsson-publ-nasdaqeric-to-buy.html,20220520T051642,Stocknews.com,"Telefonaktiebolaget LM Ericsson ( publ ) ( NASDAQ:ERIC - Get Rating ) was downgraded by StockNews.com from a ""strong-buy"" rating to a ""buy"" rating in a report released on Friday. ERIC has been the topic of several other reports.",0.006741,Neutral,0.058202,Neutral,0,broad,
CSCO,"Target  ( NYSE:TGT )  Downgraded to ""Buy"" at StockNews.com",https://www.defenseworld.net/2022/05/20/target-nysetgt-downgraded-to-buy-at-stocknews-com.html,20220520T051444,Stocknews.com,"Target ( NYSE:TGT - Get Rating ) was downgraded by StockNews.com from a ""strong-buy"" rating to a ""buy"" rating in a note issued to investors on Friday.",0.003861,Neutral,0.054607,Neutral,0,broad,
CSCO,Workday  ( NYSE:WDAY )  Stock Rating Lowered by StockNews.com,https://www.defenseworld.net/2022/05/20/workday-nysewday-stock-rating-lowered-by-stocknews-com.html,20220520T051444,Stocknews.com,"Workday ( NYSE:WDAY - Get Rating ) was downgraded by StockNews.com from a ""buy"" rating to a ""hold"" rating in a note issued to investors on Friday. NYSE WDAY opened at $164.52 on Friday. Workday has a 12 month low of $161.62 and a 12 month high of $307.81. The business has a 50-day moving ...",0.002573,Neutral,0.136267,Neutral,0,broad,
CSCO,Tredegar  ( NYSE:TG )  Stock Rating Upgraded by StockNews.com,https://www.defenseworld.net/2022/05/20/tredegar-nysetg-stock-rating-upgraded-by-stocknews-com.html,20220520T051443,Stocknews.com,"Tredegar ( NYSE:TG - Get Rating ) was upgraded by StockNews.com from a ""buy"" rating to a ""strong-buy"" rating in a research note issued on Friday. TG stock opened at $11.75 on Friday. The stock has a market capitalization of $397.77 million, a P/E ratio of 6.06 and a beta of 0.92.",0.018802,Neutral,0.069154,Neutral,0,broad,
CSCO,"Sonic Automotive  ( NYSE:SAH )  Downgraded by StockNews.com to ""Hold""",https://www.defenseworld.net/2022/05/20/sonic-automotive-nysesah-downgraded-by-stocknews-com-to-hold.html,20220520T051443,Stocknews.com,"Sonic Automotive ( NYSE:SAH - Get Rating ) was downgraded by StockNews.com from a ""buy"" rating to a ""hold"" rating in a research note issued to investors on Friday.",0.016111,Neutral,0.051763,Neutral,0,broad,
CSCO,StockNews.com Lowers Arrow Electronics  ( NYSE:ARW )  to Buy,https://www.defenseworld.net/2022/05/20/stocknews-com-lowers-arrow-electronics-nysearw-to-buy.html,20220520T051441,Stocknews.com,"Arrow Electronics ( NYSE:ARW - Get Rating ) was downgraded by StockNews.com from a ""strong-buy"" rating to a ""buy"" rating in a report issued on Friday. ARW has been the subject of a number of other reports.",0.003296,Neutral,0.058889,Neutral,0,broad,
CSCO,"BrasilAgro - Companhia Brasileira de Propriedades Agrícolas  ( NYSE:LND )  Upgraded to ""Buy"" by StockNews.com",https://www.defenseworld.net/2022/05/20/brasilagro-companhia-brasileira-de-propriedades-agricolas-nyselnd-upgraded-to-buy-by-stocknews-com.html,20220520T051441,Stocknews.com,"BrasilAgro - Companhia Brasileira de Propriedades Agrícolas ( NYSE:LND - Get Rating ) was upgraded by StockNews.com from a ""hold"" rating to a ""buy"" rating in a research report issued on Friday. Shares of LND stock opened at $6.39 on Friday.",0.005265,Neutral,0.088602,Neutral,0,broad,
CSCO,Buckle  ( NYSE:BKE )  Cut to Hold at StockNews.com,https://www.defenseworld.net/2022/05/20/buckle-nysebke-cut-to-hold-at-stocknews-com.html,20220520T051441,Stocknews.com,"Buckle ( NYSE:BKE - Get Rating ) was downgraded by StockNews.com from a ""buy"" rating to a ""hold"" rating in a report issued on Friday. Separately, Zacks Investment Research downgraded shares of Buckle from a ""strong-buy"" rating to a ""hold"" rating in a research note on Wednesday, May 11th.",-0.005575,Neutral,0.080674,Neutral,0,broad,
CSCO,Culp  ( NYSE:CULP )  Now Covered by Analysts at StockNews.com,https://www.defenseworld.net/2022/05/20/culp-nyseculp-now-covered-by-analysts-at-stocknews-com.html,20220520T051441,Stocknews.com,"StockNews.com assumed coverage on shares of Culp ( NYSE:CULP - Get Rating ) in a research report issued to clients and investors on Friday. The brokerage set a ""hold"" rating on the textile maker's stock.",0.014859,Neutral,0.079788,Neutral,0,broad,
CSCO,Ambev  ( NYSE:ABEV )  Stock Rating Upgraded by StockNews.com,https://www.defenseworld.net/2022/05/20/ambev-nyseabev-stock-rating-upgraded-by-stocknews-com.html,20220520T051441,Stocknews.com,"Ambev ( NYSE:ABEV - Get Rating ) was upgraded by StockNews.com from a ""hold"" rating to a ""buy"" rating in a report released on Friday. Several other equities analysts have also weighed in on the company. Citigroup raised Ambev from a ""neutral"" rating to a ""buy"" rating in a research note on ...",0.028606,Neutral,0.072022,Neutral,0,focused,AI
CSCO,"Banc of California  ( NYSE:BANC )  Lowered to ""Hold"" at StockNews.com",https://www.defenseworld.net/2022/05/20/banc-of-california-nysebanc-lowered-to-hold-at-stocknews-com.html,20220520T051441,Stocknews.com,"Banc of California ( NYSE:BANC - Get Rating ) was downgraded by StockNews.com from a ""buy"" rating to a ""hold"" rating in a research note issued on Friday. BANC has been the topic of a number of other reports.",-0.025816,Neutral,0.070704,Neutral,0,broad,
CSCO,Diageo  ( NYSE:DEO )  Stock Rating Upgraded by StockNews.com,https://www.defenseworld.net/2022/05/20/diageo-nysedeo-stock-rating-upgraded-by-stocknews-com.html,20220520T051441,Stocknews.com,"Diageo ( NYSE:DEO - Get Rating ) was upgraded by StockNews.com from a ""hold"" rating to a ""buy"" rating in a research note issued on Friday. Other equities research analysts have also issued reports about the stock.",0.011896,Neutral,0.067939,Neutral,0,broad,
CSCO,Farmland Partners  ( NYSE:FPI )  Downgraded by StockNews.com,https://www.defenseworld.net/2022/05/20/farmland-partners-nysefpi-downgraded-by-stocknews-com.html,20220520T051441,Stocknews.com,"Farmland Partners ( NYSE:FPI - Get Rating ) was downgraded by StockNews.com from a ""hold"" rating to a ""sell"" rating in a report released on Friday.",0.000784,Neutral,0.065132,Neutral,0,focused,ML
CSCO,Enzo Biochem  ( NYSE:ENZ )  Earns Hold Rating from Analysts at StockNews.com,https://www.defenseworld.net/2022/05/20/enzo-biochem-nyseenz-earns-hold-rating-from-analysts-at-stocknews-com-2.html,20220520T051441,Stocknews.com,"StockNews.com started coverage on shares of Enzo Biochem ( NYSE:ENZ - Get Rating ) in a research report issued on Friday. The firm set a ""hold"" rating on the medical research company's stock. Separately, TheStreet cut Enzo Biochem from a ""c-"" rating to a ""d+"" rating in a research note on Tuesday.",0.010648,Neutral,0.09722,Neutral,0,broad,
CSCO,CACI International  ( NYSE:CACI )  Lowered to Hold at StockNews.com,https://www.defenseworld.net/2022/05/20/caci-international-nysecaci-lowered-to-hold-at-stocknews-com.html,20220520T051441,Stocknews.com,"CACI International ( NYSE:CACI - Get Rating ) was downgraded by StockNews.com from a ""buy"" rating to a ""hold"" rating in a research report issued on Friday. Other research analysts also recently issued reports about the stock.",0.003864,Neutral,0.056741,Neutral,0,broad,
CSCO,Advance Auto Parts  ( NYSE:AAP )  Stock Rating Upgraded by StockNews.com,https://www.defenseworld.net/2022/05/20/advance-auto-parts-nyseaap-stock-rating-upgraded-by-stocknews-com.html,20220520T051441,Stocknews.com,"Advance Auto Parts ( NYSE:AAP - Get Rating ) was upgraded by StockNews.com from a ""hold"" rating to a ""buy"" rating in a research report issued on Friday. AAP has been the topic of several other research reports. Evercore ISI initiated coverage on Advance Auto Parts in a research report on ...",0.029381,Neutral,0.055287,Neutral,0,broad,
CSCO,Walt Disney  ( NYSE:DIS )  Upgraded at StockNews.com,https://www.defenseworld.net/2022/05/20/walt-disney-nysedis-upgraded-at-stocknews-com.html,20220520T051441,Stocknews.com,"Walt Disney ( NYSE:DIS - Get Rating ) was upgraded by StockNews.com from a ""sell"" rating to a ""hold"" rating in a research report issued on Friday. Several other equities research analysts also recently weighed in on the company.",-0.006576,Neutral,0.051864,Neutral,0,broad,
CSCO,CACI International  ( NYSE:CACI )  Downgraded by StockNews.com to Hold,https://www.etfdailynews.com/2022/05/20/caci-international-nysecaci-downgraded-by-stocknews-com-to-hold/,20220520T051441,Stocknews.com,"CACI International ( NYSE:CACI - Get Rating ) was downgraded by StockNews.com from a ""buy"" rating to a ""hold"" rating in a research note issued to investors on Friday. Other equities analysts have also issued research reports about the stock.",0.008345,Neutral,0.049292,Neutral,0,broad,
CSCO,Evolve Transition Infrastructure  ( NYSE:SNMP )  Receives New Coverage from Analysts at StockNews.com,https://www.defenseworld.net/2022/05/20/evolve-transition-infrastructure-nysesnmp-receives-new-coverage-from-analysts-at-stocknews-com.html,20220520T051441,Stocknews.com,"StockNews.com initiated coverage on shares of Evolve Transition Infrastructure ( NYSE:SNMP - Get Rating ) in a note issued to investors on Friday. The brokerage set a ""hold"" rating on the stock. Shares of Evolve Transition Infrastructure stock opened at $0.46 on Friday.",0.002102,Neutral,0.219809,Neutral,0,broad,
CSCO,Asian stocks rise after Wall St slips closer to bear market,https://apnews.com/article/politics-financial-markets-prices-inflation-ef4f85a9a8b829219e1ff473e401e4f7,20220520T044805,Associated Press,"A currency trader watches monitors at the foreign exchange dealing room of the KEB Hana Bank headquarters in Seoul, South Korea, Friday, May 20, 2022. Asian stock markets rose Friday after Wall Street fell closer to bear territory, China cut a key interest rate and Japanese inflation edged ...",-0.091221,Neutral,0.060161,Somewhat-Bearish,0,broad,
CSCO,Asian stocks rise after Wall St slips closer to bear market,https://apnews.com/article/politics-financial-markets-prices-inflation-ef4f85a9a8b829219e1ff473e401e4f7,20220520T043000,Associated Press,"A currency trader watches monitors at the foreign exchange dealing room of the KEB Hana Bank headquarters in Seoul, South Korea, Friday, May 20, 2022. Asian stock markets rose Friday after Wall Street fell closer to bear territory, China cut a key interest rate and Japanese inflation edged ...",-0.091221,Neutral,0.060161,Somewhat-Bearish,0,broad,
CSCO,"Stocks end lower, nearing but not quite in a bear market",https://apnews.com/article/politics-financial-markets-prices-inflation-ef4f85a9a8b829219e1ff473e401e4f7,20220520T043000,Associated Press,Asian stocks rise after Wall St slips closer to bear market The Associated Press,-0.414461,Bearish,0.05387,Bearish,0,broad,
CSCO,"StockNews.com Upgrades Home Depot  ( NYSE:HD )  to ""Buy""",https://www.defenseworld.net/2022/05/20/stocknews-com-upgrades-home-depot-nysehd-to-buy.html,20220520T041442,Stocknews.com,"Home Depot ( NYSE:HD - Get Rating ) was upgraded by StockNews.com from a ""hold"" rating to a ""buy"" rating in a report issued on Thursday. Several other research analysts also recently commented on the stock.",0.012264,Neutral,0.054907,Neutral,0,broad,
CSCO,"US Stock Market: S&P 500, Dow slip as Cisco drags, growth stocks lead Nasdaq rebound | The Financial Express",https://www.financialexpress.com/market/us-stock-market-sp-500-dow-slip-as-cisco-drags-growth-stocks-lead-nasdaq-rebound/2531720/,20220520T025350,The Financial Express,"he S&P 500 is down 18.2% from its record close on Jan. 3, as investors adjust to a rise in prices, geopolitical uncertainty stemming from the war in Ukraine and tightening financial conditions with the US Federal Reserve raising rates.",-0.131751,Neutral,0.081193,Bearish,0,focused,AI
CSCO,Asian shares jump as China cuts key lending benchmark,https://www.moneycontrol.com/news/business/markets/asian-shares-jump-as-china-cuts-key-lending-benchmark-8542931.html,20220520T024353,Money Control,"China cut its five-year loan prime rate ( LPR ) by 15 basis points on Friday morning, a sharper cut than had been expected, as authorities seek to cushion an economic slowdown, though it left the one-year LPR unchanged. The five-year rate influences the pricing of mortgages.",-0.113545,Neutral,0.065381,Bearish,0,broad,
CSCO,MGM Resorts International  ( NYSE:MGM )  Upgraded to Buy by StockNews.com,https://www.defenseworld.net/2022/05/20/mgm-resorts-international-nysemgm-upgraded-to-buy-by-stocknews-com.html,20220520T024042,Stocknews.com,"MGM Resorts International ( NYSE:MGM - Get Rating ) was upgraded by StockNews.com from a ""hold"" rating to a ""buy"" rating in a report issued on Thursday. Other research analysts have also recently issued research reports about the company.",0.009176,Neutral,0.0507,Neutral,0,broad,
CSCO,Asian shares jump as China cuts key lending benchmark,https://www.reuters.com/markets/europe/global-markets-wrapup-1-2022-05-20/,20220520T022000,Reuters,"FILE PHOTO - An investor stands in front of an electronic board showing stock information at a brokerage house in Shanghai, China, August 24, 2015. REUTERS/Aly Song",-0.099958,Neutral,0.064138,Somewhat-Bearish,0,focused,AI
CSCO,"WestRock  ( NYSE:WRK )  Upgraded by StockNews.com to ""Strong-Buy""",https://www.defenseworld.net/2022/05/20/westrock-nysewrk-upgraded-by-stocknews-com-to-strong-buy.html,20220520T020842,Stocknews.com,"WestRock ( NYSE:WRK - Get Rating ) was upgraded by StockNews.com from a ""buy"" rating to a ""strong-buy"" rating in a research report issued to clients and investors on Thursday.",0.002507,Neutral,0.051842,Neutral,0,broad,
CSCO,"StockNews.com Upgrades Dollar General  ( NYSE:DG )  to ""Buy""",https://www.defenseworld.net/2022/05/20/stocknews-com-upgrades-dollar-general-nysedg-to-buy.html,20220520T020841,Stocknews.com,"Dollar General ( NYSE:DG - Get Rating ) was upgraded by StockNews.com from a ""hold"" rating to a ""buy"" rating in a report released on Thursday. Other analysts also recently issued reports about the stock.",0.005109,Neutral,0.045586,Neutral,0,broad,
CSCO,StockNews.com Lowers Everi  ( NYSE:EVRI )  to Buy,https://www.defenseworld.net/2022/05/20/stocknews-com-lowers-everi-nyseevri-to-buy.html,20220520T020841,Stocknews.com,"Everi ( NYSE:EVRI - Get Rating ) was downgraded by StockNews.com from a ""strong-buy"" rating to a ""buy"" rating in a research note issued to investors on Thursday. Several other equities analysts have also recently commented on EVRI. B.",0.008949,Neutral,0.064657,Neutral,0,broad,
CSCO,StockNews.com Lowers Everi  ( NYSE:EVRI )  to Buy,https://www.etfdailynews.com/2022/05/20/stocknews-com-lowers-everi-nyseevri-to-buy/,20220520T020841,Stocknews.com,"Everi ( NYSE:EVRI - Get Rating ) was downgraded by StockNews.com from a ""strong-buy"" rating to a ""buy"" rating in a report issued on Thursday. A number of other research firms have also weighed in on EVRI. B. Riley lowered their price objective on shares of Everi from $40.00 to $36.00 in a ...",-0.001888,Neutral,0.060988,Neutral,0,broad,
CSCO,Best Buy  ( NYSE:BBY )  Rating Increased to Buy at StockNews.com,https://www.defenseworld.net/2022/05/20/best-buy-nysebby-rating-increased-to-buy-at-stocknews-com-2.html,20220520T020841,Stocknews.com,"Best Buy ( NYSE:BBY - Get Rating ) was upgraded by StockNews.com from a ""hold"" rating to a ""buy"" rating in a note issued to investors on Thursday. Other analysts have also issued research reports about the company.",0.019127,Neutral,0.053701,Neutral,0,broad,
CSCO,"World stocks slide as growth fears persist, safe-havens gain",https://www.moneycontrol.com/news/business/world-stocks-slide-as-growth-fears-persist-safe-havens-gain-8542501.html,20220520T004129,Money Control,"Supply chain woes continued to fuel inflation and growth concerns as Cisco Systems Inc warned of persistent component shortages, knocking its shares down 13.7 percent. The plunge made it the latest big name stock this week to post its largest decline in more than a decade.",-0.256065,Somewhat-Bearish,0.056024,Bearish,0,focused,AI
CSCO,"Cisco blames China lockdowns for its forecast cut, but there could be deeper problems",https://www.marketwatch.com/story/cisco-blames-china-lockdowns-for-its-forecast-cut-but-there-could-be-deeper-problems-11652998778,20220519T221900,MarketWatch,"Cisco Systems Inc. executives spent much of the company's conference call talking about the COVID-related shutdowns in China, but they did not seem worried about the overall tech demand.",-0.302117,Somewhat-Bearish,0.618644,Somewhat-Bearish,0,broad,
CSCO,Why Cisco Stock Tanked 16.7% This Week,https://www.fool.com/investing/2022/05/19/why-cisco-systems-tanked-this-week/,20220519T205319,Motley Fool,Revenue and guidance in its Q3 earnings report were weaker than analysts expected.,-0.137666,Neutral,0.635868,Somewhat-Bearish,0,broad,
CSCO,Markets Finish Lower Following Wednesday's Intense Sell-Off,https://www.benzinga.com/news/22/05/27312546/markets-finish-lower-following-wednesdays-intense-sell-off,20220519T203221,Benzinga,"U.S. indices finished Thursday's trading session lower. Worse-than-expected retail earnings and anticipation of further Federal Reserve policy tightening in 2022 have continued to weigh on stocks across sectors. The Nasdaq composite finished lower by 0.26% to 11,388; The Invesco QQQ Trust Series 1",-0.216513,Somewhat-Bearish,0.290607,Bearish,0,focused,AI
CSCO,Stock Market Today: S&P Creeps Closer to Bear Market,https://www.kiplinger.com/investing/stocks/604702/stock-market-today-051922-sp-closer-bear-market,20220519T201156,Kiplinger,"If there was any good news Thursday, it's that the market's downward momentum from yesterday largely fizzled out. But the S&P 500 still edged ever nearer to bear-market territory in a mixed day for U.S. equities. The Department of Labor reported that initial unemployment claims for the week ending M",-0.226032,Somewhat-Bearish,0.116886,Bearish,0,focused,AI
CSCO,US stocks fall in another volatile day of trading,https://www.aljazeera.com/economy/2022/5/19/stocks-2,20220519T201143,Al Jareeza,US stocks fell in a volatile day of trading as investors weighed prospects for growth against a backdrop of rising prices and tightening monetary policy. Treasuries held gains amid a steady stream of haven bids.,-0.327859,Somewhat-Bearish,0.090576,Bearish,0,focused,AI
CSCO,Investing Club: Here's how much each company in our portfolio is exposed to China,https://www.cnbc.com/2022/05/19/heres-how-much-each-company-in-our-portfolio-is-exposed-to-china.html,20220519T192947,CNBC,We are providing a breakdown of the revenue exposure to China and the potential supply chain ramifications of every name we own.,-0.202766,Somewhat-Bearish,0.141459,Somewhat-Bearish,0,focused,AI
