ticker,title,url,time_published,source,summary,sentiment_score,sentiment_label,ticker_sentiment_score,ticker_sentiment_label,relevance_score,category,ai_keywords_found
IBM,"Shared Services Market to grow at a CAGR of 17% by 2024, Emergence of Robotics Process Automation is a Major Trend to Fuel the Market Growth - Technavio",https://www.prnewswire.com/news-releases/shared-services-market-to-grow-at-a-cagr-of-17-by-2024-emergence-of-robotics-process-automation-is-a-major-trend-to-fuel-the-market-growth---technavio-301598744.html,20220804T011500,PR Newswire,"The shared services market is segmented by application ( F&A, IT, SCM, HR, and CRM ) and geography ( North America, Europe, APAC, South America, and MEA ) • Regional Highlights - 35% of the market's growth will originate from during the forecast period. The US is the key market for shared ...",0.413927,Bullish,0.054483,Somewhat-Bullish,0,focused,automation
IBM,"Human Resource Outsourcing Market Size to Grow by USD 10.90 billion, Accenture Plc and Adecco Group AG Among Key Vendors - Technavio",https://www.prnewswire.com/news-releases/human-resource-outsourcing-market-size-to-grow-by-usd-10-90-billion-accenture-plc-and-adecco-group-ag-among-key-vendors---technavio-301598705.html,20220803T153500,PR Newswire,Get a comprehensive report summary describing the market size and forecast along with research methodology. The FREE Sample report is available in PDF format The digitization of human resource outsourcing is driving market growth.,0.226649,Somewhat-Bullish,0.048133,Neutral,0,focused,AI
IBM,Learnbay introduces domain specialisation programme for sustainable career transition | The Financial Express,https://www.financialexpress.com/education-2/learnbay-introduces-domain-specialisation-programme-for-sustainable-career-transition/2613104/,20220801T064658,The Financial Express,Learnbay introduces domain specialisation programme for sustainable career transition The Financial Express ...,0.320564,Somewhat-Bullish,0.317527,Somewhat-Bullish,0,focused,AI
IBM,"Learning Management Systems Market Value for Higher Education is Set to Grow by USD 5.42 Billion, Progressing at a CAGR of 22.75% from 2021 to 2026",https://www.prnewswire.com/news-releases/learning-management-systems-market-value-for-higher-education-is-set-to-grow-by-usd-5-42-billion-progressing-at-a-cagr-of-22-75-from-2021-to-2026--301595510.html,20220729T213500,PR Newswire,"LMS is a software application that enables the documentation, administration, tracking, reporting, and delivery of educational courses or training programs. It is also used to monitor the learner's progress so that actions can be taken accordingly.",0.242253,Somewhat-Bullish,0.039096,Neutral,0,focused,AI
IBM,BIOLASE  ( NASDAQ:BIOL )  Receives New Coverage from Analysts at StockNews.com,https://reporter.am/2022/07/29/biolase-nasdaqbiol-receives-new-coverage-from-analysts-at-stocknews-com-2.html,20220729T170512,Stocknews.com,"StockNews.com assumed coverage on shares of BIOLASE ( NASDAQ:BIOL - Get Rating ) in a research note published on Thursday morning. The firm issued a sell rating on the medical technology company's stock. Separately, Lake Street Capital began coverage on shares of BIOLASE in a research note on ...",0.237679,Somewhat-Bullish,0.082677,Neutral,0,broad,
IBM,Relays Sourcing and Procurement Report | Forecast and Analysis 2022-2026| SpendEdge,https://www.prnewswire.com/news-releases/relays-sourcing-and-procurement-report--forecast-and-analysis-2022-2026-spendedge-301594526.html,20220729T135500,PR Newswire,"Procurement Relays Procurement report explains key category management objectives that should form the base for sourcing strategy, including: To optimize the value of the purchase, it is crucial to keep a track of current and future price trends.",0.410807,Bullish,0.115232,Neutral,0,focused,AI
IBM,Cerner  ( NASDAQ:CERN )  Research Coverage Started at StockNews.com,https://reporter.am/2022/07/29/cerner-nasdaqcern-research-coverage-started-at-stocknews-com.html,20220729T105442,Stocknews.com,"StockNews.com started coverage on shares of Cerner ( NASDAQ:CERN - Get Rating ) in a research note issued to investors on Thursday morning. The firm issued a buy rating on the stock. Separately, Argus downgraded shares of Cerner from a buy rating to a hold rating in a report on Monday, April ...",0.3075,Somewhat-Bullish,0.066784,Somewhat-Bullish,0,broad,
IBM,eGain  ( NASDAQ:EGAN )  Rating Increased to Strong-Buy at StockNews.com,https://reporter.am/2022/07/29/egain-nasdaqegan-rating-increased-to-strong-buy-at-stocknews-com.html,20220729T105442,Stocknews.com,"StockNews.com upgraded shares of eGain ( NASDAQ:EGAN - Get Rating ) from a buy rating to a strong-buy rating in a research report sent to investors on Thursday morning. Shares of eGain stock opened at $9.06 on Thursday. The stock has a market cap of $288.29 million, a PE ratio of 302.00 and a ...",0.258241,Somewhat-Bullish,0.087503,Somewhat-Bullish,0,focused,AI
IBM,Could IBM Become the Next Microsoft?,https://www.fool.com/investing/2022/07/29/could-ibm-become-the-next-microsoft/,20220729T100500,Motley Fool,"IBM's cloud strategy may remind investors of Microsoft's comeback, but the cloud industry has changed during that time.",0.150278,Somewhat-Bullish,0.840917,Somewhat-Bullish,0,broad,
IBM,Innovative Solutions and Support  ( NASDAQ:ISSC )  Cut to Buy at StockNews.com,https://reporter.am/2022/07/29/innovative-solutions-and-support-nasdaqissc-cut-to-buy-at-stocknews-com.html,20220729T095041,Stocknews.com,"StockNews.com downgraded shares of Innovative Solutions and Support ( NASDAQ:ISSC - Get Rating ) from a strong-buy rating to a buy rating in a report published on Thursday morning. ISSC opened at $7.01 on Thursday. The stock has a market cap of $121.08 million, a P/E ratio of 17.53 and a beta ...",0.26198,Somewhat-Bullish,0.05257,Neutral,0,broad,
IBM,AECOM  ( NYSE:ACM )  Upgraded to Buy at StockNews.com,https://reporter.am/2022/07/29/aecom-nyseacm-upgraded-to-buy-at-stocknews-com.html,20220729T095041,Stocknews.com,StockNews.com upgraded shares of AECOM ( NYSE:ACM - Get Rating ) from a hold rating to a buy rating in a research report sent to investors on Thursday. A number of other research firms have also commented on ACM. Royal Bank of Canada assumed coverage on shares of AECOM in a research note on ...,0.255288,Somewhat-Bullish,0.062926,Neutral,0,broad,
IBM,StockNews.com Initiates Coverage on GEE Group  ( NYSE:JOB ) ,https://reporter.am/2022/07/29/stocknews-com-initiates-coverage-on-gee-group-nysejob.html,20220729T095041,Stocknews.com,StockNews.com began coverage on shares of GEE Group ( NYSE:JOB - Get Rating ) in a report issued on Thursday morning. The firm issued a strong-buy rating on the stock. Shares of JOB opened at $0.56 on Thursday. The stock has a 50-day moving average of $0.56.,0.128359,Neutral,0.124809,Neutral,0,broad,
IBM,Goodyear Tire & Rubber  ( NASDAQ:GT )  Upgraded to Buy at StockNews.com,https://reporter.am/2022/07/29/goodyear-tire-rubber-nasdaqgt-upgraded-to-buy-at-stocknews-com.html,20220729T095041,Stocknews.com,StockNews.com upgraded shares of Goodyear Tire & Rubber ( NASDAQ:GT - Get Rating ) from a hold rating to a buy rating in a research note published on Thursday morning. Several other equities analysts have also issued reports on the company.,0.196851,Somewhat-Bullish,0.058472,Neutral,0,broad,
IBM,ARCA biopharma  ( NASDAQ:ABIO )  Coverage Initiated at StockNews.com,https://reporter.am/2022/07/29/arca-biopharma-nasdaqabio-coverage-initiated-at-stocknews-com-3.html,20220729T095041,Stocknews.com,StockNews.com began coverage on shares of ARCA biopharma ( NASDAQ:ABIO - Get Rating ) in a report released on Thursday. The firm issued a sell rating on the biopharmaceutical company's stock. Shares of ARCA biopharma stock opened at $2.39 on Thursday.,0.226527,Somewhat-Bullish,0.091509,Neutral,0,broad,
IBM,GSK  ( NYSE:GSK )  Earns Strong-Buy Rating from Analysts at StockNews.com,https://reporter.am/2022/07/29/gsk-nysegsk-earns-strong-buy-rating-from-analysts-at-stocknews-com.html,20220729T095041,Stocknews.com,StockNews.com started coverage on shares of GSK ( NYSE:GSK - Get Rating ) in a research report released on Thursday. The brokerage issued a strong-buy rating on the pharmaceutical company's stock. A number of other equities research analysts have also recently issued reports on the stock.,0.288535,Somewhat-Bullish,0.06515,Neutral,0,broad,
IBM,OpGen  ( NASDAQ:OPGN )  Receives New Coverage from Analysts at StockNews.com,https://reporter.am/2022/07/29/opgen-nasdaqopgn-receives-new-coverage-from-analysts-at-stocknews-com.html,20220729T095041,Stocknews.com,StockNews.com initiated coverage on shares of OpGen ( NASDAQ:OPGN - Get Rating ) in a research report sent to investors on Thursday. The firm issued a sell rating on the medical research company's stock. OPGN has been the topic of several other research reports.,0.163963,Somewhat-Bullish,0.098659,Neutral,0,broad,
IBM,Occidental Petroleum  ( NYSE:OXY )  Upgraded by StockNews.com to Buy,https://reporter.am/2022/07/29/occidental-petroleum-nyseoxy-upgraded-by-stocknews-com-to-buy.html,20220729T092442,Stocknews.com,StockNews.com upgraded shares of Occidental Petroleum ( NYSE:OXY - Get Rating ) from a hold rating to a buy rating in a research note published on Tuesday. Other research analysts have also issued research reports about the company.,0.252072,Somewhat-Bullish,0.046543,Neutral,0,broad,
IBM,Dynagas LNG Partners  ( NYSE:DLNG )  Lifted to Strong-Buy at StockNews.com,https://reporter.am/2022/07/29/dynagas-lng-partners-nysedlng-lifted-to-strong-buy-at-stocknews-com.html,20220729T092442,Stocknews.com,"StockNews.com upgraded shares of Dynagas LNG Partners ( NYSE:DLNG - Get Rating ) from a buy rating to a strong-buy rating in a report issued on Tuesday morning. Separately, Jefferies Financial Group started coverage on Dynagas LNG Partners in a research note on Wednesday, April 27th.",0.224104,Somewhat-Bullish,0.102013,Neutral,0,broad,
IBM,Simpson Manufacturing  ( NYSE:SSD )  Downgraded to Hold at StockNews.com,https://reporter.am/2022/07/29/simpson-manufacturing-nysessd-downgraded-to-hold-at-stocknews-com.html,20220729T092441,Stocknews.com,"Simpson Manufacturing ( NYSE:SSD - Get Rating ) was downgraded by StockNews.com from a ""buy"" rating to a ""hold"" rating in a research note issued on Wednesday. Separately, Robert W. Baird raised their price objective on shares of Simpson Manufacturing from $136.00 to $145.00 in a research note ...",0.293597,Somewhat-Bullish,0.051551,Neutral,0,focused,AI
IBM,MICT  ( NASDAQ:MICT )  Upgraded by StockNews.com to Sell,https://reporter.am/2022/07/29/mict-nasdaqmict-upgraded-by-stocknews-com-to-sell.html,20220729T092441,Stocknews.com,StockNews.com upgraded shares of MICT ( NASDAQ:MICT - Get Rating ) to a sell rating in a research report sent to investors on Tuesday morning. Shares of NASDAQ MICT opened at $0.61 on Tuesday. MICT has a fifty-two week low of $0.41 and a fifty-two week high of $2.30.,0.302754,Somewhat-Bullish,0.116914,Neutral,0,broad,
IBM,"StockNews.com Upgrades Schlumberger  ( NYSE:SLB )  to ""Buy""",https://reporter.am/2022/07/29/stocknews-com-upgrades-schlumberger-nyseslb-to-buy.html,20220729T091242,Stocknews.com,StockNews.com upgraded shares of Schlumberger ( NYSE:SLB - Get Rating ) from a hold rating to a buy rating in a research note issued to investors on Tuesday morning. SLB has been the subject of several other reports.,0.262424,Somewhat-Bullish,0.045139,Neutral,0,broad,
IBM,"TAL Education Group  ( NYSE:TAL )  Upgraded to ""Hold"" by StockNews.com",https://reporter.am/2022/07/29/tal-education-group-nysetal-upgraded-to-hold-by-stocknews-com.html,20220729T085044,Stocknews.com,"TAL Education Group ( NYSE:TAL - Get Rating ) was upgraded by StockNews.com from a ""sell"" rating to a ""hold"" rating in a research report issued on Wednesday. TAL has been the topic of a number of other research reports.",0.190339,Somewhat-Bullish,0.088472,Neutral,0,broad,
IBM,"TriNet Group  ( NYSE:TNET )  Lowered to ""Buy"" at StockNews.com",https://reporter.am/2022/07/29/trinet-group-nysetnet-lowered-to-buy-at-stocknews-com.html,20220729T085044,Stocknews.com,"TriNet Group ( NYSE:TNET - Get Rating ) was downgraded by stock analysts at StockNews.com from a ""strong-buy"" rating to a ""buy"" rating in a research report issued to clients and investors on Wednesday. NYSE TNET opened at $82.32 on Wednesday. TriNet Group has a 1-year low of $69.16 and a 1-year ...",0.248587,Somewhat-Bullish,0.051886,Neutral,0,broad,
IBM,StockNews.com Downgrades PulteGroup  ( NYSE:PHM )  to Hold,https://reporter.am/2022/07/29/stocknews-com-downgrades-pultegroup-nysephm-to-hold.html,20220729T085042,Stocknews.com,"PulteGroup ( NYSE:PHM - Get Rating ) was downgraded by stock analysts at StockNews.com from a ""buy"" rating to a ""hold"" rating in a research note issued on Wednesday.",0.169697,Somewhat-Bullish,0.062271,Neutral,0,broad,
IBM,MGIC Investment  ( NYSE:MTG )  Stock Rating Lowered by StockNews.com,https://reporter.am/2022/07/29/mgic-investment-nysemtg-stock-rating-lowered-by-stocknews-com.html,20220729T085041,Stocknews.com,"MGIC Investment ( NYSE:MTG - Get Rating ) was downgraded by equities research analysts at StockNews.com from a ""buy"" rating to a ""hold"" rating in a research report issued on Wednesday. A number of other research analysts have also recently issued reports on the company.",0.1935,Somewhat-Bullish,0.070105,Neutral,0,broad,
IBM,Canadian National Railway  ( NYSE:CNI )  Upgraded at StockNews.com,https://reporter.am/2022/07/29/canadian-national-railway-nysecni-upgraded-at-stocknews-com.html,20220729T085041,Stocknews.com,"Canadian National Railway ( NYSE:CNI - Get Rating ) ( TSE:CNR ) was upgraded by research analysts at StockNews.com from a ""hold"" rating to a ""buy"" rating in a research report issued on Wednesday.",0.160603,Somewhat-Bullish,0.065327,Neutral,0,focused,AI
IBM,Aaron's  ( NYSE:AAN )  Stock Rating Lowered by StockNews.com,https://reporter.am/2022/07/29/aarons-nyseaan-stock-rating-lowered-by-stocknews-com.html,20220729T084241,Stocknews.com,"Aaron's ( NYSE:AAN - Get Rating ) was downgraded by stock analysts at StockNews.com from a ""buy"" rating to a ""hold"" rating in a research note issued on Wednesday. AAN has been the topic of several other research reports.",0.265926,Somewhat-Bullish,0.089462,Neutral,0,broad,
IBM,Tonix Pharmaceuticals  ( NASDAQ:TNXP )  Upgraded to Sell at StockNews.com,https://reporter.am/2022/07/29/tonix-pharmaceuticals-nasdaqtnxp-upgraded-to-sell-at-stocknews-com.html,20220729T080844,Stocknews.com,"StockNews.com upgraded shares of Tonix Pharmaceuticals ( NASDAQ:TNXP - Get Rating ) to a sell rating in a report published on Tuesday morning. Separately, Noble Financial initiated coverage on Tonix Pharmaceuticals in a research report on Monday, April 18th.",0.321731,Somewhat-Bullish,0.073546,Neutral,0,broad,
IBM,"StockNews.com Upgrades Argo Group International  ( NASDAQ:ARGO )  to ""Buy""",https://reporter.am/2022/07/29/stocknews-com-upgrades-argo-group-international-nasdaqargo-to-buy.html,20220729T075841,Stocknews.com,"Argo Group International ( NASDAQ:ARGO - Get Rating ) was upgraded by equities researchers at StockNews.com from a ""hold"" rating to a ""buy"" rating in a report released on Wednesday. Shares of ARGO opened at $32.48 on Wednesday.",-0.021597,Neutral,0.110973,Neutral,0,broad,
IBM,Syros Pharmaceuticals  ( NASDAQ:SYRS )  Stock Rating Lowered by StockNews.com,https://reporter.am/2022/07/29/syros-pharmaceuticals-nasdaqsyrs-stock-rating-lowered-by-stocknews-com.html,20220729T075444,Stocknews.com,"Syros Pharmaceuticals ( NASDAQ:SYRS - Get Rating ) was downgraded by stock analysts at StockNews.com from a ""hold"" rating to a ""sell"" rating in a research report issued to clients and investors on Wednesday.",0.183431,Somewhat-Bullish,0.068306,Neutral,0,broad,
IBM,Winmark  ( NASDAQ:WINA )  Rating Increased to Buy at StockNews.com,https://reporter.am/2022/07/29/winmark-nasdaqwina-rating-increased-to-buy-at-stocknews-com.html,20220729T075442,Stocknews.com,"Winmark ( NASDAQ:WINA - Get Rating ) was upgraded by StockNews.com from a ""hold"" rating to a ""buy"" rating in a report issued on Wednesday. Separately, TheStreet upgraded Winmark from a ""c+"" rating to a ""b"" rating in a report on Monday, April 11th. Winmark stock opened at $218.60 on Wednesday.",0.309877,Somewhat-Bullish,0.091162,Neutral,0,broad,
IBM,Infosys  ( NYSE:INFY )  Stock Rating Lowered by StockNews.com,https://reporter.am/2022/07/29/infosys-nyseinfy-stock-rating-lowered-by-stocknews-com.html,20220729T075441,Stocknews.com,"Infosys ( NYSE:INFY - Get Rating ) was downgraded by StockNews.com from a ""buy"" rating to a ""hold"" rating in a research report issued to clients and investors on Friday. Other equities research analysts have also issued reports about the stock.",0.289208,Somewhat-Bullish,0.0699,Neutral,0,broad,
IBM,Primo Water  ( NASDAQ:PRMW )  Rating Lowered to Buy at StockNews.com,https://reporter.am/2022/07/29/primo-water-nasdaqprmw-rating-lowered-to-buy-at-stocknews-com.html,20220729T075441,Stocknews.com,"Primo Water ( NASDAQ:PRMW - Get Rating ) was downgraded by analysts at StockNews.com from a ""strong-buy"" rating to a ""buy"" rating in a research report issued on Wednesday. NASDAQ:PRMW opened at $13.27 on Wednesday. The stock has a market cap of $2.13 billion, a price-to-earnings ratio of 28.89 ...",0.077231,Neutral,0.1331,Neutral,0,broad,
IBM,Infosys  ( NYSE:INFY )  Stock Rating Lowered by StockNews.com,https://www.defenseworld.net/2022/07/29/infosys-nyseinfy-stock-rating-lowered-by-stocknews-com.html,20220729T075441,Stocknews.com,"Infosys ( NYSE:INFY - Get Rating ) was downgraded by StockNews.com from a ""buy"" rating to a ""hold"" rating in a research note issued to investors on Friday. INFY has been the subject of a number of other reports.",0.327326,Somewhat-Bullish,0.071145,Neutral,0,broad,
IBM,CubeSmart  ( NYSE:CUBE )  Downgraded by StockNews.com,https://reporter.am/2022/07/29/cubesmart-nysecube-downgraded-by-stocknews-com.html,20220729T074115,Stocknews.com,StockNews.com cut shares of CubeSmart ( NYSE:CUBE - Get Rating ) from a hold rating to a sell rating in a report released on Tuesday. CUBE has been the topic of a number of other reports.,0.261619,Somewhat-Bullish,0.056943,Somewhat-Bullish,0,focused,smart
IBM,Ventas  ( NYSE:VTR )  Downgraded by StockNews.com to Sell,https://www.defenseworld.net/2022/07/29/ventas-nysevtr-downgraded-by-stocknews-com-to-sell.html,20220729T072242,Stocknews.com,"Ventas ( NYSE:VTR - Get Rating ) was downgraded by equities researchers at StockNews.com from a ""hold"" rating to a ""sell"" rating in a research report issued to clients and investors on Friday. Other equities research analysts have also issued research reports about the company.",0.21729,Somewhat-Bullish,0.063594,Somewhat-Bullish,0,broad,
IBM,Lennar  ( NYSE:LEN )  Downgraded to Hold at StockNews.com,https://www.defenseworld.net/2022/07/29/lennar-nyselen-downgraded-to-hold-at-stocknews-com.html,20220729T065241,Stocknews.com,"Lennar ( NYSE:LEN - Get Rating ) was downgraded by investment analysts at StockNews.com from a ""buy"" rating to a ""hold"" rating in a research report issued on Friday. Other research analysts have also recently issued research reports about the stock.",0.272244,Somewhat-Bullish,0.055751,Neutral,0,broad,
IBM,Diamond Hill Investment Group  ( NASDAQ:DHIL )  Upgraded at StockNews.com,https://reporter.am/2022/07/29/diamond-hill-investment-group-nasdaqdhil-upgraded-at-stocknews-com.html,20220729T062230,Stocknews.com,StockNews.com upgraded shares of Diamond Hill Investment Group ( NASDAQ:DHIL - Get Rating ) from a hold rating to a buy rating in a research note released on Tuesday. Shares of NASDAQ:DHIL opened at $195.89 on Tuesday. The firm has a 50 day simple moving average of $178.25 and a 200-day simple ...,0.269093,Somewhat-Bullish,0.085022,Neutral,0,broad,
IBM,StockNews.com Initiates Coverage on Mega Matrix  ( NYSE:ACY ) ,https://www.etfdailynews.com/2022/07/29/stocknews-com-initiates-coverage-on-mega-matrix-nyseacy/,20220729T062052,Stocknews.com,"Investment analysts at StockNews.com assumed coverage on shares of Mega Matrix ( NYSE:ACY - Get Rating ) in a research note issued to investors on Friday. The brokerage set a ""hold"" rating on the stock. Mega Matrix has a twelve month low of $0.55 and a twelve month high of $13.34.",0.124869,Neutral,0.148731,Neutral,0,broad,
IBM,Lennar  ( NYSE:LEN )  Downgraded to Hold at StockNews.com,https://www.etfdailynews.com/2022/07/29/lennar-nyselen-downgraded-to-hold-at-stocknews-com/,20220729T062051,Stocknews.com,"Lennar ( NYSE:LEN - Get Rating ) was downgraded by StockNews.com from a ""buy"" rating to a ""hold"" rating in a research report issued on Friday. Several other equities research analysts have also commented on the company.",0.15835,Somewhat-Bullish,0.054114,Neutral,0,broad,
IBM,PS Business Parks  ( NYSE:PSB )  Coverage Initiated at StockNews.com,https://www.etfdailynews.com/2022/07/29/ps-business-parks-nysepsb-coverage-initiated-at-stocknews-com/,20220729T062050,Stocknews.com,"Research analysts at StockNews.com started coverage on shares of PS Business Parks ( NYSE:PSB - Get Rating ) in a research report issued on Friday. The firm set a ""hold"" rating on the real estate investment trust's stock. Shares of NYSE PSB opened at $187.44 on Friday.",0.225108,Somewhat-Bullish,0.089462,Neutral,0,broad,
IBM,Antares Pharma  ( NASDAQ:ATRS )  Receives New Coverage from Analysts at StockNews.com,https://www.etfdailynews.com/2022/07/29/antares-pharma-nasdaqatrs-receives-new-coverage-from-analysts-at-stocknews-com/,20220729T062050,Stocknews.com,"StockNews.com assumed coverage on shares of Antares Pharma ( NASDAQ:ATRS - Get Rating ) in a research report issued on Friday. The brokerage set a ""sell"" rating on the specialty pharmaceutical company's stock.",0.189893,Somewhat-Bullish,0.061003,Neutral,0,broad,
IBM,Vista Gold  ( NYSE:VGZ )  Research Coverage Started at StockNews.com,https://www.etfdailynews.com/2022/07/29/vista-gold-nysevgz-research-coverage-started-at-stocknews-com-2/,20220729T062050,Stocknews.com,"StockNews.com initiated coverage on shares of Vista Gold ( NYSE:VGZ - Get Rating ) in a research report issued to clients and investors on Friday. The brokerage set a ""hold"" rating on the stock.",0.296069,Somewhat-Bullish,0.16171,Somewhat-Bullish,0,broad,
IBM,Adamis Pharmaceuticals  ( NASDAQ:ADMP )  Coverage Initiated by Analysts at StockNews.com,https://www.etfdailynews.com/2022/07/29/adamis-pharmaceuticals-nasdaqadmp-coverage-initiated-by-analysts-at-stocknews-com/,20220729T062050,Stocknews.com,"Research analysts at StockNews.com started coverage on shares of Adamis Pharmaceuticals ( NASDAQ:ADMP - Get Rating ) in a research note issued to investors on Friday. The firm set a ""hold"" rating on the specialty pharmaceutical company's stock. Shares of ADMP opened at $0.36 on Friday.",0.016748,Neutral,0.127456,Neutral,0,broad,
IBM,Bottomline Technologies  ( NASDAQ:EPAY )  Earns Hold Rating from Analysts at StockNews.com,https://www.etfdailynews.com/2022/07/29/bottomline-technologies-nasdaqepay-earns-hold-rating-from-analysts-at-stocknews-com/,20220729T062048,Stocknews.com,"Equities researchers at StockNews.com assumed coverage on shares of Bottomline Technologies ( NASDAQ:EPAY - Get Rating ) in a research report issued to clients and investors on Friday. The brokerage set a ""hold"" rating on the technology company's stock. EPAY stock opened at $56.99 on Friday.",0.168475,Somewhat-Bullish,0.094762,Neutral,0,focused,ML
IBM,L.B. Foster  ( NASDAQ:FSTR )  Now Covered by StockNews.com,https://www.etfdailynews.com/2022/07/29/l-b-foster-nasdaqfstr-now-covered-by-stocknews-com/,20220729T062048,Stocknews.com,"Investment analysts at StockNews.com initiated coverage on shares of L.B. Foster ( NASDAQ:FSTR - Get Rating ) in a research report issued to clients and investors on Friday. The firm set a ""hold"" rating on the basic materials company's stock. Separately, B. Riley downgraded shares of L.B.",0.10215,Neutral,0.079392,Neutral,0,broad,
IBM,StockNews.com Lowers Banco Bilbao Vizcaya Argentaria  ( NYSE:BBVA )  to Buy,https://www.defenseworld.net/2022/07/29/stocknews-com-lowers-banco-bilbao-vizcaya-argentaria-nysebbva-to-buy.html,20220729T062048,Stocknews.com,"Banco Bilbao Vizcaya Argentaria ( NYSE:BBVA - Get Rating ) was downgraded by stock analysts at StockNews.com from a ""strong-buy"" rating to a ""buy"" rating in a research report issued to clients and investors on Friday.",0.216786,Somewhat-Bullish,0.063258,Neutral,0,broad,
IBM,Ampio Pharmaceuticals  ( NYSE:AMPE )  Now Covered by Analysts at StockNews.com,https://www.defenseworld.net/2022/07/29/ampio-pharmaceuticals-nyseampe-now-covered-by-analysts-at-stocknews-com.html,20220729T062048,Stocknews.com,"Research analysts at StockNews.com started coverage on shares of Ampio Pharmaceuticals ( NYSE:AMPE - Get Rating ) in a research note issued on Friday. The firm set a ""sell"" rating on the stock. Shares of Ampio Pharmaceuticals stock opened at $0.16 on Friday.",0.073403,Neutral,0.124809,Neutral,0,broad,
IBM,Endo International  ( NASDAQ:ENDP )  Coverage Initiated at StockNews.com,https://www.defenseworld.net/2022/07/29/endo-international-nasdaqendp-coverage-initiated-at-stocknews-com-2.html,20220729T062044,Stocknews.com,"Equities researchers at StockNews.com initiated coverage on shares of Endo International ( NASDAQ:ENDP - Get Rating ) ( TSE:ENL ) in a research note issued on Friday. The firm set a ""hold"" rating on the stock. Other equities analysts have also recently issued reports about the company.",0.133292,Neutral,0.062761,Neutral,0,broad,
