ticker,title,url,time_published,source,summary,sentiment_score,sentiment_label,ticker_sentiment_score,ticker_sentiment_label,relevance_score,category,ai_keywords_found
IBM,Should You Invest in the SPDR NYSE Technology ETF  ( XNTK ) ?,https://www.zacks.com/stock/news/1950853/should-you-invest-in-the-spdr-nyse-technology-etf-xntk,20220712T102009,Zacks Commentary,Sector ETF report for ...,0.234232,Somewhat-Bullish,0.132004,Somewhat-Bullish,0,broad,
IBM,What Lies Ahead for Dow ETF in Q2 Earnings?,https://www.zacks.com/stock/news/1950681/what-lies-ahead-for-dow-etf-in-q2-earnings,20220711T171200,Zacks Commentary,"With some of the blue-chip companies expected to report an earnings surprise, investors should closely monitor the movement of the Dow ETF and grab an opportunity that arises from a surge in any of the 30 stocks.",0.20061,Somewhat-Bullish,0.18602,Neutral,0,broad,
IBM,"Want $1,000 in Passive Income? Invest $21,625 in These 3 Surprising Dividend Stocks",https://www.fool.com/investing/2022/07/10/want-passive-income-invest-dividend-stocks/,20220710T121500,Motley Fool,Don't count out tech stocks when looking for high-yield dividends.,0.219651,Somewhat-Bullish,0.333257,Somewhat-Bullish,0,broad,
IBM,"Worldwide Web Analytics Industry to 2027 - Featuring Microsoft, MicroStrategy and Splunk Among Others",https://www.prnewswire.com/news-releases/worldwide-web-analytics-industry-to-2027---featuring-microsoft-microstrategy-and-splunk-among-others-301582908.html,20220708T180000,PR Newswire,"DUBLIN, July 8, 2022 /PRNewswire/ -- The ""Web Analytics Market: Global Industry Trends, Share, Size, Growth, Opportunity and Forecast 2022-2027"" report has been added to ResearchAndMarkets.com's offering. The global web analytics market reached a value of US$ 4.1 Billion in 2021.",0.146821,Neutral,0.129516,Neutral,0,broad,
IBM,Cognizant  ( CTSH )  Inks Deal With Zurich Insurance Subsidiary,https://www.zacks.com/stock/news/1949943/cognizant-ctsh-inks-deal-with-zurich-insurance-subsidiary,20220708T150500,Zacks Commentary,Cognizant Technology Solutions (CTSH) has been selected as a strategic technology provider for Zurich Beteiligungs-AG to help in its digital transformation.,0.009288,Neutral,0.284861,Neutral,0,broad,
IBM,Hewlett Packard's  ( HPE )  Ezmeral Chosen by Catharina Hospital,https://www.zacks.com/stock/news/1949134/hewlett-packards-hpe-ezmeral-chosen-by-catharina-hospital,20220707T134000,Zacks Commentary,Hewlett Packard (HPE) to enhance accurate diagnosis and quality of patient care for Netherlands' Catharina hospital by offering edge-to-cloud infrastructure and analytical solution - HPE Ezmeral.,0.123346,Neutral,0.230728,Neutral,0,broad,
IBM,Raymond James Downgrades Rating On VMware - Read Why,https://www.benzinga.com/news/22/07/27973118/raymond-james-downgrades-rating-on-vmware-following-expiry-of-go-shop-period-with-no-other-bidders,20220706T155140,Benzinga,"Raymond James analyst Simon Leopold downgraded VMware, Inc VMW from Outperform to Market Perform. The re-rating reflects the expiry of the ""Go Shop"" period with no other bidders. He expects Broadcom Inc AVGO deal to win approval but will take about a year to close.",0.022142,Neutral,0.273705,Neutral,0,broad,
IBM,Cognizant  ( CTSH )  Boosts Presence in India With NICL Deal,https://www.zacks.com/stock/news/1948726/cognizant-ctsh-boosts-presence-in-india-with-nicl-deal,20220706T150200,Zacks Commentary,"Cognizant (CTSH) has been selected as a strategic technology provider for National Insurance Company Ltd. (""NICL"") to help in its digital transformation.",0.052547,Neutral,0.284134,Neutral,0,broad,
IBM,Reasons to Retain DXC Technology  ( DXC )  Stock in Your Portfolio,https://www.zacks.com/stock/news/1948709/reasons-to-retain-dxc-technology-dxc-stock-in-your-portfolio,20220706T144600,Zacks Commentary,"DXC Technology (DXC) is likely to continue gaining from the ongoing digital transformation around the globe. However, stiff competition from tech giants and weak liquidity position remain headwinds.",0.016462,Neutral,0.048691,Neutral,0,focused,AI
IBM,Data Center Market in Malaysia to observe USD 2.08 Bn growth | Demand planning and expansion by hyperscalers to boost growth | Technavio,https://www.prnewswire.com/news-releases/data-center-market-in-malaysia-to-observe-usd-2-08-bn-growth--demand-planning-and-expansion-by-hyperscalers-to-boost-growth--technavio-301579993.html,20220705T020000,PR Newswire,"The data center market in Malaysia is fragmented, and the degree of fragmentation will accelerate during the forecast period.",0.022417,Neutral,0.091983,Neutral,0,broad,
IBM,New Study from StrategyR Highlights a $87.5 Billion Global Market for Smart Classroom by 2026,https://www.prnewswire.com/news-releases/new-study-from-strategyr-highlights-a-87-5-billion-global-market-for-smart-classroom-by-2026--301579420.html,20220704T110500,PR Newswire,"• Access to our digital archives and MarketGlass Research Platform Companies: 13 - Players covered include Apple, Inc. Barco. BigBlueButton. Blackboard Inc. Cisco Systems Inc. Dell Inc. Digital Samba SL. Discovery Communication. Dynavox Mayer-Johnson. Electa Communications Ltd.",0.001229,Neutral,0.117688,Neutral,0,focused,smart
IBM,"Only 8 Of The 30 Dow Jones Stocks Were Positive In The First Half Of 2022: Chevron Leads, But Who Else Was Up?",https://www.benzinga.com/news/22/07/27934908/only-8-of-the-30-dow-jones-stocks-were-positive-in-the-first-half-of-2022-chevron-leads-but-who-else,20220701T204549,Benzinga,"The U.S. stock market had a rough start to 2022 with a market correction hitting stocks and many indexes seeing their worst performances in decades. What Happened: The S&P 500, as tracked by the SPDR S&P 500 ETF Trust SPY, saw a decline of 20.8% in the first half of 2022.",-0.117141,Neutral,0.193001,Neutral,0,broad,
IBM,10 Defensive ETFs to Protect Your Portfolio,https://www.kiplinger.com/investing/etfs/604881/10-defensive-etfs-to-protect-your-portfolio,20220701T184415,Kiplinger,"It's hard to blame investors for wanting to dive into a safe room following the S&P 500's worst first half of a year since 1970. Fortunately, they can find the protection they seek via defensive exchange-traded funds ( ETFs ).",-0.139301,Neutral,0.034119,Neutral,0,broad,
IBM,Business Process Management as a Service  ( BPMaaS )  Market Size to Grow by USD 19.56 billion | Accenture Plc and Appian Corp. among Key Vendors | Technavio,https://www.prnewswire.com/news-releases/business-process-management-as-a-service-bpmaas-market-size-to-grow-by-usd-19-56-billion--accenture-plc-and-appian-corp-among-key-vendors--technavio-301579036.html,20220701T153500,PR Newswire,• BFSI: The market vendors should focus on grabbing business opportunities from the BFSI segment under the end-users category as it accounted for the largest market share in the base year.,0.003092,Neutral,0.130677,Neutral,0,broad,
IBM,Should SPDR S&P Dividend ETF  ( SDY )  Be on Your Investing Radar?,https://www.zacks.com/stock/news/1946589/should-spdr-sp-dividend-etf-sdy-be-on-your-investing-radar,20220701T102007,Zacks Commentary,Style Box ETF report for ...,0.034186,Neutral,0.118617,Neutral,0,broad,
IBM,3 Top Tech Stocks to Buy Right Now,https://www.fool.com/investing/2022/06/30/3-top-tech-stocks-to-buy-right-now/,20220630T115500,Motley Fool,"IBM, Accenture, and Cloudflare are all solid long-term investments.",0.00508,Neutral,0.307347,Neutral,0,broad,
IBM,Insurance Software Market Size to Grow by USD 7.29 Billion | 6.34% YOY Growth to be Recorded in 2021 | Technavio,https://www.prnewswire.com/news-releases/insurance-software-market-size-to-grow-by-usd-7-29-billion--6-34-yoy-growth-to-be-recorded-in-2021--technavio-301577849.html,20220630T114000,PR Newswire,"Technavio presents a detailed picture of the market by the way of study, synthesis, and summation of data from multiple sources. The insurance software market report covers the following areas: • The market is fragmented, and the degree of fragmentation will accelerate during the forecast period.",0.022229,Neutral,0.617238,Neutral,0,focused,AI
IBM,Artificial Intelligence  ( AI )  Market in Retail Sector Market - 40% of Growth to Originate from North America| Driven by the Rise in Investments and R & D in AI Startups| Technavio,https://www.prnewswire.com/news-releases/artificial-intelligence-ai-market-in-retail-sector-market---40-of-growth-to-originate-from-north-america-driven-by-the-rise-in-investments-and-r--d-in-ai-startups-technavio-301576949.html,20220630T001000,PR Newswire,For more information on region segment - Get a sample now! The key factor driving the global artificial intelligence ( AI ) market growth in the retail sector is the rise in investments and R&D in AI startups.,0.005701,Neutral,0.545524,Neutral,0,focused,"artificial intelligence, AI"
IBM,"Mastercard  ( MA ) , Softcell Tie Up to Boost Cybersecurity in India",https://www.zacks.com/stock/news/1945793/mastercard-ma-softcell-tie-up-to-boost-cybersecurity-in-india,20220629T152800,Zacks Commentary,"Mastercard (MA) collaborates with Softcell, which will distribute MA's RiskRecon to its customers across India and empower them to counter cybersecurity threats.",0.067184,Neutral,0.089813,Neutral,0,broad,
IBM,Cloud Backup and Recovery Market Size to Grow by USD 14.59 billion | Hewlett Packard Enterprise Co. and International Business Machines Corp. Among Key Vendors | Technavio,https://www.prnewswire.com/news-releases/cloud-backup-and-recovery-market-size-to-grow-by-usd-14-59-billion--hewlett-packard-enterprise-co-and-international-business-machines-corp-among-key-vendors--technavio-301576839.html,20220629T055000,PR Newswire,"The market vendors should focus on grabbing business opportunities from the ICT segment under the end-users category, as it accounted for the largest market growth share in the base year. The growth of the segment is driven by factors such as the increasing demand for the digitalization of the ...",0.00733,Neutral,0.744067,Neutral,0,broad,
IBM,Green Technology and Sustainability Market Size to Grow by USD 26.10 billion | AAA Taranis Visual Ltd. and ConsenSys Software Inc. Among Key Market Contributors | Technavio,https://www.prnewswire.com/news-releases/green-technology-and-sustainability-market-size-to-grow-by-usd-26-10-billion--aaa-taranis-visual-ltd-and-consensys-software-inc-among-key-market-contributors--technavio-301576816.html,20220629T051000,PR Newswire,"To learn more about market dynamics, Download a Sample Report! The green technology and sustainability market covers the following areas: Green Technology And Sustainability Market Sizing Green Technology And Sustainability Market Forecast Green Technology And Sustainability Market Analysis",0.001274,Neutral,0.099974,Neutral,0,focused,AI
IBM,Hewlett Packard  ( HPE )  Adds Red Hat to GreenLake Ecosystem,https://www.zacks.com/stock/news/1944925/hewlett-packard-hpe-adds-red-hat-to-greenlake-ecosystem,20220628T120700,Zacks Commentary,"Hewlett Packard (HPE) to offer new GreenLake solutions combined with Red Hat's open-source software technologies, enabling organizations to address their cost & risk challenges in a better way.",0.086002,Neutral,0.368991,Neutral,0,broad,
IBM,"Software Testing Services Market to Grow at a CAGR of 15.07% | Regional Outlook, Growth Potential, Competitive Market Share & Forecast | Technavio",https://www.prnewswire.com/news-releases/software-testing-services-market-to-grow-at-a-cagr-of-15-07--regional-outlook-growth-potential-competitive-market-share--forecast--technavio-301575874.html,20220628T094500,PR Newswire,Didn't Find What You Were Looking For? Customize Report- Don't miss out on the opportunity to speak to our analyst and know more insights about this market report. Our analysts can also help you customize this report according to your needs.,0.019224,Neutral,0.042922,Neutral,0,broad,
IBM,Data-as-a-Service Market: 47.21% YOY growth achieved in 2021 | Driven by growing amount of data | Technavio,https://www.prnewswire.com/news-releases/data-as-a-service-market-47-21-yoy-growth-achieved-in-2021--driven-by-growing-amount-of-data--technavio-301573966.html,20220625T035000,PR Newswire,Get highlights on the growth variance and the Y-O-Y growth rate. The growing amount of data and increase in the adoption of big data services in industries are some of the key market drivers. The volume of data generated across industries has significantly increased over the past decade.,0.03,Neutral,0.050285,Neutral,0,broad,
IBM,3 Top Tech Stocks That Could Help Make You Rich by Retirement,https://www.fool.com/investing/2022/06/23/top-tech-stocks-help-make-you-rich-retirement/,20220623T131727,Motley Fool,Let time do the heavy lifting with these tech stocks.,-0.057597,Neutral,0.170365,Neutral,0,broad,
IBM,Dogs of the Dow Are 2022's Best in Show,https://www.kiplinger.com/investing/stocks/dividend-stocks/604828/dogs-of-the-dow-are-2022s-best-in-show,20220622T183419,Kiplinger,"All portfolio doctors should prescribe high dividends to remedy rising interest rates and stiff inflation. In 2022, the first year in recent memory pockmarked by those twin afflictions, dividend-heavy stocks such as utilities, pharmaceuticals, pipelines and many consumer-oriented blue chips like ...",0.110007,Neutral,0.145276,Bullish,0,broad,
IBM,5 Low Price-to-Sales Stocks to Scoop for Brimming Returns,https://www.zacks.com/stock/news/1942052/5-low-price-to-sales-stocks-to-scoop-for-brimming-returns,20220622T103200,Zacks Commentary,"Price-to-sales is a convenient tool to gauge the value of stocks incurring losses or are in an early development cycle. Stocks like AAN, SIG, AVT, VSH and TA hold promise.",0.147874,Neutral,0.030216,Somewhat-Bullish,0,broad,
IBM,These 2 Dividend ETFs Are a Retiree's Best Friend,https://www.fool.com/investing/2022/06/17/these-2-dividend-etfs-are-a-retirees-best-friend/,20220617T131700,Motley Fool,These ETFs provide a hassle-free way to boost your retirement income.,0.115439,Neutral,0.081111,Neutral,0,broad,
IBM,ASA Launches New Global Branding Initiative,https://www.prnewswire.com/news-releases/asa-launches-new-global-branding-initiative-301569707.html,20220617T123400,PR Newswire,"HERNDON, Va. , June 17, 2022 /PRNewswire/ -- ASA has officially launched a new global initiative to update its corporate branding. Efforts include a change in public reference of the organization's name from the American Society of Appraisers to ""ASA"".",0.188628,Somewhat-Bullish,0.14864,Somewhat-Bullish,0,focused,AI
IBM,T: 5 Blue Chip Dividend Stocks Yielding More Than 4%,https://stocknews.com/news/t-lyb-bns-ibm-mo-5-blue-chip-dividend-stocks-yielding-more-than-4/,20220616T202924,Stocknews.com,T: 5 Blue Chip Dividend Stocks Yielding More Than ...,0.068221,Neutral,0.177361,Neutral,0,broad,
IBM,"Global eDiscovery Market Report  ( 2022 to 2027 )  - Industry Trends, Share, Size, Growth, Opportunity and Forecasts",https://www.benzinga.com/pressreleases/22/06/g27716337/global-ediscovery-market-report-2022-to-2027-industry-trends-share-size-growth-opportunity-and-for,20220615T114835,Benzinga,"Dublin, June 15, 2022 ( GLOBE NEWSWIRE ) -- The ""eDiscovery Market: Global Industry Trends, Share, Size, Growth, Opportunity and Forecast 2022-2027"" report has been added to ResearchAndMarkets.com's offering. The global eDiscovery market reached a value of US$ 11.4 Billion in 2021.",-0.037931,Neutral,0.041661,Neutral,0,broad,
IBM,Blockchain Technology Market in Transportation and Logistics Industry: North America to Occupy 55% Market Share | Sea Segment to be Significant for Revenue Generation | Technavio,https://www.prnewswire.com/news-releases/blockchain-technology-market-in-transportation-and-logistics-industry-north-america-to-occupy-55-market-share--sea-segment-to-be-significant-for-revenue-generation--technavio-301566702.html,20220614T070000,PR Newswire,The blockchain technology market in the transportation and logistics industry market report covers the following areas: • What are the major trends in the market?,0.058159,Neutral,0.642678,Neutral,0,focused,AI
IBM,Why IBM is one of few tech giants that are actually gaining through the selloff,https://www.marketwatch.com/story/why-ibm-is-one-of-few-tech-giants-that-are-actually-gaining-through-the-selloff-11655146869,20220613T190100,MarketWatch,"International Business Machines Corp., unlike many other tech giants, has been able to buck the sector's selloff in recent months.",0.044534,Neutral,0.848678,Neutral,0,focused,AI
IBM,"Zacks.com featured highlights The Aaron's Company, MarineMax, Avnet, Vishay Intertechnology and Huntsman",https://www.zacks.com/stock/news/1937966/zackscom-featured-highlights-the-aarons-company-marinemax-avnet-vishay-intertechnology-and-huntsman,20220613T104200,Zacks Commentary,"The Aaron's Company, MarineMax, Avnet, Vishay Intertechnology and Huntsman have been highlighted in this Screen of the Week article.",0.038827,Neutral,0.02428,Neutral,0,broad,
IBM,Cloud Migration Services Market to witness USD 7.09 Bn growth | North America to have largest share | Technavio,https://www.prnewswire.com/news-releases/cloud-migration-services-market-to-witness-usd-7-09-bn-growth--north-america-to-have-largest-share--technavio-301565827.html,20220613T072000,PR Newswire,"The market is mainly driven by the increasing adoption of cloud computing. In addition, factors such as the shift from the CAPEX model to the OPEX model and the increasing adoption of container-as-a-service will have a positive impact on the growth of the market.",0.006443,Neutral,0.187076,Neutral,0,focused,AI
IBM,Microsoft Makes an Important Decision About Russia,https://www.thestreet.com/technology/microsoft-makes-an-important-decision-about-russia,20220610T150400,The Street,"Software giant Microsoft, like other multinationals, faces the dilemma about Russia after the country invaded Ukraine: Stay or go?",-0.252763,Somewhat-Bearish,0.185829,Bearish,0,focused,AI
IBM,5 Low Price-to-Sales Stocks That Can Uplift Your Portfolio,https://www.zacks.com/stock/news/1937250/5-low-price-to-sales-stocks-that-can-uplift-your-portfolio,20220610T114700,Zacks Commentary,"Price-to-sales is a convenient tool to gauge the value of stocks incurring losses or are in an early development cycle. Stocks like AAN, HZO, AVT, VSH and HUN hold promise.",0.15649,Somewhat-Bullish,0.029231,Somewhat-Bullish,0,broad,
IBM,Everyone Is Talking About This Stock. Is It a Good Long-Term Option?,https://www.fool.com/investing/2022/06/10/everyone-talking-about-stock-good-long-term-ibm/,20220610T105000,Motley Fool,"A name cast off as a has-been is being rekindled, en route to its former glory.",0.121623,Neutral,0.404807,Somewhat-Bullish,0,broad,
IBM,AscendEX Appoints Shane Molidor as New CEO,https://www.benzinga.com/pressreleases/22/06/g27633118/ascendex-appoints-shane-molidor-as-new-ceo,20220609T185108,Benzinga,"Singapore, June 09, 2022 ( GLOBE NEWSWIRE ) -- AscendEX, a global cryptocurrency financial platform, announced today that Shane Molidor has been appointed Chief Executive Officer. He succeeds the exchange's founding partner, George Cao, who will continue to support AscendEX as Chairman.",0.072642,Neutral,0.124776,Neutral,0,focused,AI
IBM,IT Services Market Size in Latin America to Increase by USD 33.68 billion by 2025| Evolving Opportunities with Accenture Plc & Amazon.com Inc| Technavio,https://www.prnewswire.com/news-releases/it-services-market-size-in-latin-america-to-increase-by-usd-33-68-billion-by-2025-evolving-opportunities-with-accenture-plc--amazoncom-inc-technavio-301564041.html,20220609T154000,PR Newswire,• Drivers: The key factors driving growth in the IT services market in are the rising focus on core competencies and improved efficiency. Companies outsource IT-related requirements such as application and infrastructure management to IT outsourcing service providers.,0.00566,Neutral,0.05242,Neutral,0,broad,
IBM,Kerala: IBM launches automation innovation centre to meet business demands,https://www.business-standard.com/article/companies/kerala-ibm-launches-automation-innovation-centre-to-meet-business-demands-122060801402_1.html,20220609T040300,Business Standard,"To be in line with the business demands in India, the International Business Machines (IBM) on Monday launched Automation Innovation Centre at Brigade World Trade Centre Info Park in ...",0.068322,Neutral,0.778943,Neutral,0,focused,automation
IBM,7 Tempting Tech Stocks With Above-Average Dividends,https://www.kiplinger.com/investing/stocks/tech-stocks/604778/tempting-tech-stocks-with-above-average-dividends,20220608T193903,Kiplinger,"Finding tech stocks with dividends isn't the easiest task for investors. Most don't issue cash payouts to shareholders, but the few that do become even more enticing during periods of market volatility due to their ability to offer a unique combination of growth and income.",0.092377,Neutral,0.121266,Neutral,0,broad,
IBM,One of the Best-Performing Tech Stocks Will Surprise You,https://www.thestreet.com/investing/ibm-stock-is-best-performing-stocks-in-technology-sector,20220608T180400,The Street,IBM stock has quickly become one of the top-performing tech stocks of 2022. Here's where to buy the dip.,-0.054382,Neutral,0.950798,Neutral,0,broad,
IBM,Microsoft Goes Aggressive In Its Protest Against Russia's Ukraine Invasion - Read How,https://www.benzinga.com/news/22/06/27606220/microsoft-goes-aggressive-in-its-protest-against-russias-ukraine-invasion-read-how,20220608T133149,Benzinga,"In an email accessed by Bloomberg, Microsoft Corp MSFT disclosed materially scaling down its operations in Russia following the Russian invasion of Ukraine. Microsoft joined the likes of International Business Machines Corp IBM and Apple Inc AAPL, cutting back or exiting the country after the ...",-0.195597,Somewhat-Bearish,0.584208,Somewhat-Bearish,0,focused,AI
IBM,IBM zSystems Solutions Boost Siam Commercial Bank Security,https://www.zacks.com/stock/news/1934964/ibm-zsystems-solutions-boost-siam-commercial-bank-security,20220606T142000,Zacks Commentary,"IBM's key expertise in offering a secure, resilient enterprise platform for mission critical apps and data on hybrid multi-cloud will help minimize fraudulent activities in financial transactions.",0.078893,Neutral,0.429197,Neutral,0,broad,
IBM,Vocational Education and Training Market Worth $896.01 Billion by 2029 - Exclusive Report by Meticulous Research®,https://www.benzinga.com/pressreleases/22/06/g27566767/vocational-education-and-training-market-worth-896-01-billion-by-2029-exclusive-report-by-meticulo,20220606T135926,Benzinga,"Redding, California, June 06, 2022 ( GLOBE NEWSWIRE ) -- According to a new market research report titled, 'Vocational Education and Training Market by Supplier Institution ( Public, Private ) , User's Gender ( Male, Female ) , and End User ( Students, Office Workers ) - Global Forecast to",0.04869,Neutral,0.020581,Neutral,0,focused,AI
IBM,Amazon Stock Powers Higher Ahead of 20-For-1 Split Debut: Opening Pegged Near $125 Each,https://www.thestreet.com/markets/amazon-stock-gains-on-split-debut-opening-pegged-near-125,20220606T124300,The Street,"Amazon will begin trading on a 20-for-1 split adjusted basis Monday, with investors pegging its opening bell price at around $125 per share.",-0.022009,Neutral,0.179655,Neutral,0,broad,
IBM,The Final Call: Starbucks And IBM,https://www.benzinga.com/trading-ideas/long-ideas/22/06/27559688/the-final-call-starbucks-and-ibm,20220606T123844,Benzinga,"On CNBC's ""The Final Call,"" Michael Khouw of Optimize Advisors recommended Starbucks Corporation ( NASDAQ: SBUX ) and International Business Machines Corp ( NYSE: IBM ) , saying that ""they're so bad, they're good."" Check out other stocks making big moves in the premarket. Carter Worth also recomm",-0.114611,Neutral,0.938938,Neutral,0,broad,
IBM,"Exclusive: AICTE, MoE and MSDE join hands to launch Digital Skilling - a free skilling platform on emerging technologies | The Financial Express",https://www.financialexpress.com/education-2/aicte-moe-and-msde-join-hands-to-launch-digital-skilling-a-free-skilling-platform-on-emerging-technologies/2549406/,20220606T022126,The Financial Express,"The platform will be launched on June 6, 2022 at 3:30 pm by Dharmendra Pradhan, Union Education Minister and Minister of Skill Development and Entrepreneurship.",0.130265,Neutral,0.189819,Neutral,0,focused,AI
IBM,"AICTE, MoE and MSDE join hands to launch ABCDEFGHI - a free skilling platform on emerging technologies | The Financial Express",https://www.financialexpress.com/education-2/aicte-moe-and-msde-join-hands-to-launch-abcdefghi-a-free-skilling-platform-on-emerging-technologies/2549406/,20220606T022126,The Financial Express,"The platform will be launched on June 6, 2022 at 3:30 pm by Dharmendra Pradhan, Union Education Minister and Minister of Skill Development and Entrepreneurship.",0.130265,Neutral,0.190868,Neutral,0,focused,AI
IBM,SHAREHOLDER ALERT: Pomerantz Law Firm Investigates Claims On Behalf of Investors International Business Machines Corporation - IBM,https://www.benzinga.com/pressreleases/22/06/g27557433/shareholder-alert-pomerantz-law-firm-investigates-claims-on-behalf-of-investors-international-busi,20220605T041714,Benzinga,"NEW YORK, June 05, 2022 ( GLOBE NEWSWIRE ) -- Pomerantz LLP is investigating claims on behalf of investors of International Business Machines Corporation ( ""IBM"" or the ""Company"" ) ( NYSE:IBM ) . Such investors are advised to contact Robert S. Willoughby at newaction@pomlaw.com or 888-476-652",-0.036394,Neutral,0.529363,Neutral,0,focused,"AI, ML"
