ticker,title,url,time_published,source,summary,sentiment_score,sentiment_label,ticker_sentiment_score,ticker_sentiment_label,relevance_score,category,ai_keywords_found
IBM,Healthcare Cloud Computing Market worth $89.4 billion by 2027 - Exclusive Report by MarketsandMarkets™,https://www.prnewswire.com/news-releases/healthcare-cloud-computing-market-worth-89-4-billion-by-2027--exclusive-report-by-marketsandmarkets-301530901.html,20220422T143000,PR Newswire,"CHICAGO, April 22, 2022 /PRNewswire/ -- According to the new market research report ""Healthcare Cloud Computing Market by Product  ( EMR/EHR, VNA, RIS, LIS, PIS ) , Deployment  ( Private Cloud, Hybrid Cloud, Public Cloud ) , Component  ( Software, Services ) , Pricing  ( Spot Pricing ) , Service  ( SaaS, IaaS, PaaS ) , End User - Global Forecasts to 2027"", published by MarketsandMarkets™, the global Healthcare Cloud Computing Market is projected to reach USD 89.4 billion by 2027 from USD 39.4 billion in 2022, at a CAGR of 17.8%.",0.012131,Neutral,0.038137,Neutral,0,broad,
IBM,Microsoft Analyst Warns 'There's Little Margin For Error',https://www.benzinga.com/analyst-ratings/analyst-color/22/04/26757314/why-this-microsoft-analyst-warns-theres-little-margin-for-error-ahead-of-quarterly-,20220422T124823,Benzinga,"Microsoft Corporation  ( NASDAQ: MSFT )  is scheduled to report its fiscal-year third-quarter results after the market closes on Tuesday. Ahead of the event, an analyst at Piper Sandler sounded out downside risks but retained his bullish bias.
The Microsoft Analyst:  Brent Bracelin maintained an Ove",-0.064669,Neutral,0.224799,Neutral,0,focused,AI
IBM,Should Investors Worry About IBM's Dividend?,https://www.fool.com/investing/2022/04/22/should-investors-worry-about-ibm-dividend/,20220422T115500,Motley Fool,A troubled decade has taken a toll on the tech stalwart's financial health.,-0.141669,Neutral,0.540657,Neutral,0,broad,
IBM,"Cloud Computing Market: 40% of Growth to Originate from North America | By Service  ( SaaS, IaaS, and PaaS )  and Geography - Global Forecast to 2025",https://www.prnewswire.com/news-releases/cloud-computing-market-40-of-growth-to-originate-from-north-america--by-service-saas-iaas-and-paas-and-geography--global-forecast-to-2025-301530204.html,20220422T050000,PR Newswire,"• SaaS:

The adoption of SaaS helps enterprises in eliminating expenses and complexities associated with managing hardware and software required to ru",0.015002,Neutral,0.524096,Neutral,0,broad,
IBM,IBM: Web 3.0: How to Capitalize on the Future of the Internet,https://stocknews.com/news/ibm-msft-intc-web-3-0-how-to-capitalize-on-the-future-of-the/,20220421T113000,Stocknews.com,"The 1990s and the early 2000s gave the world an unprecedented change through the rise of what we call the Internet. Web 1.0 was ushered in when web browsers such as Netscape Navigator were introduced. The bland and disorganized web pages of this era were replaced by the era of social media and user-generated content. Over the past decade, the world saw an exponential rise of Web 2.0, which is characterized by the continuous rise of a handful of dominant platforms.",0.089194,Neutral,0.251132,Neutral,0,broad,
IBM,IBM Stock Soared. Why the 111-Year-Old Tech Company Outperformed Today.,https://www.barrons.com/articles/ibm-stock-price-earnings-tech-51650475519,20220420T235400,Barrons,"Score one for the old timers. On a day when Netflix stock plunged 35% on concerns about disappointing subscriber growth, the market is getting a boost from none other than 111-year old International Business Machines. As the company's first-quarter financial results demonstrated, the tech giant is making clear progress on its push to reshape the company, shifting its focus to the cloud and artificial intelligence.",0.354467,Bullish,0.907478,Bullish,0,focused,artificial intelligence
IBM,"CLASS ACTION UPDATE for VRT, IBM and AUPH: Levi & Korsinsky, LLP Reminds Investors of Class Actions on Behalf of Shareholders",https://investingnews.com/class-action-update-for-vrt-ibm-and-auph-levi-korsinsky-llp-reminds-investors-of-class-actions-on-behalf-of-shareholders/,20220420T222543,Investing News Network,"Levi & Korsinsky, LLP announces that class action lawsuits have commenced on behalf of shareholders of the following publicly-traded companies. Shareholders interested in serving as lead plaintiff have until the deadlines listed to petition the court. Further details about the cases can be found at the links provided. There is no cost or obligation to you",-0.4896,Bearish,0.198669,Bearish,0,focused,AI
IBM,Stock Market Today: Netflix's Epic Crash Clips Nasdaq,https://www.kiplinger.com/investing/stocks/604571/stock-market-today-042022-netflix-epic-crash-clips-nasdaq,20220420T201906,Kiplinger,"The earnings calendar was front and center Wednesday as a mixed day for the broader indexes was easily overshadowed by a plunge in of Wall Street's most notable mega-caps.
Netflix  ( NFLX )  suffered its worst single-day decline in 18 years - a 35% nosedive eroding roughly $55 billion in market valu",-0.188979,Somewhat-Bearish,0.123083,Neutral,0,broad,
IBM,PreMarket Prep Stock Of The Day: Big Blue On The Move,https://www.benzinga.com/news/earnings/22/04/26720119/premarket-prep-stock-of-the-day-big-blue-on-the-move,20220420T174816,Benzinga,"International Business Machines  ( NYSE: IBM )  is having its best day since Jan. 25  ( $128.82 to $136.10 )  after its earnings beat. The corresponding price action makes it the PreMarket Prep Stock Of The Day.
Price Action Ahead Of Report: Since April 6, IBM has been in a trading range from $124.9",0.063569,Neutral,0.332509,Bullish,0,broad,
IBM,IBM Stock Is Soaring. Strong Earnings Is Giving Legacy Tech a Leg Up.,https://www.barrons.com/articles/ibm-earnings-stock-legacy-tech-51650475519,20220420T172600,Barrons,"Score one for the old timers. On a day when Netflix stock has plunged 36% on concerns about disappointing subscriber growth, the market is getting a boost from none other than 111-year old International Business Machines. As the company's first-quarter financial results demonstrated, the tech giant is making clear progress on its push to reshape the company, shifting its focus to the cloud and artificial intelligence.",0.342824,Somewhat-Bullish,0.909909,Somewhat-Bullish,0,focused,artificial intelligence
IBM,Software and Consulting Power IBM's Earnings Beat,https://www.fool.com/investing/2022/04/20/software-and-consulting-power-ibms-earnings-beat/,20220420T171823,Motley Fool,"With Kyndryl cut loose, IBM's growth profile looks a whole lot better.",0.103081,Neutral,0.664553,Neutral,0,broad,
IBM,ETFs to Buy as IBM Tops Estimates in Q1 Earnings,https://www.zacks.com/stock/news/1903385/etfs-to-buy-as-ibm-tops-estimates-in-q1-earnings,20220420T151500,Zacks Commentary,International Business Machines (IBM) cheered investors as it reported solid first-quarter 2022 results.,0.032739,Neutral,0.446481,Neutral,0,broad,
IBM,"The Gross Law Firm Announces Class Actions on Behalf of Shareholders of CELH, ABBV and IBM",https://investingnews.com/the-gross-law-firm-announces-class-actions-on-behalf-of-shareholders-of-celh-abbv-and-ibm/,20220420T150704,Investing News Network,The securities litigation law firm of The Gross Law Firm issues the following notice on behalf of shareholders in the following publicly traded companies. Shareholders who purchased shares in the following companies during the dates listed are encouraged to contact the firm regarding possible Lead Plaintiff appointment. Appointment as Lead Plaintiff is not required to partake in any recovery,-0.601754,Bearish,0.164581,Bearish,0,focused,AI
IBM,Homebuilders Hammer Away After Tuesday's Rally As Yields Tick Lower,https://www.benzinga.com/news/earnings/22/04/26716827/homebuilders-hammer-away-after-tuesdays-rally-as-yields-tick-lower,20220420T150506,Benzinga,"This post contains sponsored advertising content. This content is for informational purposes only and not intended to be investing advice.
 ( Wednesday Market Open )  Equity index futures pointed to a higher open in premarket trading as investors look to build on yesterday's gains.
However, Netflix ",-0.235244,Somewhat-Bearish,0.081368,Neutral,0,focused,AI
IBM,IBM Shares Are Surging: Here's Why,https://www.benzinga.com/news/earnings/22/04/26715753/ibm-shares-are-surging-heres-why,20220420T145114,Benzinga,"International Business Machines Corp  ( NYSE: IBM )  shares are trading higher Wednesday after the company reported better-than-expected financial results.
IBM said first-quarter revenue increased 8% year-over-year to $14.2 billion, which beat the $13.85 billion estimate. The company reported quarte",-0.014049,Neutral,0.953697,Neutral,0,focused,AI
IBM,IBM Tops Q1 Earnings Estimates on Hybrid Cloud and AI Demand,https://www.zacks.com/stock/news/1903161/ibm-tops-q1-earnings-estimates-on-hybrid-cloud-and-ai-demand,20220420T132100,Zacks Commentary,"IBM's first-quarter 2022 results benefit from strong demand for hybrid cloud and AI, driving growth in Software and Consulting.",0.145914,Neutral,0.35373,Somewhat-Bullish,0,focused,AI
IBM,"Stock Market News for Apr 20, 2022",https://www.zacks.com/stock/news/1903240/stock-market-news-for-apr-20-2022,20220420T125200,Zacks Commentary,"Wall Street made gains on Tuesday, disregarding reduced global growth forecasts.",-0.144502,Neutral,0.073795,Neutral,0,focused,AI
IBM,"Stock Market Today - 4/20: Stocks Mixed As Treasury Yields Rise, Earnings Underwhelm",https://www.thestreet.com/markets/stocks-mixed-as-yields-rise-earnings-underwhelm-netflix-plummets,20220420T114300,The Street,"With real Treasury bond yields turning positive for the first time in two years, investors are now re-assessing their appetite for stocks amid a mixed first quarter earnings season.",-0.084972,Neutral,0.182506,Neutral,0,broad,
IBM,"IBM Stock Jumps After Q1 Earnings Beat, Solid Cloud, Consulting Outlook",https://www.thestreet.com/markets/ibm-stock-jumps-on-q1-profit-beat-solid-cloud-consulting-outlook,20220420T105400,The Street,"This solid start to the year reinforces our confidence in our strategy (and) we continue to see a strong demand environment for both technology and consulting,"" said CEO Arvind Krishna.",0.064698,Neutral,0.648164,Neutral,0,focused,AI
IBM,"Top Stock Market News For Today April 20, 2022",https://stockmarket.com/featured/top-stock-market-news-for-today-april-20-2022-2022-04-20,20220420T102440,StockMarket.com,"Stock index futures show continued volatility; Netflix slumps as subscriber count shrinks.
The post Top Stock Market News For Today April 20, 2022 appeared first on Stock Market News, Quotes, Charts and Financial Information | StockMarket.com.",-0.064192,Neutral,0.200715,Neutral,0,broad,
IBM,A Peek Into The Markets: US Stock Futures Flat Ahead Of Earnings; Netflix Shares Plunge,https://www.benzinga.com/news/earnings/22/04/26706710/a-peek-into-the-markets-us-stock-futures-flat-ahead-of-earnings-netflix-shares-plunge,20220420T101157,Benzinga,"Pre-open movers
U.S. stock futures traded mostly flat in early pre-market trade after the Dow Jones jumped around 500 points in the previous session. Investors are awaiting earnings results from  The Procter & Gamble Company  ( NYSE: PG ) ,  Tesla, Inc.  ( NASDAQ: TSLA )  and  Abbott Laboratories  (",-0.005914,Neutral,0.132004,Neutral,0,focused,AI
IBM,"Stocks Mixed, Netflix Pounded, IBM Impresses, Tesla and Twitter In Focus - 5 Things You Must Know",https://www.thestreet.com/markets/-5-things-you-must-know-before-market-opens-wednesday-041422,20220420T095500,The Street,"Stock futures mixed as Treasury yields rise, earnings underwhelm; Netflix shares pummeled as subscriber exodus prompts advertising re-think; IBM shares rise after solid earnings, robust cloud revenue outlook; Tesla earnings on deck with margins, outlook in focus and Twitter shares jump as Elon Musk ",-0.052284,Neutral,0.223248,Neutral,0,broad,
IBM,"5 Stocks To Watch For April 20, 2022",https://www.benzinga.com/news/earnings/22/04/26706074/5-stocks-to-watch-for-april-20-2022,20220420T090214,Benzinga,"Some of the stocks that may grab investor focus today are:
Wall Street expects  The Procter & Gamble Company  ( NYSE: PG )  to report quarterly earnings at $1.30 per share on revenue of $18.73 billion before the opening bell. Procter & Gamble shares rose 0.6% to $160.30 in pre-market trading.
Netfli",-0.001874,Neutral,0.450165,Neutral,0,broad,
IBM,IBM revenue up 8% on continued momentum in hybrid cloud business,https://www.foxbusiness.com/technology/ibm-revenue-up-8-on-continued-momentum-in-hybrid-cloud-business,20220420T040238,Fox Business News,"International Business Machines Corp. reported a stronger-than-expected 8% revenue increase in the first quarter on continued momentum in its hybrid cloud platform, a key focus of the tech company's transformation.",0.029565,Neutral,0.547391,Neutral,0,broad,
IBM,"Nasdaq up 2% as Wall Street advances on earnings optimism, bond yields up; Netflix, J&J stocks rise | The Financial Express",https://www.financialexpress.com/market/nasdaq-up-2-as-wall-street-advances-on-earnings-optimism-bond-yields-up-netflix-jj-stocks-rise/2497224/,20220420T025027,The Financial Express,"The Dow Jones Industrial Average rose 499.51 points, or 1.45%, the S&P 500 gained 70.52 points, or 1.61%, and Nasdaq Composite added 287.30 points, or 2.15%.",-0.048902,Neutral,0.063712,Neutral,0,focused,AI
IBM,SHAREHOLDER ALERT: VLTA IBM AUPH: The Law Offices of Vincent Wong Reminds Investors of Important Class Action Deadlines,https://investingnews.com/shareholder-alert-vlta-ibm-auph-the-law-offices-of-vincent-wong-reminds-investors-of-important-class-action-deadlines/,20220419T212632,Investing News Network,The Law Offices of Vincent Wong announce that class actions have commenced on behalf of certain shareholders in the following companies. If you suffered a loss you have until the lead plaintiff deadline to request that the court appoint you as lead plaintiff. There will be no obligation or cost to you,-0.547459,Bearish,0.174756,Bearish,0,focused,AI
IBM,"IBM stock rises following Street beat, optimistic outlook",https://www.marketwatch.com/story/ibm-stock-rises-following-street-beat-optimistic-outlook-11650400442,20220419T204000,MarketWatch,International Business Machines Corp.  shares rose in the extended session Tuesday after Big Blue's quarterly results came in slightly better than expected and the company forecast revenue at the high end of its estimated range.,0.047611,Neutral,0.657375,Neutral,0,broad,
IBM,Why IBM Shares Are Trading Higher After Hours,https://www.benzinga.com/news/earnings/22/04/26701999/why-ibm-shares-are-trading-higher-after-hours,20220419T202812,Benzinga,"International Business Machines Corp  ( NYSE: IBM )  shares are trading higher in Tuesday's after-hours session after the company announced better-than-expected financial results.
IBM said first-quarter revenue increased 8% year-over-year to $14.2 billion, which beat the $13.85 billion estimate. The",-0.002054,Neutral,0.90699,Neutral,0,focused,AI
IBM,Cboe's Market Recap: April 11 To April 15,https://www.benzinga.com/news/22/04/26696478/cboes-market-recap-april-11-to-april-15,20220419T172930,Benzinga,"This post contains sponsored advertising content. This content is for informational purposes only and is not intended to be investing advice.
One quarter into 2022, the markets are still experiencing drawbacks.
Cboe Global Markets Inc.  ( BATS: CBOE )  reports a decline in a number of U.S. funds tra",-0.029536,Neutral,0.100835,Neutral,0,focused,AI
IBM,"CTG Continues to Execute on Strategy to Drive Client Success with Advanced Digital Solutions; Promotes Brett Hunt to Vice President, North America Solutions and Delivery",https://www.globenewswire.com/news-release/2022/04/19/2424219/35337/en/CTG-Continues-to-Execute-on-Strategy-to-Drive-Client-Success-with-Advanced-Digital-Solutions-Promotes-Brett-Hunt-to-Vice-President-North-America-Solutions-and-Delivery.html,20220419T105500,GlobeNewswire,"BUFFALO, N.Y., April  19, 2022   ( GLOBE NEWSWIRE )  -- CTG  ( Nasdaq: CTG )   ( ""Company"" ) , a leader in helping companies employ digital IT solutions and services to drive productivity and profitability in North America and Western Europe, announced today the promotion of Brett Hunt to the newly ",0.00656,Neutral,0.078559,Neutral,0,broad,
IBM,A Peek Into The Markets: US Stock Futures Mixed Ahead Of Earnings,https://www.benzinga.com/news/earnings/22/04/26681887/a-peek-into-the-markets-us-stock-futures-mixed-ahead-of-earnings,20220419T091313,Benzinga,"Pre-open movers
U.S. stock futures traded mixed in early pre-market trade after the Dow Jones dropped around 40 points in the previous session. Investors are awaiting earnings results from  Johnson & Johnson  ( NYSE: JNJ ) ,  Netflix, Inc.  ( NASDAQ: NFLX ) ,  Lockheed Martin Corporation  ( NYSE: LM",0.016686,Neutral,0.171913,Neutral,0,focused,AI
IBM,"Top Stock Market News For Today April 19, 2022",https://stockmarket.com/featured/top-stock-market-news-for-today-april-19-2022-2022-04-19,20220419T082728,StockMarket.com,"Netflix and IBM are set to report their latest financials today.
The post Top Stock Market News For Today April 19, 2022 appeared first on Stock Market News, Quotes, Charts and Financial Information | StockMarket.com.",-0.160336,Somewhat-Bearish,0.359759,Neutral,0,broad,
IBM,Wall Street closes lower as investors await earnings cues; Twitter stock up 7.5% after co adopts 'poison pill' | The Financial Express,https://www.financialexpress.com/market/wall-street-closes-lower-as-investors-await-earnings-cues-twitter-stock-up-7-5-after-co-adopts-poison-pill/2495842/,20220419T024434,The Financial Express,"Market participants are bracing for a barrage of earnings that will help them assess the impact of the Ukraine war and a spike in inflation on company financials. Netflix, Tesla, Johnson & Johnson and International Business Machines are all to report this week.",-0.109066,Neutral,0.215574,Somewhat-Bearish,0,focused,AI
IBM,Wall Street ends lower as investors await further earnings cues,https://www.moneycontrol.com/news/business/markets/wall-street-ends-lower-as-investors-await-further-earnings-cues-8376341.html,20220419T003102,Money Control,"Market participants are bracing for a barrage of earnings that will help them assess the impact of the Ukraine war and a spike in inflation on company financials. Netflix  ( NFLX.O ) , Tesla  ( TSLA.O ) , Johnson  Johnson  ( JNJ.N )  and International Business Machines  ( IBM.N )  are all to report ",-0.098744,Neutral,0.067727,Neutral,0,focused,AI
IBM,Predictive Presymptomatic Testing Market - 40% of Growth to Originate from North America|Evolving Opportunities with 23andMe Inc. & Abbott Laboratories |Technavio,https://www.prnewswire.com/news-releases/predictive-presymptomatic-testing-market---40-of-growth-to-originate-from-north-americaevolving-opportunities-with-23andme-inc--abbott-laboratories-technavio-301526028.html,20220419T000000,PR Newswire,For more insights on the market share of various regions - Download a free sample now!,0.011631,Neutral,0.051144,Neutral,0,broad,
IBM,"The Klein Law Firm Reminds Investors of Class Actions on Behalf of Shareholders of ABBV, IBM and MYPS",https://investingnews.com/the-klein-law-firm-reminds-investors-of-class-actions-on-behalf-of-shareholders-of-abbv-ibm-and-myps/,20220418T151008,Investing News Network,"The Klein Law Firm announces that class action complaints have been filed on behalf of shareholders of the following companies. There is no cost to participate in the suit. If you suffered a loss, you have until the lead plaintiff deadline to request that the court appoint you as lead plaintiff",-0.592182,Bearish,0.194868,Bearish,0,focused,AI
IBM,"Futures slip as bond yields rise, BofA up on strong consumer lending",https://www.reuters.com/business/futures-slip-bond-yields-rise-bofa-up-strong-consumer-lending-2022-04-18/,20220418T113500,Reuters,"Traders work on the floor of the New York Stock Exchange  ( NYSE )  in New York City, U.S., March 30, 2022. REUTERS/Brendan McDermid/File Photo",-0.042642,Neutral,0.093325,Neutral,0,broad,
IBM,TOP RANKED ROSEN LAW FIRM Encourages International Business Machines Corporation Investors with Losses in Excess of $100K to Secure Counsel Before Important Deadline in Securities Class Action - IBM,https://www.benzinga.com/pressreleases/22/04/g26657658/top-ranked-rosen-law-firm-encourages-international-business-machines-corporation-investors-with-lo,20220416T210000,Benzinga,"NEW YORK, April  16, 2022   ( GLOBE NEWSWIRE )  -- WHY: Rosen Law Firm, a global investor rights law firm, reminds purchasers of the securities of International Business Machines Corporation  ( NYSE:IBM )  between April 4, 2017 and October 20, 2021, inclusive  ( the ""Class Period"" ) , of the importa",-0.30621,Somewhat-Bearish,0.199324,Neutral,0,broad,
IBM,"IBM NOTICE: ROSEN, TRUSTED INVESTOR COUNSEL, Encourages International Business Machines Corporation Investors with Losses in Excess of $100K to Secure Counsel Before Important Deadline in Securiti...",https://markets.businessinsider.com/news/stocks/ibm-notice-rosen-trusted-investor-counsel-encourages-international-business-machines-corporation-investors-with-losses-in-excess-of-100k-to-secure-counsel-before-important-deadline-in-securiti-1031359062,20220415T230000,Business Insider,"WHY: Rosen Law Firm, a global investor rights law firm, reminds purchasers of the securities of International Business Machines Corporation  ( NYSE: IBM )  between April 4, 2017 and October 20, 2021, inclusive  ( the ""Class Period"" ) , of the important June 6, 2022 lead plaintiff deadline.",-0.291176,Somewhat-Bearish,0.261173,Neutral,0,focused,AI
IBM,SHAREHOLDER ALERT: Pomerantz Law Firm Investigates Claims On Behalf of Investors International Business Machines Corporation - IBM,https://www.benzinga.com/pressreleases/22/04/g26651716/shareholder-alert-pomerantz-law-firm-investigates-claims-on-behalf-of-investors-international-busi,20220415T134042,Benzinga,"NEW YORK, April  15, 2022   ( GLOBE NEWSWIRE )  -- Pomerantz LLP is investigating claims on behalf of investors of International Business Machines Corporation  ( ""IBM"" or the ""Company"" )   ( NYSE:IBM ) .   Such investors are advised to contact Robert S. Willoughby at newaction@pomlaw.com or 888-476-",-0.036391,Neutral,0.528475,Neutral,0,focused,"AI, ML"
IBM,"IBM SHAREHOLDER ALERT: Jakubowitz Law Reminds IBM Shareholders of a Lead Plaintiff Deadline of June 6, 2022",https://www.prnewswire.com/news-releases/ibm-shareholder-alert-jakubowitz-law-reminds-ibm-shareholders-of-a-lead-plaintiff-deadline-of-june-6-2022-301526250.html,20220415T094500,PR Newswire,"NEW YORK, April 15, 2022 /PRNewswire/ -- Jakubowitz Law announces that a securities fraud class action lawsuit has commenced on behalf of shareholders of International Business Machines Corporation  ( NYSE: IBM ) .",-0.569863,Bearish,0.461908,Bearish,0,focused,AI
IBM,USD 152.38 Bn growth expected in Shared Services Market | North America to occupy 35% global market share | Technavio,https://www.prnewswire.com/news-releases/usd-152-38-bn-growth-expected-in-shared-services-market--north-america-to-occupy-35-global-market-share--technavio-301525810.html,20220415T071000,PR Newswire,The global shared services market is fragmented with the presence of numerous vendors. Vendors are focused on offering hybrid shared service solutions to provide a mix of nearshoring and offshoring services for strategic sourcing and the fulfillment of client requirements.,0.006115,Neutral,0.118151,Neutral,0,focused,LLM
IBM,"Cramer's Mad Money Recap 4/14: Bank of America, Netflix, Tesla",https://www.thestreet.com/jim-cramer/cramers-mad-money-recap-april-14-2022,20220414T230300,The Street,Jim Cramer sizes up next week's earnings reports as he hunts for stocks with growth at a reasonable price.,0.177876,Somewhat-Bullish,0.947397,Neutral,0,broad,
IBM,"LAWSUITS FILED AGAINST CABA, FB and IBM - Jakubowitz Law Pursues Shareholders Claims",https://investingnews.com/lawsuits-filed-against-caba-fb-and-ibm-jakubowitz-law-pursues-shareholders-claims/,20220414T173928,Investing News Network,"Jakubowitz Law announces that securities fraud class action lawsuits have commenced on behalf of shareholders of the following publicly-traded companies who purchased shares within the class periods listed below. Shareholders interested in representing the class of wronged shareholders have until the lead plaintiff deadline to petition the court. Your ability to share in any recovery doesn't require that you serve as a lead plaintiff. For more details and to speak with our firm without cost or obligation, follow the links below",-0.432724,Bearish,0.062597,Neutral,0,focused,AI
IBM,Is IBM Stock 'A Place To Hide' In Volatile Market? PreMarket Prep Crew Talks Big Blue,https://www.benzinga.com/analyst-ratings/analyst-color/22/04/26639831/is-ibm-stock-a-place-to-hide-in-volatile-market-premarket-prep-crew-talks-big-blue,20220414T172625,Benzinga,"One former Wall Street darling that has been a serial underperformer during the greatest bull market of all time was the recipient of an upgrade Friday morning. That company is International Business Machines Corp  ( NYSE: IBM ) , and it's the PreMarket Prep Stock of the Day.
Long-Term IBM Price Act",-0.072894,Neutral,0.798063,Neutral,0,broad,
IBM,Here's Why Morgan Stanley Is Bullish On IBM,https://www.benzinga.com/news/22/04/26636032/heres-why-morgan-stanley-is-bullish-on-ibm,20220414T161347,Benzinga,"Morgan Stanley analyst Erik Woodring upgraded the rating on International Business Machines Corp  ( NYSE: IBM )  to Overweight from Equal-weight, with a price target boost to $150 from $147  ( 16% upside ) .
Woodring saw IBM as a reliable ""defensive play"" amid more significant risks in the tech sect",-0.01057,Neutral,0.952563,Neutral,0,broad,
