ticker,title,url,time_published,source,summary,sentiment_score,sentiment_label,ticker_sentiment_score,ticker_sentiment_label,relevance_score,category,ai_keywords_found
IBM,"Virtual Desktop Infrastructure  ( VDI )  Market Size in South Korea to Grow by USD 462.39 Mn, Rising Need for Remote Support Across Various Organizations to Drive Growth - Technavio",https://www.prnewswire.com/news-releases/virtual-desktop-infrastructure-vdi-market-size-in-south-korea-to-grow-by-usd-462-39-mn-rising-need-for-remote-support-across-various-organizations-to-drive-growth---technavio-301652420.html,20221019T070000,PR Newswire,"NEW YORK, Oct. 19, 2022 /PRNewswire/ -- The ""Virtual Desktop Infrastructure ( VDI ) Market in South Korea by Development and Geography - Forecast and Analysis 2022-2026"" has been added to Technavio's offerings. The market size is set to grow by USD 462.39 million from 2021 to 2026.",0.234226,Somewhat-Bullish,0.038843,Neutral,0,broad,
IBM,IBM Q3 Preview: Another EPS Beat Inbound?,https://www.zacks.com/stock/news/1993840/ibm-q3-preview-another-eps-beat-inbound,20221018T221700,Zacks Commentary,"Year-to-date, IBM shares have displayed stellar relative strength, declining roughly 5% and widely outperforming the S&P 500.",0.086724,Neutral,0.723894,Bullish,0,broad,
IBM,Can a Steady Software Revenue Stream Drive IBM Q3 Earnings?,https://www.zacks.com/stock/news/1993395/can-a-steady-software-revenue-stream-drive-ibm-q3-earnings,20221018T134400,Zacks Commentary,"In the third quarter, IBM is likely to have recorded healthy revenues from the Software segment due to increased adoption of its cloud services.",0.212316,Somewhat-Bullish,0.514619,Somewhat-Bullish,0,broad,
IBM,Can Modest Consulting Revenues Aid IBM This Earnings Season?,https://www.zacks.com/stock/news/1993351/can-modest-consulting-revenues-aid-ibm-this-earnings-season,20221018T134000,Zacks Commentary,"In the third quarter, IBM is likely to have recorded healthy revenues from the Consulting segment with significant traction from the Technology Consulting business.",0.232119,Somewhat-Bullish,0.608634,Bullish,0,focused,AI
IBM,"The Zacks Analyst Blog Highlights Apple, Abbott Laboratories, International Business Machines, Estee Lauder and Progressive",https://www.zacks.com/stock/news/1993224/the-zacks-analyst-blog-highlights-apple-abbott-laboratories-international-business-machines-estee-lauder-and-progressive,20221018T112500,Zacks Commentary,"Apple, Abbott Laboratories, International Business Machines, Estee Lauder and Progressive are included in this Analyst Blog.",0.106733,Neutral,0.203215,Somewhat-Bullish,0,broad,
IBM,Is Invesco Dow Jones Industrial Average Dividend ETF  ( DJD )  a Strong ETF Right Now?,https://www.zacks.com/stock/news/1993181/is-invesco-dow-jones-industrial-average-dividend-etf-djd-a-strong-etf-right-now,20221018T102004,Zacks Commentary,Smart Beta ETF report for ...,0.264008,Somewhat-Bullish,0.11123,Somewhat-Bullish,0,focused,smart
IBM,"Cloud Security Solutions Market to Record a CAGR of 15.16%, BFSI to be Largest Revenue-generating End-user Segment - Technavio",https://www.prnewswire.com/news-releases/cloud-security-solutions-market-to-record-a-cagr-of-15-16-bfsi-to-be-largest-revenue-generating-end-user-segment---technavio-301651008.html,20221018T090000,PR Newswire,"NEW YORK, Oct. 18, 2022 /PRNewswire/ -- The ""Cloud Security Solutions Market by End-user ( BFSI, healthcare, retail, government, and others ) , Component ( cloud IAM, cloud e-mail security, cloud DLP, cloud IDS/IPS, and cloud SIEM ) , and Geography ( North America, Europe, APAC, Middle East and ...",0.100971,Neutral,0.039224,Neutral,0,focused,AI
IBM,"Earnings Season Is Here: Tesla, Netflix, IBM, AT&T And More On Deck - But This Stock Could Be 'Most Important' - Snap  ( NYSE:SNAP ) ",https://www.benzinga.com/news/earnings/22/10/29295013/earnings-season-is-here-tesla-netflix-ibm-at-t-and-more-on-deck-but-this-stock-could-be-most-import,20221017T212340,Benzinga,"The week of Oct. 17 is one of the busiest weeks for publicly traded companies reporting quarterly earnings. Several of the largest and most well-known companies - Johnson & Johnson JNJ, Goldman Sachs GS, Lockheed Martin LMT, Hasbro Inc.",0.1199,Neutral,0.12165,Neutral,0,broad,
IBM,"Q3 Earnings Scorecard and Analyst Reports for Apple, Abbott, IBM & Others",https://www.zacks.com/research-daily/1992855/q3-earnings-scorecard-and-analyst-reports-for-apple-abbott-ibm-others,20221017T175100,Zacks Commentary,"Today's Research Daily features the Q3 earnings season scorecard and new research reports on Apple (AAPL), Abbott (ABT) and IBM (IBM) and others.",0.084526,Neutral,0.224072,Neutral,0,focused,AI
IBM,Stress Testing Market to record USD 3.59 Bn incremental growth; Market to have fragmented structure -- Technavio,https://www.prnewswire.com/news-releases/stress-testing-market-to-record-usd-3-59-bn-incremental-growth-market-to-have-fragmented-structure--technavio-301649789.html,20221017T150000,PR Newswire,Stress Testing Market to record USD 3.59 Bn incremental growth. Market to have fragmented structure -- Technavio PR ...,0.140206,Neutral,0.045655,Neutral,0,broad,
IBM,Will Slightly Higher Revenues Benefit IBM's Q3 Earnings?,https://www.zacks.com/stock/news/1992821/will-slightly-higher-revenues-benefit-ibms-q3-earnings,20221017T141400,Zacks Commentary,IBM is expected to have recorded marginally higher aggregate revenues year over year despite a challenging macroeconomic environment and softness in traditional businesses.,0.148103,Neutral,0.563609,Somewhat-Bullish,0,broad,
IBM,"Microsoft To $320? Plus Stifel Slashes PT On IBM - Check Point Software  ( NASDAQ:CHKP ) , First Republic Bank  ( NYSE:FRC ) ",https://www.benzinga.com/news/22/10/29286876/microsoft-to-320-plus-stifel-slashes-pt-on-ibm,20221017T124051,Benzinga,Mizuho cut the price target on Microsoft Corporation MSFT from $340 to $320. Mizuho analyst Gregg Moskowitz maintained a Buy rating on the stock. Microsoft shares rose 1.4% to $231.83 in pre-market trading. Stifel cut the price target for International Business Machines Corporation IBM from $150 ...,0.057117,Neutral,0.501398,Neutral,0,focused,AI
IBM,"Netflix and Tesla stocks are not having a good year, but here comes a chance to turn it around",https://www.marketwatch.com/story/netflix-and-tesla-stocks-are-not-having-a-good-year-but-here-comes-a-chance-to-turn-it-around-11665848500,20221016T133000,MarketWatch,Wall Street in the week ahead will turn to quarterly results from companies like streaming giant Netflix Inc. and electric-vehicle maker Tesla Inc.,-0.002426,Neutral,0.072545,Neutral,0,broad,
IBM,"Tesla, Netflix Set to Report Earnings as Recession Talk Mounts",https://www.wsj.com/articles/tesla-netflix-set-to-report-earnings-as-recession-talk-mounts-11665798615,20221015T130000,Wall Street Journal,"Corporate earnings season is ramping up with quarterly reports from other bellwethers, including Procter & Gamble, Johnson & Johnson and IBM.",-0.040503,Neutral,0.323078,Neutral,0,broad,
IBM,Airline Route Profitability Software Market to record USD 15.99 Bn incremental growth; North America to have a significant market share -- Technavio,https://www.prnewswire.com/news-releases/airline-route-profitability-software-market-to-record-usd-15-99-bn-incremental-growth-north-america-to-have-a-significant-market-share--technavio-301648920.html,20221014T234500,PR Newswire,Airline Route Profitability Software Market to record USD 15.99 Bn incremental growth. North America to have a significant market share -- Technavio PR ...,0.231317,Somewhat-Bullish,0.035189,Neutral,0,focused,AI
IBM,"Cloud-based Product Lifecycle Management Market to grow by USD 2.69 Bn by 2026, Reduction in IT expenditure to boost market growth - Technavio",https://www.prnewswire.com/news-releases/cloud-based-product-lifecycle-management-market-to-grow-by-usd-2-69-bn-by-2026--reduction-in-it-expenditure-to-boost-market-growth---technavio-301647599.html,20221014T124500,PR Newswire,"NEW YORK, Oct. 14, 2022 /PRNewswire/ -- The cloud-based product lifecycle management market size is expected to grow by USD 2.69 billion from 2021 to 2026, at a CAGR of 12.37%, according to Technvaio Research Reports.",0.174522,Somewhat-Bullish,0.049732,Neutral,0,focused,AI
IBM,"Cloud-based Product Lifecycle Management Market to grow by USD 2.69 Bn by 2026, Reduction in IT expenditure to boost market growth - Technavio",https://www.prnewswire.com/news-releases/cloud-based-product-lifecycle-management-market-to-grow-by-usd-2-69-bn-by-2026--reduction-in-it-expenditure-to-boost-market-growth---technavio-301647530.html,20221014T124500,PR Newswire,"NEW YORK, Oct. 14, 2022 /PRNewswire/ -- The cloud-based product lifecycle management market size is expected to grow by USD 2.69 billion from 2021 to 2026, at a CAGR of 12.37%, according to Technvaio Research Reports.",0.174522,Somewhat-Bullish,0.049732,Neutral,0,focused,AI
IBM,Better Buy: IBM Stock vs. 2-Year Treasury Notes,https://www.fool.com/investing/2022/10/14/better-buy-ibm-stock-vs-2-year-treasury-note/,20221014T092500,Motley Fool,"At IBM's current share price, its dividend yield exceeds the interest rates paid by 2-year Treasury notes. But is the stock worth the risk?",0.246364,Somewhat-Bullish,0.717099,Bullish,0,focused,AI
IBM,"SaaS-based Business Analytics Market Size to Grow by USD 10.70 Bn, Global Application Software to be the Parent Market - Technavio",https://www.prnewswire.com/news-releases/saas-based-business-analytics-market-size-to-grow-by-usd-10-70-bn-global-application-software-to-be-the-parent-market---technavio-301647607.html,20221013T234500,PR Newswire,"This report on the SaaS-based business analytics market offers comprehensive analysis by end-user ( retail, BFSI, telecom, healthcare, and others ) and geography ( North America, Europe, APAC, South America, and the Middle East and Africa )",0.232259,Somewhat-Bullish,0.127007,Somewhat-Bullish,0,focused,AI
IBM,"Geographic Information System Analytics Market Size to Grow by USD 17.61 Bn, Retail and Real Estate to be Largest Revenue-generating End-user Segment - Technavio",https://www.prnewswire.com/news-releases/geographic-information-system-analytics-market-size-to-grow-by-usd-17-61-bn-retail-and-real-estate-to-be-largest-revenue-generating-end-user-segment---technavio-301647644.html,20221013T231500,PR Newswire,"NEW YORK, Oct. 13, 2022 /PRNewswire/ -- The ""Geographic Information System Analytics Market by End-user ( Retail and real estate, Government and utilities, Telecom, Manufacturing and automotive, and Others ) and Geography ( North America, Europe, APAC, Middle East and Africa, and South America ) ...",0.171468,Somewhat-Bullish,0.038468,Neutral,0,focused,AI
IBM,Smart Railway Market Is Anticipated To Hit USD 43.34 Billion at a CAGR of 9.45% by 2030 - Report by Market Research Future  ( MRFR ) ,https://www.benzinga.com/pressreleases/22/10/g29229883/smart-railway-market-is-anticipated-to-hit-usd-43-34-billion-at-a-cagr-of-9-45-by-2030-report-by-m,20221012T071844,Benzinga,"New York, US, Oct. 12, 2022 ( GLOBE NEWSWIRE ) -- According to a comprehensive research report by Market Research Future ( MRFR ) , ""Global Smart Railway Market Research Report: By Solution, Type, Services, Component, and Region- Forecast to 2030, the market is anticipated to acquire a valuation ...",0.443403,Bullish,0.03453,Neutral,0,focused,"AI, smart"
IBM,"IT market in Czech Republic to record USD 2.22 Mn growth; Accenture Plc, Acer Inc., and Adyen NV emerge as key vendors -- Technavio",https://www.prnewswire.com/news-releases/it-market-in-czech-republic-to-record-usd-2-22-mn-growth-accenture-plc-acer-inc-and-adyen-nv-emerge-as-key-vendors--technavio-301646193.html,20221012T024500,PR Newswire,"IT market in Czech Republic to record USD 2.22 Mn growth. Accenture Plc, Acer Inc., and Adyen NV emerge as key vendors -- Technavio PR ...",0.229508,Somewhat-Bullish,0.056275,Neutral,0,broad,
IBM,MSFT: 3 Tech Stocks You Could Buy This Fall Instead of Apple,https://stocknews.com/news/msft-csco-caj-aapl-3-tech-stocks-you-could-buy-this-fall-instead-of/,20221011T193739,Stocknews.com,The Fed's persistent monetary policy tightening has led to the tech-heavy Nasdaq composite losing 32.6% year-to-date. The potential impact of rising borrowing costs on tech companies' financials has been making investors dump tech stocks this year.,0.169423,Somewhat-Bullish,0.089797,Neutral,0,broad,
IBM,Dow ETFs in Focus Ahead of Q3 Earnings,https://www.zacks.com/stock/news/1990357/dow-etfs-in-focus-ahead-of-q3-earnings,20221011T141000,Zacks Commentary,"After the worst first nine months of 2022, the Dow Jones Industrial Average showed some stability at the start of the fourth quarter.",0.158282,Somewhat-Bullish,0.17879,Neutral,0,broad,
IBM,"As consulting firms enter tech, problems grow for Indian IT companies",https://www.business-standard.com/article/companies/covid-era-splurge-on-it-is-now-in-the-rearview-mirror-for-indian-vendors-122101100120_1.html,20221011T021000,Business Standard,"European clients, which typically account for a quarter to a third of Indian firms' sales, are almost certain to cut their tech budgets - at least until the war in Ukraine comes to an end ...",0.004825,Neutral,0.043579,Neutral,0,focused,AI
IBM,"IT and BPO Services Market Size in India to Grow by USD 116.01 Bn, IT to be Largest Revenue-generating Product Segment - Technavio",https://www.prnewswire.com/news-releases/it-and-bpo-services-market-size-in-india-to-grow-by-usd-116-01-bn-it-to-be-largest-revenue-generating-product-segment---technavio-301642910.html,20221010T030000,PR Newswire,"This report analyzes the IT and BPO services market in India by product ( IT, BPM, and software and R&D ) , end-user ( finance, insurance, telecom, healthcare, and others ) , and type ( export and domestic )",0.18111,Somewhat-Bullish,0.041538,Neutral,0,broad,
IBM,2 High-Yield Tech Stocks to Buy in October,https://www.fool.com/investing/2022/10/09/2-high-yield-tech-stocks-to-buy-in-october/,20221009T181213,Motley Fool,What's not to love?,0.220185,Somewhat-Bullish,0.240489,Bullish,0,broad,
IBM,Air Travel Market to reach USD 598.85 Billion by 2026 | Sourcing and Procurement Forecast and Analysis Report |SpendEdge,https://www.prnewswire.com/news-releases/air-travel-market-to-reach-usd-598-85-billion-by-2026--sourcing-and-procurement-forecast-and-analysis-report-spendedge-301642879.html,20221007T162200,PR Newswire,"• What is the major supplier selection scope? Coverage of travel destinations, Value-added services, Transparency in pricing, and References and clientele. • What are the expected price changes in this market? The Air Travel Market is expected to have a CAGR of 16.09% during 2022-2026. • Who are ...",0.279951,Somewhat-Bullish,0.100729,Neutral,0,focused,AI
IBM,"Marketing Automation Market is expected to generate a revenue of USD 47.76 Billion by 2027, Globally, at 13.96% CAGR: Verified Market Research®",https://www.prnewswire.com/news-releases/marketing-automation-market-is-expected-to-generate-a-revenue-of-usd-47-76-billion-by-2027--globally-at-13-96-cagr-verified-market-research-301643651.html,20221007T141500,PR Newswire,"The Marketing Automation Market will rise as a result of rising IoT device penetration, advancements in big data and data analytics tools, desire for corporate automation, and demand for insights.",0.249018,Somewhat-Bullish,0.079524,Neutral,0,focused,automation
IBM,"The Zacks Analyst Blog Highlights Fortinet, VMware, IB, Infosys and Palo Alto",https://www.zacks.com/stock/news/1989063/the-zacks-analyst-blog-highlights-fortinet-vmware-ib-infosys-and-palo-alto,20221007T112600,Zacks Commentary,"Fortinet, VMware, IB, Infosys and Palo Alto are part of the Zacks top Analyst Blog.",0.229778,Somewhat-Bullish,0.22595,Somewhat-Bullish,0,broad,
IBM,"Cloud Computing Market In Government Sector to grow by USD 25.41 Bn in 2022, Alphabet Inc. and Amazon.com Inc. emerge as Key Contributors to growth - Technavio",https://www.prnewswire.com/news-releases/cloud-computing-market-in-government-sector-to-grow-by-usd-25-41-bn-in-2022--alphabet-inc-and-amazoncom-inc-emerge-as-key-contributors-to-growth---technavio-301641232.html,20221006T234500,PR Newswire,"NEW YORK, Oct. 6, 2022 /PRNewswire/ -- According to the latest market research report titled cloud computing market in government sector by Product ( Hardware, Software, and Services ) and Geography ( North America, Europe, APAC, South America, and the Middle East and Africa ) from Technavio, ...",0.134463,Neutral,0.047749,Neutral,0,broad,
IBM,"Healthcare Cloud-Based Analytics Market Size to Grow by USD 26.93 Bn, Healthcare Technology Market to be Parent Market - Technavio",https://www.prnewswire.com/news-releases/healthcare-cloud-based-analytics-market-size-to-grow-by-usd-26-93-bn-healthcare-technology-market-to-be-parent-market---technavio-301640599.html,20221006T230000,PR Newswire,"This report segments the healthcare cloud-based analytics market by component ( software, services, and hardware ) and geography ( North America, Europe, APAC, the Middle East and Africa, and South America )",0.252232,Somewhat-Bullish,0.121037,Somewhat-Bullish,0,broad,
IBM,"IT Outsourcing Market Size to Grow by USD 117.24 Mn, Need to Optimize Business Processes to Drive Growth - Technavio",https://www.prnewswire.com/news-releases/it-outsourcing-market-size-to-grow-by-usd-117-24-mn-need-to-optimize-business-processes-to-drive-growth---technavio-301640641.html,20221006T223000,PR Newswire,"This report segments the IT outsourcing market by service ( infrastructure outsourcing and application outsourcing ) and geography ( North America, Europe, APAC, South America, and Middle East and Africa )",0.337467,Somewhat-Bullish,0.054114,Neutral,0,broad,
IBM,Biden's CHIPS Act Draws Momentum; IBM Earmarks $20B In Hudson Valley Region Over The Decade - IBM  ( NYSE:IBM ) ,https://www.benzinga.com/government/22/10/29164791/bidens-chips-act-draws-momentum-ibm-earmarks-20b-in-hudson-valley-region-over-the-decade,20221006T145935,Benzinga,"Today U.S. President Joseph R. Biden, Jr. and International Business Machines Corp IBM Chair and CEO Arvind Krishna will tour IBM's Poughkeepsie, New York site. During the visit, IBM will announce a plan to invest $20 billion across the Hudson Valley region over the next ten years.",0.378126,Bullish,0.685927,Neutral,0,focused,AI
IBM,Cognizant  ( CTSH )  Expands Partnership With Centrica in UK,https://www.zacks.com/stock/news/1988653/cognizant-ctsh-expands-partnership-with-centrica-in-uk,20221006T142100,Zacks Commentary,Cognizant Technology (CTSH) extends its partnership with Centrica to provide cloud infrastructure support.,0.225153,Somewhat-Bullish,0.2589,Somewhat-Bullish,0,broad,
IBM,5 Cloud Security Stocks That Could Enhance Returns in 2022,https://www.zacks.com/stock/news/1988612/5-cloud-security-stocks-that-could-enhance-returns-in-2022,20221006T135600,Zacks Commentary,"Here we present five cloud security stocks, FTNT, VMW, IBM, INFY and PANW, which are poised to gain from the heightening need for secure networks and cloud-based applications.",0.228154,Somewhat-Bullish,0.295421,Somewhat-Bullish,0,focused,AI
IBM,"IoT Analytics Market Size to Grow by USD 49.04 Bn, Vendors to Deploy Organic and Inorganic Growth Strategies - Technavio",https://www.prnewswire.com/news-releases/iot-analytics-market-size-to-grow-by-usd-49-04-bn-vendors-to-deploy-organic-and-inorganic-growth-strategies---technavio-301640664.html,20221006T124500,PR Newswire,"NEW YORK, Oct. 6, 2022 /PRNewswire/ -- The Internet of things ( IoT ) analytics market is fragmented and includes various international players and a few small-scale industries regionally. Vendors are deploying organic and inorganic growth strategies to compete in the market.",0.195288,Somewhat-Bullish,0.044551,Neutral,0,broad,
IBM,How To Invest In Artificial Intelligence,https://www.forbes.com/sites/qai/2022/10/05/how-to-invest-in-artificial-intelligence/,20221006T002654,Forbes,"We all see the power of artificial intelligence. As investors, we must consider the best way to get into AI so that we don't get left behind. Here are 10 AI investments to consider right now.",0.210816,Somewhat-Bullish,0.045139,Neutral,0,focused,"artificial intelligence, AI"
IBM,"International Business Machines  ( NYSE:IBM )  Upgraded to ""Buy"" at StockNews.com",https://reporter.am/2022/10/05/international-business-machines-nyseibm-upgraded-to-buy-at-stocknews-com.html,20221005T052441,Stocknews.com,"International Business Machines ( NYSE:IBM - Get Rating ) was upgraded by investment analysts at StockNews.com from a ""hold"" rating to a ""buy"" rating in a research report issued to clients and investors on Monday.",0.214692,Somewhat-Bullish,0.803061,Somewhat-Bullish,0,broad,
IBM,"Nvidia closes Russian offices, will fly relocating employees out of the country, report says",https://www.marketwatch.com/story/nvidia-closes-russian-offices-will-fly-relocating-employees-out-of-the-country-report-says-11664908547,20221004T183500,MarketWatch,Nvidia will give employees the option of continuing their jobs in other countries.,0.057521,Neutral,0.163354,Neutral,0,broad,
IBM,Connected Logistics Market Worth $57.75 Billion by 2029 - Exclusive Report by Meticulous Research®,https://www.benzinga.com/pressreleases/22/10/g29137627/connected-logistics-market-worth-57-75-billion-by-2029-exclusive-report-by-meticulous-research,20221004T140820,Benzinga,"Redding, California, Oct. 04, 2022 ( GLOBE NEWSWIRE ) -- According to a new market research report titled, 'Connected Logistics Market by Offering, Transportation Mode ( Roadways, Railways ) , Application ( Inventory Tracking, Real-Time Fleet Management, Others ) , End User ( Automotive, ...",0.219741,Somewhat-Bullish,0.024749,Neutral,0,focused,AI
IBM,International Business Machines  ( NYSE:IBM )  Upgraded to Buy at StockNews.com,https://www.etfdailynews.com/2022/10/04/international-business-machines-nyseibm-upgraded-to-buy-at-stocknews-com/,20221004T073047,Stocknews.com,StockNews.com upgraded shares of International Business Machines ( NYSE:IBM - Get Rating ) from a hold rating to a buy rating in a report released on Monday morning.,0.25851,Somewhat-Bullish,0.805127,Bullish,0,broad,
IBM,Artificial Intelligence  ( AI )  Market in BFSI Sector to Record USD 32.97 Billion growth between 2021 and 2026; Major Opportunities with Alphabet Inc. and Amazon.com Inc. -- Technavio,https://www.prnewswire.com/news-releases/artificial-intelligence-ai-market-in-bfsi-sector-to-record-usd-32-97-billion-growth-between-2021-and-2026-major-opportunities-with-alphabet-inc-and-amazoncom-inc--technavio-301639081.html,20221004T051500,PR Newswire,Artificial Intelligence ( AI ) Market in BFSI Sector to Record USD 32.97 Billion growth between 2021 and 2026. Major Opportunities with Alphabet Inc. and Amazon.com Inc. -- Technavio PR ...,0.317996,Somewhat-Bullish,0.085022,Somewhat-Bullish,0,focused,"artificial intelligence, AI"
IBM,"Cognitive Media Solutions Market Size to Grow by USD 4.49 Bn, Digital Transformation in Industries to Drive Growth - Technavio",https://www.prnewswire.com/news-releases/cognitive-media-solutions-market-size-to-grow-by-usd-4-49-bn-digital-transformation-in-industries-to-drive-growth---technavio-301637647.html,20221003T094500,PR Newswire,"NEW YORK, Oct. 3, 2022 /PRNewswire/ -- The size is anticipated to grow by USD 4.49 billion. However, the growth momentum is expected to decelerate at a CAGR of 27.14% during the forecast period.",0.254587,Somewhat-Bullish,0.051886,Neutral,0,focused,cognitive
IBM,Buy This Off-the-Radar Tech Stock Before It Rallies Any Further,https://www.fool.com/investing/2022/10/03/buy-off-radar-tech-stock-before-rallies-aspen/,20221003T093000,Motley Fool,A challenging economic environment is a boon for companies helping other enterprises save money by improving efficiency.,0.261765,Somewhat-Bullish,0.130217,Somewhat-Bullish,0,broad,
IBM,3 Dividend Growth Stocks With Yields Above 5%,https://www.fool.com/investing/2022/10/03/dividend-growth-stocks-yields-above-5-percent/,20221003T090500,Motley Fool,A high-yield payout that increases every year could attract bear market investments.,0.060869,Neutral,0.394236,Somewhat-Bullish,0,broad,
IBM,5 Things You Might Not Know About Bill Gates: Did He Really Start His First Company At Age 15? - Microsoft  ( NASDAQ:MSFT ) ,https://www.benzinga.com/news/21/05/20938993/5-things-you-might-not-know-about-bill-gates-2,20221001T194006,Benzinga,Bill Gates is well-known as the co-founder of Microsoft Corporation MSFT. The entrepreneur is also a huge philanthropist creating the Bill and Melinda Gates Foundation in 2000 to help spread technology and medical advancements around the world and reduce poverty.,0.239443,Somewhat-Bullish,0.23281,Somewhat-Bullish,0,broad,
IBM,SL Green  ( SLG )  Inks Long-Term Lease at One Madison Avenue,https://www.zacks.com/stock/news/1987222/sl-green-slg-inks-long-term-lease-at-one-madison-avenue,20220930T133700,Zacks Commentary,"With these leasing activities, SL Green's (SLG) One Madison Avenue, which is currently under development and on schedule for completion in November 2023, is now 55% leased.",0.193277,Somewhat-Bullish,0.220809,Neutral,0,broad,
IBM,"Japan Beefs Up Semiconductor Presence By Tying Up With Several Chipmakers, Latest Being Micron - Micron Technology  ( NASDAQ:MU ) ",https://www.benzinga.com/government/22/09/29090978/micron-wins-japanese-grants-up-to-320m-for-deepening-roots-in-the-country,20220930T113735,Benzinga,"Japanese government committed subsidies of up to $320 million to U.S. chipmaker Micron Technology, Inc MU to fortify supply chains against China. The Micron deal followed months of negotiations to reduce heavy dependence on Taiwanese chipmaker Taiwan Semiconductor Manufacturing Company Ltd TSM, ...",0.054573,Neutral,0.28387,Neutral,0,focused,AI
