ticker,title,url,time_published,source,summary,sentiment_score,sentiment_label,ticker_sentiment_score,ticker_sentiment_label,relevance_score,category,ai_keywords_found
ORCL,Compensation Software Market Size to Grow by USD 5.21 billion | Pricing Strategies to Drive Growth | Technavio,https://www.prnewswire.com/news-releases/compensation-software-market-size-to-grow-by-usd-5-21-billion--pricing-strategies-to-drive-growth--technavio-301525955.html,20220418T054500,PR Newswire,"Vendors' pricing strategies are driving the global compensation software industry growth. Software vendors are adopting customer-centric pricing strategies that are enabled by advances in technology to thrive in a competitive market environment. Customers focus on certain economic and market factors such as ROI, the ability to opt for free models, and the limited IT budgets while implementing the software. Vendors need to accommodate varying customer pricing preferences and budgets. The high price of the software and limited IT budgets have compelled vendors to re-evaluate the software pricing and delivery models. Therefore, vendors are providing SaaS, commercial open-source models, and term licensing to be in sync with the changing demands.",0.005489,Neutral,0.047588,Neutral,0,focused,AI
ORCL,Elon Musk baffles investors with 'Love Me Tender' tweet amid Twitter row,https://www.scmp.com/tech/big-tech/article/3174608/elon-musk-channels-elvis-love-me-tender-tweet-baffling-investors-amid,20220418T020438,South China Morning Post,"The billionaire entrepreneur posted the cryptic tweet over weekend, possibly alluding to a direct tender offer to Twitter shareholders after the company implemented a 'poison pill' provision.",-0.038863,Neutral,0.068054,Neutral,0,focused,AI
ORCL,Oracle Whale Trades For April 14,https://www.benzinga.com/markets/options/22/04/26644267/oracle-whale-trades-for-april-14,20220414T191213,Benzinga,"Someone with a lot of money to spend has taken a bearish stance on Oracle  ( NYSE:ORCL ) .
And retail traders should know.
We noticed this today when the big position showed up on publicly available options history that we track here at Benzinga.
Whether this is an institution or just a wealthy indi",0.039318,Neutral,0.62973,Neutral,0,focused,AI
ORCL,Wedbush Expresses Bullishness On Cybersecurity Sector; Names Top Picks; Boosts Price Targets,https://www.benzinga.com/analyst-ratings/analyst-color/22/04/26640622/wedbush-expresses-bullishness-on-cybersecurity-sector-names-top-picks-boosts-price-,20220414T173714,Benzinga,"Wedbush analyst Daniel Ives believes the cyber security sector is poised to have a full year ahead with a solid Q1 earnings season despite jitters around Fed tapering and rates rising.
Ives considers cyber security as a ""safety blanket tech sector"" in a Category 5 storm. 
While investors will worry ",0.004265,Neutral,0.28256,Neutral,0,broad,
ORCL,Big Data as a Service  ( BDaaS )  Market is anticipated to have a prodigious CAGR of 25.7% during the period of 2022-2032,https://www.prnewswire.com/news-releases/big-data-as-a-service-bdaas-market-is-anticipated-to-have-a-prodigious-cagr-of-25-7-during-the-period-of-2022-2032--301525775.html,20220414T123000,PR Newswire,"The rise in the growth in data due to digitization and automation, and rise in the growth for demand in Industries to gain actionable insights from big data, which is driving the market demand for BDaaS. Moreover, the rising number of connected devices globally is one of the factors that is expected to fuel the market growth during the forecast period. End-user industries such as government, media & entertainment, retail, BFSI, and manufacturing are adopting connected devices for their business and manufacturing units.",0.015535,Neutral,0.053665,Neutral,0,focused,"AI, automation"
ORCL,Keep an Eye Out for Ampere Computing After It Files for IPO,https://www.fool.com/investing/2022/04/14/keep-eye-out-ampere-computing-after-ipo-filing/,20220414T114000,Motley Fool,"If it IPOs this year, Ampere Computing could be a top stock to keep close tabs on.",0.117991,Neutral,0.155051,Somewhat-Bullish,0,broad,
ORCL,Global Feed Enzymes Market to reach USD 639.9 million by 2026 | SpendEdge,https://www.prnewswire.com/news-releases/global-feed-enzymes-market-to-reach-usd-639-9-million-by-2026--spendedge-301522615.html,20220413T171300,PR Newswire,• What are the major supplier selection scope?,0.007149,Neutral,0.091405,Neutral,0,broad,
ORCL,Alibaba Undergoes Aggressive Restructuring At Its Cloud Unit,https://www.benzinga.com/news/22/04/26607529/alibaba-undergoes-aggressive-restructuring-at-its-cloud-unit,20220413T145245,Benzinga,"Alibaba Group Holding Ltd  ( NYSE: BABA )  owned Alibaba Cloud initiated a new round of organizational restructuring, the Pandaily reports.
Alibaba Cloud China President Ren Geng resigned for undisclosed reasons. Geng looked to leave as early as 2021 but stayed back. 
Also Read: Alibaba Looks To Sla",-0.094497,Neutral,0.285526,Neutral,0,focused,AI
ORCL,Ukraine crisis: Infosys to move business out of Russia,https://www.business-standard.com/article/companies/ukraine-crisis-infosys-to-move-business-out-of-russia-122041300902_1.html,20220413T121000,Business Standard,Infosys' presence in Moscow has come under attack as UK Chancellor Rishi Sunak's wife is the daughter of Infosys co-founder Narayana Murthy,-0.18886,Somewhat-Bearish,0.139913,Somewhat-Bearish,0,focused,AI
ORCL,Oracle Launches Complete Employee Experience Platform For Evolving Workforce Needs,https://www.prnewswire.com/news-releases/oracle-launches-complete-employee-experience-platform-for-evolving-workforce-needs-301524130.html,20220413T120500,PR Newswire,"Comprehensive platform within Oracle Cloud HCM gives HR and business leaders tools to support employee success with new solutions for listening, communication, productivity, and engagement",0.155906,Somewhat-Bullish,0.813423,Somewhat-Bullish,0,broad,
ORCL,Live news updates: Infosys says it will move business out of Russia,https://www.business-standard.com/article/international/latest-news-live-manhunt-for-brooklyn-subway-shooter-continues-122041300122_1.html,20220413T113606,Business Standard,The war-torn nation's president says instruments needed to be found to pressure Russia to stop forcibly deporting Ukrainians.,-0.057151,Neutral,0.276179,Neutral,0,focused,AI
ORCL,How Can Blockchain Technology Improve E-Commerce Businesses?,https://www.benzinga.com/markets/cryptocurrency/22/04/26584819/how-can-blockchain-technology-improve-e-commerce-businesses,20220412T132321,Benzinga,"Photo by Shubham Dhage on Unsplash
This post contains sponsored advertising content. This content is for informational purposes only and is not intended to be investing advice.
Despite blockchain technology's status as a possible nascent disruptor, many remain in the dark about the technology's pote",-0.055868,Neutral,0.081414,Neutral,0,focused,AI
ORCL,How Can TikTok Bring In More Ad $$$ Than Twitter And Snapchat Combined?,https://www.thestreet.com/investing/tick-tok-more-revenue-than-twitter-snapchat,20220412T001500,The Street,TikTok leaves Twitter and Snapchat in the dust but lags behind Meta.,-0.080197,Neutral,0.263942,Neutral,0,broad,
ORCL,Oracle again extends Cerner tender offer,https://www.marketwatch.com/story/oracle-again-extends-cerner-tender-offer-271649717113,20220411T224500,MarketWatch,Oracle Corp. again extended its tender offer for Cerner Corp. shares and said about 11.5% of outstanding shares were tendered as of midnight at the end of the day Friday.,0.011683,Neutral,0.808368,Neutral,0,focused,AI
ORCL,Former Intel Executive Founded Chipmaker Confidentially Files For US IPO,https://www.benzinga.com/news/22/04/26572236/former-intel-executive-founded-chipmaker-confidentially-files-for-us-ipo,20220411T205142,Benzinga,"Former Intel Corp  ( NASDAQ: INTC )  President founded chipmaker Ampere Computing has confidentially filed for a U.S. initial public offering, Reuters reports.
Founder Renee James, who serves as Ampere's CEO, also is a ...Full story available on Benzinga.com",-0.043247,Neutral,0.565943,Neutral,0,focused,AI
ORCL,DLT Solutions Adds Oracle Cloud Infrastructure to Its Department of Navy Oracle II Enterprise Licensing Agreement,https://www.benzinga.com/pressreleases/22/04/n26571525/dlt-solutions-adds-oracle-cloud-infrastructure-to-its-department-of-navy-oracle-ii-enterprise-lice,20220411T150800,Benzinga,"DLT's Enterprise Agreement Platform will be used to streamline procurement, optimize IT management and provide greater access to Oracle Cloud Infrastructure
HERNDON, Va., April 11, 2022 /PRNewswire/ -- DLT Solutions, LLC., a wholly owned subsidiary of Tech Data Corporation, and part of the TD SYNNEX",0.046113,Neutral,0.044793,Neutral,0,focused,ML
ORCL,"HubSpot: Jack Of All Trades, Master Of None",https://www.forbes.com/sites/greatspeculations/2022/04/11/hubspot-jack-of-all-trades-master-of-none/,20220411T130706,Forbes,A popular growth stock with fundamentals that cannot justify its high-flying valuation.,-0.258683,Somewhat-Bearish,0.056235,Neutral,0,broad,
ORCL,Urban-gro eyes 80% revenue growth as indoor farm specialist,https://www.marketwatch.com/story/urban-gro-eyes-80-revenue-growth-as-indoor-farm-specialist-11649678477,20220411T120100,MarketWatch,Acquisitions and hiring  are ahead for Urban-gro in 2022 as a provider of equipment and services for controlled environment agriculture.,0.023895,Neutral,0.134892,Neutral,0,broad,
ORCL,"Tax The Wealthy? These 5 Billionaires Make You Filthy Rich, Too",https://www.investors.com/etfs-and-funds/sectors/sp500-tax-the-wealthy-these-5-billionaires-make-you-filthy-rich-too/,20220411T120000,Investors Business Daily,"S&P 500: These 5 Billionaires Make You Filthy Rich, Too Investor's Business Daily",-0.038327,Neutral,0.110234,Bearish,0,focused,AI
ORCL,City of Tampa Redesigns Staff Operations with Oracle Fusion Cloud Applications,https://www.prnewswire.com/news-releases/city-of-tampa-redesigns-staff-operations-with-oracle-fusion-cloud-applications-301522424.html,20220411T114500,PR Newswire,Florida municipality reduces costs and boosts employees' productivity by moving finance and HR applications to the cloud,0.251332,Somewhat-Bullish,0.971561,Somewhat-Bullish,0,broad,
ORCL,"These 3 ETF Picks Will Help You Beat A Tough Market, Advisor Says",https://www.investors.com/etfs-and-funds/best-etfs-to-help-you-beat-a-tough-market/,20220411T110000,Investors Business Daily,Best ETFs To Help You Beat A Tough Market Investor's Business Daily,0.109437,Neutral,0.093434,Neutral,0,focused,AI
ORCL,"Data Analytics Market Size to grow by USD 196.47 Billion | 32% of the market growth will originate from APAC | 17,000+ Technavio Reports",https://www.prnewswire.com/news-releases/data-analytics-market-size-to-grow-by-usd-196-47-billion--32-of-the-market-growth-will-originate-from-apac--17-000-technavio-reports-301521031.html,20220411T091500,PR Newswire,"• Services

The services component segment held the largest data analytics market share in 2021. The segment will continue to retain its market domina",0.078767,Neutral,0.047185,Neutral,0,focused,AI
ORCL,Learning Management System Market Size [2022-2029] | to Reach USD 40.95 Billion and Exhibit a CAGR of 14.2%,https://www.benzinga.com/pressreleases/22/04/g26561524/learning-management-system-market-size-2022-2029-to-reach-usd-40-95-billion-and-exhibit-a-cagr-of-,20220411T080925,Benzinga,"Pune, India, April  11, 2022   ( GLOBE NEWSWIRE )  -- The global learning management system market size was USD 14.43 billion in 2021. The market is expected to grow from USD 16.19 billion in 2022 to USD 40.95 billion by 2029, exhibiting a CAGR of 14.2% during the forecast period. The rising demand ",-0.005671,Neutral,0.035768,Neutral,0,broad,
ORCL,"AI in BFSI Market to hit US$ 140 billion by 2028, Says Global Market Insights Inc.",https://www.prnewswire.com/news-releases/ai-in-bfsi-market-to-hit-us-140-billion-by-2028-says-global-market-insights-inc-301522547.html,20220411T074700,PR Newswire,"The growing demand to analyze, report, and collect a large volume of data and gain meaningful insights to support banking processes will support market growth. The increasing adoption of advanced technologies including big data, blockchain, cloud computing, and biometrics generates extensive data. AI-based solutions are integrated with machine learning algorithms to help banks in collecting and analyzing data. It provides an in-depth analysis of the customer data and helps banks to make decisions, enabling operational efficiency and gaining higher ROI.",0.041752,Neutral,0.043007,Neutral,0,focused,"machine learning, AI, algorithm"
ORCL,NewNet Secure Transactions Selects Oracle Cloud Infrastructure Providing Customers with Secure and Scalable Cloud Payments,https://www.prnewswire.com/news-releases/newnet-secure-transactions-selects-oracle-cloud-infrastructure-providing-customers-with-secure-and-scalable-cloud-payments-301520434.html,20220408T110700,PR Newswire,"NewNet's STC solution offers cloud-based secure payment acquiring, processing and issuer processing application with advanced data security, intelligent routing capabilities, comprehensive networking functions, point-to-point encryption and tokenized for security of payment transactions.",0.031294,Neutral,0.03565,Neutral,0,focused,intelligent
ORCL,Will Howard Schultz Stick Around at Starbucks?,https://www.fool.com/investing/2022/04/07/will-howard-schultz-stick-around-at-starbucks/,20220407T202100,Motley Fool,"What does Elon Musk's ""passive stake"" in Twitter amount to?",-0.062574,Neutral,0.024978,Neutral,0,broad,
ORCL,Oracle and AICPA & CIMA Team Up to Tackle the Technology Skills Gap in Finance,https://www.prnewswire.com/news-releases/oracle-and-aicpa--cima-team-up-to-tackle-the-technology-skills-gap-in-finance-301519687.html,20220407T120000,PR Newswire,New Certification Series Helps Equip the Next Generation of Finance Leaders with Digital Finance Transformation Skills and Supports the Profession's Blueprint for the Future of Finance,0.125516,Neutral,0.518801,Neutral,0,focused,AI
ORCL,"Tech stocks haven't been this oversold since 2015, leading analyst says",https://www.marketwatch.com/story/tech-stocks-havent-been-this-oversold-since-2015-leading-analyst-says-11649332475,20220407T115400,MarketWatch,"Tech stocks are the most oversold they have been since 2015, according to Dan Ives, an analyst at Wedbush Securities.",-0.115448,Neutral,0.199776,Neutral,0,broad,
ORCL,Industrial Predictive Maintenance Market in APAC - 43% of Growth to Originate from China |Driven by Developments in Customized Industrial Predictive Maintenance | Technavio,https://www.prnewswire.com/news-releases/industrial-predictive-maintenance-market-in-apac---43-of-growth-to-originate-from-china-driven-by-developments-in-customized-industrial-predictive-maintenance--technavio-301519111.html,20220407T083000,PR Newswire,The industrial predictive maintenance market in APAC covers the following areas:,-0.011628,Neutral,0.049815,Neutral,0,focused,AI
ORCL,AMD Acquires Pensando: Is It a Perfect Match?,https://www.zacks.com/commentary/1894477/amd-acquires-pensando-is-it-a-perfect-match,20220406T221700,Zacks Commentary,"After making a splash with its acquisition of Xilinx, Advanced Micro Devices (AMD) is back on the offensive, announcing on Monday its plans to acquire another company.",0.141887,Neutral,0.0726,Neutral,0,broad,
ORCL,Insights on the DevOps Global Market to 2030 - High Rate of Adoption Among SMEs Presents Opportunities,https://www.prnewswire.com/news-releases/insights-on-the-devops-global-market-to-2030---high-rate-of-adoption-among-smes-presents-opportunities-301519016.html,20220406T153000,PR Newswire,"DUBLIN, April 6, 2022 /PRNewswire/ -- The ""DevOps Market by Component, Cloud Type, Organization Size and Industry Vertical: Global Opportunity Analysis and Industry Forecast, 2021-2030"" report has been added to ResearchAndMarkets.com's offering.",0.005561,Neutral,0.041466,Neutral,0,broad,
ORCL,Global Medical Device Connectivity Market to Grow on Account of Rising Adoption of Telehealth Services and Increasing Awareness for Remote Patient Monitoring; Market to Touch a Revenue of USD 10897.22 Million by 2031,https://www.benzinga.com/pressreleases/22/04/g26497114/global-medical-device-connectivity-market-to-grow-on-account-of-rising-adoption-of-telehealth-serv,20220406T125609,Benzinga,"New York, April  06, 2022   ( GLOBE NEWSWIRE )  -- The novel coronavirus  ( COVID-19 )  outbreak was declared a pandemic by the World Health Organization  ( WHO )  on the 11th of March 2020. The deadly SARS-CoV-2 virus that caused the contagious disease and was first identified in December 2019 in W",0.033325,Neutral,0.021265,Neutral,0,broad,
ORCL,"Digital Transformation Market [2022-2028] size to Hit USD 3,546.80 billion | Exhibiting a Stellar CAGR of 22.1%",https://www.benzinga.com/pressreleases/22/04/g26495152/digital-transformation-market-2022-2028-size-to-hit-usd-3-546-80-billion-exhibiting-a-stellar-cagr,20220406T113856,Benzinga,"Pune, India, April  06, 2022   ( GLOBE NEWSWIRE )  -- The global digital transformation market is expected to gain impetus from the emergence of industrial automation in a wide range of industries. Robots are able to control several core industrial processes efficiently. Fortune Business Insights™ p",-0.025137,Neutral,0.035231,Neutral,0,focused,"AI, automation"
ORCL,Global Cloud Orchestration Market Report 2022-2030: Rise in Demand for Streamline Business Process & Need for Self-servicing Provisioning,https://www.prnewswire.com/news-releases/global-cloud-orchestration-market-report-2022-2030-rise-in-demand-for-streamline-business-process--need-for-self-servicing-provisioning-301518794.html,20220406T101700,PR Newswire,"DUBLIN, April 6, 2022 /PRNewswire/ -- The ""Cloud Orchestration Market by Service, Deployment Mode Organization Size, Industry Vertical: Global Opportunity Analysis and Industry Forecast, 2021-2030"" report has been added to ResearchAndMarkets.com's offering.",-0.035076,Neutral,0.175284,Neutral,0,focused,ML
ORCL,"Global Digital Power Utility Market Size  ( 2022-2027 )  Analysis By Business Strategies, Progression Status, Opportunities, Future Trends, Industry Leading Players Update, Market Share, Healthy CAGR with Growing Demand, and Forecast to 2027",https://www.benzinga.com/pressreleases/22/04/g26493030/global-digital-power-utility-market-size-2022-2027-analysis-by-business-strategies-progression-sta,20220406T091818,Benzinga,"Pune, April  06, 2022   ( GLOBE NEWSWIRE )  -- ""Final Report will add the analysis of the impact of COVID-19 on this industry.""
Global ""Digital Power Utility Market"" is a comprehensive research that provides information regarding Digital Power Utility market size, trends, growth, cost structure, cap",0.018568,Neutral,0.053967,Neutral,0,broad,
ORCL,Does Elon Musk's Investment Make Twitter A Serious Buyout Candidate?,https://www.benzinga.com/analyst-ratings/analyst-color/22/04/26484716/does-elon-musks-investment-make-twitter-a-serious-buyout-candidate,20220405T213916,Benzinga,"Twitter Inc  ( NYSE: TWTR )  shares are up 30.4% this week after Tesla Inc  ( NASDAQ: TSLA )  CEO and world's richest man Elon Musk disclosed a new 9.2% ownership stake in Twitter and announced on Tuesday joined Twitter's board of directors.
Musk tweeted he is already ""working with [Twitter CEO Para",-0.031873,Neutral,0.18175,Neutral,0,broad,
ORCL,Tech CEO plots spring-break trip to Ukraine to help employees keep working amid Russian invasion,https://www.marketwatch.com/story/tech-ceo-plots-spring-break-trip-to-ukraine-to-help-employees-keep-working-amid-russian-invasion-11649181628,20220405T180000,MarketWatch,Andy Kurtzig and his family plan to spend spring break at a destination that most are fleeing.,-0.082961,Neutral,0.115039,Neutral,0,focused,AI
ORCL,MSFT: 3 High-Quality Infrastructure Software Stocks to Buy and Hold for Years to Come,https://stocknews.com/news/msft-orcl-ibm-3-high-quality-infrastructure-software-stocks-to-buy-and-hold-for/,20220405T164904,Stocknews.com,"During the worst of the COVID-19 pandemic, technology became a lifeline for most people globally amid stay-at-home mandates which fostered remote working arrangements and distance learning. This resulted in a surge in internet penetration and major digital adoption and transformation. The innovative, modern, and updated software infrastructure is the driving force of digital transformation and adoption of IT technologies, including cloud computing, artificial intelligence and machine learning, Internet of Things  (  IoT  )  , and virtual reality.",0.088828,Neutral,0.274968,Neutral,0,focused,"artificial intelligence, machine learning"
ORCL,MSFT: 5 Best Mega-Cap Stocks in the Tech Sector to Buy in April,https://stocknews.com/news/msft-avgo-orcl-acn-intc-5-best-mega-cap-stocks-in-the-tech-sector-to-buy/,20220405T145250,Stocknews.com,"On Monday, the stock market posted gains, with the tech-heavy Nasdaq Composite advancing 1.9% to 14,532.55. Investors shook off concerns about an impending recession and bought tech shares. Furthermore, the index has made a stellar recovery and is down only approximately 10% from its record.",0.070587,Neutral,0.232532,Neutral,0,focused,AI
ORCL,"Ex-Dividend Reminder: Oracle, Verizon Communications And NetApp",https://www.forbes.com/sites/dividendchannel/2022/04/05/ex-dividend-reminder-oracle-verizon-communications-and-netapp/,20220405T145003,Forbes,"On 4/7/22, Oracle, Verizon Communications, and NetApp, will all trade ex-dividend for their respective upcoming dividends.",0.0596,Neutral,0.808714,Neutral,0,broad,
ORCL,Global Operations Support Business Support  ( OSS/BSS )  Software Market to Grow on the Back of Increasing Need for Transparency in Billing Systems Among Telecom Service Providers; Market to Touch a Revenue of USD 108078.62 Million by 2031,https://www.benzinga.com/pressreleases/22/04/g26472888/global-operations-support-business-support-ossbss-software-market-to-grow-on-the-back-of-increasin,20220405T123154,Benzinga,"New York, April  05, 2022   ( GLOBE NEWSWIRE )  -- The telecom industry across the globe is witnessing a massive spur in growth and is expected to touch significant heights in the coming years. It is expected that by the end of 2026, the total number of 5G connections globally would cross 2 Billion.",0.018051,Neutral,0.020796,Neutral,0,broad,
ORCL,"AMD, Qualcomm make software-focused acquisitions as growth in core chip businesses questioned",https://www.marketwatch.com/story/amd-qualcomm-make-software-focused-acquisitions-as-growth-in-core-chip-businesses-questioned-11649099779,20220404T191600,MarketWatch,Advanced Micro Devices Inc. and Qualcomm Inc. both announced acquisitions on Monday that will help diversify into greater software holdings as analysts question growth in the chip makers' core businesses.,-0.032026,Neutral,0.092124,Neutral,0,broad,
ORCL,"Semiconductor Watchlist: Qualcomm, Micron, NXP",https://www.thestreet.com/investing/semiconductor-watchlist-qualcomm-micron-nxp,20220404T174900,The Street,Chips try to recover from slump in previous week.,-0.031974,Neutral,0.778139,Neutral,0,broad,
ORCL,Tech Stocks Roundup: Amazon's Union Face-Off Inspires Apple Workers,https://www.thestreet.com/technology/tech-stocks-roundup-amazons-union-face-off-inspires-apple-workers,20220404T172100,The Street,"Check out the latest news and performance numbers from the top technology stocks like Facebook, Apple, Microsoft, Google, Twitter, and more.",-0.022157,Neutral,0.286912,Neutral,0,broad,
ORCL,Oracle  ( ORCL )  Cloud Infrastructure Selected by DOCOMO for ALADIN,https://www.zacks.com/stock/news/1892571/oracle-orcl-cloud-infrastructure-selected-by-docomo-for-aladin,20220404T160000,Zacks Commentary,"Oracle (ORCL) Cloud Infrastructure gets selected by NTT DOCOMO to build ALADIN, the largest customer information management system in the world.",0.08186,Neutral,0.638544,Neutral,0,broad,
ORCL,AMD To Snap Pensando For $1.9B,https://www.benzinga.com/m-a/22/04/26447738/amd-to-snap-pensando-for-1-9b,20220404T124646,Benzinga,"Advanced Micro Devices Inc  ( NASDAQ: AMD )  has agreed to acquire Pensando for $1.9 billion. 
Pensando distributed services platform included a high-performance, fully programmable packet processor and comprehensive software stack that accelerate networking, security, storage, and other services fo",0.010148,Neutral,0.99998,Neutral,0,broad,
ORCL,Machine Learning Market Size [2022-2029] Worth USD 209.91 Billion | Exhibiting a CAGR of 38.8%,https://www.benzinga.com/pressreleases/22/04/g26447395/machine-learning-market-size-2022-2029-worth-usd-209-91-billion-exhibiting-a-cagr-of-38-8,20220404T121927,Benzinga,"Pune, India, April  04, 2022   ( GLOBE NEWSWIRE )  -- The global Machine Learning Market is expected to rise during the forecast period owing to the increasing adoption of technological advancements in various industries such as healthcare, automotive, retail, and manufacturing. Fortune Business Ins",0.0104,Neutral,0.040206,Neutral,0,focused,"machine learning, AI"
ORCL,AMD Extends Data Center Drive With $1.9 Billion Purchase of Cloud Startup Pensando,https://www.thestreet.com/markets/amd-extends-data-center-drive-with-1-9-billion-pensando-purchase,20220404T121800,The Street,"Pensando, founded by former executives from Cisco, will add to AMD's ongoing push into the lucrative data center chip market.",0.018953,Neutral,0.999545,Neutral,0,broad,
