ticker,title,url,time_published,source,summary,sentiment_score,sentiment_label,ticker_sentiment_score,ticker_sentiment_label,relevance_score,category,ai_keywords_found
ORCL,Artificial Intelligence in Marketing Market to grow at a CAGR of 26.84% by 2026 |Increasing Digitalization & Internet Penetration is a Major Trend Driving Growth| Technavio,https://www.prnewswire.com/news-releases/artificial-intelligence-in-marketing-market-to-grow-at-a-cagr-of-26-84-by-2026--increasing-digitalization--internet-penetration-is-a-major-trend--driving-growth-technavio-301554894.html,20220527T073000,PR Newswire,"The competitive scenario provided in the Artificial Intelligence in Marketing Market report analyzes, evaluates, and positions companies based on various performance indicators.",0.009128,Neutral,0.046871,Neutral,0,focused,artificial intelligence
ORCL,"Broadcom will let VMware shop for another buyer, but is any other software company interested?",https://www.marketwatch.com/story/broadcom-will-let-vmware-shop-for-another-buyer-but-is-any-other-software-company-interested-11653609792,20220527T000300,MarketWatch,"Virtualization-software maker VMware Inc. agreed to be acquired by Broadcom Inc. on Thursday in an roughly $61 billion deal that will triple the chip maker's software business, and has an usual provision that lets VMware look for another buyer.",-0.069417,Neutral,0.137435,Neutral,0,broad,
ORCL,"Advanced Predictive Analytics Software Market Size to Grow by USD 9.35 billion | Find Future Trends, Analysis, and Insights | Technavio",https://www.prnewswire.com/news-releases/advanced-predictive-analytics-software-market-size-to-grow-by-usd-9-35-billion--find-future-trends-analysis-and-insights--technavio-301555030.html,20220526T230000,PR Newswire,Find additional market insights by Technavio to help your organization foster innovation and make effective decisions. View our Exclusive Sample Report What are the Some of the Topics Covered in this Report? We offer customization at the time of purchase.,0.008571,Neutral,0.127659,Neutral,0,focused,predictive analytics
ORCL,NVS: 5 No-Brainer Stocks to Buy if the Market Crashes,https://stocknews.com/news/nvs-mu-wm-orcl-amgn-5-no-brainer-stocks-to-buy-if-the-market-crashes/,20220526T191707,Stocknews.com,"The stock market has been turbulent of late due to multi-decade high inflation, continued Russia-Ukraine war, extended lockdowns in China, and worries over the increasing odds of the economy slipping into a recession due to aggressive interest rate hikes.",0.049548,Neutral,0.162704,Neutral,0,focused,AI
ORCL,Oracle  ( ORCL )  Outpaces Stock Market Gains: What You Should Know,https://www.zacks.com/stock/news/1929347/oracle-orcl-outpaces-stock-market-gains-what-you-should-know,20220525T220005,Zacks Commentary,"Oracle (ORCL) closed at $69.83 in the latest trading session, marking a +1.16% move from the prior day.",-0.021663,Neutral,0.526304,Neutral,0,focused,AI
ORCL,ORCL: 5 Top-Quality Tech Stocks to Buy at a Discount,https://stocknews.com/news/orcl-otex-qcom-sap-umc-5-top-quality-tech-stocks-to-buy-at-a-discount/,20220525T194607,Stocknews.com,"Concerns over the Federal Reserve's monetary policy tightening have fostered a massive tech sell-off of late, making many high-quality stocks now trade at attractive valuations. The tech-heavy Nasdaq Composite has declined 28.8% year-to-date.",0.074557,Neutral,0.198683,Somewhat-Bullish,0,broad,
ORCL,Oracle  ( ORCL )  Integrates Security Capabilities Into Cloud,https://www.zacks.com/stock/news/1929133/oracle-orcl-integrates-security-capabilities-into-cloud,20220525T154000,Zacks Commentary,Oracle (ORCL) integrates new security capabilities across Oracle Cloud Infrastructure to help customers protect their data.,0.047403,Neutral,0.840024,Neutral,0,broad,
ORCL,Exclusive: Oracle to win unconditional EU nod for $28.3 billion Cerner deal,https://www.reuters.com/markets/deals/exclusive-eu-set-clear-without-conditions-283-bln-oracle-cerner-deal-sources-2022-05-24/,20220524T143200,Reuters,"A logo of cloud service provider Oracle is seen at the company's offices at Eastpoint Business Park, Dublin, Ireland October 18, 2021. Picture taken October 18, 2021. REUTERS/Tom Bergin",-0.005884,Neutral,0.190567,Neutral,0,broad,
ORCL,Data Center Market - 35% of Growth to Originate from North America |Evolving Opportunities with Alphabet Inc. & Amazon.com Inc| Technavio,https://www.prnewswire.com/news-releases/data-center-market---35-of-growth-to-originate-from-north-america-evolving-opportunities-with-alphabet-inc--amazoncom-inc-technavio-301551093.html,20220520T083000,PR Newswire,"Factors such as the rise in adoption of multi-cloud and network upgrades to support 5g, demand planning, and expansion by hyper-scalers will be crucial in driving the growth of the market. However, the cybersecurity issues will restrict the market growth.",0.039871,Neutral,0.057462,Neutral,0,broad,
ORCL,Oracle  ( ORCL )  Dips More Than Broader Markets: What You Should Know,https://www.zacks.com/stock/news/1926859/oracle-orcl-dips-more-than-broader-markets-what-you-should-know,20220519T220005,Zacks Commentary,"Oracle (ORCL) closed the most recent trading day at $67.04, moving -1.84% from the previous trading session.",-0.01646,Neutral,0.47075,Neutral,0,broad,
ORCL,Oracle Whale Trades Spotted,https://www.benzinga.com/markets/options/22/05/27312763/oracle-whale-trades-spotted,20220519T203120,Benzinga,"A whale with a lot of money to spend has taken a noticeably bearish stance on Oracle. Looking at options history for Oracle ( NYSE:ORCL ) we detected 16 strange trades. If we consider the specifics of each trade, it is accurate to state that 37% of the investors opened trades with bullish expectat",-0.028449,Neutral,0.620455,Neutral,0,broad,
ORCL,Increase In Demand For Industrial Automation Is To Drive Streaming Analytics Market Growth At A Huge Rate Of 29% As Per The Business Research Company's Streaming Analytics Global Market Report 2022,https://www.benzinga.com/pressreleases/22/05/g27305511/increase-in-demand-for-industrial-automation-is-to-drive-streaming-analytics-market-growth-at-a-hu,20220519T153000,Benzinga,"LONDON, May 19, 2022 ( GLOBE NEWSWIRE ) -- According to The Business Research Company's research report on the streaming analytics market, the increasing demand for industrial automation is significantly driving the growth of the streaming analytics market. Automation refers to the application o",-0.058085,Neutral,0.047626,Neutral,0,focused,automation
ORCL,"The Global Internet of Things  ( IoT )  market is expected to reach a value of USD 1,721,231.5 Million By 2027 growing at a CAGR of 22.75% over the forecast period  ( 2021 - 2027 )  - SkyQuest Technology",https://www.benzinga.com/pressreleases/22/05/g27300503/the-global-internet-of-things-iot-market-is-expected-to-reach-a-value-of-usd-1-721-231-5-million-b,20220519T132040,Benzinga,"Westford, USA, May 19, 2022 ( GLOBE NEWSWIRE ) -- The epidemic has compelled governments, corporations, and individuals to rethink their goals, perspectives on socioeconomic issues, and methods of operation. While the globe battled the new coronavirus epidemic in 2020, healthcare experts worked",0.037932,Neutral,0.024155,Neutral,0,broad,
ORCL,Takuya Hirano Joins PingCAP as an Executive Advisor,https://www.prnewswire.com/news-releases/takuya-hirano-joins-pingcap-as-an-executive-advisor-301550864.html,20220519T123000,PR Newswire,"Hirano has deep expertise in business development, which positions him to provide strategic counsel to help accelerate PingCAP's business. Naming Hirano as Executive Advisor highlights the importance of the global market growth and the company's continued commitment to providing the gold standard ...",0.021718,Neutral,0.066139,Neutral,0,broad,
ORCL,U.S. banks' 2021 hiring show lenders are seeking talent far beyond Wall Street,https://www.reuters.com/business/finance/us-banks-2021-hiring-show-lenders-are-seeking-talent-far-beyond-wall-street-2022-05-19/,20220519T120500,Reuters,"A man is seen silhouetted wearing a protective face mask, amid the coronavirus disease ( COVID-19 ) pandemic, walking near the financial district of New York City, U.S., October 18, 2021. REUTERS/Shannon Stapleton",-0.142108,Neutral,0.105372,Neutral,0,broad,
ORCL,"Customer Engagement Solutions Market Size to Grow by USD 7.69 Billion | By Component and Geography | Growth, Trends, and Forecasts  ( 2022 - 2026 ) ",https://www.prnewswire.com/news-releases/customer-engagement-solutions-market-size-to-grow-by-usd-7-69-billion--by-component-and-geography--growth-trends-and-forecasts-2022---2026-301550217.html,20220519T093000,PR Newswire,,0.005909,Neutral,0.077606,Neutral,0,broad,
ORCL,Oracle  ( ORCL )  Attains Additional DOD Provisional Authorizations,https://www.zacks.com/stock/news/1926166/oracle-orcl-attains-additional-dod-provisional-authorizations,20220518T164800,Zacks Commentary,Oracle's (ORCL) Cloud Infrastructure services attain DOD provisional authorization and are available to U.S. defense and intelligence organizations.,0.083794,Neutral,0.801693,Neutral,0,focused,AI
ORCL,Transactional and Marketing Emails Market Size to Grow by USD 8.87 billion | Amazon.com Inc. and Constant Contact Inc. Among Key Vendors | Technavio,https://www.prnewswire.com/news-releases/transactional-and-marketing-emails-market-size-to-grow-by-usd-8-87-billion--amazoncom-inc-and-constant-contact-inc-among-key-vendors--technavio-301549022.html,20220518T100000,PR Newswire,Technavio categorizes the global transactional and marketing emails market as a part of the global advertising market. External factors influencing the parent market's growth potential in the coming years have been thoroughly investigated in our research analysis.,0.04958,Neutral,0.060342,Neutral,0,focused,AI
ORCL,Transactional and Marketing Emails Market Size to Grow by USD 8.87 billion | Amazon.com Inc. and Constant Contact Inc. Among Key Vendors | Technavio,https://www.benzinga.com/pressreleases/22/05/n27270747/transactional-and-marketing-emails-market-size-to-grow-by-usd-8-87-billion-amazon-com-inc-and-cons,20220518T100000,Benzinga,"NEW YORK, May 18, 2022 /PRNewswire/ -- The Transactional and Marketing Emails Market is segmented by application ( transactions and marketing ) , end-user ( large enterprises, SMEs, and government ) , and geography ( North America, Europe, APAC, South America, and MEA ) . The market share is expe",0.071361,Neutral,0.037057,Neutral,0,focused,AI
ORCL,Disaster Recovery-as-a-Service  ( DRaaS )  Market Size to Grow by USD 40.97 bn growth | Amazon.com Inc. and Broadcom Inc. Among Key Vendors|Technavio,https://www.prnewswire.com/news-releases/disaster-recovery-as-a-service-draas-market-size-to-grow-by-usd-40-97-bn-growth--amazoncom-inc-and-broadcom-inc-among-key-vendorstechnavio-301549018.html,20220518T083000,PR Newswire,The disaster recovery-as-a-service ( DRaaS ) market covers the following areas: Improvements in manageability and protection are driving the global disaster recovery-as-a-service ( DRaaS ) market share growth. DRaaS helps in continuing business operations in case of an outage.,0.0189,Neutral,0.058846,Neutral,0,broad,
ORCL,Twitter Bid: Musk Wants Help From an Agency He Hates,https://www.thestreet.com/technology/twitter-bid-musk-wants-help-from-an-agency-he-hates,20220517T181300,The Street,Billionaire Elon Musk wants the U.S. Securities and Exchange Commission to examine Twitter's financials.,-0.255633,Somewhat-Bearish,0.154885,Neutral,0,focused,AI
ORCL,Peering Into Oracle's Recent Short Interest,https://www.benzinga.com/short-sellers/22/05/27259787/peering-into-oracles-recent-short-interest,20220517T170239,Benzinga,"Oracle's ( NYSE:ORCL ) short percent of float has fallen 5.88% since its last report. The company recently reported that it has 12.18 million shares sold short, which is 0.8% of all regular shares that are available for trading. Based on its trading volume, it would take traders 1.4 days to cover",-0.445427,Bearish,0.12031,Bearish,0,focused,AI
ORCL,Increasing Digitization And Advanced Tech Are Contributing To The Growth Of The Cloud-Based ERP Market As Per The Business Research Company's Cloud-Based ERP Global Market Report 2022,https://www.benzinga.com/pressreleases/22/05/g27256795/increasing-digitization-and-advanced-tech-are-contributing-to-the-growth-of-the-cloud-based-erp-ma,20220517T153000,Benzinga,"LONDON, May 17, 2022 ( GLOBE NEWSWIRE ) -- According to The Business Research Company's research report on the cloud-based ERP market, increasing digitization, adoption of IoT, and cloud computing environment contributed to the growth of the cloud-based ERP market. Cloud ERP provides real-time i",-0.036973,Neutral,0.039898,Neutral,0,broad,
ORCL,"Customer Communication Management Market Size Report [2022-2029] | Global Industry Share, Growth Rate, Key Players, Type & Application, Expansion Plans, Recent Developments, Revenue, Challenges, Restraints Analysis",https://www.benzinga.com/pressreleases/22/05/g27243671/customer-communication-management-market-size-report-2022-2029-global-industry-share-growth-rate-k,20220517T081928,Benzinga,"Pune, India, May 17, 2022 ( GLOBE NEWSWIRE ) -- The customer communication management market size will witness an appreciable gain on the back of the rising adoption of customer communication management ( CCM ) solutions across industry verticals. With rising demand to enhance the customer exp",0.094263,Neutral,0.038592,Neutral,0,focused,AI
ORCL,Elon Musk Thinks of Buying Twitter at a Lower Price,https://www.thestreet.com/technology/elon-musk-thinks-of-buying-twitter-at-the-price-that-suits-him,20220516T230000,The Street,The billionaire has launched a public campaign designed to force Twitter's board of directors to renegotiate the price.,-0.176372,Somewhat-Bearish,0.146737,Neutral,0,focused,AI
ORCL,Merger Arbitrage Mondays - Chicken Soup For The Soul Acquires Redbox At a Massive Discount,https://www.benzinga.com/markets/penny-stocks/22/05/27233723/merger-arbitrage-mondays-chicken-soup-for-the-soul-acquires-redbox-at-a-massive-discount,20220516T193355,Benzinga,Most M&A observers had expected U.S. deal activity to moderate or drop sharply this year but it feels like things are heating up with large acquisitions like Microsoft's acquisition of Activision Blizzard ( ATVI ) or Elon Musk's acquisition of Twitter ( TWTR ) . More than half of the 45 deals ann,-0.099452,Neutral,0.036983,Neutral,0,broad,
ORCL,"Supply Chain Analytics Market Projected to Surpass USD 16.82 Billion by 2030, at a CAGR of 17.21% - Report by Market Research Future  ( MRFR ) ",https://www.benzinga.com/pressreleases/22/05/g27227292/supply-chain-analytics-market-projected-to-surpass-usd-16-82-billion-by-2030-at-a-cagr-of-17-21-re,20220516T160000,Benzinga,"New York, May 16, 2022 ( GLOBE NEWSWIRE ) -- Supply Chain Analytics Market Overview: According to a comprehensive research report by Market Research Future ( MRFR ) , ""Supply Chain Analytics Market"" information by Solution, by Components, by Deployment, by Vertical and Region - Forecast to 2030",-0.088968,Neutral,0.037848,Neutral,0,focused,AI
ORCL,Should You Invest in the First Trust Cloud Computing ETF  ( SKYY ) ?,https://www.zacks.com/stock/news/1924512/should-you-invest-in-the-first-trust-cloud-computing-etf-skyy,20220516T102007,Zacks Commentary,Sector ETF report for SKYY,0.057941,Neutral,0.124582,Neutral,0,broad,
ORCL,"With 19.8% CAGR, Global Linux Operating System Market Size Worth USD 22.15 Billion in 2029",https://www.benzinga.com/pressreleases/22/05/g27212268/with-19-8-cagr-global-linux-operating-system-market-size-worth-usd-22-15-billion-in-2029,20220516T080854,Benzinga,"Pune, India, May 16, 2022 ( GLOBE NEWSWIRE ) -- The global Linux operating system market size is expected to rise from USD 6.27 billion in 2022 to USD 22.15 billion by 2029 at a CAGR of 19.8% during the forecast period. The market is expected to grow during the projected period due to rising ado",-0.005091,Neutral,0.039154,Neutral,0,broad,
ORCL,3 Top Cloud Stocks to Buy in May,https://www.fool.com/investing/2022/05/14/3-top-cloud-stocks-to-buy-in-may/,20220514T144500,Motley Fool,A falling market cannot stop the secular growth story in these cloud stocks.,-0.009234,Neutral,0.049588,Somewhat-Bullish,0,broad,
ORCL,3 Top Software Stocks To Watch Right Now,https://stockmarket.com/featured/3-top-software-stocks-to-watch-right-now-2022-05-13,20220513T203000,StockMarket.com,"3 Hot Software Stocks To Check Out In The Stock Market Today Software stocks, similar to many other tech segments, have struggled to find their footing in the stock market this year. For most parts, there aren't many changes in the fundamentals of the industry.",0.151056,Somewhat-Bullish,0.071538,Somewhat-Bullish,0,broad,
ORCL,Elon Musk Has Some Good News for Tesla Investors,https://www.thestreet.com/technology/elon-musk-has-some-good-news-for-tesla-investors,20220513T143300,The Street,Elon Musk's financing of the acquisition of microblogging website Twitter involves a margin loan tied to the billionaire's Tesla shares.,-0.148727,Neutral,0.163023,Neutral,0,focused,AI
ORCL,Twitter Deal: Musk Has Some Good News for Tesla Investors,https://www.thestreet.com/technology/twitter-deal-musk-has-good-news-for-tesla-investors,20220513T141700,The Street,Elon Musk's financing of the acquisition of microblogging website Twitter involves a margin loan tied to the billionaire's Tesla shares.,-0.148727,Neutral,0.163023,Neutral,0,focused,AI
ORCL,"Location-based Services Market Worth $239.7 Billion by 2029 - Market Size, Share, Forecasts, & Trends Analysis Report with COVID-19 Impact by Meticulous Research®",https://www.prnewswire.com/news-releases/location-based-services-market-worth-239-7-billion-by-2029---market-size-share-forecasts--trends-analysis-report-with-covid-19-impact-by-meticulous-research-301546917.html,20220513T133000,PR Newswire,,0.034572,Neutral,0.017056,Neutral,0,broad,
ORCL,Could Musk's Twitter Buyout Hit the Skids?,https://www.kiplinger.com/investing/stocks/604677/could-musks-twitter-buyout-hit-the-skids,20220513T121314,Kiplinger,"Anyone who expected turbulence amid Elon Musk's quest to acquire Twitter ( TWTR ) got precisely what they anticipated Friday morning, when the Tesla ( TSLA ) CEO tweeted that the Twitter deal was ""temporarily on hold."" TWTR shares plunged roughly 15% in Friday's early trade following Musk's twee",-0.125534,Neutral,0.157844,Neutral,0,broad,
ORCL,ORCL: 2 Big Data Stocks Worth Buying Now,https://stocknews.com/news/orcl-tdc-2-big-data-stocks-worth-buying-now/,20220512T203838,Stocknews.com,The increasing digitization and the use of analytics across almost every industry to increase work efficiency and magnify opportunities is enhancing the prospects of big data companies.,0.09847,Neutral,0.677475,Neutral,0,broad,
ORCL,Elon Musk Faces Federal Probe Over Twitter Stake Disclosure,https://www.benzinga.com/news/22/05/27154380/elon-musk-said-to-be-facing-regulatory-probe-over-his-twitter-stake-while-small-investors-get-a-chan,20220512T015647,Benzinga,"Tesla Inc ( NASDAQ: TSLA ) CEO Elon Musk is facing a federal probe over missing a key deadline last month to disclose a sizable stake in Twitter Inc ( NYSE: TWTR ) , the microblogging site that he is now buying for $44 billion, The Wall Street Journal reported on Wednesday, citing people familiar",-0.04892,Neutral,0.208464,Neutral,0,broad,
ORCL,Pharmacovigilance and Drug Safety Software Market - 50% of Growth to Originate from North America | Evolving Opportunities with AB Cube SARL & Oracle Corp.| Technavio,https://www.prnewswire.com/news-releases/pharmacovigilance-and-drug-safety-software-market---50-of-growth-to-originate-from-north-america--evolving-opportunities-with-ab-cube-sarl--oracle-corp-technavio-301544085.html,20220512T001500,PR Newswire,"Read the 120-page report with TOC on ""Pharmacovigilance and Drug Safety Software Market Analysis Report by End-user ( Pharmaceutical and biotechnology companies, Contract research organization, and Business process outsourcing ) and Geography ( North America, Europe, Asia, and Rest of World ( ...",0.005773,Neutral,0.037012,Neutral,0,broad,
ORCL,Tesla's stock slide raises doubts about Elon Musk's Twitter purchase,https://edition.cnn.com/2022/05/11/investing/tesla-stock-elon-musk-twitter/index.html,20220511T174642,CNN,New York ( CNN Business ) Elon Musk's bold plan to buy Twitter depends partly on how his investment in Tesla is doing. Uh-oh. Shares of Tesla ( TSLA ) have plummeted about 20% since Musk first disclosed plans to buy all of Twitter and take it private.,-0.210841,Somewhat-Bearish,0.122331,Neutral,0,focused,AI
ORCL,Tesla's stock slide raises doubts about Elon Musk's Twitter purchase,https://www.cnn.com/2022/05/11/investing/tesla-stock-elon-musk-twitter/index.html,20220511T160600,CNN,New York  (  CNN Business  )  Elon Musk's bold plan to buy Twitter depends partly on how his investment in Tesla is doing. Uh-oh.,-0.210841,Somewhat-Bearish,0.122331,Neutral,0,focused,AI
ORCL,Healthcare Information Software Market - 41% of Growth to Originate from North America | Driven by Increasing Adoption of EHRs | Technavio,https://www.prnewswire.com/news-releases/healthcare-information-software-market---41-of-growth-to-originate-from-north-america--driven-by-increasing-adoption-of-ehrs--technavio-301544090.html,20220511T151500,PR Newswire,"Read the 120-page report with TOC on ""Healthcare Information Software Market Analysis Report by Application  ( HIS and PIS ) , Deployment  ( On-premises and Cloud-based ) , and Geography  ( North America, Europe, APAC, South America, and the Middle East and Africa ) , and the Segment Forecasts,2022-2026"". Gain competitive intelligence about market leaders. Track key industry opportunities, trends, and threats. Information on marketing, brand, strategy and market development, sales, and supply functions.",0.004754,Neutral,0.039353,Neutral,0,focused,AI
ORCL,Insights on the Oil and Gas Data Management Global Market to 2030 - Increasing Popularity of Real-Time Analysis and Predictive Analytics Solutions is Driving Growth,https://www.prnewswire.com/news-releases/insights-on-the-oil-and-gas-data-management-global-market-to-2030---increasing-popularity-of-real-time-analysis-and-predictive-analytics-solutions-is-driving-growth-301544901.html,20220511T124500,PR Newswire,"DUBLIN, May 11, 2022 /PRNewswire/ -- The ""Oil and Gas Data Management Market by Type, Deployment Model, and Application: Global Opportunity Analysis and Industry Forecast, 2021-2030"" report has been added to ResearchAndMarkets.com's offering.",-0.005997,Neutral,0.446671,Neutral,0,focused,predictive analytics
ORCL,Penetration Testing Market Anticipated to Touch USD 8.13 Billion at a 13.5% CAGR by 2030 - Report by Market Research Future  ( MRFR ) ,https://www.benzinga.com/pressreleases/22/05/g27130803/penetration-testing-market-anticipated-to-touch-usd-8-13-billion-at-a-13-5-cagr-by-2030-report-by-,20220511T105039,Benzinga,"New York, US, May  11, 2022   ( GLOBE NEWSWIRE )  -- Market Overview: According to a comprehensive research report by Market Research Future  ( MRFR ) , ""Penetration Testing Market"" information by Type, by Components, by Deployment, by Organization Size and Region - Forecast to 2030"" market size to ",0.035034,Neutral,0.027795,Neutral,0,broad,
ORCL,"With Capital Levels High and Stocks Low, Going-Private Deals Rise",https://www.wsj.com/articles/with-capital-levels-high-and-stocks-low-going-private-deals-rise-11652261521,20220511T093200,Wall Street Journal,More U.S. public companies are going private as deal makers look to use the capital they have built up to buy targets made more attractive amid stock-market declines.,-0.039776,Neutral,0.039719,Neutral,0,broad,
ORCL,"With 13.6% CAGR, Data Integration and Integrity Software Market Size Worth USD 29.16 Billion in 2029",https://www.benzinga.com/pressreleases/22/05/g27129702/with-13-6-cagr-data-integration-and-integrity-software-market-size-worth-usd-29-16-billion-in-2029,20220511T092805,Benzinga,"Pune, India, May  11, 2022   ( GLOBE NEWSWIRE )  -- The global data integration and integrity software market size was valued at USD 10.75 billion in 2021. The market is projected to grow from USD 11.94 billion in 2022 to USD 29.16 billion by 2029, exhibiting a CAGR of 13.6% during the forecast peri",0.069498,Neutral,0.035377,Neutral,0,broad,
ORCL,"Hyperscale Data Center Market Size to Grow by USD 129.16 billion | Find Future Trends, Analysis, and Insights | Technavio",https://www.prnewswire.com/news-releases/hyperscale-data-center-market-size-to-grow-by-usd-129-16-billion--find-future-trends-analysis-and-insights--technavio-301543950.html,20220511T091500,PR Newswire,Find additional market insights by Technavio to help your organization foster innovation and make effective decisions. View our Exclusive Sample Report,0.001027,Neutral,0.051774,Neutral,0,broad,
ORCL,Location-Based Services Market Is Expected To Reach $114 Billion By 2026 Due To The Upsurge In The Use Of Smartphone And GPS Enabled Devices,https://www.prnewswire.com/news-releases/location-based-services-market-is-expected-to-reach-114-billion-by-2026-due-to-the-upsurge-in-the-use-of-smartphone-and-gps-enabled-devices-301540827.html,20220510T150000,PR Newswire,"TBRC's market research report covers location-based services market size, location-based services market forecasts, major location-based services companies and their market share, key strategies to undertake, and more.",0.002499,Neutral,0.073411,Neutral,0,focused,smart
