ticker,title,url,time_published,source,summary,sentiment_score,sentiment_label,ticker_sentiment_score,ticker_sentiment_label,relevance_score,category,ai_keywords_found
QUBT,"Lowey Dannenberg Notifies Quantum Computing Inc.  ( ""QCI"" or the ""Company"" )   ( NASDAQ: QUBT )  Investors of Securities Class Action Lawsuit and Encourages Investors with more than $50,000 in Losses to Contact the Firm - Quantum Computing  ( NASDAQ:QUBT ) ",https://www.benzinga.com/pressreleases/25/03/g44439337/lowey-dannenberg-notifies-quantum-computing-inc-qci-or-the-company-nasdaq-qubt-investors-of-securi,20250321T153446,Benzinga,"NEW YORK, March 21, 2025 ( GLOBE NEWSWIRE ) -- Lowey Dannenberg P.C., a preeminent law firm in obtaining redress for consumers and investors, announces the filing of a class action lawsuit against Quantum Computing Inc. ( ""QCI"" or the ""Company"" ) QUBT for violations of the federal securities ...",-0.031785,Neutral,0.179788,Neutral,0,focused,AI
QUBT,Why Quantum Computing  ( QUBT )  Stock Is Volatile - Quantum Computing  ( NASDAQ:QUBT ) ,https://www.benzinga.com/news/25/03/44437844/why-quantum-computing-qubt-stock-is-falling,20250321T143435,Benzinga,Quantum Computing shares are trading lower by 0.6% during Friday's session. The company on Thursday reported Q4 results. Volatility can create massive trading opportunities-if you know how to capitalize on it.,0.226157,Somewhat-Bullish,0.243701,Neutral,0,broad,
QUBT,"Bragar Eagel & Squire, P.C. Reminds Investors That Class Action Lawsuits Have Been Filed Against Quantum Computing, Atkore, Newmont, and Rocket Lab and Encourages Investors to Contact the Firm - Atkore  ( NYSE:ATKR ) , Newmont  ( NYSE:NEM ) ",https://www.benzinga.com/pressreleases/25/03/g44428914/bragar-eagel-squire-p-c-reminds-investors-that-class-action-lawsuits-have-been-filed-against-quant,20250321T010000,Benzinga,"NEW YORK, March 20, 2025 ( GLOBE NEWSWIRE ) -- Bragar Eagel & Squire, P.C., a nationally recognized shareholder rights law firm, reminds investors that class actions have been commenced on behalf of stockholders of Quantum Computing, Inc. QUBT, Atkore Inc. ATKR, Newmont Corporation NEM, and ...",-0.070108,Neutral,0.122685,Neutral,0,focused,AI
QUBT,Quantum Computing Stock Tumbles On Q4 Earnings: The Details - Quantum Computing  ( NASDAQ:QUBT ) ,https://www.benzinga.com/news/earnings/25/03/44426530/quantum-computing-stock-tumbles-on-q4-earnings-the-details,20250320T205604,Benzinga,Quantum Computing comes up short of analyst estimates on the top and bottom lines in the fourth quarter. The company says it ended the quarter with $78.9 million in cash and cash equivalents. Feel unsure about the market's next move?,0.282178,Somewhat-Bullish,0.309539,Somewhat-Bullish,0,focused,AI
QUBT,The Gross Law Firm Notifies Shareholders of Quantum Computing Inc. ( QUBT )  of a Class Action Lawsuit and an Upcoming Deadline - Quantum Computing  ( NASDAQ:QUBT ) ,https://www.benzinga.com/pressreleases/25/03/g44421487/the-gross-law-firm-notifies-shareholders-of-quantum-computing-inc-qubt-of-a-class-action-lawsuit-a,20250320T165900,Benzinga,"NEW YORK, March 20, 2025 ( GLOBE NEWSWIRE ) -- The Gross Law Firm issues the following notice to shareholders of Quantum Computing Inc. QUBT. Shareholders who purchased shares of QUBT during the class period listed are encouraged to contact the firm regarding possible lead plaintiff ...",-0.063881,Neutral,0.385286,Somewhat-Bullish,0,focused,AI
QUBT,"DEADLINE ALERT for SMTC, QUBT, RKLB, MRVI: Law Offices of Howard G. Smith Reminds Investors of Opportunity to Lead Securities Fraud Class Actions - Quantum Computing  ( NASDAQ:QUBT ) , Maravai LifeSciences  ( NASDAQ:MRVI ) ",https://www.benzinga.com/pressreleases/25/03/g44420522/deadline-alert-for-smtc-qubt-rklb-mrvi-law-offices-of-howard-g-smith-reminds-investors-of-opportun,20250320T160000,Benzinga,"BENSALEM, Pa., March 20, 2025 ( GLOBE NEWSWIRE ) -- Law Offices of Howard G. Smith reminds investors that class action lawsuits have been filed on behalf of shareholders of the following publicly-traded companies. Investors have until the deadlines listed below to file a lead plaintiff motion.",-0.024443,Neutral,0.097457,Neutral,0,focused,AI
QUBT,"ROSEN, RECOGNIZED INVESTOR COUNSEL, Encourages Quantum Computing Inc. Investors to Secure Counsel Before Important Deadline in Securities Class Action - QUBT - Quantum Computing  ( NASDAQ:QUBT ) ",https://www.benzinga.com/pressreleases/25/03/g44408144/rosen-recognized-investor-counsel-encourages-quantum-computing-inc-investors-to-secure-counsel-bef,20250319T225040,Benzinga,"NEW YORK, March 19, 2025 ( GLOBE NEWSWIRE ) -- WHY: Rosen Law Firm, a global investor rights law firm, reminds purchasers of securities of Quantum Computing Inc. QUBT between March 30, 2020 and January 15 2025, both dates inclusive ( the ""Class Period"" ) , of the important April 28, 2025 lead ...",0.143164,Neutral,0.104911,Neutral,0,broad,
QUBT,"QUBT Announcement: Contact Kessler Topaz Meltzer & Check, LLP About the Securities Fraud Class Action Lawsuit Filed Against Quantum Computing Inc.  ( QUBT )  - Quantum Computing  ( NASDAQ:QUBT ) ",https://www.benzinga.com/pressreleases/25/03/g44406771/qubt-announcement-contact-kessler-topaz-meltzer-check-llp-about-the-securities-fraud-class-action-,20250319T205938,Benzinga,"RADNOR, Pa., March 19, 2025 ( GLOBE NEWSWIRE ) -- The law firm of Kessler Topaz Meltzer & Check, LLP ( www.ktmc.com ) informs investors that a securities class action lawsuit has been filed in the United States District Court for the District of New Jersey against Quantum Computing Inc. ( ""QCI"" ...",0.082867,Neutral,0.114137,Neutral,0,focused,AI
QUBT,"DEADLINE ALERT for SMTC, QUBT, and RKLB: The Law Offices of Frank R. Cruz Reminds Investors of Class Actions on Behalf of Shareholders - Quantum Computing  ( NASDAQ:QUBT ) , Rocket Lab USA  ( NASDAQ:RKLB ) ",https://www.benzinga.com/pressreleases/25/03/g44401108/deadline-alert-for-smtc-qubt-and-rklb-the-law-offices-of-frank-r-cruz-reminds-investors-of-class-a,20250319T160900,Benzinga,"LOS ANGELES, March 19, 2025 ( GLOBE NEWSWIRE ) -- The Law Offices of Frank R. Cruz reminds investors that class action lawsuits have been filed on behalf of shareholders of the following publicly-traded companies. Investors have until the deadlines listed below to file a lead plaintiff motion.",0.036358,Neutral,0.154455,Neutral,0,focused,AI
QUBT,"April 28, 2025 Deadline: Contact The Gross Law Firm to Join Class Action Suit Against QUBT - Quantum Computing  ( NASDAQ:QUBT ) ",https://www.benzinga.com/pressreleases/25/03/g44362295/april-28-2025-deadline-contact-the-gross-law-firm-to-join-class-action-suit-against-qubt,20250317T182400,Benzinga,"NEW YORK, March 17, 2025 ( GLOBE NEWSWIRE ) -- The Gross Law Firm issues the following notice to shareholders of Quantum Computing Inc. QUBT. Shareholders who purchased shares of QUBT during the class period listed are encouraged to contact the firm regarding possible lead plaintiff ...",-0.063881,Neutral,0.385286,Somewhat-Bullish,0,focused,AI
QUBT,"Quantum Computing Stocks Are Rallying Monday: What's Going On? - NVIDIA  ( NASDAQ:NVDA ) , IonQ  ( NYSE:IONQ ) ",https://www.benzinga.com/news/events/25/03/44357297/quantum-computing-stocks-are-rallying-monday-whats-going-on,20250317T141216,Benzinga,Nvidia will host its first Quantum Day at GTC 2025 this week. Several quantum computing stocks appear to be rallying in anticipation of the event. Our government trade tracker caught Pelosi's 169% AI winner. Discover how to track all 535 Congress member stock trades today.,0.201965,Somewhat-Bullish,0.238913,Neutral,0,focused,AI
QUBT,"Why Precision BioSciences Shares Are Trading Higher By Over 10%; Here Are 20 Stocks Moving Premarket - Aspira Womens Health  ( NASDAQ:AWH ) , Aclarion  ( NASDAQ:ACON ) ",https://www.benzinga.com/25/03/44353594/why-precision-biosciences-shares-are-trading-higher-by-over-10-here-are-20-stocks-moving-premarket,20250317T114057,Benzinga,"Shares of Precision BioSciences, Inc. DTIL rose sharply in today's pre-market trading. Precision BioSciences reported clearance of investigational new drug application by the U.S. FDA for first-in-class PBGENE-HBV designed to eliminate root cause of chronic hepatitis B.",0.144237,Neutral,0.184598,Neutral,0,broad,
QUBT,"ROSEN, A LEADING LAW FIRM, Encourages Quantum Computing Inc. Investors to Secure Counsel Before Important Deadline in Securities Class Action - QUBT - Quantum Computing  ( NASDAQ:QUBT ) ",https://www.benzinga.com/pressreleases/25/03/g44348332/rosen-a-leading-law-firm-encourages-quantum-computing-inc-investors-to-secure-counsel-before-impor,20250316T211859,Benzinga,"NEW YORK, March 16, 2025 ( GLOBE NEWSWIRE ) -- WHY: Rosen Law Firm, a global investor rights law firm, reminds purchasers of securities of Quantum Computing Inc. QUBT between March 30, 2020 and January 15 2025, both dates inclusive ( the ""Class Period"" ) , of the important April 28, 2025 lead ...",0.143164,Neutral,0.104911,Neutral,0,broad,
QUBT,"ROSEN, A TRUSTED AND LEADING LAW FIRM, Encourages Quantum Computing Inc. Investors to Secure Counsel Before Important Deadline in Securities Class Action - QUBT - Quantum Computing  ( NASDAQ:QUBT ) ",https://www.benzinga.com/pressreleases/25/03/g44319839/rosen-a-trusted-and-leading-law-firm-encourages-quantum-computing-inc-investors-to-secure-counsel-,20250314T000000,Benzinga,"NEW YORK, March 13, 2025 ( GLOBE NEWSWIRE ) -- WHY: Rosen Law Firm, a global investor rights law firm, reminds purchasers of securities of Quantum Computing Inc. QUBT between March 30, 2020 and January 15 2025, both dates inclusive ( the ""Class Period"" ) , of the important April 28, 2025 lead ...",0.143164,Neutral,0.104911,Neutral,0,broad,
QUBT,Quantum Computing Inc. Stockholders with Large Losses are Encouraged to Contact Robbins LLP for Information About the Securities Fraud Class Action Filed Against QUBT - Quantum Computing  ( NASDAQ:QUBT ) ,https://www.benzinga.com/pressreleases/25/03/g44291385/quantum-computing-inc-stockholders-with-large-losses-are-encouraged-to-contact-robbins-llp-for-inf,20250312T214301,Benzinga,"SAN DIEGO, March 12, 2025 ( GLOBE NEWSWIRE ) -- Robbins LLP reminds stockholders that a class action was filed on behalf of all persons or entities that purchased or otherwise acquired Quantum Computing Inc. QUBT securities between March 30, 2020 and January 15, 2025.",0.033814,Neutral,0.354741,Neutral,0,focused,AI
QUBT,"Lowey Dannenberg Notifies Quantum Computing Inc.  ( ""QCI"" or the ""Company"" )   ( NASDAQ: QUBT )  Investors of Securities Class Action Lawsuit and Encourages Investors with more than $50,000 in Losses to Contact the Firm - Quantum Computing  ( NASDAQ:QUBT ) ",https://www.benzinga.com/pressreleases/25/03/g44286436/lowey-dannenberg-notifies-quantum-computing-inc-qci-or-the-company-nasdaq-qubt-investors-of-securi,20250312T184851,Benzinga,"NEW YORK, March 12, 2025 ( GLOBE NEWSWIRE ) -- Lowey Dannenberg P.C., a preeminent law firm in obtaining redress for consumers and investors, announces the filing of a class action lawsuit against Quantum Computing Inc. ( ""QCI"" or the ""Company"" ) QUBT for violations of the federal securities ...",-0.031785,Neutral,0.179788,Neutral,0,focused,AI
QUBT,"QUBT Investor Alert: Kessler Topaz Meltzer & Check, LLP Urges QUBT Investors with Losses to Contact the Firm - Quantum Computing  ( NASDAQ:QUBT ) ",https://www.benzinga.com/pressreleases/25/03/g44211089/qubt-investor-alert-kessler-topaz-meltzer-check-llp-urges-qubt-investors-with-losses-to-contact-th,20250309T150900,Benzinga,"RADNOR, Pa., March 09, 2025 ( GLOBE NEWSWIRE ) -- The law firm of Kessler Topaz Meltzer & Check, LLP ( www.ktmc.com ) informs investors that a securities class action lawsuit has been filed in the United States District Court for the District of New Jersey against Quantum Computing Inc. ( ""QCI"" ...",0.082867,Neutral,0.114137,Neutral,0,focused,AI
QUBT,"ROSEN, A LEADING LAW FIRM, Encourages Quantum Computing Inc. Investors to Secure Counsel Before Important Deadline in Securities Class Action - QUBT - Quantum Computing  ( NASDAQ:QUBT ) ",https://www.benzinga.com/pressreleases/25/03/g44210155/rosen-a-leading-law-firm-encourages-quantum-computing-inc-investors-to-secure-counsel-before-impor,20250309T011730,Benzinga,"NEW YORK, March 08, 2025 ( GLOBE NEWSWIRE ) -- WHY: Rosen Law Firm, a global investor rights law firm, reminds purchasers of securities of Quantum Computing Inc. QUBT between March 30, 2020 and January 15 2025, both dates inclusive ( the ""Class Period"" ) , of the important April 28, 2025 lead ...",0.143164,Neutral,0.104911,Neutral,0,broad,
QUBT,Deadline Alert: Quantum Computing Inc.  ( QUBT )  Investors Who Lost Money Urged To Contact Glancy Prongay & Murray LLP About Securities Fraud Lawsuit - Quantum Computing  ( NASDAQ:QUBT ) ,https://www.benzinga.com/pressreleases/25/03/g44196725/deadline-alert-quantum-computing-inc-qubt-investors-who-lost-money-urged-to-contact-glancy-prongay,20250307T170000,Benzinga,"LOS ANGELES, March 07, 2025 ( GLOBE NEWSWIRE ) -- Glancy Prongay & Murray LLP reminds investors of the upcoming April 28, 2025 deadline to file a lead plaintiff motion in the class action filed on behalf of investors who purchased or otherwise acquired Quantum Computing Inc. ( ""QCI"" or the ...",0.041251,Neutral,0.103331,Neutral,0,focused,AI
QUBT,"ROSEN, LEADING TRIAL ATTORNEYS, Encourages Quantum Computing Inc. Investors to Secure Counsel Before Important Deadline in Securities Class Action - QUBT - Quantum Computing  ( NASDAQ:QUBT ) ",https://www.benzinga.com/pressreleases/25/03/g44156913/rosen-leading-trial-attorneys-encourages-quantum-computing-inc-investors-to-secure-counsel-before-,20250306T011359,Benzinga,"NEW YORK, March 05, 2025 ( GLOBE NEWSWIRE ) -- WHY: Rosen Law Firm, a global investor rights law firm, reminds purchasers of securities of Quantum Computing Inc. QUBT between March 30, 2020 and January 15 2025, both dates inclusive ( the ""Class Period"" ) , of the important April 28, 2025 lead ...",0.138502,Neutral,0.106541,Neutral,0,broad,
QUBT,"Bragar Eagel & Squire, P.C. Reminds Investors That Class Action Lawsuits Have Been Filed Against Quantum Computing and Rocket Lab and Encourages Investors to Contact the Firm - Quantum Computing  ( NASDAQ:QUBT ) , Rocket Lab USA  ( NASDAQ:RKLB ) ",https://www.benzinga.com/pressreleases/25/03/g44132669/bragar-eagel-squire-p-c-reminds-investors-that-class-action-lawsuits-have-been-filed-against-quant,20250305T020000,Benzinga,"NEW YORK, March 04, 2025 ( GLOBE NEWSWIRE ) -- Bragar Eagel & Squire, P.C., a nationally recognized shareholder rights law firm, reminds investors that class actions have been commenced on behalf of stockholders of Quantum Computing, Inc. QUBT and Rocket Lab USA, Inc.",-0.105202,Neutral,0.166551,Neutral,0,focused,AI
QUBT,"NASDAQ: QUBT Investor Reminder: Kessler Topaz Meltzer & Check, LLP Reminds Investors of Deadline in Securities Fraud Class Action Lawsuit Filed Against Quantum Computing Inc. - Quantum Computing  ( NASDAQ:QUBT ) ",https://www.benzinga.com/pressreleases/25/03/g44122725/nasdaq-qubt-investor-reminder-kessler-topaz-meltzer-check-llp-reminds-investors-of-deadline-in-sec,20250304T194948,Benzinga,"RADNOR, Pa., March 04, 2025 ( GLOBE NEWSWIRE ) -- The law firm of Kessler Topaz Meltzer & Check, LLP ( www.ktmc.com ) informs investors that a securities class action lawsuit has been filed in the United States District Court for the District of New Jersey against Quantum Computing Inc. ( ""QCI"" ...",0.075626,Neutral,0.116067,Neutral,0,focused,AI
QUBT,Quantum Computing Inc. Investor Notice: Shareholder Rights Law Firm Robbins LLP Reminds Investors of the Class Action Lawsuit Against Quantum Computing Inc. - Quantum Computing  ( NASDAQ:QUBT ) ,https://www.benzinga.com/pressreleases/25/03/g44098835/quantum-computing-inc-investor-notice-shareholder-rights-law-firm-robbins-llp-reminds-investors-of,20250304T002823,Benzinga,"SAN DIEGO, March 03, 2025 ( GLOBE NEWSWIRE ) -- Robbins LLP reminds stockholders that a class action was filed on behalf of all persons or entities that purchased or otherwise acquired Quantum Computing Inc. QUBT securities between March 30, 2020 and January 15, 2025.",0.021763,Neutral,0.364275,Neutral,0,focused,AI
QUBT,Quantum Computing Inc. Class Action Alert: Wolf Haldenstein Adler Freeman & Herz LLP reminds investors that a securities class action lawsuit has been filed in the United States District Court for the District of New Jersey against Quantum Computing Inc. - Quantum Computing  ( NASDAQ:QUBT ) ,https://www.benzinga.com/pressreleases/25/03/g44088484/quantum-computing-inc-class-action-alert-wolf-haldenstein-adler-freeman-herz-llp-reminds-investors,20250303T184343,Benzinga,"NEW YORK, March 03, 2025 ( GLOBE NEWSWIRE ) -- Wolf Haldenstein Adler Freeman & Herz LLP ( ""Wolf Haldenstein"" ) announces that a securities class action lawsuit has been filed in the United States District Court for the District of New Jersey on behalf of purchasers of Quantum Computing Inc.",0.009727,Neutral,0.117774,Neutral,0,focused,AI
QUBT,"DEADLINE ALERT for SMTC, QUBT, and RKLB: The Law Offices of Frank R. Cruz Reminds Investors of Class Actions on Behalf of Shareholders - Quantum Computing  ( NASDAQ:QUBT ) , Rocket Lab USA  ( NASDAQ:RKLB ) ",https://www.benzinga.com/pressreleases/25/02/g44049821/deadline-alert-for-smtc-qubt-and-rklb-the-law-offices-of-frank-r-cruz-reminds-investors-of-class-a,20250228T170500,Benzinga,"LOS ANGELES, Feb. 28, 2025 ( GLOBE NEWSWIRE ) -- The Law Offices of Frank R. Cruz reminds investors that class action lawsuits have been filed on behalf of shareholders of the following publicly-traded companies. Investors have until the deadlines listed below to file a lead plaintiff motion.",0.026687,Neutral,0.158,Neutral,0,focused,AI
QUBT,"ROSEN, A TRUSTED AND LEADING LAW FIRM, Encourages Quantum Computing Inc. Investors to Secure Counsel Before Important Deadline in Securities Class Action - QUBT - Quantum Computing  ( NASDAQ:QUBT ) ",https://www.benzinga.com/pressreleases/25/02/g44030893/rosen-a-trusted-and-leading-law-firm-encourages-quantum-computing-inc-investors-to-secure-counsel-,20250228T004500,Benzinga,"NEW YORK, Feb. 27, 2025 ( GLOBE NEWSWIRE ) -- WHY: Rosen Law Firm, a global investor rights law firm, announces the filing of a class action lawsuit on behalf of purchasers of securities of Quantum Computing Inc. QUBT between March 30, 2020 and January 15 2025, both dates inclusive ( the ...",0.129396,Neutral,0.107016,Neutral,0,broad,
QUBT,Quantum Computing Inc. Investors: Company Investigated by the Portnoy Law Firm - Quantum Computing  ( NASDAQ:QUBT ) ,https://www.benzinga.com/pressreleases/25/02/g44027932/quantum-computing-inc-investors-company-investigated-by-the-portnoy-law-firm,20250227T220632,Benzinga,"Investors can contact the law firm at no cost to learn more about recovering their losses LOS ANGELES, Feb. 27, 2025 ( GLOBE NEWSWIRE ) -- The Portnoy Law Firm advises Quantum Computing Inc. ( ""QCI"" or ""the Company"" ) QUBT investors that the firm has initiated an investigation into possible ...",0.004859,Neutral,0.188928,Neutral,0,broad,
QUBT,"QCI ALERT: Bragar Eagel & Squire, P.C. Announces that a Class Action Lawsuit Has Been Filed Against Quantum Computing, Inc. and Encourages Investors to Contact the Firm - Quantum Computing  ( NASDAQ:QUBT ) ",https://www.benzinga.com/pressreleases/25/02/g43995700/qci-alert-bragar-eagel-squire-p-c-announces-that-a-class-action-lawsuit-has-been-filed-against-qua,20250227T020000,Benzinga,"NEW YORK, Feb. 26, 2025 ( GLOBE NEWSWIRE ) -- Bragar Eagel & Squire, P.C., a nationally recognized stockholder rights law firm, announces that a class action lawsuit has been filed against Quantum Computing, Inc. ( ""QCI"" or the ""Company"" ) QUBT in the United States District Court for the ...",0.009732,Neutral,0.173958,Neutral,0,focused,AI
QUBT,QUBT ALERT: Kirby McInerney LLP Announces the Filing of a Securities Class Action on Behalf of Quantum Computing Inc. Investors - Quantum Computing  ( NASDAQ:QUBT ) ,https://www.benzinga.com/pressreleases/25/02/g43995230/qubt-alert-kirby-mcinerney-llp-announces-the-filing-of-a-securities-class-action-on-behalf-of-quan,20250227T010000,Benzinga,"NEW YORK, Feb. 26, 2025 ( GLOBE NEWSWIRE ) -- The law firm of Kirby McInerney LLP announces that a class action lawsuit has been filed in the U.S.",0.055057,Neutral,0.109705,Neutral,0,broad,
QUBT,QUBT INVESTOR ALERT: Robbins Geller Rudman & Dowd LLP Announces that Quantum Computing Inc. Investors with Substantial Losses Have Opportunity to Lead the Quantum Computing Class Action Lawsuit - Quantum Computing  ( NASDAQ:QUBT ) ,https://www.benzinga.com/pressreleases/25/02/g43994463/qubt-investor-alert-robbins-geller-rudman-dowd-llp-announces-that-quantum-computing-inc-investors-,20250226T233404,Benzinga,"SAN DIEGO, Feb. 26, 2025 ( GLOBE NEWSWIRE ) -- Robbins Geller Rudman & Dowd LLP announces that purchasers or acquirers of Quantum Computing Inc. QUBT securities between March 30, 2020 and January 15, 2025, inclusive ( the ""Class Period"" ) , have until April 28, 2025 to seek appointment as lead ...",0.060856,Neutral,0.128363,Neutral,0,broad,
QUBT,"Top Holders Of Quantum Computing Stocks In Q4: BlackRock, Vanguard, UBS, State Street Pour Money In Rigetti, D-Wave, IonQ, QUBT - Microsoft  ( NASDAQ:MSFT ) , IonQ  ( NYSE:IONQ ) ",https://www.benzinga.com/25/02/43876325/quantum-computing-top-holders-in-q4-blackrock-vanguard-ubs-state-street-pour-money-in-rigetti-d-wave-ionq-qubt,20250221T095513,Benzinga,"As quantum computing stocks resume their rally after a steep year-to-date decline following Microsoft Corp.'s MSFT 'Majorana 1' launch, we look at the top five holders of these companies according to the Security Exchange Commission's ( SEC ) 13F filings.",0.163383,Somewhat-Bullish,0.246582,Somewhat-Bullish,0,broad,
QUBT,"D-Wave, Rigetti and Quantum Computing Stocks Surge: What's Fueling the Growth? - Quantum Computing  ( NASDAQ:QUBT ) , D-Wave Quantum  ( NYSE:QBTS ) ",https://www.benzinga.com/trading-ideas/movers/25/02/43855457/d-wave-rigetti-and-quantum-computing-stocks-surge-whats-fueling-the-growth,20250220T162118,Benzinga,"Quantum computing-related stocks are rising after a Wednesday report suggested Microsoft will unveil its Majorana 1 chip. The Majorana 1 chip, after 17 years in the making, has the potential to solve large-scale problems.",0.15373,Somewhat-Bullish,0.19661,Somewhat-Bullish,0,broad,
QUBT,"Google's Quantum Computing Chief Challenges Nvidia's Jensen Huang's 20-Year Timeline: 'Within Five Years We'll See Real-World Applications That Are Possible Only On Quantum Computers' Google Challenges Nvdia On The Timeline For Quantum Computing. Plans To - Alphabet  ( NASDAQ:GOOG ) , Alphabet  ( NASDAQ:GOOGL ) ",https://www.benzinga.com/25/02/43552657/google-to-launch-commercial-quantum-computing-applications-in-five-years-challenges-nvdia-on-the-timeline,20250207T065302,Benzinga,"Google GOOGL has announced plans to introduce commercial quantum computing applications within the next five years, a timeline that challenges Nvidia's NVDA Jensen Huang's 20-year prediction.",0.404414,Bullish,0.15697,Somewhat-Bearish,0,broad,
QUBT,'s 'Stock Whisper' Index: 5 Stocks Investors Secretly Monitor But Don't Talk About Yet,https://www.benzinga.com/25/01/43066466/benzingas-stock-whisper-index-5-stocks-investors-secretly-monitor-but-dont-talk-about-yet,20250117T202155,Benzinga,The Benzinga Stock Whisper Index looks at five stocks seeing increased interest from readers during the week. Quantum computing and cryptocurrency could be themes to watch again in 2025. Get Pro-Level Earnings Insights Before the Market Moves,0.156559,Somewhat-Bullish,0.160099,Neutral,0,focused,AI
QUBT,"Quantum Computing Stocks Are 'Totally Divorced From Reality,' Says Analyst Flagging Inflated Valuations - IonQ  ( NYSE:IONQ ) , GameStop  ( NYSE:GME ) ",https://www.benzinga.com/25/01/43053808/quantum-computing-firms-are-expensive-totally-divorced-from-reality-says-analyst-as-this-metric-points-to-higher-,20250117T130738,Benzinga,Quantum computing stocks have seen a triple digit growth over six months and one year. ETF tracking these stocks rose 26.29% in the last six months and 53.69% over a year. Get 5 New Stock Recommendations Every Week,0.239834,Somewhat-Bullish,0.069294,Neutral,0,broad,
QUBT,"Quantum Computing Stock Drops Over 3% During Friday Premarket Amid Fraud Allegations - Microsoft  ( NASDAQ:MSFT ) , Quantum Computing  ( NASDAQ:QUBT ) ",https://www.benzinga.com/markets/equities/25/01/43052999/quantum-computing-stock-drops-over-3-during-friday-premarket-amid-fraud-allegations,20250117T122919,Benzinga,"Amid a turbulent period for quantum computing stocks, Quantum Computing Inc QUBT is under scrutiny following allegations of issuing misleading press releases. The company's stock experienced a 3.49% decline in pre-market trading on Friday, as per Benzinga Pro.",-0.127495,Neutral,0.672712,Somewhat-Bearish,0,broad,
QUBT,Quantum Computing Inc. Investors Who Have Lost Money Should Contact Block & Leviton to Find Out How They Might Recover Money Through The Firm's Investigation - Quantum Computing  ( NASDAQ:QUBT ) ,https://www.benzinga.com/pressreleases/25/01/g43038312/quantum-computing-inc-investors-who-have-lost-money-should-contact-block-leviton-to-find-out-how-t,20250116T185417,Benzinga,"BOSTON, Jan. 16, 2025 ( GLOBE NEWSWIRE ) -- Block & Leviton is investigating Quantum Computing Inc. QUBT for potential securities law violations. Investors who have lost money in their Quantum Computing Inc. investment should contact the firm to learn more about how they might recover those ...",0.017192,Neutral,0.537474,Neutral,0,broad,
