ticker,title,url,time_published,source,summary,sentiment_score,sentiment_label,ticker_sentiment_score,ticker_sentiment_label,relevance_score,category,ai_keywords_found
QUBT,"Worthington Enterprises Posts Upbeat Results, Joins Jabil, Archer Aviation And Other Big Stocks Moving Higher On Wednesday - Archer Aviation  ( NYSE:ACHR ) , EnerSys  ( NYSE:ENS ) ",https://www.benzinga.com/24/12/42559178/worthington-enterprises-posts-upbeat-results-joins-jabil-archer-aviation-and-other-big-stocks-moving-higher-on-we,20241218T171333,Benzinga,"U.S. stocks were higher, with the Dow Jones index gaining around 150 points on Wednesday. Shares of Worthington Enterprises, Inc. WOR rose sharply during Wednesday's session as the company posted better-than-expected results for its second quarter.",0.344548,Somewhat-Bullish,0.246582,Bullish,0,focused,AI
QUBT,What's Going On With Quantum Computing  ( QUBT )  Stock? - Quantum Computing  ( NASDAQ:QUBT ) ,https://www.benzinga.com/news/24/12/42554980/whats-going-on-with-quantum-computing-qubt-stock,20241218T144610,Benzinga,"Quantum Computing Inc QUBT shares are trading higher by 31.6% to $22.09 during Wednesday's session, possibly on continued strength, after the company on Tuesday announced it was awarded a prime contract by NASA to apply Dirac-3 for imaging and data processing support.",0.414536,Bullish,0.38489,Bullish,0,broad,
QUBT,"Why US Futures Are Rising Wednesday - Corvus Pharma  ( NASDAQ:CRVS ) , Applied DNA Sciences  ( NASDAQ:APDN ) ",https://www.benzinga.com/trading-ideas/previews/24/12/42549182/us-stocks-to-open-higher-as-rate-cut-expectations-surge-all-eyes-on-dow-jones-to-break-its,20241218T112212,Benzinga,"U.S. stock futures climbed on Wednesday in premarket hours as Wall Street awaits the Federal Reserve's final interest rate decision for 2024 and its monetary policy forecasts for 2025. On Tuesday, the Dow Jones index fell for the ninth session in a row to record its longest losing streak since 1978.",-0.033835,Neutral,0.075995,Somewhat-Bullish,0,focused,AI
QUBT,"NUKK, MU, TEVA, QUBT, TSLA: Top 5 Trending Stocks Today - Nukkleus  ( NASDAQ:NUKK ) , Micron Technology  ( NASDAQ:MU ) ",https://www.benzinga.com/24/12/42545441/nukkleus-micron-teva-pharmaceutical-quantum-computing-tesla-why-these-5-stocks-are-on-investors-radars-today,20241218T022025,Benzinga,Wall Street experienced a downturn on Tuesday as major indices fell following a strong retail sales report for November. The data raised concerns about the Federal Reserve's potential delay in cutting interest rates next year.,0.200769,Somewhat-Bullish,0.089129,Neutral,0,focused,AI
QUBT,"Crude Oil Down Over 1%; US Industrial Production Declines In November - Portage Biotech  ( NASDAQ:PRTG ) , Digital Brands Group  ( NASDAQ:DBGI ) ",https://www.benzinga.com/24/12/42536147/crude-oil-down-over-1-us-industrial-production-declines-in-november,20241217T173710,Benzinga,"U.S. stocks traded lower midway through trading, with the S&P 500 falling around 0.3% on Tuesday. The Dow traded down 0.59% to 43,459.99 while the NASDAQ fell 0.15% to 20,143.34. The S&P 500 also fell, dropping, 0.28% to 6,057.00. Communication services shares rose by 0.3% on Tuesday.",0.116656,Neutral,0.176502,Bullish,0,broad,
QUBT,Quantum Computing Stock Is Rising Tuesday: Here's Why - Quantum Computing  ( NASDAQ:QUBT ) ,https://www.benzinga.com/24/12/42533581/quantum-computing-stock-is-rising-tuesday-heres-why,20241217T153623,Benzinga,Quantum Computing Inc QUBT shares are trading higher Tuesday after the company announced it was awarded a prime contract from NASA for imaging and data processing support.,0.449456,Bullish,0.380978,Bullish,0,broad,
QUBT,"RCI Hospitality, Quantum Computing, Teva Pharmaceutical, Tesla And Other Big Stocks Moving Higher On Monday - Akso Health  ( NASDAQ:AHG ) , Arqit Quantum  ( NASDAQ:ARQQ ) ",https://www.benzinga.com/24/12/42532590/rci-hospitality-quantum-computing-teva-pharmaceutical-tesla-and-other-big-stocks-moving-higher-on-monday,20241217T150547,Benzinga,"U.S. stocks were mostly higher, with the Nasdaq Composite gaining around 1% on Monday. Shares of RCI Hospitality Holdings, Inc. RICK rose sharply during Tuesday's session after the company reported better-than-expected quarterly financial results.",0.40195,Bullish,0.238133,Bullish,0,focused,AI
QUBT,"Quantum Computing, Inc. Awarded Contract by NASA to Support Phase Unwrapping Using Dirac-3 Photonic Optimization Solver - Quantum Computing  ( NASDAQ:QUBT ) ",https://www.benzinga.com/pressreleases/24/12/n42529211/quantum-computing-inc-awarded-contract-by-nasa-to-support-phase-unwrapping-using-dirac-3-photonic-,20241217T133000,Benzinga,"HOBOKEN, N.J., Dec. 17, 2024 /PRNewswire/ -- Quantum Computing Inc. ( ""QCi"" or the ""Company"" ) QUBT, an innovative, integrated photonics and quantum optics technology company, today announced that the Company has been awarded a prime contract by the National Aeronautics and Space ...",0.278522,Somewhat-Bullish,0.2842,Bullish,0,broad,
QUBT,"Wall Street Set To Open Lower As Fed Rate Cut Decision, Jerome Powell's Comments Take Center Stage: Wharton's Jeremy Siegel Sees Small-Cap, Value Stock Rotation In 2025 - Apple  ( NASDAQ:AAPL ) , Broadcom  ( NASDAQ:AVGO ) ",https://www.benzinga.com/trading-ideas/previews/24/12/42525196/wall-street-set-to-open-lower-as-fed-rate-cut-decision-jerome-powells-comments-take-center,20241217T104844,Benzinga,"U.S. stock futures declined on Tuesday in premarket hours as Wall Street awaits Federal Reserve's final interest rate decision for the current year and its monetary policy forecasts for 2025. On Monday, the tech-heavy Nasdaq 100 set a new record high and crossed the 22,000-point milestone, ...",0.158433,Somewhat-Bullish,0.071463,Neutral,0,focused,AI
QUBT,D-Wave Quantum Shares Are On The Rise Monday: What's Going On? - D-Wave Quantum  ( NYSE:QBTS ) ,https://www.benzinga.com/trading-ideas/movers/24/12/42517239/d-wave-quantum-shares-are-on-the-rise-monday-whats-going-on,20241216T205659,Benzinga,"D-Wave Quantum Inc. QBTS shares are trading higher Monday amid continued momentum in the sector and in part with Google's recent announcement of its new quantum chip, Willow. Here's what you need to know. What To Know: Willow, developed by Google Quantum AI, marks a breakthrough in quantum ...",0.382803,Bullish,0.218817,Somewhat-Bullish,0,focused,AI
QUBT,"IonQ, Quantum Computing And Rigetti Computing Shares Are Soaring Monday: What's Going On? - IonQ  ( NYSE:IONQ ) ",https://www.benzinga.com/trading-ideas/movers/24/12/42516580/ionq-quantum-computing-and-rigetti-computing-shares-are-soaring-monday-whats-going-on,20241216T201623,Benzinga,"Shares of several quantum computing companies, including IonQ, Inc. IONQ, Quantum Computing Inc. QUBT and Rigetti Computing, Inc. RGTI, are trading higher Monday as excitement builds around the quantum computing sector. Here's what you need to know.",0.300673,Somewhat-Bullish,0.154951,Somewhat-Bullish,0,broad,
QUBT,"Tesla, Micron, Broadcom, MARA Holdings And Other Big Stocks Moving Higher On Monday - Aehr Test System  ( NASDAQ:AEHR ) , Agios Pharmaceuticals  ( NASDAQ:AGIO ) ",https://www.benzinga.com/24/12/42513632/tesla-micron-broadcom-mara-holdings-and-other-big-stocks-moving-higher-on-monday,20241216T173311,Benzinga,"U.S. stocks were mostly higher, with the Nasdaq Composite gaining around 1% on Monday. Shares of Tesla, Inc. TSLA rose sharply during Monday's session after Wedbush maintained an Outperform rating on the stock and raised its price target from $400 to $515. Tesla shares gained 5% to $458.08 on ...",0.383005,Bullish,0.206685,Bullish,0,focused,AI
QUBT,What's Going On With Quantum Computing Stock Today? - Quantum Computing  ( NASDAQ:QUBT ) ,https://www.benzinga.com/24/12/42434413/whats-going-on-with-quantum-computing-stock-today,20241211T125033,Benzinga,"Quantum Computing announces a $50M securities offering to support R&D and expand its Tempe, Arizona chip foundry. QUBT shares dip in premarket trading following the announcement of the stock offering. Quantum Computing Inc. QUBT shares are trading lower in the premarket session on Wednesday.",0.365084,Bullish,0.443626,Neutral,0,broad,
QUBT,"US Futures Mixed As Street Brace For Inflation Data: Analyst Says 2024 Will Go Down As The 'Best Election Year Return Ever' - Adobe  ( NASDAQ:ADBE ) , GameStop  ( NYSE:GME ) ",https://www.benzinga.com/24/12/42432367/us-stock-futures-mixed-as-traders-brace-for-inflation-data-analyst-predicts-that-the-bull-market-is-far-from-over,20241211T112146,Benzinga,"U.S. futures were mixed on Wednesday in premarket hours ahead of the crucial inflation data. Major index futures like Dow Jones and Russell 2000 fell, while Nasdaq 100 and S&P 500 advanced. The 10-year and two-year Treasury notes yielded 4.24% and 4.17%, respectively.",0.130954,Neutral,0.075754,Neutral,0,broad,
QUBT,"US Futures Mixed As Street Braces For Inflation Data: Analyst Says 2024 Will Go Down As The 'Best Election Year Return Ever' - Adobe  ( NASDAQ:ADBE ) , GameStop  ( NYSE:GME ) ",https://www.benzinga.com/trading-ideas/movers/24/12/42432367/us-futures-mixed-as-street-brace-for-inflation-data-analyst-says-2024-will-go-down-as-the-be,20241211T112137,Benzinga,"U.S. futures were mixed on Wednesday in premarket hours ahead of the crucial inflation data. Major index futures like Dow Jones and Russell 2000 fell, while Nasdaq 100 and S&P 500 advanced. The 10-year and two-year Treasury notes yielded 4.24% and 4.17%, respectively.",0.130954,Neutral,0.075754,Neutral,0,broad,
QUBT,What's Going On With Quantum Computing Shares Monday? - Quantum Computing  ( NASDAQ:QUBT ) ,https://www.benzinga.com/trading-ideas/movers/24/12/42394470/whats-going-on-with-quantum-computing-shares-monday,20241209T163918,Benzinga,"Quantum Computing, Inc. QUBT shares are trading lower following new comments on the stock from Iceberg Research. The Details: In a report titled ""$QUBT is Already Running Behind with its New Chip Manufacturing Hype,"" Iceberg Research claims the company has ""chased every possible hype over the ...",0.055544,Neutral,0.605266,Somewhat-Bearish,0,focused,AI
QUBT,"Quantum Computing Stocks Roundup: D-Wave, Rigetti, IonQ Lead the Charge With Explosive Growth - NVIDIA  ( NASDAQ:NVDA ) , IonQ  ( NYSE:IONQ ) ",https://www.benzinga.com/trading-ideas/movers/24/12/42380768/quantum-computing-stocks-roundup-d-wave-rigetti-ionq-lead-the-charge-with-explosive-growth,20241208T193016,Benzinga,"Quantum computing stocks are experiencing a significant surge, driven by industry advancements, key partnerships, and growing investor enthusiasm. This emerging tech sector is gaining momentum, with vast potential in fields like drug discovery, cryptography, and artificial intelligence, ...",0.304665,Somewhat-Bullish,0.109705,Neutral,0,focused,"artificial intelligence, AI"
QUBT,"Leslie's Posts Weak Results, Joins Zoom Video And Other Big Stocks Moving Lower In Tuesday's Pre-Market Session - Alector  ( NASDAQ:ALEC ) , Agora  ( NASDAQ:API ) ",https://www.benzinga.com/24/11/42188477/leslies-posts-weak-results-joins-zoom-video-and-other-big-stocks-moving-lower-in-tuesdays-pre-market-session,20241126T131313,Benzinga,"U.S. stock futures were slightly higher this morning, with the Nasdaq futures gaining around 0.1% on Tuesday. Shares of Leslie's, Inc. LESL fell sharply in today's pre-market trading after the company reported worse-than-expected fourth-quarter adjusted EPS and sales.",0.044192,Neutral,0.236972,Neutral,0,focused,AI
QUBT,"Why Poseida Therapeutics Shares Are Trading Higher By 219%; Here Are 20 Stocks Moving Premarket - Alector  ( NASDAQ:ALEC ) , Channel Therapeutics  ( AMEX:CHRO ) ",https://www.benzinga.com/24/11/42183881/why-poseida-therapeutics-shares-are-trading-higher-by-219-here-are-20-stocks-moving-premarket,20241126T102458,Benzinga,"Shares of Poseida Therapeutics, Inc. PSTX rose sharply in today's pre-market trading after the company agreed to be acquired by Roche in a $1.5 billion deal. Poseida Therapeutics shares jumped 218.8% to $9.12 in the pre-market trading session. Here are some other stocks moving in pre-market ...",0.205807,Somewhat-Bullish,0.169081,Neutral,0,broad,
QUBT,"Gold Down Over 3%; Rigetti Computing Shares Spike Higher - BridgeBio Pharma  ( NASDAQ:BBIO ) , CareMax  ( NASDAQ:CMAX ) ",https://www.benzinga.com/markets/commodities/24/11/42172722/gold-down-over-3-rigetti-computing-shares-spike-higher,20241125T191859,Benzinga,"U.S. stocks traded higher toward the end of trading, with the Dow Jones index gaining more than 400 points on Monday. The Dow traded up 0.95% to 44,718.05 while the NASDAQ rose 0.25% to 19,050.84. The S&P 500 also rose, gaining, 0.29% to 5,986.39. Consumer discretionary shares jumped by 1.6% on ...",0.185251,Somewhat-Bullish,0.178459,Somewhat-Bullish,0,focused,AI
QUBT,"Crude Oil Down 3%; Chicago Fed National Activity Index Falls In October - BridgeBio Pharma  ( NASDAQ:BBIO ) , CareMax  ( NASDAQ:CMAX ) ",https://www.benzinga.com/24/11/42170458/crude-oil-down-2-chicago-fed-national-activity-index-falls-in-october,20241125T173538,Benzinga,"U.S. stocks traded mostly higher midway through trading, with the Dow Jones index gaining over 250 points on Monday. The Dow traded up 0.63% to 44,574.37 while the NASDAQ rose 0.08% to 19,018.98. The S&P 500 also rose, gaining, 0.12% to 5,976.72. Real estate shares jumped by 1.5% on Monday.",0.197372,Somewhat-Bullish,0.18967,Bullish,0,focused,AI
QUBT,"Quantum Industry Stocks Soar: What's Behind the D-Wave, Quantum Computing and IonQ Gains? - NVIDIA  ( NASDAQ:NVDA ) , IonQ  ( NYSE:IONQ ) ",https://www.benzinga.com/trading-ideas/movers/24/11/42169669/quantum-industry-stocks-soar-whats-behind-the-d-wave-quantum-computing-and-ionq-gains,20241125T170651,Benzinga,"D-Wave Quantum Inc. QBTS, Quantum Computing Inc. QUBT and IonQ, Inc. IONQ shares are soaring on Monday. Here's what you need to know. What To Know: Amazon Web Services announced the Quantum Embark Program, which builds on Amazon Bracket. The program consists of three service offerings.",0.221015,Somewhat-Bullish,0.255641,Somewhat-Bullish,0,focused,AI
QUBT,"BridgeBio Pharma, Rigetti Computing, Bath & Body Works And Other Big Stocks Moving Higher On Monday - Archer Aviation  ( NYSE:ACHR ) , BridgeBio Pharma  ( NASDAQ:BBIO ) ",https://www.benzinga.com/24/11/42166800/bridgebio-pharma-rigetti-computing-bath-body-works-and-other-big-stocks-moving-higher-on-monday,20241125T152128,Benzinga,"U.S. stocks were higher, with the Dow Jones index gaining more than 400 points on Monday. Shares of BridgeBio Pharma, Inc. BBIO rose sharply during Monday's session after the company announced that the FDA approved Attruby to treat adults with ATTR-CM.",0.327825,Somewhat-Bullish,0.181819,Neutral,0,focused,AI
QUBT,"Why Uxin Shares Are Trading Higher; Here Are 20 Stocks Moving Premarket - Akoustis Technologies  ( NASDAQ:AKTS ) , Allot  ( NASDAQ:ALLT ) ",https://www.benzinga.com/24/11/42158698/why-uxin-shares-are-trading-higher-here-are-20-stocks-moving-premarket,20241125T102733,Benzinga,"Shares of Uxin Limited UXIN rose sharply in today's pre-market trading after the company reported second-quarter financial results. Uxin posted quarterly sales of $70.85 million, up from $48.80 million in the year-ago period Uxin shares rose 3% to $6.50 in the pre-market trading session.",0.137941,Neutral,0.159043,Somewhat-Bullish,0,broad,
QUBT,"Nasdaq Edges Higher; Baidu Shares Fall After Q3 Results - Baidu  ( NASDAQ:BIDU ) , Cool Co  ( NYSE:CLCO ) ",https://www.benzinga.com/24/11/42121847/nasdaq-edges-higher-baidu-shares-fall-after-q3-results,20241121T193933,Benzinga,"U.S. stocks traded higher toward the end of trading, with the Dow Jones index gaining by more than 500 points on Thursday. The Dow traded up 1.24% to 43,945.57 while the NASDAQ rose 0.09% to 18,982.36. The S&P 500 also rose, gaining, 0.62% to 5,953.83.",0.154826,Somewhat-Bullish,0.151539,Neutral,0,focused,AI
QUBT,"Crude Oil Gains 1%; Deere Posts Better-Than-Expected Earnings - Deere  ( NYSE:DE ) , Cool Co  ( NYSE:CLCO ) ",https://www.benzinga.com/24/11/42119233/crude-oil-gains-15-deere-posts-better-than-expected-earnings,20241121T173222,Benzinga,"U.S. stocks traded mixed midway through trading, with the Dow Jones index gaining by more than 400 points on Thursday. The Dow traded up 1.03% to 43,855.97 while the NASDAQ fell 0.10% to 18,948.11. The S&P 500 also rose, gaining, 0.41% to 5,941.38. In trading on Thursday, communication services ...",0.125249,Neutral,0.156461,Neutral,0,focused,AI
QUBT,"BJ's Wholesale Club, Snowflake, Universal Technical Institute And Other Big Stocks Moving Higher On Thursday - BJ's Wholesale Club  ( NYSE:BJ ) , Amentum Holdings  ( NYSE:AMTM ) ",https://www.benzinga.com/24/11/42116355/bjs-wholesale-club-snowflake-universal-technical-institute-and-other-big-stocks-moving-higher-on-thursday,20241121T155423,Benzinga,"U.S. stocks were mixed, with the Nasdaq Composite falling more than 150 points on Thursday. Shares of BJ's Wholesale Club Holdings, Inc. BJ surged 7% to $91.65 after the company reported better-than-expected third-quarter adjusted EPS results and raised its FY24 adjusted EPS guidance above ...",0.437291,Bullish,0.223866,Somewhat-Bullish,0,focused,AI
QUBT,"Dow Jumps Over 100 Points; Nvidia Posts Upbeat Earnings - Kura Oncology  ( NASDAQ:KURA ) , Perspective Therapeutics  ( AMEX:CATX ) ",https://www.benzinga.com/24/11/42115220/dow-jumps-over-100-points-nvidia-posts-upbeat-earnings,20241121T151941,Benzinga,"U.S. stocks traded higher this morning, with the Dow Jones index gaining by more than 100 points on Thursday. The Dow traded up 0.30% to 43,539.98 while the NASDAQ rose 0.01% to 18,968.98. The S&P 500 also rose, gaining, 0.17% to 5,926.95. Industrials shares rose by 0.7% on Thursday.",0.145791,Neutral,0.141726,Neutral,0,focused,AI
QUBT,Quantum Computing Stock Is Soaring Again: What's Going On? - Quantum Computing  ( NASDAQ:QUBT ) ,https://www.benzinga.com/trading-ideas/movers/24/11/42094231/quantum-computing-stock-is-soaring-again-whats-going-on,20241120T164802,Benzinga,Quantum Computing Inc QUBT shares are trading higher Wednesday after the company announced it received another purchase order for its photonic chip foundry. What Happened: Quantum Computing ( QCi ) received its second purchase order for its thin film lithium niobate ( TFLN ) photonic chip foundry ...,0.302853,Somewhat-Bullish,0.380978,Bullish,0,focused,AI
QUBT,Why Symbotic Shares Are Trading Higher By Over 28%; Here Are 20 Stocks Moving Premarket - Symbotic  ( NASDAQ:SYM ) ,https://www.benzinga.com/24/11/42058176/why-symbotic-shares-are-trading-higher-by-over-28-here-are-20-stocks-moving-premarket,20241119T113044,Benzinga,"Shares of Symbotic Inc. SYM rose sharply in today's pre-market trading after the company reported better-than-expected fourth-quarter financial results. Symbotic reported quarterly earnings of five cents per share, which beat the analyst consensus estimate of three cents.",0.19937,Somewhat-Bullish,0.1331,Somewhat-Bullish,0,broad,
QUBT,Quantum Computing Dives After $40M Stock Offering - What's Going On? - Quantum Computing  ( NASDAQ:QUBT ) ,https://www.benzinga.com/news/offerings/24/11/42007920/quantum-computing-dives-after-40m-stock-offering-whats-going-on,20241115T133301,Benzinga,"Quantum Computing Inc. QUBT shares are declining premarket on Friday. Yesterday, the company disclosed a securities purchase agreement to sell 16 million shares of common stock at $2.50 per share in a registered direct offering. The company expects to generate gross proceeds of $40 million.",0.180241,Somewhat-Bullish,0.535653,Bullish,0,broad,
QUBT,"Applied Materials Reports Q1 Results, Joins Oklo, AST SpaceMobile And Other Big Stocks Moving Lower In Friday's Pre-Market Session - Applied Mat  ( NASDAQ:AMAT ) ",https://www.benzinga.com/24/11/42006745/applied-materials-reports-q1-results-joins-oklo-ast-spacemobile-and-other-big-stocks-moving-lower-in-fridays-pre-,20241115T130120,Benzinga,"U.S. stock futures were lower this morning, with the Dow futures falling more than 200 points on Friday. Shares of Applied Materials, Inc. AMAT fell sharply in today's pre-market trading following first-quarter results.",-0.167933,Somewhat-Bearish,0.282234,Neutral,0,broad,
QUBT,Why Domino's Pizza Shares Are Trading Higher By Around 8%; Here Are 20 Stocks Moving Premarket - Domino's Pizza  ( NYSE:DPZ ) ,https://www.benzinga.com/24/11/42002180/why-dominos-pizza-shares-are-trading-higher-by-around-8-here-are-20-stocks-moving-premarket,20241115T093505,Benzinga,"Shares of Domino's Pizza, Inc. DPZ rose sharply in today's pre-market trading after a 13F filing showed that Berkshire Hathaway added a new stake. Buffett bought 1,277,256 shares of Ann Arbor, Michigan-based pizza chain Domino's Pizza. Domino's Pizza shares jumped 7.8% to $470.00 in the ...",0.060789,Neutral,0.154455,Neutral,0,focused,AI
QUBT,Why DLocal Shares Are Trading Higher By Around 18%; Here Are 20 Stocks Moving Premarket - DLocal  ( NASDAQ:DLO ) ,https://www.benzinga.com/24/11/41965367/why-dlocal-shares-are-trading-higher-by-around-18-here-are-20-stocks-moving-premarket,20241114T101228,Benzinga,Shares of DLocal Limited DLO rose sharply in today's pre-market trading after the company reported better-than-expected third-quarter revenue results. DLocal reported quarterly earnings of 9 cents per share which missed the analyst consensus estimate of 11 cents per share.,0.11151,Neutral,0.165598,Neutral,0,broad,
QUBT,Quantum Computing Shares Are Up By More Than 70%: Here's What You Need To Know - Quantum Computing  ( NASDAQ:QUBT ) ,https://www.benzinga.com/trading-ideas/movers/24/11/41953419/quantum-computing-shares-are-up-by-more-than-70-heres-what-you-need-to-know,20241113T205408,Benzinga,"Quantum Computing Inc. QUBT shares are trading higher today. The company announced its first secured order for thin film lithium niobate ( TFLN ) photonic chip technology, marking a milestone for its foundry services. Here's what you need to know.",0.262368,Somewhat-Bullish,0.379051,Bullish,0,broad,
QUBT,Why VF Corp Shares Are Trading Higher By Around 21%; Here Are 20 Stocks Moving Premarket - VF  ( NYSE:VFC ) ,https://www.benzinga.com/news/24/10/41594283/why-vf-corp-shares-are-trading-higher-by-around-21-here-are-20-stocks-moving-premarket,20241029T101223,Benzinga,"Shares of V.F. Corporation VFC rose sharply in today's pre-market trading after the company reported better-than-expected second-quarter financial results. VF Corp, the parent company of Vans and The North Face, reported second-quarter revenue of $2.8 billion, beating the consensus estimate of ...",0.156681,Somewhat-Bullish,0.138863,Somewhat-Bullish,0,broad,
QUBT,All Nanotechnology News and Press Releases from PR Newswire,https://www.prnewswire.com/news-releases/business-technology-latest-news/nanotechnology-list/,20240504T142745,PR Newswire,"Nanotech industry-specific topics are featured, including, but not limited to: Science and technology, financial reporting, technological advancements, new products, and business trends across a wide scope of industries that utilize the latest advancements in nanotechnology.",0.224245,Somewhat-Bullish,0.230235,Bullish,0,broad,
QUBT,Quantum Computing Inc. Awarded Fourth Subcontract from NASA,https://www.prnewswire.com/news-releases/quantum-computing-inc-awarded-fourth-subcontract-from-nasa-302061809.html,20240214T130000,PR Newswire,"LEESBURG, Va., Feb. 14, 2024 /PRNewswire/ -- Quantum Computing Inc. ( QCi ) , ( Nasdaq: QUBT ) , an innovative quantum optics and nanophononics technology company, today announced that they have been awarded a fourth project from NASA. QCi, the only company worldwide that can utilize Entropy ...",0.340828,Somewhat-Bullish,0.291471,Somewhat-Bullish,0,broad,
QUBT,Quantum Computing Inc. Board of Directors Appoints Dr. William McGann as the Company's CEO and Co-Founder Robert Liscouski as Chairman of the Board,https://www.prnewswire.com/news-releases/quantum-computing-inc-board-of-directors-appoints-dr-william-mcgann-as-the-companys-ceo-and-co-founder-robert-liscouski-as-chairman-of-the-board-302049813.html,20240131T213000,PR Newswire,Quantum Computing Inc. Board of Directors Appoints Dr. William McGann as the Company's CEO and Co-Founder ... PR ...,0.328805,Somewhat-Bullish,0.188193,Somewhat-Bullish,0,focused,AI
QUBT,"Presenting on Emerging Growth Conference 66 Day 2 on January 11 Register to Stream - American Lithium  ( NASDAQ:AMLI ) , Anfield Energy  ( OTC:ANLDF ) ",https://www.benzinga.com/pressreleases/24/01/g36573019/presenting-on-emerging-growth-conference-66-day-2-on-january-11-register-to-stream,20240110T120000,Benzinga,"MIAMI, Jan. 10, 2024 ( GLOBE NEWSWIRE ) -- EmergingGrowth.com a leading independent small cap media portal announces the schedule of the 66th Emerging Growth Conference on January 10 & 11, 2024.",0.187367,Somewhat-Bullish,0.08687,Neutral,0,focused,ML
QUBT,"Quantum Computing Inc. to Present at the Emerging Growth Conference on January 11, 2024",https://www.prnewswire.com/news-releases/quantum-computing-inc-to-present-at-the-emerging-growth-conference-on-january-11-2024-302026971.html,20240105T130000,PR Newswire,"LEESBURG, Va., Jan. 5, 2024 /PRNewswire/ -- Quantum Computing Inc. ( ""QCi"", ""we"", ""our"" or the ""Company"" ) ( Nasdaq: QUBT ) , an innovative, quantum optics and nanophotonics technology company, invites individual and institutional investors as well as advisors and analysts, to attend its ...",0.224109,Somewhat-Bullish,0.230454,Somewhat-Bullish,0,broad,
