ticker,title,url,time_published,source,summary,sentiment_score,sentiment_label,ticker_sentiment_score,ticker_sentiment_label,relevance_score,category,ai_keywords_found
QUBT,Shkreli's Quantum Shorts Are 'Pretty F***kn Far From Okay' - Rigetti Computing  ( NASDAQ:RGTI ) ,https://www.benzinga.com/trading-ideas/movers/25/10/48212626/quantum-stock-rally-leaves-shkrelis-short-pretty-fn-far-from-okay,20251014T202723,Benzinga,"Martin Shkreli, known for his outspoken views in finance, has been shorting quantum computing stocks IonQ, Inc. ( NYSE:IONQ ) , D-Wave Quantum, Inc. ( NYSE:QBTS ) , Rigetti Computing, Inc. ( NASDAQ:RGTI ) , and Quantum Computing Inc. ( NASDAQ:QUBT ) , regularly mocking what he sees as ...",-0.238869,Somewhat-Bearish,0.1331,Neutral,0,broad,
QUBT,"Could Investing $10,000 in D-Wave Quantum Make You a Millionaire?",https://www.fool.com/investing/2025/10/14/could-investing-10000-in-d-wave-quantum-make-you-a/,20251014T084200,Motley Fool,The path to making a lot of money just might begin with investing in the hottest stock in the hottest tech space.,0.289613,Somewhat-Bullish,0.097259,Neutral,0,focused,AI
QUBT,Why Is Quantum Computing Inc. Stock Jumping Today?,https://www.fool.com/investing/2025/10/13/why-is-quantum-computing-inc-stock-jumping-today/,20251013T185633,Motley Fool,Quantum Computing Inc. stock is moving higher. Here's why.,0.01925,Neutral,0.532043,Somewhat-Bullish,0,broad,
QUBT,"Quantum Computing Stocks IonQ, Rigetti, and D-Wave Have Soared Up to 5,400% Over the Trailing Year -- but History Offers a Dire Warning",https://www.fool.com/investing/2025/10/10/quantum-computing-ionq-rgti-qbts-history-warning/,20251010T070600,Motley Fool,History has a flawless track record of foreshadowing trouble for next-big-thing technologies and innovations -- and quantum computing just made the list.,0.225307,Somewhat-Bullish,0.120632,Neutral,0,focused,AI
QUBT,"The Zacks Analyst Blog Highlights Rigetti Computing, D-Wave Quantum and Quantum Computing",https://www.zacks.com/stock/news/2765518/the-zacks-analyst-blog-highlights-rigetti-computing-d-wave-quantum-and-quantum-computing,20251009T133200,Zacks Commentary,"Rigetti Computing secures $5.7M in orders for its 9-qubit Novera systems, signaling momentum in commercial quantum hardware.",0.276678,Somewhat-Bullish,0.205807,Neutral,0,broad,
QUBT,The Meme ETF is back. Is it late to the party again?,https://www.cnbc.com/2025/10/08/the-meme-etf-is-back-is-it-late-to-the-party-again.html,20251008T190653,CNBC,"In its first go around, the ETF's launch coincided with the Nasdaq Composite's peak.",0.004784,Neutral,0.085629,Neutral,0,focused,AI
QUBT,Can RGTI's $5.7M Novera System Purchase Orders Signal Rising Demand?,https://www.zacks.com/stock/news/2764811/can-rgtis-57m-novera-system-purchase-orders-signal-rising-demand,20251008T165000,Zacks Commentary,"Rigetti secures $5.7M in orders for its 9-qubit Novera systems, signaling growing traction in commercial quantum hardware.",0.271838,Somewhat-Bullish,0.152499,Neutral,0,broad,
QUBT,Revenue Decline and Widening Losses Raise Concerns for QUBT,https://www.zacks.com/stock/news/2763382/revenue-decline-and-widening-losses-raise-concerns-for-qubt,20251007T122300,Zacks Commentary,"Quantum Computing's revenue plunge and widening losses highlight mounting financial strain, even as its photonic chip ambitions remain 12 to 18 months away from payoff.",-0.127201,Neutral,0.356609,Neutral,0,focused,AI
QUBT,Quantum Computing  ( QUBT )  Shares Are Sliding Today: Here's Why - Quantum Computing  ( NASDAQ:QUBT ) ,https://www.benzinga.com/trading-ideas/movers/25/10/48053260/quantum-computing-qubt-shares-are-sliding-today-heres-why,20251006T183838,Benzinga,Quantum Computing Inc ( NASDAQ:QUBT ) shares are trading lower on Monday after the company announced a $750 million oversubscribed private placement.,0.137207,Neutral,0.244109,Somewhat-Bullish,0,broad,
QUBT,"Nasdaq Jumps Over 150 Points; Skye Bioscience Shares Plunge - Critical Metals  ( NASDAQ:CRML ) , Advanced Micro Devices  ( NASDAQ:AMD ) ",https://www.benzinga.com/markets/market-summary/25/10/48050881/nasdaq-jumps-over-150-points-skye-bioscience-shares-plunge,20251006T170901,Benzinga,"U.S. stocks traded mixed midway through trading, with the Nasdaq Composite gaining more than 150 points on Monday. The Dow traded down 0.16% to 46,684.03 while the NASDAQ rose 0.71% to 22,941.69. The S&P 500 also rose, gaining, 0.40% to 6,742.80. Information technology shares jumped by 0.9% on ...",0.128427,Neutral,0.085324,Neutral,0,focused,"AI, ML"
QUBT,Why Quantum Computing Inc. Stock Was Sliding Today,https://www.fool.com/investing/2025/10/06/why-quantum-computing-inc-stock-was-sliding-today/,20251006T161108,Motley Fool,A stock sale turned off investors.,0.112182,Neutral,0.29234,Neutral,0,broad,
QUBT,"Why AMD Shares Are Trading Higher By Over 34%; Here Are 20 Stocks Moving Premarket - Arteris  ( NASDAQ:AIP ) , Advanced Micro Devices  ( NASDAQ:AMD ) ",https://www.benzinga.com/trading-ideas/movers/25/10/48040074/why-amd-shares-are-trading-higher-by-over-34-here-are-20-stocks-moving-premarket,20251006T130108,Benzinga,"Shares of Advanced Micro Devices, Inc. ( NASDAQ:AMD ) rose sharply in pre-market trading following a landmark agreement with OpenAI to deploy up to 6 gigawatts of AMD Instinct GPU power for the tech giant's next-generation AI infrastructure.",0.083151,Neutral,0.084722,Neutral,0,focused,AI
QUBT,"Quantum Computing, Mesoblast And Other Big Stocks Moving Lower In Monday's Pre-Market Session - Rich Sparkle Holdings  ( NASDAQ:ANPA ) , International Paper  ( NYSE:IP ) ",https://www.benzinga.com/trading-ideas/movers/25/10/48039034/quantum-computing-mesoblast-and-other-big-stocks-moving-lower-in-mondays-pre-market-session,20251006T120929,Benzinga,"U.S. stock futures were higher this morning, with the Dow futures gaining around 100 points on Monday. Shares of Quantum Computing Inc. ( NASDAQ:QUBT ) fell sharply in pre-market trading. Quantum Computing raised $750 million from institutional investors in market-priced private placement ...",-0.101375,Neutral,0.149656,Somewhat-Bearish,0,focused,AI
QUBT,What Does the Market Think About Quantum Computing Inc? - Quantum Computing  ( NASDAQ:QUBT ) ,https://www.benzinga.com/insights/short-sellers/25/10/48024581/what-does-the-market-think-about-quantum-computing-inc,20251003T180119,Benzinga,"Quantum Computing Inc's ( NYSE:QUBT ) short interest as a percent of float has risen 4.5% since its last report. According to exchange reported data, there are now 27.37 million shares sold short, which is 20.22% of all regular shares that are available for trading.",0.280582,Somewhat-Bullish,0.109455,Neutral,0,focused,AI
QUBT,This Is What Whales Are Betting On Quantum Computing - Quantum Computing  ( NASDAQ:QUBT ) ,https://www.benzinga.com/insights/options/25/10/48022877/this-is-what-whales-are-betting-on-quantum-computing,20251003T170110,Benzinga,"Investors with a lot of money to spend have taken a bullish stance on Quantum Computing ( NASDAQ:QUBT ) . We noticed this today when the trades showed up on publicly available options history that we track here at Benzinga. Whether these are institutions or just wealthy individuals, we don't ...",0.186606,Somewhat-Bullish,0.153961,Somewhat-Bullish,0,focused,AI
QUBT,Trending Quantum Stocks-Rigetti And D-Wave Are Popping - Rigetti Computing  ( NASDAQ:RGTI ) ,https://www.benzinga.com/trading-ideas/movers/25/10/48019438/trending-quantum-stocks-rigetti-and-d-wave-are-popping,20251003T151324,Benzinga,Quantum stocks were popping on Friday after trending across social media for most of the week. Here's a look at what's going on in the quantum computing sector. RGTI stock is climbing. See the real-time chart here.,0.235249,Somewhat-Bullish,0.095138,Somewhat-Bullish,0,broad,
QUBT,Was Quantum Computing Stock's News Good or Bad?,https://www.fool.com/investing/2025/10/03/was-quantum-computing-stocks-news-good-or-bad/,20251003T144011,Motley Fool,Are the same people who bought Quantum Computing stock last week selling it this week?,0.062163,Neutral,0.246582,Neutral,0,broad,
QUBT,Where Will Quantum Computing Inc. Be in 1 Year?,https://www.fool.com/investing/2025/10/02/where-will-quantum-computing-inc-be-in-1-year/,20251002T192900,Motley Fool,Hope and hype could last longer than you think with this popular quantum computing play.,0.103541,Neutral,0.268589,Somewhat-Bullish,0,broad,
QUBT,Will Rigetti's $5.8M AFRL Deal With QphoX Advance Quantum Networking?,https://www.zacks.com/stock/news/2760737/will-rigettis-58m-afrl-deal-with-qphox-advance-quantum-networking,20251002T134000,Zacks Commentary,RGTI secures a $5.8M AFRL contract with QphoX to tackle quantum networking bottlenecks and advance superconducting scalability.,0.319196,Somewhat-Bullish,0.337197,Somewhat-Bullish,0,broad,
QUBT,How Quantum Computing Is Positioned to Drive Long-Term Growth,https://www.zacks.com/stock/news/2759558/how-quantum-computing-is-positioned-to-drive-long-term-growth,20250930T134000,Zacks Commentary,"QUBT expands government ties, ships new products, and scales its Tempe chip foundry to drive growth.",0.29844,Somewhat-Bullish,0.291471,Somewhat-Bullish,0,broad,
QUBT,"Quantum Stock News: Rigetti, D-Wave, IonQ, Quantum Computing - D-Wave Quantum  ( NYSE:QBTS ) ",https://www.benzinga.com/trading-ideas/movers/25/09/47898286/quantum-stock-tracker-rigetti-d-wave-climb-on-bullish-coverage,20250926T182550,Benzinga,Some quantum stocks pulled back from all-time highs this week as investors rotated out of speculative names and into more defensive positions. Other quantum names maintained the upward momentum as the sector remained in the spotlight. QBTS stock is climbing. See the real-time chart here.,0.282497,Somewhat-Bullish,0.2306,Neutral,0,focused,AI
QUBT,"Why Quantum Computing Stock Popped, Then Dropped",https://www.fool.com/investing/2025/09/26/why-quantum-computing-stock-popped-then-dropped/,20250926T155043,Motley Fool,Quantum Computing stock has the money it needs to keep burning cash for years -- and it will.,0.300805,Somewhat-Bullish,0.252987,Bullish,0,broad,
QUBT,"Crinetics Pharmaceuticals, BlackBerry, Perpetua Resources And Other Big Stocks Moving Higher On Friday - Robo.ai  ( NASDAQ:AIIO ) , Aquestive Therapeutics  ( NASDAQ:AQST ) ",https://www.benzinga.com/trading-ideas/movers/25/09/47890720/crinetics-pharmaceuticals-blackberry-perpetua-resources-and-other-big-stocks-moving-higher-o,20250926T142315,Benzinga,"U.S. stocks were higher, with the Dow Jones index gaining more than 200 points on Friday. Shares of Crinetics Pharmaceuticals, Inc. ( NASDAQ: CRNX ) rose sharply during Friday's session after the FDA approved PALSONIFY. Also, Baird and JMP Securities raised their respective price targets on ...",0.304205,Somewhat-Bullish,0.245339,Neutral,0,focused,AI
QUBT,Could This Small-Cap Artificial Intelligence  ( AI )  Stock Become the Next Nvidia?,https://www.fool.com/investing/2025/09/25/could-this-small-cap-ai-stock-become-next-nvidia/,20250925T104500,Motley Fool,Nvidia has become one of the best-known businesses in the world thanks to the artificial intelligence revolution.,0.293884,Somewhat-Bullish,0.3527,Somewhat-Bullish,0,focused,"artificial intelligence, AI"
QUBT,IONQ or QUBT: Which Quantum Stock Is the Better Investment in 2025?,https://www.zacks.com/stock/news/2756652/ionq-or-qubt-which-quantum-stock-is-the-better-investment-in-2025,20250924T190000,Zacks Commentary,"IonQ's acquisitions, partnerships and space-based quantum networking give it an edge over QUBT's chip-driven momentum.",0.318383,Somewhat-Bullish,0.374,Somewhat-Bullish,0,broad,
QUBT,Powell Said Stocks 'Highly Valued' - Remember After 'Irrational Exuberance' Stock Bubble Inflated More Before Crash - Apple  ( NASDAQ:AAPL ) ,https://www.benzinga.com/Opinion/25/09/47844936/powell-said-stocks-highly-valued-remember-after-irrational-exuberance-stock-bubble-inflated-more-before-c,20250924T152459,Benzinga,"To gain an edge, this is what you need to know today. Please click here for an enlarged chart of Micron Technology Inc MU. This article is about the big picture, not an individual stock. The chart of MU stock is being used to illustrate the point.",0.207283,Somewhat-Bullish,0.063678,Somewhat-Bullish,0,focused,AI
QUBT,"Micron To Test AI Rally After Nvidia-Open AI Deal Drove AI Trade Higher, Quantum Breakthrough, China Gold Move",https://www.benzinga.com/news/25/09/47822238/micron-to-test-ai-rally-after-nvidia-open-ai-deal-drove-ai-trade-higher-quantum-breakthrough-china-gold-move,20250923T152528,Benzinga,"To gain an edge, this is what you need to know today. Please click here for an enlarged chart of Micron Technology Inc MU. This article is about the big picture, not an individual stock. The chart of MU stock is being used to illustrate the point. The trendline on the chart shows MU stock has ...",0.195527,Somewhat-Bullish,0.066047,Neutral,0,focused,AI
QUBT,"Johnson Fistel, PLLP Continues Investigation on Behalf of Quantum Computing Inc.  ( QUBT ) , Acadia Healthcare Company, Inc.  ( ACHC ) , Treace Medical Concepts, Inc.  ( TMCI ) , and BigBear.ai Holdings, Inc.  ( BBAI )  Long-Term Shareholders - Acadia Healthcare Co  ( NASDAQ:ACHC ) , BigBear.ai Hldgs  ( NYSE:BBAI ) ",https://www.benzinga.com/pressreleases/25/09/g47799718/johnson-fistel-pllp-continues-investigation-on-behalf-of-quantum-computing-inc-qubt-acadia-healthc,20250922T172259,Benzinga,"SAN DIEGO, Sept. 22, 2025 ( GLOBE NEWSWIRE ) -- Johnson Fistel, PLLP is investigating potential violations of federal and state securities laws by certain officers and directors of Quantum Computing Inc. QUBT, Acadia Healthcare Company, Inc. ACHC, Treace Medical Concepts, Inc.",-0.07327,Neutral,0.265584,Somewhat-Bullish,0,focused,AI
QUBT,Why Quantum Computing Inc. Stock Was Sliding Double Digits Today,https://www.fool.com/investing/2025/09/22/why-quantum-computing-inc-stock-was-sliding-double/,20250922T162444,Motley Fool,Investors balked at a follow-on offering in the hot quantum stock.,0.257262,Somewhat-Bullish,0.29234,Somewhat-Bullish,0,broad,
QUBT,Why Quantum Computing  ( QUBT )  Stock Is Falling Sharply Monday - Quantum Computing  ( NASDAQ:QUBT ) ,https://www.benzinga.com/trading-ideas/movers/25/09/47795045/why-quantum-computing-qubt-stock-is-falling-sharply-monday,20250922T161936,Benzinga,Shares of Quantum Computing Inc QUBT are trading sharply lower Monday morning after the company's announcement of a $500 million oversubscribed private placement of common stock.,0.169049,Somewhat-Bullish,0.262994,Neutral,0,broad,
QUBT,"Gold Gains Over 1%; Quantum Computing Shares Plunge - AgriFORCE Growing Systems  ( NASDAQ:AGRI ) , Chijet Motor Co  ( NASDAQ:CJET ) ",https://www.benzinga.com/markets/market-summary/25/09/47793862/gold-gains-over-1-quantum-computing-shares-plunge,20250922T160602,Benzinga,"U.S. stocks traded mostly higher midway through trading, with the Nasdaq Composite gaining over 50 points on Monday. The Dow traded up 0.01% to 46,321.12 while the NASDAQ rose 0.24% to 22,685.77. The S&P 500 also rose, gaining, 0.15% to 6,674.60. Information technology shares jumped by 0.4% on ...",0.081304,Neutral,0.201523,Neutral,0,focused,AI
QUBT,Quantum Stocks On Fire Ahead Of Trump's Next Tech Order - Quantum Computing  ( NASDAQ:QUBT ) ,https://www.benzinga.com/trading-ideas/movers/25/09/47788546/trumps-next-tech-order-could-set-quantum-stocks-on-fire,20250922T135909,Benzinga,"Quantum computing stocks have boomed in 2025, and a new catalyst is adding fuel to the fire: The Trump administration is looking to bolster the industry in the name of national security. QUBT stock is pulling back. See the real-time price action here.",0.286813,Somewhat-Bullish,0.470894,Somewhat-Bullish,0,broad,
QUBT,QUBT Prepares for Aggressive Growth With Robust Capital Position,https://www.zacks.com/stock/news/2754736/qubt-prepares-for-aggressive-growth-with-robust-capital-position,20250922T133200,Zacks Commentary,"Quantum Computing ends Q2 with $349M cash, trims liabilities, and eyes growth with hiring, foundry scaling, and quantum commercialization.",0.301364,Somewhat-Bullish,0.432291,Neutral,0,broad,
QUBT,"American Battery Technology, Quantum Computing, CEA Industries And Other Big Stocks Moving Lower In Monday's Pre-Market Session - Amer Sports  ( NYSE:AS ) , American Battery Tech  ( NASDAQ:ABAT ) ",https://www.benzinga.com/trading-ideas/movers/25/09/47785756/american-battery-technology-quantum-computing-cea-industries-and-other-big-stocks-moving-low,20250922T121804,Benzinga,"U.S. stock futures were lower this morning, with the Dow futures falling more than 100 points on Monday. Shares of American Battery Technology Company ABAT fell sharply in pre-market trading. American Battery Technology filed for mixed shelf offering of up to $250 million.",0.004952,Neutral,0.271274,Neutral,0,broad,
QUBT,"Quantum Computing Stock  ( QUBT )  Declines Over 12% In Monday Pre-Market: What's Going On? - D-Wave Quantum  ( NYSE:QBTS ) , IonQ  ( NYSE:IONQ ) ",https://www.benzinga.com/markets/tech/25/09/47785147/quantum-computing-stock-qubt-declines-over-12-in-monday-pre-market-whats-going-on,20250922T115139,Benzinga,"Shares of Quantum Computing Inc. QUBT fell 12.25% following the company's completion of an oversubscribed private placement, raising a substantial $500 million. QUBT has entered into securities purchase agreements with institutional investors.",0.216239,Somewhat-Bullish,0.465901,Somewhat-Bullish,0,focused,AI
QUBT,Better Quantum Computing Stock: D-Wave Quantum  ( QBTS )  vs. Quantum Computing  ( QUBT ) ,https://www.fool.com/investing/2025/09/20/better-quantum-computing-stocks-qubt-and-qbts/,20250920T131500,Motley Fool,"Quantum investing is heating up, but not all quantum computing stocks are created equal.",0.164782,Somewhat-Bullish,0.12013,Somewhat-Bullish,0,broad,
QUBT,Why Quantum Computing Stock Keeps Going Up,https://www.fool.com/investing/2025/09/19/why-quantum-computing-stock-keeps-going-up/,20250919T144825,Motley Fool,Momentum traders love Quantum Computing stock. Should you?,0.218876,Somewhat-Bullish,0.279015,Somewhat-Bullish,0,broad,
QUBT,"CoreWeave, Barrick Mining, FedEx And Other Big Stocks Moving Higher On Friday - Barrick Mining  ( NYSE:B ) , Aquestive Therapeutics  ( NASDAQ:AQST ) ",https://www.benzinga.com/trading-ideas/movers/25/09/47763389/coreweave-barrick-mining-fedex-and-other-big-stocks-moving-higher-on-friday,20250919T143128,Benzinga,"U.S. stocks were higher, with the Nasdaq Composite gaining more than 100 points on Friday. Shares of CoreWeave, Inc. CRWV rose sharply during Friday's session after Loop Capital initiated coverage with a Buy rating and announced a $165 price target. CoreWeave shares jumped 4.8% to $127.15 on ...",0.262896,Somewhat-Bullish,0.239305,Bullish,0,focused,AI
QUBT,Can Quantum Computing's Government Contracts Boost Future Growth?,https://www.zacks.com/stock/news/2753850/can-quantum-computings-government-contracts-boost-future-growth,20250919T120900,Zacks Commentary,"QUBT secures NASA and NIST contracts, strengthening its role in quantum tech for government missions.",0.275289,Somewhat-Bullish,0.343755,Bullish,0,broad,
QUBT,Check Out What Whales Are Doing With QUBT - Quantum Computing  ( NASDAQ:QUBT ) ,https://www.benzinga.com/insights/options/25/09/47750702/check-out-what-whales-are-doing-with-qubt,20250918T200136,Benzinga,"Investors with a lot of money to spend have taken a bullish stance on Quantum Computing QUBT. We noticed this today when the trades showed up on publicly available options history that we track here at Benzinga. Whether these are institutions or just wealthy individuals, we don't know.",0.173539,Somewhat-Bullish,0.232069,Somewhat-Bullish,0,focused,AI
QUBT,"Quantum Stocks Boom As IonQ, Rigetti Join Government Initiatives - IonQ  ( NYSE:IONQ ) ",https://www.benzinga.com/trading-ideas/movers/25/09/47742879/quantum-stocks-boom-as-ionq-rigetti-join-government-initiatives,20250918T151318,Benzinga,"Quantum stocks are booming, driven by acquisitions, government contracts and investor optimism. IonQ, Rigetti and D-Wave Quantum stocks are all trading at all-time highs. See the trading strategy with a perfect track record in 2025 [currently 35-0] →",0.29524,Somewhat-Bullish,0.196344,Bullish,0,broad,
QUBT,Will Rigetti's C-DAC Partnership Translate Into New Revenue Streams?,https://www.zacks.com/stock/news/2752841/will-rigettis-c-dac-partnership-translate-into-new-revenue-streams,20250917T143900,Zacks Commentary,"RGTI's pact with India's C-DAC aims to advance hybrid quantum systems, expand partnerships and fuel its 2025 commercialization push.",0.169277,Somewhat-Bullish,0.145145,Neutral,0,focused,AI
QUBT,QUBT Gains Commercial Traction With Quantum AI and Cybersecurity Deals  ( Revised ) ,https://www.zacks.com/stock/news/2752101/qubt-gains-commercial-traction-with-quantum-ai-and-cybersecurity-deals-revised,20250916T134800,Zacks Commentary,"Quantum Computing secures traction with an EmuCore sale to a global automaker and a $332,000 U.S. bank order for quantum cybersecurity.",0.214119,Somewhat-Bullish,0.426225,Bullish,0,focused,AI
QUBT,"Quantum Stock Tracker: IonQ Price Targets, Rigetti Climbs - IonQ  ( NYSE:IONQ ) ",https://www.benzinga.com/markets/tech/25/09/47678234/quantum-stock-tracker-ionqs-higher-price-targets-rigetti-climbs-30-nvidias-new-quantum-investments,20250915T193249,Benzinga,"Multiple analysts raised price targets on IonQ stock on Monday. IonQ shares are up more than 45% over the past five days. Up Next: Wall Street trader's 34-0 strategy goes public this week. See it first → Quantum stocks have been on a tear over the past week, moving higher on news and momentum.",0.173534,Somewhat-Bullish,0.18602,Bullish,0,focused,AI
QUBT,QUBT Lags Peers Over Three Months: Are Widening Losses a Sell Signal?,https://www.zacks.com/stock/news/2751069/qubt-lags-peers-over-three-months-are-widening-losses-a-sell-signal,20250912T190000,Zacks Commentary,"QUBT trails rivals as revenues shrink and losses widen, raising questions about near-term momentum despite long-term Quantum growth plans.",0.126724,Neutral,0.44021,Somewhat-Bullish,0,focused,AI
QUBT,"IBEX, Tesla, IonQ, Warner Bros. Discovery And Other Big Stocks Moving Higher On Friday - Figure Technology  ( NASDAQ:FIGR ) , Six Flags Entertainment  ( NYSE:FUN ) ",https://www.benzinga.com/trading-ideas/movers/25/09/47643979/ibex-tesla-ionq-warner-bros-discovery-and-other-big-stocks-moving-higher-on-friday,20250912T142409,Benzinga,"U.S. stocks were mixed, with the Dow Jones index falling more than 100 points on Friday. Shares of IBEX Limited IBEX rose sharply during Friday's session after the company reported better-than-expected fourth-quarter financial results and issued FY26 sales guidance above estimates.",0.288198,Somewhat-Bullish,0.208464,Bullish,0,focused,AI
QUBT,RGTI Strengthens Global Ties in Quantum Push: Time to Buy or Hold?,https://www.zacks.com/stock/news/2750825/rgti-strengthens-global-ties-in-quantum-push-time-to-buy-or-hold,20250912T140500,Zacks Commentary,"Rigetti is expanding global collaborations and advancing hybrid quantum systems, but investors must weigh growth potential against ongoing risks.",0.289883,Somewhat-Bullish,0.128592,Neutral,0,focused,AI
QUBT,"Johnson Fistel, PLLP Continues Investigation on Behalf of Quantum Computing Inc.  ( QUBT ) , Acadia Healthcare Company, Inc.  ( ACHC ) , Treace Medical Concepts, Inc.  ( TMCI ) , and BigBear.ai Holdings, Inc.  ( BBAI )  Long-Term Shareholders - Acadia Healthcare Co  ( NASDAQ:ACHC ) , BigBear.ai Hldgs  ( NYSE:BBAI ) ",https://www.benzinga.com/pressreleases/25/09/g47640338/johnson-fistel-pllp-continues-investigation-on-behalf-of-quantum-computing-inc-qubt-acadia-healthc,20250912T121029,Benzinga,"SAN DIEGO, Sept. 12, 2025 ( GLOBE NEWSWIRE ) -- Johnson Fistel, PLLP is investigating potential violations of federal and state securities laws by certain officers and directors of Quantum Computing Inc. QUBT, Acadia Healthcare Company, Inc. ACHC, Treace Medical Concepts, Inc.",-0.068424,Neutral,0.262724,Somewhat-Bullish,0,focused,AI
QUBT,This Artificial Intelligence  ( AI )  Stock Has a First-Mover Advantage in Quantum Integration,https://www.fool.com/investing/2025/09/11/artificial-intelligence-ai-stock-mover-quantum/,20250911T094800,Motley Fool,IonQ is an emerging quantum computing developer that integrates with all three major cloud hyperscalers.,0.124838,Neutral,0.05257,Neutral,0,focused,"artificial intelligence, AI"
QUBT,QUBT Gains Commercial Traction With Quantum AI and Cybersecurity Deals,https://www.zacks.com/stock/news/2749282/qubt-gains-commercial-traction-with-quantum-ai-and-cybersecurity-deals,20250910T133700,Zacks Commentary,Quantum Computing secures traction with an EmuCore sale to a global automaker and a $332M U.S. bank order for quantum cybersecurity.,0.224526,Somewhat-Bullish,0.43852,Bullish,0,focused,AI
QUBT,"Quantum Stock Tracker: Nvidia Jumps In, IonQ And D-Wave Execs - D-Wave Quantum  ( NYSE:QBTS ) ",https://www.benzinga.com/markets/tech/25/09/47581553/quantum-stock-tracker-nvidia-backs-quantinuum-d-wave-ionq-announce-new-execs,20250909T194259,Benzinga,"Nvidia invests in Quantinuum, a quantum computing company majority-owned by Honeywell. Nvidia is also involved in developing hybrid quantum-classical computing solutions with partners like Quantum Machines. Get the strategy to turn September's volatility into 10x trades →",0.220435,Somewhat-Bullish,0.138066,Somewhat-Bullish,0,broad,
QUBT,Is Quantum Computing Inc.  ( QUBT )  Stock a Buy?,https://www.fool.com/investing/2025/09/06/is-quantum-computing-inc-qubt-stock-a-buy/,20250906T133000,Motley Fool,This quantum computing stock has taken its investors on a wild ride.,-0.033431,Neutral,0.102013,Neutral,0,broad,
