ticker,title,url,time_published,source,summary,sentiment_score,sentiment_label,ticker_sentiment_score,ticker_sentiment_label,relevance_score,category,ai_keywords_found
STX,"STX Investor Notice: ROSEN, National Trial Lawyers, Encourages Seagate Technology Holdings plc Investors with Losses to Secure Counsel Before Important Deadline in Securities Class Action - STX",https://markets.businessinsider.com/news/stocks/stx-investor-notice-rosen-national-trial-lawyers-encourages-seagate-technology-holdings-plc-investors-with-losses-to-secure-counsel-before-important-deadline-in-securities-class-action-stx-1032448736,20230715T221600,Business Insider,"STX Investor Notice: ROSEN, National Trial Lawyers, Encourages Seagate Technology Holdings plc Investors with Losses to Secure Counsel Before Important Deadline in Securities Class Action ...",0.081712,Neutral,0.123526,Neutral,0,broad,
STX,STX INVESTOR ALERT: Robbins Geller Rudman & Dowd LLP Files Class Action Lawsuit Against Seagate Technology Holding plc and Announces Opportunity for Investors with Substantial Losses to Lead Case,https://www.prnewswire.com/news-releases/stx-investor-alert-robbins-geller-rudman--dowd-llp-files-class-action-lawsuit-against-seagate-technology-holding-plc-and-announces-opportunity-for-investors-with-substantial-losses-to-lead-case-301877920.html,20230715T172500,PR Newswire,STX INVESTOR ALERT: Robbins Geller Rudman & Dowd LLP Files Class Action Lawsuit Against Seagate Technology ... PR ...,0.036472,Neutral,0.124593,Neutral,0,focused,AI
STX,"STX CLASS ACTION ANNOUNCEMENT: Kessler Topaz Meltzer & Check, LLP Announces Securities Class Action Lawsuit Filed Against Seagate Technology Holdings plc  ( STX ) ",https://www.prnewswire.com/news-releases/stx-class-action-announcement-kessler-topaz-meltzer--check-llp-announces-securities-class-action-lawsuit-filed-against-seagate-technology-holdings-plc-stx-301877905.html,20230715T172000,PR Newswire,"STX CLASS ACTION ANNOUNCEMENT: Kessler Topaz Meltzer & Check, LLP Announces Securities Class Action ... PR ...",0.065884,Neutral,0.227007,Neutral,0,focused,AI
STX,"SEAGATE DEADLINE ALERT: Securities Litigation Partner James  ( Josh )  Wilson Encourages Investors Who Suffered Losses Exceeding $100,000 In Seagate To Contact Him Directly To Discuss Their Options",https://www.prnewswire.com/news-releases/seagate-deadline-alert-securities-litigation-partner-james-josh-wilson-encourages-investors-who-suffered-losses-exceeding-100-000-in-seagate-to-contact-him-directly-to-discuss-their-options-301877771.html,20230715T150000,PR Newswire,SEAGATE DEADLINE ALERT: Securities Litigation Partner James ( Josh ) Wilson Encourages Investors Who Suffered ... PR ...,0.095895,Neutral,0.161349,Neutral,0,broad,
STX,"DEADLINE ALERT for IBRX, BTAI, and STX: The Law Offices of Frank R. Cruz Reminds Investors of Class Actions on Behalf of Shareholders - BioXcel Therapeutics  ( NASDAQ:BTAI ) , ImmunityBio  ( NASDAQ:IBRX ) ",https://www.benzinga.com/pressreleases/23/07/g33238749/deadline-alert-for-ibrx-btai-and-stx-the-law-offices-of-frank-r-cruz-reminds-investors-of-class-ac,20230715T030600,Benzinga,"LOS ANGELES, July 14, 2023 ( GLOBE NEWSWIRE ) -- The Law Offices of Frank R. Cruz reminds investors that class action lawsuits have been filed on behalf of shareholders of the following publicly-traded companies. Investors have until the deadlines listed below to file a lead plaintiff motion.",-0.092162,Neutral,0.080458,Neutral,0,focused,AI
STX,"Solid State Drive  ( SSD )  Market to Grow by 23.87% from 2022 to 2027 | ADATA Technology Co. Ltd., Corsair Gaming Inc., DataDirect Networks Inc., and more to emerge as key players- Technavio",https://www.prnewswire.com/news-releases/solid-state-drive-ssd-market-to-grow-by-23-87-from-2022-to-2027--adata-technology-co-ltd-corsair-gaming-inc-datadirect-networks-inc-and-more-to-emerge-as-key-players--technavio-301876866.html,20230714T070000,PR Newswire,"Solid State Drive ( SSD ) Market to Grow by 23.87% from 2022 to 2027 | ADATA Technology Co. Ltd., Corsair Gaming ... PR ...",0.196359,Somewhat-Bullish,0.077845,Neutral,0,focused,AI
STX,Seagate Technology Holdings PLC  ( STX )  Investor Alert: Robbins LLP Informs Investors of Class Action Against Seagate Technology Holdings PLC - Seagate Tech Hldgs  ( NASDAQ:STX ) ,https://www.benzinga.com/pressreleases/23/07/g33224210/seagate-technology-holdings-plc-stx-investor-alert-robbins-llp-informs-investors-of-class-action-a,20230713T214522,Benzinga,"SAN DIEGO, July 13, 2023 ( GLOBE NEWSWIRE ) -- Robbins LLP reminds investors that a shareholder filed a class action on behalf of all persons and entities that purchased or otherwise acquired Seagate Technology Holdings PLC STX securities between September 15, 2020 and October 25, 2022.",-0.071849,Neutral,0.45825,Somewhat-Bullish,0,focused,AI
STX,"Seagate Technology Holdings plc: Please contact the Portnoy Law Firm to recover your losses; September 8, 2023 deadline - Seagate Tech Hldgs  ( NASDAQ:STX ) ",https://www.benzinga.com/pressreleases/23/07/g33221461/seagate-technology-holdings-plc-please-contact-the-portnoy-law-firm-to-recover-your-losses-septemb,20230713T185101,Benzinga,Investors can contact the law firm at no cost to learn more about recovering their losses,-0.134027,Neutral,0.197413,Neutral,0,broad,
STX,"Kessler Topaz Meltzer & Check, LLP Announces a Securities Fraud Class Action Filed Against Seagate Technology Holdings plc - Seagate Tech Hldgs  ( NASDAQ:STX ) ",https://www.benzinga.com/pressreleases/23/07/g33220336/kessler-topaz-meltzer-check-llp-announces-a-securities-fraud-class-action-filed-against-seagate-te,20230713T172220,Benzinga,"RADNOR, Pa., July 13, 2023 ( GLOBE NEWSWIRE ) -- The law firm of Kessler Topaz Meltzer & Check, LLP ( www.ktmc.com ) informs investors that a securities class action lawsuit has been filed in the United States District Court for the Northern District of California against Seagate Technology ...",0.058321,Neutral,0.213517,Neutral,0,focused,AI
STX,STX INVESTOR NOTICE: Robbins Geller Rudman & Dowd LLP Files Class Action Lawsuit Against Seagate Technology Holdings plc and Announces Opportunity for Investors with Substantial Losses to Lead Case - Seagate Tech Hldgs  ( NASDAQ:STX ) ,https://www.benzinga.com/pressreleases/23/07/g33192436/stx-investor-notice-robbins-geller-rudman-dowd-llp-files-class-action-lawsuit-against-seagate-tech,20230712T010800,Benzinga,"SAN DIEGO, July 11, 2023 ( GLOBE NEWSWIRE ) -- The law firm of Robbins Geller Rudman & Dowd LLP announced that it has filed a class action lawsuit seeking to represent purchasers of Seagate Technology Holdings plc STX common stock between September 15, 2020 and October 25, 2022, inclusive ( the ...",0.019347,Neutral,0.121856,Neutral,0,focused,AI
STX,"HAGENS BERMAN, NATIONAL TRIAL ATTORNEYS, Encourages Seagate Technology  ( STX )  Investors with Substantial Losses to Contact Firm, Securities Fraud Class Action Filed - Seagate Tech Hldgs  ( NASDAQ:STX ) ",https://www.benzinga.com/pressreleases/23/07/g33191828/hagens-berman-national-trial-attorneys-encourages-seagate-technology-stx-investors-with-substantia,20230711T222524,Benzinga,"SAN FRANCISCO, July 11, 2023 ( GLOBE NEWSWIRE ) -- Hagens Berman urges Seagate Technology Holdings plc STX investors who suffered substantial losses to submit your losses now.",-0.036693,Neutral,0.218817,Somewhat-Bearish,0,broad,
STX,Seagate Technology  ( STX )  Faces Shareholder Class Action Lawsuit: Johnson Fistel Encourages Investors to Seek Compensation for Alleged Wrongdoings - Seagate Tech Hldgs  ( NASDAQ:STX ) ,https://www.benzinga.com/pressreleases/23/07/g33189524/seagate-technology-stx-faces-shareholder-class-action-lawsuit-johnson-fistel-encourages-investors-,20230711T174710,Benzinga,"SAN DIEGO, July 11, 2023 ( GLOBE NEWSWIRE ) -- Johnson Fistel, LLP, a shareholder rights law firm, announces that a class action lawsuit has been filed on behalf of Seagate Technology Holdings plc STX investors who acquired common stock between September 15, 2020 and October 25, 2022, inclusive ...",-0.055292,Neutral,0.220809,Neutral,0,broad,
STX,Seagate Technology  ( NASDAQ:STX )  Rating Increased to Hold at StockNews.com,https://www.defenseworld.net/2023/06/29/seagate-technology-nasdaqstx-rating-increased-to-hold-at-stocknews-com.html,20230629T052044,Stocknews.com,Seagate Technology ( NASDAQ:STX ) Rating Increased to Hold at ... Defense World ...,0.173912,Somewhat-Bullish,0.87047,Somewhat-Bullish,0,broad,
STX,"Wall Street's Most Accurate Analysts Say Hold These 3 Tech Stocks With Over 4% Dividend Yields - IBM  ( NYSE:IBM ) , Telefonaktiebolaget L M  ( NASDAQ:ERIC ) ",https://www.benzinga.com/news/23/06/33041852/wall-streets-most-accurate-analysts-say-hold-these-3-tech-stocks-with-over-4-dividend-yields,20230628T130612,Benzinga,"During times of turbulence and uncertainty in the markets, many investors turn to dividend-yielding stocks. These are often companies that have high free cash flows and reward shareholders with a high dividend payout.",0.072498,Neutral,0.114682,Neutral,0,focused,AI
STX,"Bragar Eagel & Squire, P.C. Is Investigating Waldencast, Seagate, Chegg, and Relmada and Encourages Investors to Contact the Firm - Relmada Therapeutics  ( NASDAQ:RLMD ) , Chegg  ( NYSE:CHGG ) ",https://www.benzinga.com/pressreleases/23/06/g32915607/bragar-eagel-squire-p-c-is-investigating-waldencast-seagate-chegg-and-relmada-and-encourages-inves,20230620T010000,Benzinga,"NEW YORK, June 19, 2023 ( GLOBE NEWSWIRE ) -- Bragar Eagel & Squire, P.C., a nationally recognized shareholder rights law firm, is investigating potential claims against Waldencast Plc WALD, Seagate Technology Holdings Plc STX, Chegg, Inc. CHGG, and Relmada Therapeutics, Inc.",-0.069299,Neutral,0.16317,Neutral,0,focused,AI
STX,Seagate Technology  ( NASDAQ:STX )  Stock Rating Upgraded by StockNews.com,https://www.defenseworld.net/2023/06/16/seagate-technology-nasdaqstx-stock-rating-upgraded-by-stocknews-com.html,20230616T052246,Stocknews.com,Seagate Technology ( NASDAQ:STX ) Stock Rating Upgraded by ... Defense World ...,0.30069,Somewhat-Bullish,0.849961,Bullish,0,broad,
STX,Hard Disk Market Worth US$ 80.6 Billion by 2030 at a CAGR of 5.60%: Market Research Report by MRFR,https://www.benzinga.com/pressreleases/23/06/g32871518/hard-disk-market-worth-us-80-6-billion-by-2030-at-a-cagr-of-5-60-market-research-report-by-mrfr,20230615T120351,Benzinga,"New York, USA, June 15, 2023 ( GLOBE NEWSWIRE ) -- According to the Research Report published by Market Research Future ( MRFR ) , ""Hard Disk Market Information by Type, Application, End-User, and Region - Forecast till 2030"", the Hard Disk Market could thrive at a rate of 5.60% between 2022 and ...",0.157361,Somewhat-Bullish,0.058472,Somewhat-Bullish,0,broad,
STX,Seagate Technology  ( NASDAQ:STX )  Downgraded by StockNews.com to Sell,https://www.defenseworld.net/2023/06/09/seagate-technology-nasdaqstx-downgraded-by-stocknews-com-to-sell.html,20230609T095107,Stocknews.com,Seagate Technology ( NASDAQ:STX ) Downgraded by StockNews ... Defense World ...,0.218076,Somewhat-Bullish,0.819893,Bullish,0,broad,
STX,"Marvell, Seagate And 2 Other Stocks Insiders Are Selling - Royal Caribbean Gr  ( NYSE:RCL ) , Marvell Tech  ( NASDAQ:MRVL ) ",https://www.benzinga.com/news/23/05/32623772/marvell-seagate-and-2-other-stocks-insiders-are-selling,20230530T130210,Benzinga,"The S&P 500 closed higher on Friday. Investors, meanwhile, focused on some notable insider trades. When insiders sell shares, it indicates their concern in the company's prospects or that they view the stock as being overpriced. Either way, this signals an opportunity to go short on the stock.",0.205681,Somewhat-Bullish,0.247838,Neutral,0,broad,
STX,"Microsoft To Rally Around 25%? Here Are 10 Other Analyst Forecasts For Tuesday - Big Lots  ( NYSE:BIG ) , FactSet Research Systems  ( NYSE:FDS ) ",https://www.benzinga.com/news/23/05/32526513/microsoft-to-rally-around-25-here-are-10-other-analyst-forecasts-for-tuesday,20230523T114922,Benzinga,"Credit Suisse cut the price target for Big Lots, Inc. BIG from $13 to $7. Credit Suisse analyst Karen Short maintained an Underperform rating. Big Lots shares gained 2.9% to $8.15 in pre-market trading. BMO Capital slashed the price target for Willis Towers Watson Public Limited Company WTW from ...",0.134928,Neutral,0.185306,Neutral,0,focused,AI
STX,"STX INVESTIGATION: Hagens Berman Encourages Seagate Technology  ( STX )  Investors with Substantial Losses to Contact Firm, Firm Investigating Possible Securities Law Violations Related to $300 Million Fine Over Huawei Business - Seagate Tech Hldgs  ( NASDAQ:STX ) ",https://www.benzinga.com/pressreleases/23/05/g32221345/stx-investigation-hagens-berman-encourages-seagate-technology-stx-investors-with-substantial-losse,20230504T174754,Benzinga,"SAN FRANCISCO, May 04, 2023 ( GLOBE NEWSWIRE ) -- Hagens Berman urges Seagate Technology Holdings plc STX investors who suffered substantial losses to submit your losses now. Visit: www.hbsslaw.com/investor-fraud/STX Contact An Attorney Now: STX@hbsslaw.com 844-916-0895",-0.026748,Neutral,0.22421,Somewhat-Bearish,0,broad,
STX,"UnitedHealth Group, Wynn Resorts, ON Semiconductor And This Memory Storage Company: CNBC's 'Final Trades' - Seagate Tech Hldgs  ( NASDAQ:STX ) , ON Semiconductor  ( NASDAQ:ON ) ",https://www.benzinga.com/news/23/05/32157433/unitedhealth-group-wynn-resorts-on-semiconductor-and-this-memory-storage-company-cnbcs-final-trades,20230502T144716,Benzinga,"On CNBC's ""Halftime Report Final Trades,"" Stephen Weiss of Short Hills Capital Partners said UnitedHealth Group Inc. UNH was the ""good horse here."" Jim Lebenthal of Cerity Partners chose Wynn Resorts, Limited WYNN saying that both Macau and Las Vegas properties were ""killing it.""",0.033393,Neutral,0.56415,Somewhat-Bullish,0,focused,AI
STX,Seagate Technology Holdings Investigated by Block & Leviton For Potential Securities Law Violations; Investors Who Have Lost Money Are Encouraged to Contact the Firm - Seagate Tech Hldgs  ( NASDAQ:STX ) ,https://www.benzinga.com/pressreleases/23/05/g32121464/seagate-technology-holdings-investigated-by-block-leviton-for-potential-securities-law-violations-,20230501T141727,Benzinga,"BOSTON, May 01, 2023 ( GLOBE NEWSWIRE ) -- Block & Leviton is investigating Seagate Technology Holdings plc STX for potential securities law violations. Investors who have lost money in their Seagate Technology Holdings plc investment should contact the firm to learn more about how they might ...",-0.070009,Neutral,0.565003,Somewhat-Bearish,0,broad,
STX,"HAGENS BERMAN, NATIONAL TRIAL ATTORNEYS, Encourages Seagate Technology  ( STX )  Investors with Substantial Losses to Contact Firm, Firm Investigating Possible Securities Law Violations Related to $300 Million Fine Over Huawei Business - Seagate Tech Hldgs  ( NASDAQ:STX ) ",https://www.benzinga.com/pressreleases/23/04/g32066180/hagens-berman-national-trial-attorneys-encourages-seagate-technology-stx-investors-with-substantia,20230427T225126,Benzinga,"SAN FRANCISCO, April 27, 2023 ( GLOBE NEWSWIRE ) -- Hagens Berman urges Seagate Technology Holdings plc STX investors who suffered substantial losses to submit your losses now. Visit: www.hbsslaw.com/investor-fraud/STX Contact An Attorney Now: STX@hbsslaw.com 844-916-0895",-0.029282,Neutral,0.237358,Somewhat-Bearish,0,broad,
STX,"Wall Street's Most Accurate Analysts Say Buy These 3 Tech Stocks With Over 3% Dividend Yields - Adtran  ( NASDAQ:ADTN ) , Cisco Systems  ( NASDAQ:CSCO ) ",https://www.benzinga.com/trading-ideas/long-ideas/23/04/32048935/wall-streets-most-accurate-analysts-say-buy-these-3-tech-stocks-with-over-3-dividend-yie,20230427T144206,Benzinga,"During times of turbulence and uncertainty in the markets, many investors turn to dividend-yielding stocks. These are often companies that have high free cash flows and reward shareholders with a high dividend payout.",0.147421,Neutral,0.112008,Neutral,0,focused,AI
STX,StockNews.com Downgrades Seagate Technology  ( NASDAQ:STX )  to Sell,https://www.defenseworld.net/2023/04/23/stocknews-com-downgrades-seagate-technology-nasdaqstx-to-sell.html,20230423T070842,Stocknews.com,StockNews.com Downgrades Seagate Technology ( NASDAQ:STX ... Defense World ...,0.1705,Somewhat-Bullish,0.907913,Somewhat-Bullish,0,broad,
STX,"Barron's Weekend Stock Picks: Tesla, AT&T, And Crop Protection Companies To Watch As The World's Population Grows - Tesla  ( NASDAQ:TSLA ) ",https://www.benzinga.com/news/23/04/31948259/barrons-weekend-stock-picks-tesla-at-t-and-crop-protection-companies-to-watch-as-the-worlds-populati,20230422T220118,Benzinga,"Benzinga reviews this weekend's top stories covered by Barron's. Here are the articles investors need to read. In ""The World's Population Is Growing.",0.246058,Somewhat-Bullish,0.268294,Neutral,0,broad,
STX,"Tech hardware was already struggling, but 'market conditions have deteriorated' even more",https://www.marketwatch.com/story/tech-hardware-was-already-struggling-but-market-conditions-have-deteriorated-even-more-29d61c88,20230421T194000,MarketWatch,Seagate Technology Holdings PLC shares were on track for their worst week in more than six months Friday.,-0.257598,Somewhat-Bearish,0.414559,Neutral,0,broad,
STX,"Seagate Stock's Recovery Will Be Delayed, Says Morgan Stanley",https://www.barrons.com/articles/seagate-stock-earnings-downgrade-f87cb1b6,20230421T155200,Barrons,Morgan Stanley warns Seagate Technology Holdings may suffer as a turnaround for technology hardware demand is likely going to take longer than expected.,-0.333848,Somewhat-Bearish,0.885652,Bearish,0,broad,
STX,Seagate Technology Analyst Turns Bearish After Q1 Earnings Call: Market Conditions Have Deteriorated 'More Rapidly Than We Expected' - Seagate Tech Hldgs  ( NASDAQ:STX ) ,https://www.benzinga.com/analyst-ratings/analyst-color/23/04/31936136/seagate-technology-analyst-turns-bearish-after-q1-earnings-call-market-conditions-h,20230421T143707,Benzinga,"Shares of Seagate Technology Holdings PLC STX declined in early trading on Friday, after the company reported its fiscal third-quarter earnings. Earnings commentary suggested the hard disk drive ( HDD ) market recovery was delayed by more than two quarters and there was limited visibility into ...",-0.087947,Neutral,0.922387,Neutral,0,broad,
STX,Seagate Technology Holdings Investigated by Block & Leviton For Potential Securities Law Violations; Investors Who Have Lost Money Are Encouraged to Contact the Firm - Seagate Tech Hldgs  ( NASDAQ:STX ) ,https://www.benzinga.com/pressreleases/23/04/g31934380/seagate-technology-holdings-investigated-by-block-leviton-for-potential-securities-law-violations-,20230421T130903,Benzinga,"BOSTON, April 21, 2023 ( GLOBE NEWSWIRE ) -- Block & Leviton is investigating Seagate Technology Holdings plc STX for potential securities law violations. Investors who have lost money in their Seagate Technology Holdings plc investment should contact the firm to learn more about how they might ...",-0.070009,Neutral,0.565003,Somewhat-Bearish,0,broad,
STX,"Barrick Gold To Rally Over 47%? Here Are 10 Other Analyst Forecasts For Friday - American Express  ( NYSE:AXP ) , Accolade  ( NASDAQ:ACCD ) ",https://www.benzinga.com/news/23/04/31932181/barrick-gold-to-rally-over-47-here-are-10-other-analyst-forecasts-for-friday,20230421T113751,Benzinga,"Keybanc raised the price target for Watsco, Inc. WSO from $365 to $380. Keybanc analyst Jeffrey Hammond maintained an Overweight rating. Watsco shares gained 8.3% to close at $342.93 on Thursday. Raymond James cut the price target for Nokia Oyj NOK from $7 to $6.",0.104538,Neutral,0.190417,Neutral,0,focused,AI
STX,"Investor Optimism Declines Following Tesla Earnings Report - HCA Healthcare  ( NYSE:HCA ) , Procter & Gamble  ( NYSE:PG ) ",https://www.benzinga.com/news/earnings/23/04/31929607/investor-optimism-declines-following-tesla-earnings-report,20230421T070252,Benzinga,"The CNN Money Fear and Greed index showed some decline in the overall market sentiment on Thursday. U.S stocks closed lower on Thursday following mixed bag of earnings results. Tesla, Inc. TSLA shares dropped around 9.8% on Thursday after the company reported a decrease in operating margins.",-0.355508,Bearish,0.355588,Somewhat-Bullish,0,broad,
STX,"Seagate  ( STX )  Swings to Loss in Q3, Revenues Decline Y/Y",https://www.zacks.com/stock/news/2082355/seagate-stx-swings-to-loss-in-q3-revenues-decline-yy,20230420T162200,Zacks Commentary,Seagate's (STX) third-quarter fiscal 2023 performance hit by elongated customer inventory correction.,0.068693,Neutral,0.157741,Neutral,0,broad,
STX,"Seagate Reaches Settlement With Regulators Regarding Huawei Export, Will Pay $300M - Seagate Tech Hldgs  ( NASDAQ:STX ) ",https://www.benzinga.com/news/earnings/23/04/31912648/seagate-reaches-settlement-with-regulators-regarding-huawei-export-will-pay-300m,20230420T151842,Benzinga,"Seagate Technology Holdings PLC STX settled with the U.S. Department of Commerce's Bureau of Industry and Security ( BIS ) over allegations that the company's sales of hard disk drives to Huawei Technologies Co between Aug. 17, 2020, and Sept. 29, 2021, did not comply with the U.S.",-0.137229,Neutral,0.40348,Neutral,0,broad,
STX,Seagate Reports Surprise Loss as Big Customers Hold Back,https://www.barrons.com/articles/seagate-earnings-stock-price-a72bee65,20230420T130200,Barrons,Seagate's Results Miss Forecasts for Profit and Revenue. The Stock Is Falling. ...,-0.116848,Neutral,0.837089,Somewhat-Bearish,0,broad,
STX,"Why Nasdaq, S&P 500 Futures Are Slumping Today - Invesco QQQ Trust, Series 1  ( NASDAQ:QQQ ) , SPDR S&P 500  ( ARCA:SPY ) ",https://www.benzinga.com/news/earnings/23/04/31909599/nasdaq-futures-slump-as-tesla-earnings-sap-sentiment-analyst-says-market-clearly-in-waiting-mode,20230420T110809,Benzinga,"Early indications suggest a notably lower opening by Wall Street stocks on Thursday, as disappointing earnings reports from big names such as Tesla, Inc. TSLA weighed on sentiment. Stocks ended Tuesday's session on a narrowly mixed note for a second straight session, reflecting the jittery mood ...",-0.016891,Neutral,0.095327,Neutral,0,focused,AI
STX,Morning Bid: Oil price relapse,https://www.reuters.com/markets/us/global-markets-view-usa-2023-04-20/,20230420T100300,Reuters,"A look at the day ahead in U.S. and global markets from Mike Dolan Throwing another curve ball into an already confusing inflation picture, crude oil prices have retreated sharply again this week and take some of the edge off renewed anxiety in interest rate markets.",-0.198147,Somewhat-Bearish,0.055492,Neutral,0,focused,AI
STX,Seagate's hard-drive sales to Huawei result in US$300 million fine in US,https://www.scmp.com/tech/big-tech/article/3217676/seagate-sales-huawei-result-us300-million-fine-us-worlds-biggest-hard-drive-maker,20230420T040943,South China Morning Post,"The fine represents the largest stand-alone settlement in the history of the Bureau of Industry and Security, which first blacklisted Huawei in 2019.",-0.155025,Somewhat-Bearish,0.085324,Somewhat-Bearish,0,broad,
STX,Seagate to Pay $300 Million for Violating Export Restrictions on China's Huawei,https://www.wsj.com/articles/seagate-to-pay-300-million-for-violating-export-restrictions-on-chinas-huawei-9fbdc1a,20230419T233800,Wall Street Journal,The penalty comes after a group of Senate Republicans in 2021 alleged the data-storage equipment provider continued to sell hard drives to Huawei despite national security restrictions.,-0.354287,Bearish,0.395012,Bearish,0,broad,
STX,US Imposes $300mn Penalty On Seagate Over Huawei Shipments,https://www.barrons.com/news/us-imposes-300mn-penalty-on-seagate-over-huawei-shipments-5acc0ef5,20230419T220136,Barrons,"US authorities on Wednesday imposed a $300 million penalty on Seagate Technology, to resolve alleged violations of export controls related to selling hard disk drives to Huawei Technologies, the Commerce Department said.",-0.171827,Somewhat-Bearish,0.1331,Somewhat-Bearish,0,focused,AI
STX,Here's What to Expect From Seagate's  ( STX )  Q3 Earnings Release,https://www.zacks.com/stock/news/2079744/heres-what-to-expect-from-seagates-stx-q3-earnings-release,20230417T143600,Zacks Commentary,Seagate's (STX) Q3 performance is likely to have borne the brunt of global macroeconomic weakness and inventory adjustments by customers.,0.086066,Neutral,0.335519,Neutral,0,broad,
STX,Seagate Technology  ( NASDAQ:STX )  Stock Rating Upgraded by StockNews.com,https://www.defenseworld.net/2023/04/11/seagate-technology-nasdaqstx-stock-rating-upgraded-by-stocknews-com.html,20230411T052843,Stocknews.com,Seagate Technology ( NASDAQ:STX ) Stock Rating Upgraded by ... Defense World ...,0.304852,Somewhat-Bullish,0.807885,Bullish,0,broad,
STX,"Solid State Drive  ( SSD )  Market size to grow by CAGR 23.87% from 2022 to 2027, Increasing emergence of 3D NAND to be a major market trend - Technavio",https://www.prnewswire.com/news-releases/solid-state-drive-ssd-market-size-to-grow-by-cagr-23-87-from-2022-to-2027--increasing-emergence-of-3d-nand-to-be-a-major-market-trend---technavio-301791979.html,20230410T230000,PR Newswire,Solid State Drive ( SSD ) Market size to grow by CAGR 23.87% from ... PR ...,0.144298,Neutral,0.027603,Neutral,0,broad,
STX,What's Going On With Western Digital And Seagate Shares Today? - Western Digital  ( NASDAQ:WDC ) ,https://www.benzinga.com/news/23/04/31729894/whats-going-on-with-western-digital-and-seagate-shares-today,20230410T163802,Benzinga,"Western Digital Corp WDC and Seagate Technology Holdings PLC STX shares are trading higher Monday after Samsung Electronics Co Ltd SSNLF said it would cut memory chip output. What Happened: Micron on Friday said it would implement ""meaningful"" cuts to chip production as it faces lower prices due ...",0.101009,Neutral,0.426225,Neutral,0,focused,AI
