ticker,title,url,time_published,source,summary,sentiment_score,sentiment_label,ticker_sentiment_score,ticker_sentiment_label,relevance_score,category,ai_keywords_found
STX,Reed's  ( NYSE:REED )  Receives New Coverage from Analysts at StockNews.com,https://reporter.am/2022/09/09/reeds-nysereed-receives-new-coverage-from-analysts-at-stocknews-com.html,20220909T084842,Stocknews.com,StockNews.com assumed coverage on shares of Reed's ( NYSE:REED - Get Rating ) in a report published on Thursday. The firm issued a sell rating on the stock. Shares of NYSE REED opened at $0.18 on Thursday.,0.306711,Somewhat-Bullish,0.181137,Somewhat-Bullish,0,broad,
STX,Northwest Natural  ( NYSE:NWN )  Lowered to Sell at StockNews.com,https://reporter.am/2022/09/09/northwest-natural-nysenwn-lowered-to-sell-at-stocknews-com.html,20220909T084645,Stocknews.com,StockNews.com lowered shares of Northwest Natural ( NYSE:NWN - Get Rating ) from a hold rating to a sell rating in a research report report published on Thursday.,0.252833,Somewhat-Bullish,0.049629,Neutral,0,broad,
STX,TCF Financial  ( NYSE:TCF )  Now Covered by Analysts at StockNews.com,https://reporter.am/2022/09/09/tcf-financial-nysetcf-now-covered-by-analysts-at-stocknews-com.html,20220909T084645,Stocknews.com,StockNews.com assumed coverage on shares of TCF Financial ( NYSE:TCF - Get Rating ) in a research note issued to investors on Thursday morning. The brokerage issued a hold rating on the stock.,0.319568,Somewhat-Bullish,0.175859,Somewhat-Bullish,0,broad,
STX,IQVIA  ( NYSE:IQV )  Downgraded to Hold at StockNews.com,https://reporter.am/2022/09/09/iqvia-nyseiqv-downgraded-to-hold-at-stocknews-com.html,20220909T084645,Stocknews.com,"StockNews.com downgraded shares of IQVIA ( NYSE:IQV - Get Rating ) from a buy rating to a hold rating in a report released on Thursday morning. IQV has been the subject of several other reports. Argus increased their price target on IQVIA from $260.00 to $275.00 in a report on Thursday, August ...",0.308878,Somewhat-Bullish,0.067347,Somewhat-Bullish,0,broad,
STX,Advance Auto Parts  ( NYSE:AAP )  Downgraded by StockNews.com,https://www.etfdailynews.com/2022/09/09/advance-auto-parts-nyseaap-downgraded-by-stocknews-com/,20220909T080448,Stocknews.com,StockNews.com downgraded shares of Advance Auto Parts ( NYSE:AAP - Get Rating ) from a buy rating to a hold rating in a research note published on Thursday morning.,0.233073,Somewhat-Bullish,0.050786,Neutral,0,broad,
STX,Skyline Champion  ( NYSE:SKY )  Rating Increased to Buy at StockNews.com,https://www.etfdailynews.com/2022/09/09/skyline-champion-nysesky-rating-increased-to-buy-at-stocknews-com/,20220909T080448,Stocknews.com,StockNews.com upgraded shares of Skyline Champion ( NYSE:SKY - Get Rating ) from a hold rating to a buy rating in a research note issued to investors on Thursday.,0.250683,Somewhat-Bullish,0.058188,Somewhat-Bullish,0,broad,
STX,AngloGold Ashanti  ( NYSE:AU )  Upgraded at StockNews.com,https://www.etfdailynews.com/2022/09/09/anglogold-ashanti-nyseau-upgraded-at-stocknews-com/,20220909T080447,Stocknews.com,StockNews.com upgraded shares of AngloGold Ashanti ( NYSE:AU - Get Rating ) from a hold rating to a buy rating in a report released on Thursday. AU has been the subject of several other research reports.,0.246537,Somewhat-Bullish,0.07887,Neutral,0,broad,
STX,StockNews.com Lowers GSK  ( NYSE:GSK )  to Buy,https://www.etfdailynews.com/2022/09/09/stocknews-com-lowers-gsk-nysegsk-to-buy/,20220909T080447,Stocknews.com,StockNews.com downgraded shares of GSK ( NYSE:GSK - Get Rating ) from a strong-buy rating to a buy rating in a report published on Thursday. A number of other analysts have also issued reports on the stock. Jefferies Financial Group lowered shares of GSK from a buy rating to a hold rating in a ...,0.319447,Somewhat-Bullish,0.072655,Somewhat-Bullish,0,broad,
STX,"Gray Television  ( NYSE:GTN )  Upgraded to ""Hold"" at StockNews.com",https://www.etfdailynews.com/2022/09/09/gray-television-nysegtn-upgraded-to-hold-at-stocknews-com/,20220909T080447,Stocknews.com,StockNews.com upgraded shares of Gray Television ( NYSE:GTN - Get Rating ) from a sell rating to a hold rating in a research report sent to investors on Thursday morning. Shares of NYSE:GTN opened at $18.48 on Thursday.,0.247187,Somewhat-Bullish,0.071357,Somewhat-Bullish,0,broad,
STX,Chico's FAS  ( NYSE:CHS )  Stock Rating Upgraded by StockNews.com,https://www.etfdailynews.com/2022/09/09/chicos-fas-nysechs-stock-rating-upgraded-by-stocknews-com/,20220909T080447,Stocknews.com,StockNews.com upgraded shares of Chico's FAS ( NYSE:CHS - Get Rating ) from a buy rating to a strong-buy rating in a research note published on Thursday. A number of other equities analysts have also commented on CHS. TheStreet raised Chico's FAS from a c+ rating to a b- rating in a research ...,0.321252,Somewhat-Bullish,0.065506,Neutral,0,focused,AI
STX,StockNews.com Downgrades AMETEK  ( NYSE:AME )  to Hold,https://www.etfdailynews.com/2022/09/09/stocknews-com-downgrades-ametek-nyseame-to-hold/,20220909T080447,Stocknews.com,StockNews.com cut shares of AMETEK ( NYSE:AME - Get Rating ) from a buy rating to a hold rating in a report issued on Thursday. A number of other brokerages have also recently commented on AME. Loop Capital reduced their target price on shares of AMETEK from $170.00 to $155.00 and set a buy ...,0.234831,Somewhat-Bullish,0.051441,Neutral,0,broad,
STX,StockNews.com Lowers Jones Lang LaSalle  ( NYSE:JLL )  to Hold,https://www.etfdailynews.com/2022/09/09/stocknews-com-lowers-jones-lang-lasalle-nysejll-to-hold/,20220909T080446,Stocknews.com,"StockNews.com cut shares of Jones Lang LaSalle ( NYSE:JLL - Get Rating ) from a buy rating to a hold rating in a research report released on Thursday morning. Separately, Raymond James upped their price target on shares of Jones Lang LaSalle from $280.00 to $287.00 and gave the company an ...",0.257568,Somewhat-Bullish,0.064104,Neutral,0,broad,
STX,Piper Sandler Companies  ( NYSE:PIPR )  Rating Increased to Buy at StockNews.com,https://www.etfdailynews.com/2022/09/09/piper-sandler-companies-nysepipr-rating-increased-to-buy-at-stocknews-com/,20220909T080446,Stocknews.com,StockNews.com upgraded shares of Piper Sandler Companies ( NYSE:PIPR - Get Rating ) from a hold rating to a buy rating in a research note published on Thursday morning. Several other equities research analysts have also recently weighed in on the company.,0.242957,Somewhat-Bullish,0.059194,Neutral,0,broad,
STX,Restaurant Brands International  ( NYSE:QSR )  Downgraded by StockNews.com,https://www.etfdailynews.com/2022/09/09/restaurant-brands-international-nyseqsr-downgraded-by-stocknews-com/,20220909T080446,Stocknews.com,StockNews.com cut shares of Restaurant Brands International ( NYSE:QSR - Get Rating ) ( TSE:QSR ) from a buy rating to a hold rating in a research report released on Thursday morning. Several other equities analysts have also issued reports on the company.,0.187718,Somewhat-Bullish,0.056275,Neutral,0,broad,
STX,StockNews.com Lowers EchoStar  ( NASDAQ:SATS )  to Hold,https://www.etfdailynews.com/2022/09/09/stocknews-com-lowers-echostar-nasdaqsats-to-hold/,20220909T080445,Stocknews.com,"StockNews.com downgraded shares of EchoStar ( NASDAQ:SATS - Get Rating ) from a buy rating to a hold rating in a report issued on Thursday morning. Separately, Citigroup decreased their price target on shares of EchoStar from $29.00 to $25.00 and set a neutral rating for the company in a ...",0.177461,Somewhat-Bullish,0.146916,Somewhat-Bullish,0,broad,
STX,Sasol  ( NYSE:SSL )  Downgraded by StockNews.com,https://www.etfdailynews.com/2022/09/09/sasol-nysessl-downgraded-by-stocknews-com/,20220909T080445,Stocknews.com,"StockNews.com cut shares of Sasol ( NYSE:SSL - Get Rating ) from a buy rating to a hold rating in a research note issued to investors on Thursday morning. Separately, Morgan Stanley downgraded Sasol from an overweight rating to an equal weight rating in a research report on Tuesday, June 14th.",0.231468,Somewhat-Bullish,0.09186,Neutral,0,broad,
STX,StockNews.com Upgrades Telecom Argentina  ( NYSE:TEO )  to Buy,https://www.etfdailynews.com/2022/09/09/stocknews-com-upgrades-telecom-argentina-nyseteo-to-buy/,20220909T080445,Stocknews.com,"StockNews.com upgraded shares of Telecom Argentina ( NYSE:TEO - Get Rating ) from a hold rating to a buy rating in a research report released on Thursday morning. Separately, TheStreet raised Telecom Argentina from a d+ rating to a c- rating in a report on Friday, July 8th.",0.332189,Somewhat-Bullish,0.079921,Neutral,0,focused,AI
STX,Washington Federal  ( NASDAQ:WAFD )  Upgraded at StockNews.com,https://www.etfdailynews.com/2022/09/09/washington-federal-nasdaqwafd-upgraded-at-stocknews-com/,20220909T080445,Stocknews.com,"StockNews.com upgraded shares of Washington Federal ( NASDAQ:WAFD - Get Rating ) from a hold rating to a buy rating in a research report released on Thursday morning. Separately, DA Davidson set a $41.00 target price on Washington Federal in a report on Friday, July 15th.",0.291204,Somewhat-Bullish,0.072217,Somewhat-Bullish,0,broad,
STX,"Q2  ( NYSE:QTWO )  Upgraded to ""Hold"" at StockNews.com",https://www.etfdailynews.com/2022/09/09/q2-nyseqtwo-upgraded-to-hold-at-stocknews-com/,20220909T080445,Stocknews.com,StockNews.com upgraded shares of Q2 ( NYSE:QTWO - Get Rating ) from a sell rating to a hold rating in a report published on Thursday. Other research analysts also recently issued reports about the stock. Stephens raised their price objective on shares of Q2 to $55.00 in a research report on ...,0.24986,Somewhat-Bullish,0.068306,Somewhat-Bullish,0,focused,AI
STX,Applied DNA Sciences  ( NASDAQ:APDN )  Upgraded to Hold by StockNews.com,https://www.etfdailynews.com/2022/09/09/applied-dna-sciences-nasdaqapdn-upgraded-to-hold-by-stocknews-com/,20220909T080444,Stocknews.com,"StockNews.com upgraded shares of Applied DNA Sciences ( NASDAQ:APDN - Get Rating ) from a sell rating to a hold rating in a research report report published on Thursday. Separately, HC Wainwright raised their price objective on shares of Applied DNA Sciences to $8.00 in a research report on ...",0.34761,Somewhat-Bullish,0.073773,Neutral,0,focused,AI
STX,Medpace  ( NASDAQ:MEDP )  Downgraded to Hold at StockNews.com,https://www.etfdailynews.com/2022/09/09/medpace-nasdaqmedp-downgraded-to-hold-at-stocknews-com/,20220909T080444,Stocknews.com,StockNews.com lowered shares of Medpace ( NASDAQ:MEDP - Get Rating ) from a buy rating to a hold rating in a research report report published on Thursday morning. Other analysts also recently issued research reports about the stock. Guggenheim assumed coverage on shares of Medpace in a report ...,0.348836,Somewhat-Bullish,0.051111,Neutral,0,broad,
STX,Cadiz  ( NASDAQ:CDZI )  Downgraded to Sell at StockNews.com,https://www.etfdailynews.com/2022/09/09/cadiz-nasdaqcdzi-downgraded-to-sell-at-stocknews-com/,20220909T080441,Stocknews.com,"StockNews.com lowered shares of Cadiz ( NASDAQ:CDZI - Get Rating ) from a hold rating to a sell rating in a report released on Thursday. Separately, B. Riley lowered their price objective on shares of Cadiz from $17.50 to $15.00 in a research report on Monday, May 16th.",0.26345,Somewhat-Bullish,0.088472,Neutral,0,broad,
STX,REV Group  ( NYSE:REVG )  Raised to Buy at StockNews.com,https://www.etfdailynews.com/2022/09/09/rev-group-nyserevg-raised-to-buy-at-stocknews-com/,20220909T080441,Stocknews.com,StockNews.com upgraded shares of REV Group ( NYSE:REVG - Get Rating ) from a hold rating to a buy rating in a research note issued to investors on Thursday morning.,0.134937,Neutral,0.059488,Neutral,0,focused,AI
STX,Syros Pharmaceuticals  ( NASDAQ:SYRS )  Stock Rating Upgraded by StockNews.com,https://www.etfdailynews.com/2022/09/09/syros-pharmaceuticals-nasdaqsyrs-stock-rating-upgraded-by-stocknews-com/,20220909T080441,Stocknews.com,StockNews.com upgraded shares of Syros Pharmaceuticals ( NASDAQ:SYRS - Get Rating ) from a sell rating to a hold rating in a research note published on Thursday morning. Several other equities analysts also recently commented on the company.,0.258306,Somewhat-Bullish,0.059341,Neutral,0,broad,
STX,Pretium Resources  ( NYSE:PVG )  Now Covered by StockNews.com,https://www.etfdailynews.com/2022/09/09/pretium-resources-nysepvg-now-covered-by-stocknews-com/,20220909T072642,Stocknews.com,"StockNews.com started coverage on shares of Pretium Resources ( NYSE:PVG - Get Rating ) ( TSE:PVG ) in a report issued on Friday. The brokerage set a ""hold"" rating on the basic materials company's stock. PVG stock opened at $15.05 on Friday.",0.268107,Somewhat-Bullish,0.098255,Somewhat-Bullish,0,broad,
STX,Douglas Dynamics  ( NYSE:PLOW )  Rating Lowered to Hold at StockNews.com,https://www.etfdailynews.com/2022/09/09/douglas-dynamics-nyseplow-rating-lowered-to-hold-at-stocknews-com/,20220909T065441,Stocknews.com,"Douglas Dynamics ( NYSE:PLOW - Get Rating ) was downgraded by investment analysts at StockNews.com from a ""buy"" rating to a ""hold"" rating in a research note issued on Friday. Shares of Douglas Dynamics stock opened at $30.64 on Friday.",0.3225,Somewhat-Bullish,0.062271,Somewhat-Bullish,0,broad,
STX,"Simmons First National  ( NASDAQ:SFNC )  Raised to ""Hold"" at StockNews.com",https://www.etfdailynews.com/2022/09/09/simmons-first-national-nasdaqsfnc-raised-to-hold-at-stocknews-com/,20220909T065250,Stocknews.com,"Simmons First National ( NASDAQ:SFNC - Get Rating ) was upgraded by equities researchers at StockNews.com from a ""sell"" rating to a ""hold"" rating in a research note issued on Friday. Several other equities analysts also recently weighed in on the company.",0.306354,Somewhat-Bullish,0.052918,Somewhat-Bullish,0,focused,AI
STX,"RPM International  ( NYSE:RPM )  Downgraded by StockNews.com to ""Hold""",https://www.etfdailynews.com/2022/09/09/rpm-international-nyserpm-downgraded-by-stocknews-com-to-hold/,20220909T065249,Stocknews.com,"RPM International ( NYSE:RPM - Get Rating ) was downgraded by investment analysts at StockNews.com from a ""buy"" rating to a ""hold"" rating in a research report issued to clients and investors on Friday.",0.237302,Somewhat-Bullish,0.043264,Neutral,0,broad,
STX,"Evans Bancorp  ( NYSE:EVBN )  Upgraded by StockNews.com to ""Buy""",https://www.etfdailynews.com/2022/09/09/evans-bancorp-nyseevbn-upgraded-by-stocknews-com-to-buy-2/,20220909T065248,Stocknews.com,"Evans Bancorp ( NYSE:EVBN - Get Rating ) was upgraded by investment analysts at StockNews.com from a ""hold"" rating to a ""buy"" rating in a research report issued on Friday. NYSE EVBN opened at $37.76 on Friday. The company has a current ratio of 0.85, a quick ratio of 0.85 and a debt-to-equity ...",0.13849,Neutral,0.11983,Neutral,0,broad,
STX,M&T Bank  ( NYSE:MTB )  Upgraded at StockNews.com,https://www.etfdailynews.com/2022/09/09/mt-bank-nysemtb-upgraded-at-stocknews-com/,20220909T065247,Stocknews.com,"M&T Bank ( NYSE:MTB - Get Rating ) was upgraded by investment analysts at StockNews.com from a ""sell"" rating to a ""hold"" rating in a research note issued to investors on Friday. Other research analysts have also issued reports about the company.",0.258998,Somewhat-Bullish,0.044801,Neutral,0,broad,
STX,Trimble  ( NASDAQ:TRMB )  Upgraded by StockNews.com to Buy,https://www.etfdailynews.com/2022/09/09/trimble-nasdaqtrmb-upgraded-by-stocknews-com-to-buy/,20220909T065246,Stocknews.com,"Trimble ( NASDAQ:TRMB - Get Rating ) was upgraded by research analysts at StockNews.com from a ""hold"" rating to a ""buy"" rating in a report issued on Friday. Other equities analysts also recently issued research reports about the stock.",0.255174,Somewhat-Bullish,0.0428,Somewhat-Bullish,0,broad,
STX,StockNews.com Begins Coverage on Altisource Asset Management  ( NYSE:AAMC ) ,https://www.etfdailynews.com/2022/09/09/stocknews-com-begins-coverage-on-altisource-asset-management-nyseaamc-3/,20220909T065246,Stocknews.com,"Equities researchers at StockNews.com initiated coverage on shares of Altisource Asset Management ( NYSE:AAMC - Get Rating ) in a research report issued to clients and investors on Friday. The firm set a ""hold"" rating on the stock. Shares of AAMC opened at $19.42 on Friday.",0.359745,Bullish,0.16849,Somewhat-Bullish,0,broad,
STX,StockNews.com Initiates Coverage on Cedar Realty Trust  ( NYSE:CDR ) ,https://reporter.am/2022/09/09/stocknews-com-initiates-coverage-on-cedar-realty-trust-nysecdr.html,20220909T065242,Stocknews.com,"Research analysts at StockNews.com started coverage on shares of Cedar Realty Trust ( NYSE:CDR - Get Rating ) in a note issued to investors on Friday. The brokerage set a ""sell"" rating on the real estate investment trust's stock.",0.383196,Bullish,0.059049,Neutral,0,broad,
STX,"Arista Networks  ( NYSE:ANET )  Downgraded by StockNews.com to ""Hold""",https://reporter.am/2022/09/09/arista-networks-nyseanet-downgraded-by-stocknews-com-to-hold.html,20220909T065242,Stocknews.com,"Arista Networks ( NYSE:ANET - Get Rating ) was downgraded by research analysts at StockNews.com from a ""buy"" rating to a ""hold"" rating in a research note issued on Friday.",0.304736,Somewhat-Bullish,0.046095,Neutral,0,broad,
STX,NVR  ( NYSE:NVR )  Downgraded to Hold at StockNews.com,https://www.etfdailynews.com/2022/09/09/nvr-nysenvr-downgraded-to-hold-at-stocknews-com/,20220909T065242,Stocknews.com,"NVR ( NYSE:NVR - Get Rating ) was downgraded by analysts at StockNews.com from a ""buy"" rating to a ""hold"" rating in a report issued on Friday. A number of other research analysts also recently commented on the stock.",0.245685,Somewhat-Bullish,0.053992,Neutral,0,broad,
STX,Bar Harbor Bankshares  ( NYSE:BHB )  Stock Rating Upgraded by StockNews.com,https://reporter.am/2022/09/09/bar-harbor-bankshares-nysebhb-stock-rating-upgraded-by-stocknews-com.html,20220909T065242,Stocknews.com,"Bar Harbor Bankshares ( NYSE:BHB - Get Rating ) was upgraded by equities research analysts at StockNews.com from a ""hold"" rating to a ""buy"" rating in a research report issued on Friday. Shares of NYSE BHB opened at $27.33 on Friday. The firm has a 50-day moving average price of $28.19.",0.228215,Somewhat-Bullish,0.115232,Somewhat-Bullish,0,broad,
STX,S&W Seed  ( NASDAQ:SANW )  Now Covered by StockNews.com,https://reporter.am/2022/09/09/sw-seed-nasdaqsanw-now-covered-by-stocknews-com.html,20220909T065242,Stocknews.com,"Investment analysts at StockNews.com began coverage on shares of S&W Seed ( NASDAQ:SANW - Get Rating ) in a report issued on Friday. The firm set a ""sell"" rating on the stock. Shares of SANW opened at $1.17 on Friday. The company has a quick ratio of 0.47, a current ratio of 1.67 and a ...",0.336469,Somewhat-Bullish,0.083251,Neutral,0,broad,
STX,StockNews.com Initiates Coverage on Cedar Realty Trust  ( NYSE:CDR ) ,https://www.etfdailynews.com/2022/09/09/stocknews-com-initiates-coverage-on-cedar-realty-trust-nysecdr/,20220909T065242,Stocknews.com,"Research analysts at StockNews.com started coverage on shares of Cedar Realty Trust ( NYSE:CDR - Get Rating ) in a note issued to investors on Friday. The brokerage set a ""sell"" rating on the real estate investment trust's stock.",0.349379,Somewhat-Bullish,0.084423,Neutral,0,broad,
STX,MasTec  ( NYSE:MTZ )  Stock Rating Lowered by StockNews.com,https://www.etfdailynews.com/2022/09/09/mastec-nysemtz-stock-rating-lowered-by-stocknews-com/,20220909T065241,Stocknews.com,"MasTec ( NYSE:MTZ - Get Rating ) was downgraded by StockNews.com from a ""hold"" rating to a ""sell"" rating in a report issued on Friday. Other equities research analysts have also issued research reports about the stock.",0.231156,Somewhat-Bullish,0.077094,Somewhat-Bullish,0,broad,
STX,Rocky Brands  ( NASDAQ:RCKY )  Downgraded to Sell at StockNews.com,https://www.etfdailynews.com/2022/09/09/rocky-brands-nasdaqrcky-downgraded-to-sell-at-stocknews-com/,20220909T065241,Stocknews.com,"Rocky Brands ( NASDAQ:RCKY - Get Rating ) was downgraded by equities researchers at StockNews.com from a ""hold"" rating to a ""sell"" rating in a report issued on Friday. A number of other research analysts also recently issued reports on RCKY. B.",0.300363,Somewhat-Bullish,0.062761,Neutral,0,broad,
STX,RPM International  ( NYSE:RPM )  Lowered to Hold at StockNews.com,https://www.etfdailynews.com/2022/09/09/rpm-international-nyserpm-lowered-to-hold-at-stocknews-com/,20220909T062050,Stocknews.com,StockNews.com cut shares of RPM International ( NYSE:RPM - Get Rating ) from a buy rating to a hold rating in a report released on Friday morning. A number of other brokerages have also issued reports on RPM. TheStreet upgraded shares of RPM International from a c+ rating to a b rating in a ...,0.229143,Somewhat-Bullish,0.038592,Neutral,0,broad,
STX,"Simmons First National  ( NASDAQ:SFNC )  Upgraded to ""Hold"" by StockNews.com",https://www.etfdailynews.com/2022/09/09/simmons-first-national-nasdaqsfnc-upgraded-to-hold-by-stocknews-com/,20220909T062050,Stocknews.com,StockNews.com upgraded shares of Simmons First National ( NASDAQ:SFNC - Get Rating ) from a sell rating to a hold rating in a research note issued to investors on Friday morning. Other equities analysts also recently issued reports about the stock.,0.304094,Somewhat-Bullish,0.048133,Somewhat-Bullish,0,broad,
STX,NVR  ( NYSE:NVR )  Lowered to Hold at StockNews.com,https://www.etfdailynews.com/2022/09/09/nvr-nysenvr-lowered-to-hold-at-stocknews-com-2/,20220909T062050,Stocknews.com,StockNews.com cut shares of NVR ( NYSE:NVR - Get Rating ) from a buy rating to a hold rating in a research report report published on Friday morning. NVR has been the topic of a number of other reports.,0.23474,Somewhat-Bullish,0.052685,Neutral,0,broad,
STX,Invesco  ( NYSE:IVZ )  Lowered to Sell at StockNews.com,https://www.etfdailynews.com/2022/09/09/invesco-nyseivz-lowered-to-sell-at-stocknews-com/,20220909T062050,Stocknews.com,StockNews.com lowered shares of Invesco ( NYSE:IVZ - Get Rating ) from a hold rating to a sell rating in a research note issued to investors on Friday morning. IVZ has been the topic of a number of other research reports.,0.241334,Somewhat-Bullish,0.050894,Somewhat-Bullish,0,broad,
STX,Northrop Grumman  ( NYSE:NOC )  Downgraded by StockNews.com to Hold,https://www.etfdailynews.com/2022/09/09/northrop-grumman-nysenoc-downgraded-by-stocknews-com-to-hold/,20220909T062050,Stocknews.com,StockNews.com downgraded shares of Northrop Grumman ( NYSE:NOC - Get Rating ) from a buy rating to a hold rating in a research note published on Friday. NOC has been the topic of a number of other reports. Royal Bank of Canada assumed coverage on shares of Northrop Grumman in a report on ...,0.27928,Somewhat-Bullish,0.049322,Neutral,0,broad,
STX,MasTec  ( NYSE:MTZ )  Lowered to Sell at StockNews.com,https://www.etfdailynews.com/2022/09/09/mastec-nysemtz-lowered-to-sell-at-stocknews-com/,20220909T062050,Stocknews.com,StockNews.com lowered shares of MasTec ( NYSE:MTZ - Get Rating ) from a hold rating to a sell rating in a research report released on Friday morning. Several other analysts have also recently weighed in on the stock.,0.29211,Somewhat-Bullish,0.063258,Somewhat-Bullish,0,broad,
STX,Republic Bancorp  ( NASDAQ:RBCAA )  Upgraded to Buy at StockNews.com,https://www.etfdailynews.com/2022/09/09/republic-bancorp-nasdaqrbcaa-upgraded-to-buy-at-stocknews-com-2/,20220909T062050,Stocknews.com,StockNews.com upgraded shares of Republic Bancorp ( NASDAQ:RBCAA - Get Rating ) from a hold rating to a buy rating in a research note published on Friday morning.,0.283174,Somewhat-Bullish,0.082111,Somewhat-Bullish,0,broad,
STX,Pretium Resources  ( NYSE:PVG )  Receives New Coverage from Analysts at StockNews.com,https://www.etfdailynews.com/2022/09/09/pretium-resources-nysepvg-receives-new-coverage-from-analysts-at-stocknews-com-2/,20220909T062050,Stocknews.com,StockNews.com assumed coverage on shares of Pretium Resources ( NYSE:PVG - Get Rating ) ( TSE:PVG ) in a research note issued to investors on Friday. The brokerage issued a hold rating on the basic materials company's stock. Shares of PVG opened at $15.05 on Friday.,0.317291,Somewhat-Bullish,0.088147,Somewhat-Bullish,0,broad,
STX,Enzo Biochem  ( NYSE:ENZ )  Coverage Initiated by Analysts at StockNews.com,https://www.etfdailynews.com/2022/09/09/enzo-biochem-nyseenz-coverage-initiated-by-analysts-at-stocknews-com-2/,20220909T062049,Stocknews.com,StockNews.com assumed coverage on shares of Enzo Biochem ( NYSE:ENZ - Get Rating ) in a research report report published on Friday morning. The brokerage issued a hold rating on the medical research company's stock.,0.311062,Somewhat-Bullish,0.065327,Neutral,0,broad,
STX,"Evans Bancorp  ( NYSE:EVBN )  Upgraded by StockNews.com to ""Buy""",https://www.etfdailynews.com/2022/09/09/evans-bancorp-nyseevbn-upgraded-by-stocknews-com-to-buy/,20220909T062049,Stocknews.com,StockNews.com upgraded shares of Evans Bancorp ( NYSE:EVBN - Get Rating ) from a hold rating to a buy rating in a research note issued to investors on Friday morning. Shares of NYSE EVBN opened at $37.76 on Friday. Evans Bancorp has a 1 year low of $32.53 and a 1 year high of $44.47.,0.146052,Neutral,0.118647,Neutral,0,broad,
STX,"Stock Yards Bancorp  ( NASDAQ:SYBT )  Upgraded by StockNews.com to ""Hold""",https://www.etfdailynews.com/2022/09/09/stock-yards-bancorp-nasdaqsybt-upgraded-by-stocknews-com-to-hold/,20220909T062049,Stocknews.com,StockNews.com upgraded shares of Stock Yards Bancorp ( NASDAQ:SYBT - Get Rating ) from a sell rating to a hold rating in a research note published on Friday morning.,0.287059,Somewhat-Bullish,0.044304,Neutral,0,broad,
