ticker,title,url,time_published,source,summary,sentiment_score,sentiment_label,ticker_sentiment_score,ticker_sentiment_label,relevance_score,category,ai_keywords_found
STX,Pure Storage Jumps 39% Year to Date: What Lies Ahead for the Stock?,https://www.zacks.com/stock/news/2343369/pure-storage-jumps-39-year-to-date-what-lies-ahead-for-the-stock,20240930T124300,Zacks Commentary,"PSTG gains from strong sales momentum amid soft macroeconomic conditions. However, the lowered TCV sales outlook warrants caution.",0.201437,Somewhat-Bullish,0.069094,Neutral,0,focused,AI
STX,"Can KEYS Stock Gain From Facilitating Thunderbolt 5 Certification? - Ansys  ( NASDAQ:ANSS ) , American Software  ( NASDAQ:AMSWA ) ",https://www.benzinga.com/news/earnings/24/09/41070219/can-keys-stock-gain-from-facilitating-thunderbolt-5-certification,20240927T201911,Benzinga,"Keysight Technologies, Inc. KEYS has been designated by UL Solutions as the certification test partner for Thunderbolt 5 products. This new role reinforces UL Solutions' position as an Intel-authorized lab for Thunderbolt 5 technologies.",0.379094,Bullish,0.352223,Somewhat-Bullish,0,focused,AI
STX,Intrusion Secures $2 Million in New Cybersecurity Deal: Stock to Gain?,https://www.zacks.com/stock/news/2342909/intrusion-secures-2-million-in-new-cybersecurity-deal-stock-to-gain,20240927T173200,Zacks Commentary,INTZ gains $2 million in a new contract with the U.S. Department of Defense to enhance its cybersecurity initiatives.,0.26363,Somewhat-Bullish,0.376194,Somewhat-Bullish,0,focused,AI
STX,Can KEYS Stock Gain From Facilitating Thunderbolt 5 Certification?,https://www.zacks.com/stock/news/2342766/can-keys-stock-gain-from-facilitating-thunderbolt-5-certification,20240927T142800,Zacks Commentary,UL Solutions uses Keysight Technologies' test and measurement products for Thunderbolt 5 certification to provide superior solutions.,0.351492,Bullish,0.371523,Somewhat-Bullish,0,focused,AI
STX,"BlackBerry's Q2 Earnings Beat Estimates, Revenues Up Y/Y, Stock Down",https://www.zacks.com/stock/news/2342714/blackberrys-q2-earnings-beat-estimates-revenues-up-yy-stock-down,20240927T133300,Zacks Commentary,BB's fiscal second-quarter top and bottom-line numbers exceed the company's guidance.,0.109182,Neutral,0.093653,Neutral,0,broad,
STX,Cadence & TSMC Team Up to Boost AI-Driven Advanced-Node Designs,https://www.zacks.com/stock/news/2342060/cadence-tsmc-team-up-to-boost-ai-driven-advanced-node-designs,20240926T141700,Zacks Commentary,CDNS is focused on boosting productivity for AI-driven advanced-node designs and 3D-IC Solutions in collaboration with ...,0.307835,Somewhat-Bullish,0.291182,Somewhat-Bullish,0,focused,AI
STX,"SAP Reportedly Under Investigation by DOJ for Price-Fixing, Stock Down",https://www.zacks.com/stock/news/2341964/sap-reportedly-under-investigation-by-doj-for-price-fixing-stock-down,20240926T124900,Zacks Commentary,"According to a Bloomberg report, SAP, along with Carahsoft, is being examined by the DOJ for colluding to overcharge government agencies.",0.084659,Neutral,0.116631,Neutral,0,broad,
STX,NETGEAR Expands Nighthawk Portfolio With Three New WiFi 7 Routers,https://www.zacks.com/stock/news/2341344/netgear-expands-nighthawk-portfolio-with-three-new-wifi-7-routers,20240925T132300,Zacks Commentary,"NTGR's new Nighthawk RS600, RS500 and RS200 routers offer robust WiFi performance and cyber protection ...",0.284361,Somewhat-Bullish,0.265378,Somewhat-Bullish,0,broad,
STX,Generac Surges 40% in a Year: What Lies Ahead for the Stock?,https://www.zacks.com/stock/news/2341000/generac-surges-40-in-a-year-what-lies-ahead-for-the-stock,20240925T101100,Zacks Commentary,GNRC's performance is driven by higher Residential product sales amid declining C&I product revenues.,0.21542,Somewhat-Bullish,0.089129,Neutral,0,broad,
STX,Will Ciena's New 1.6 Tb/s Coherent Pluggable Solution Drive Top Line?,https://www.zacks.com/stock/news/2340642/will-cienas-new-16-tbs-coherent-pluggable-solution-drive-top-line,20240924T135500,Zacks Commentary,CIEN's 1.6 Tb/s Coherent-Lite pluggable enhances data center efficiency to accommodate increasing traffic from cloud services and AI ...,0.276968,Somewhat-Bullish,0.348919,Somewhat-Bullish,0,focused,AI
STX,Woodward Surges 25% Year to Date: What Lies Ahead for the Stock?,https://www.zacks.com/stock/news/2340374/woodward-surges-25-year-to-date-what-lies-ahead-for-the-stock,20240924T125200,Zacks Commentary,"WWD's Aerospace segment benefits from higher commercial OEM and aftermarket sales. However, the volatile China on-highway natural gas truck market is concerning.",0.206504,Somewhat-Bullish,0.090134,Neutral,0,broad,
STX,Flex Stock Up 14% in the Past Six Months: Will the Rally Last?,https://www.zacks.com/stock/news/2340319/flex-stock-up-14-in-the-past-six-months-will-the-rally-last,20240924T111300,Zacks Commentary,"FLEX's performance is buoyed by healthy demand trends across cloud/AI, automotive and digital healthcare amid weakness in the core industrials vertical.",0.166302,Somewhat-Bullish,0.082535,Neutral,0,focused,AI
STX,Seagate Stock Trading Below 52-Week High: To Buy or Not to Buy?,https://www.zacks.com/stock/news/2336561/seagate-stock-trading-below-52-week-high-to-buy-or-not-to-buy,20240916T140200,Zacks Commentary,STX's growth prospects look promising amid increasing mass capacity demand and improving margin performance.,0.267117,Somewhat-Bullish,0.357507,Somewhat-Bullish,0,broad,
STX,5 Momentum Stocks to Buy for September Gains Despite Market Volatility,https://www.zacks.com/stock/news/2332408/5-momentum-stocks-to-buy-for-september-gains-despite-market-volatility,20240905T184500,Zacks Commentary,"Despite a weak start to this month, we offer five stocks as momentum picks for September. These are: AIZ, ALLY, APP, PARAA, STX.",0.266719,Somewhat-Bullish,0.167322,Neutral,0,focused,AI
STX,"The Zacks Analyst Blog Highlights Taiwan Semiconductor, Spotify, Seagate Technology and Eaton",https://www.zacks.com/stock/news/2326047/the-zacks-analyst-blog-highlights-taiwan-semiconductor-spotify-seagate-technology-and-eaton,20240823T090000,Zacks Commentary,"Taiwan Semiconductor, Spotify, Seagate Technology and Eaton are included in this Analyst Blog.",0.235706,Somewhat-Bullish,0.165258,Neutral,0,focused,AI
STX,On the Rise: 4 Must-Buy Non-U.S. Stocks With Solid Earnings,https://www.zacks.com/stock/news/2325976/on-the-rise-4-must-buy-non-us-stocks-with-solid-earnings,20240822T184500,Zacks Commentary,"We have narrowed our search to four high-flying non-U.S. corporate bigwigs with more upside left. These are: TSM, STX, SPOT, ETN.",0.235888,Somewhat-Bullish,0.142565,Somewhat-Bullish,0,broad,
STX,The Benchmark Company Announces Upcoming September Conference Schedule,https://www.benzinga.com/pressreleases/24/08/g40510267/the-benchmark-company-announces-upcoming-september-conference-schedule,20240822T151153,Benzinga,"NEW YORK, Aug. 22, 2024 ( GLOBE NEWSWIRE ) -- The Benchmark Company, LLC is pleased to announce our upcoming September conference schedule.",0.153156,Somewhat-Bullish,0.050679,Neutral,0,broad,
STX,"The Zacks Analyst Blog Highlights Spotify, Aspen, Maplebear, Paramount Global and Seagate",https://www.zacks.com/stock/news/2324109/the-zacks-analyst-blog-highlights-spotify-aspen-maplebear-paramount-global-and-seagate,20240820T093300,Zacks Commentary,"Spotify, Aspen, Maplebear, Paramount Global and Seagate are included in this Analyst Blog.",0.213248,Somewhat-Bullish,0.150404,Neutral,0,broad,
STX,Seagate  ( STX )  Stock Jumps 19% YTD: Is it Too Late to Invest?,https://www.zacks.com/stock/news/2323997/seagate-stx-stock-jumps-19-ytd-is-it-too-late-to-invest,20240819T155100,Zacks Commentary,Seagate (STX) expects incremental improvements in mass capacity demand to drive top-line expansion.,0.326321,Somewhat-Bullish,0.42503,Somewhat-Bullish,0,broad,
STX,Best Momentum Stock to Buy for August 19th,https://www.zacks.com/commentary/2323708/best-momentum-stock-to-buy-for-august-19th,20240819T140000,Zacks Commentary,"UCBJF, STX and AXS made it to the Zacks Rank #1 (Strong Buy) momentum stocks list on August 19, 2024.",0.17401,Somewhat-Bullish,0.627119,Somewhat-Bullish,0,broad,
STX,Soft-Landing Hopes Resurface: Top 5 Momentum Stock Picks,https://www.zacks.com/stock/news/2323643/soft-landing-hopes-resurface-top-5-momentum-stock-picks,20240819T120200,Zacks Commentary,"We have narrowed our search to five stocks that have solid momentum. These are: SPOT, AZPN, STX,CART, PARAA.",0.213728,Somewhat-Bullish,0.130217,Somewhat-Bullish,0,broad,
STX,Best Income Stocks to Buy for August 19th,https://www.zacks.com/commentary/2323586/best-income-stocks-to-buy-for-august-19th,20240819T114900,Zacks Commentary,"KT, FCF and STX made it to the Zacks Rank #1 (Strong Buy) income stocks list on August 19, 2024.",0.197051,Somewhat-Bullish,0.664235,Somewhat-Bullish,0,broad,
STX,New Strong Buy Stocks for August 19th,https://www.zacks.com/commentary/2322787/new-strong-buy-stocks-for-august-19th,20240819T094000,Zacks Commentary,"STX, STRL, AXS, TSM and TXRH have been added to the Zacks Rank #1 (Strong Buy) List on August 19, 2024.",0.166634,Somewhat-Bullish,0.439786,Somewhat-Bullish,0,broad,
STX,"The Rise of Personal Cloud Market: A $57.7 billion Industry Dominated by Tech Giants - Google  ( US ) , Microsoft  ( US ) , Apple  ( US ) , Dropbox  ( US )  | MarketsandMarkets™",https://www.benzinga.com/pressreleases/24/07/g40039330/the-rise-of-personal-cloud-market-a-57-7-billion-industry-dominated-by-tech-giants-google-us-micro,20240730T140000,Benzinga,"Chicago, July 30, 2024 ( GLOBE NEWSWIRE ) -- The Personal Cloud Market size is expected to grow from USD 24.7 billion in 2023 to USD 57.7 billion by 2028 at a compound annual growth rate ( CAGR ) of 18.5% during the forecast period, according to a new report by MarketsandMarkets™.",0.150277,Somewhat-Bullish,0.07104,Neutral,0,broad,
STX,"Exxon Mobil, Morgan Stanley, Seagate And More: CNBC's 'Final Trades' - Seagate Tech Hldgs  ( NASDAQ:STX ) ",https://www.benzinga.com/trading-ideas/long-ideas/24/07/40009775/exxon-mobil-morgan-stanley-seagate-and-more-cnbcs-final-trades,20240729T123237,Benzinga,"On CNBC's ""Halftime Report Final Trades,"" Sarat Sethi of DCLA said he likes Morgan Stanley MS as the capital market is going to pick up. On July 16, Morgan Stanley reported second-quarter EPS of $1.82, up from $1.24 a year ago and beating the consensus of $1.65.",0.264179,Somewhat-Bullish,0.223866,Bullish,0,focused,AI
STX,Seagate  ( STX )  Q4 Earnings Top Estimates on Upbeat Demand Trends,https://www.zacks.com/stock/news/2310093/seagate-stx-q4-earnings-top-estimates-on-upbeat-demand-trends,20240726T151500,Zacks Commentary,Seagate's (STX) fourth-quarter fiscal 2024 results gain from increasing demand for mass capacity storage solutions.,0.141679,Neutral,0.301778,Neutral,0,focused,AI
STX,Bet on These 5 Attractive Relative Price Strength Plays,https://www.zacks.com/stock/news/2308607/bet-on-these-5-attractive-relative-price-strength-plays,20240725T111200,Zacks Commentary,"STX, RGA, HCA, IP and OSW are five stocks with explosive relative price strength.",0.291861,Somewhat-Bullish,0.141726,Neutral,0,broad,
STX,"Seagate's Q4 Earnings Beat Estimates, Revenues Up Y/Y - Generac Hldgs  ( NYSE:GNRC ) , Badger Meter  ( NYSE:BMI ) ",https://www.benzinga.com/news/earnings/24/07/39932680/seagates-q4-earnings-beat-estimates-revenues-up-yy,20240724T171604,Benzinga,"Seagate Technology Holdings plc STX reported fourth-quarter fiscal 2024 non-GAAP earnings of $1.05 per share, beating the Zacks Consensus Estimate by 40%. The company reported a non-GAAP loss of 18 cents per share in the year-ago quarter.",0.113292,Neutral,0.309539,Neutral,0,broad,
STX,"AT&T, Group 1 Automotive, Mattel, Seagate And Other Big Stocks Moving Higher On Wednesday - Alkermes  ( NASDAQ:ALKS ) , Avantor  ( NYSE:AVTR ) ",https://www.benzinga.com/news/24/07/39934830/at-t-group-1-automotive-mattel-seagate-and-other-big-stocks-moving-higher-on-wednesday,20240724T144656,Benzinga,"U.S. stocks were lower, with the Dow Jones index falling around 350 points on Wednesday. Shares of AT&T Inc. T rose during Wednesday's session following second-quarter earnings.",0.394482,Bullish,0.16117,Bullish,0,broad,
STX,These Analysts Boost Their Forecasts On Seagate After Better-Than-Expected Earnings - Seagate Tech Hldgs  ( NASDAQ:STX ) ,https://www.benzinga.com/news/earnings/24/07/39931204/these-analysts-boost-their-forecasts-on-seagate-after-better-than-expected-earnings,20240724T125726,Benzinga,Seagate Technology Holdings PLC STX reported better-than-expected fourth-quarter financial results and issued first-quarter guidance above estimates on Tuesday. Seagate Tech reported quarterly earnings of $1.05 per share which beat the analyst consensus estimate of 75 cents per share.,0.248574,Somewhat-Bullish,0.271274,Bullish,0,broad,
STX,"Seagate's  ( STX )  Q4 Earnings Beat Estimates, Revenues Up Y/Y",https://www.zacks.com/stock/news/2307600/seagates-stx-q4-earnings-beat-estimates-revenues-up-yy,20240724T115800,Zacks Commentary,Seagate's (STX) fourth-quarter fiscal 2024 performance gains from an improvement in demand for mass capacity solutions.,0.0991,Neutral,0.312158,Neutral,0,focused,AI
STX,"Nasdaq, S&P 500 Set To Open Sharply Lower: What's Driving Futures Market - Invesco QQQ Trust, Series 1  ( NASDAQ:QQQ ) , SPDR S&P 500  ( ARCA:SPY ) ",https://www.benzinga.com/news/earnings/24/07/39928846/us-stocks-could-open-sharply-lower-as-tesla-alphabet-earnings-offer-no-cheer-analyst-says-this-bode,20240724T114255,Benzinga,"Wall Street is gearing up for a negative start on Thursday, as traders mull over earnings from Tesla, Inc. TSLA and Alphabet, Inc. GOOGL GOOG, which incidentally haven't been received well by the Street.",-0.012071,Neutral,0.093836,Neutral,0,broad,
STX,Why Enphase Energy Shares Are Trading Higher; Here Are 20 Stocks Moving Premarket - Tesla  ( NASDAQ:TSLA ) ,https://www.benzinga.com/news/24/07/39925905/why-enphase-energy-shares-are-trading-higher-here-are-20-stocks-moving-premarket,20240724T092711,Benzinga,"Shares of Enphase Energy, Inc. ENPH rose sharply in today's pre-market trading after the company reported second-quarter financial results. Enphase Energy reported second-quarter revenue of $303.46 million, missing the consensus estimate of $309.67 million, according to Benzinga Pro.",0.226773,Somewhat-Bullish,0.138464,Somewhat-Bullish,0,broad,
STX,Seagate Technology Plc  ( STX )  Q4 2024 Earnings Call Transcript,https://www.fool.com/earnings/call-transcripts/2024/07/24/seagate-technology-plc-stx-q4-2024-earnings-call-t/,20240724T051518,Motley Fool,"STX earnings call for the period ending June 30, 2024.",0.218246,Somewhat-Bullish,0.004974,Somewhat-Bullish,0,broad,
STX,"Seagate Technology Q4 Earnings: Revenue Beat, EPS Beat, Strong Guidance Amid 'Improving Cloud Demand Environment' - Seagate Tech Hldgs  ( NASDAQ:STX ) ",https://www.benzinga.com/news/earnings/24/07/39919112/seagate-technology-q4-earnings-revenue-beat-eps-beat-strong-guidance-amid-improving-cloud-demand-en,20240723T205339,Benzinga,"Seagate Technology Holdings PLC STX shares are rising in Tuesday's after-hours session on the heels of the company's fiscal fourth-quarter financial results. Q4 Revenue: $1.89 billion, versus estimates of $1.877 billion Q4 EPS: $1.05, versus estimates of 75 cents",0.283638,Somewhat-Bullish,0.371523,Bullish,0,broad,
STX,"Nasdaq Futures Little Changed Ahead Of Tesla, Alphabet Earnings - Invesco QQQ Trust, Series 1  ( NASDAQ:QQQ ) , SPDR S&P 500  ( ARCA:SPY ) ",https://www.benzinga.com/news/earnings/24/07/39903213/us-stock-futures-little-changed-as-traders-brace-for-q2-reports-from-alphabet-tesla-there-remains-s,20240723T113645,Benzinga,"The market mood turned jittery after Monday's rebound, with index futures trading on either side of the unchanged line early Tuesday. The apprehensions reflect uncertainties regarding geopolitics, monetary policy, and the health of the reporting season ahead of earnings from AI stalwart Alphabet, ...",0.117001,Neutral,0.084572,Neutral,0,focused,AI
STX,New Strong Buy Stocks for July 23rd,https://www.zacks.com/commentary/2305797/new-strong-buy-stocks-for-july-23rd,20240723T104300,Zacks Commentary,"KRO, TEF, STX, WGS and THC have been added to the Zacks Rank #1 (Strong Buy) List on July 23, 2024.",0.103634,Neutral,0.52759,Neutral,0,broad,
STX,Best Income Stocks to Buy for July 23rd,https://www.zacks.com/commentary/2306503/best-income-stocks-to-buy-for-july-23rd,20240723T084200,Zacks Commentary,"KRO, TEF and STX made it to the Zacks Rank #1 (Strong Buy) income stocks list on July 23, 2024.",0.169909,Somewhat-Bullish,0.736438,Neutral,0,broad,
STX,"Tesla, Alphabet, GM, Ford Lead Earnings Parade This Week As Market Struggles To Sustain The Summer Rally - SPDR S&P 500  ( ARCA:SPY ) ",https://www.benzinga.com/markets/equities/24/07/39874391/tesla-alphabet-gm-ford-lead-earnings-parade-this-week-as-market-struggles-to-sustain-the-summer-,20240721T211825,Benzinga,About 14% of the S&P 500 companies have reported their June quarter earnings and the blended earnings growth rate for the companies constituting the broader index remains healthy.,0.078611,Neutral,0.082393,Neutral,0,focused,AI
STX,Factors to Note Ahead of Seagate's  ( STX )  Q4 Earnings Release,https://www.zacks.com/stock/news/2305199/factors-to-note-ahead-of-seagates-stx-q4-earnings-release,20240719T123900,Zacks Commentary,Seagate's (STX) fiscal Q4 performance is likely to have gained from incremental improvements in mass capacity demand driven by nearline cloud products.,0.101559,Neutral,0.302429,Neutral,0,focused,AI
STX,Model N Named in U.S. News & World Report's 2024-2025 Best Companies to Work For,https://www.globenewswire.com/news-release/2024/07/11/2912058/0/en/Model-N-Named-in-U-S-News-World-Report-s-2024-2025-Best-Companies-to-Work-For.html,20240711T173000,GlobeNewswire,Model N excelled as one of the top companies to meet employee needs. Model N excelled as one of the top companies to meet employee needs.,0.393306,Bullish,0.06515,Somewhat-Bullish,0,broad,
STX,Telenor  ( TELNY )  Acquires Combitech to Boost Cyber Portfolio,https://www.zacks.com/stock/news/2297780/telenor-telny-acquires-combitech-to-boost-cyber-portfolio,20240708T141700,Zacks Commentary,Telenor's (TELNY) Combitech buyout will allow the company to secure a foothold in Norway's cybersecurity market and expand its customer base ...,0.208591,Somewhat-Bullish,0.160277,Neutral,0,broad,
STX,"The Zacks Analyst Blog Highlights Seagate, Abercrombie & Fitch, BrightView, The Gap and Micron",https://www.zacks.com/stock/news/2297508/the-zacks-analyst-blog-highlights-seagate-abercrombie-fitch-brightview-the-gap-and-micron,20240708T091300,Zacks Commentary,"Seagate, Abercrombie & Fitch, BrightView, The Gap and Micron are included in this Analyst Blog.",0.321838,Somewhat-Bullish,0.29792,Somewhat-Bullish,0,broad,
STX,"Buy 5 Growth Stocks for a Strong July: STX, ANF, BV, GPS, MU",https://www.zacks.com/stock/news/2297401/buy-5-growth-stocks-for-a-strong-july-stx-anf-bv-gps-mu,20240705T184500,Zacks Commentary,"Looking for growth stocks? Consider Seagate Technology (STX), Abercrombie & Fitch (ANF), BrightView Holdings (BV), The Gap (GPS) and Micron Technology (MU).",0.331044,Somewhat-Bullish,0.286082,Somewhat-Bullish,0,broad,
STX,Best Income Stocks to Buy for July 2nd,https://www.zacks.com/commentary/2295763/best-income-stocks-to-buy-for-july-2nd,20240702T090100,Zacks Commentary,"CTRA, KNBWY and STX made it to the Zacks Rank #1 (Strong Buy) income stocks list on July 2, 2024.",0.159457,Somewhat-Bullish,0.401331,Neutral,0,broad,
STX,"Take the Zacks Approach to Beat the Markets: NVIDIA, Seagate, Amkor in Focus",https://www.zacks.com/stock/news/2295818/take-the-zacks-approach-to-beat-the-markets-nvidia-seagate-amkor-in-focus,20240701T142800,Zacks Commentary,"Last week, our time-tested methodologies served investors well in navigating the market. Check out some of our achievements from the past three months.",0.175103,Somewhat-Bullish,0.065685,Somewhat-Bullish,0,broad,
STX,7 Best Stocks For Magnificent Earnings Growth Next Year,https://www.investors.com/research/best-stocks-sp500-sp400-sp600-magnificent-earnings-growth/,20240621T200000,Investors Business Daily,Investors looking to supercharge their portfolios would do well to widen the search aperture.,0.320566,Somewhat-Bullish,0.078611,Neutral,0,broad,
STX,7 Best Stocks For Magnificent Earnings Growth Next Year,https://www.investors.com/news/best-stocks-sp500-sp400-sp600-magnificent-earnings-growth/,20240620T181200,Investors Business Daily,Investors looking to supercharge their portfolios would do well to widen the search aperture.,0.302364,Somewhat-Bullish,0.078482,Neutral,0,broad,
STX,"Seagate Collaborates With eBay to Boost Sustainability - Arista Networks  ( NYSE:ANET ) , eBay  ( NASDAQ:EBAY ) ",https://www.benzinga.com/news/earnings/24/06/39399426/seagate-collaborates-with-ebay-to-boost-sustainability,20240619T171452,Benzinga,"Seagate Technology Holdings plc STX is collaborating with eBay to set up its storefront on the latter's e-commerce platform. The storefront on eBay EBAY will establish a direct channel for STX's consumers to gain access to ""factory-recertified"" hard drives.",0.179502,Somewhat-Bullish,0.481177,Neutral,0,focused,AI
STX,Seagate  ( STX )  Collaborates With eBay to Boost Sustainability,https://www.zacks.com/stock/news/2290406/seagate-stx-collaborates-with-ebay-to-boost-sustainability,20240619T134900,Zacks Commentary,"Seagate (STX), as part of its Circularity Program, is looking to lower hard drive shredding and boost the reuse of storage devices.",0.153593,Somewhat-Bullish,0.489163,Neutral,0,focused,AI
STX,Seagate  ( STX )  Stock Surges 21.6% YTD: Will the Rally Last?,https://www.zacks.com/stock/news/2289061/seagate-stx-stock-surges-216-ytd-will-the-rally-last,20240617T121600,Zacks Commentary,Seagate (STX) expects incremental improvements in mass capacity demand to drive revenues.,0.205115,Somewhat-Bullish,0.199037,Somewhat-Bullish,0,broad,
STX,"Enterprise External OEM Storage Systems Market size is set to grow by USD 4.93 billion from 2024-2028, Growing ... - PR Newswire",https://www.prnewswire.com/news-releases/enterprise-external-oem-storage-systems-market-size-is-set-to-grow-by-usd-4-93-billion-from-2024-2028--growing-demand-for-non-volatile-memory-express-enabled-storage-solutions-boost-the-market-technavio-302165000.html,20240606T213500,PR Newswire,"Enterprise External OEM Storage Systems Market size is set to grow by USD 4.93 billion from 2024-2028, Growing ... PR ...",0.304014,Somewhat-Bullish,0.033006,Neutral,0,broad,
STX,"AMD, TSMC, Broadcom And Other Chip Stocks Hit By Biden's Fresh AI Chip Export Restrictions: Details",https://markets.businessinsider.com/news/stocks/amd-tsmc-broadcom-and-other-chip-stocks-hit-by-biden-s-fresh-ai-chip-export-restrictions-details-1033442477,20240531T191753,Business Insider,"The Biden Administration's embargo on AI chip exports to the Middle East has triggered a selloff in the broader sector. VanEck Semiconductor ETF ( NASDAQ:SMH ) and iShares Semiconductor ETF ( NASDAQ:SOXX ) , representing the broader sector, are trading lower by close to 3%.",0.054636,Neutral,0.094762,Neutral,0,focused,AI
STX,"AMD, TSMC, Broadcom And Other Chip Stocks Hit By Biden's Fresh AI Chip Export Restrictions: Details - Qualcomm  ( NASDAQ:QCOM ) ",https://www.benzinga.com/government/24/05/39118149/amd-tsmc-broadcom-and-other-chip-stocks-hit-by-bidens-fresh-ai-chip-export-restrictions-details,20240531T182056,Benzinga,"The Biden Administration's embargo on AI chip exports to the Middle East has triggered a selloff in the broader sector. VanEck Semiconductor ETF SMH and iShares Semiconductor ETF SOXX, representing the broader sector, are trading lower by close to 3%.",0.076256,Neutral,0.173333,Neutral,0,focused,AI
STX,More Than Half Of HDDs Could Use HAMR By 2027,https://www.forbes.com/sites/tomcoughlin/2024/05/30/more-than-half-of-hdds-could-use-hamr-by-2027/,20240530T195315,Forbes,"A few days ago, Toshiba ( the third HDD manufacturer after Western Digital and Seagate Technology ) announced that it will have HDDs with storage capacities of over 30TB with both HAMR and MAMR energy assisted magnetic recording technologies.",0.051168,Neutral,0.072655,Neutral,0,broad,
STX,Delhi High Court issues directives for sale of refurbished hard disk drives,https://www.business-standard.com/india-news/delhi-high-court-issues-directives-for-sale-of-refurbished-hard-disk-drives-124052301166_1.html,20240523T123729,Business Standard,"Delhi High Court on Thursday directed entities selling refurbished hard disk drives ( HDDs ) to comply with specific disclosure requirements on their promotional materials, including websites, e-commerce listings, brochures, and manuals, according to a report by Bar and Bench.",0.060114,Neutral,0.087185,Neutral,0,broad,
STX,Signet Jewelers and Papa John's International have been highlighted as Zacks Bull and Bear of the Day,https://www.zacks.com/stock/news/2277019/signet-jewelers-and-papa-johns-international-have-been-highlighted-as-zacks-bull-and-bear-of-the-day,20240522T110000,Zacks Commentary,"Chicago, IL - May 22, 2024 - Zacks Equity Research shares Signet Jewelers ( SIG Quick QuoteSIG - ) , as the Bull of the Day and Papa John's International ( PZZA Quick QuotePZZA - ) , asthe Bear of the Day.",0.219553,Somewhat-Bullish,0.116236,Neutral,0,broad,
STX,3 Silicon Valley Tech Stocks to Buy as Nasdaq Edges Higher,https://www.zacks.com/stock/news/2276536/3-silicon-valley-tech-stocks-to-buy-as-nasdaq-edges-higher,20240521T122600,Zacks Commentary,"Invest in NVIDIA (NVDA), Alphabet (GOOGL) and Seagate Technology (STX) which are poised to make the most of the Nasdaq's upward movement banking on rate cut hopefulness.",0.196703,Somewhat-Bullish,0.24289,Somewhat-Bullish,0,broad,
