ticker,title,url,time_published,source,summary,sentiment_score,sentiment_label,ticker_sentiment_score,ticker_sentiment_label,relevance_score,category,ai_keywords_found
STX,FILING DEADLINE--Kuznicki Law PLLC Announces Class Action on Behalf of Shareholders of Seagate Technology Holdings plc - STX - Seagate Tech Hldgs  ( NASDAQ:STX ) ,https://www.benzinga.com/pressreleases/23/08/g34128063/filing-deadline-kuznicki-law-pllc-announces-class-action-on-behalf-of-shareholders-of-seagate-tech,20230831T022055,Benzinga,"CEDARHURST, N.Y., Aug. 30, 2023 ( GLOBE NEWSWIRE ) -- The securities litigation law firm of Kuznicki Law PLLC issues this alert to shareholders of Seagate Technology Holdings plc STX, if they purchased the Company's shares between September 15, 2020 and October 25, 2022, inclusive ( the ""Class ...",0.133724,Neutral,0.401331,Somewhat-Bullish,0,broad,
STX,"Wall Street's Most Accurate Analysts Say Buy These 3 Tech Stocks With Over 3% Dividend Yields - Corning  ( NYSE:GLW ) , Juniper Networks  ( NYSE:JNPR ) ",https://www.benzinga.com/trading-ideas/long-ideas/23/08/34114956/wall-streets-most-accurate-analysts-say-buy-these-3-tech-stocks-with-over-3-dividend-yie,20230830T133704,Benzinga,"During times of turbulence and uncertainty in the markets, many investors turn to dividend-yielding stocks. These are often companies that have high free cash flows and reward shareholders with a high dividend payout.",0.026306,Neutral,0.114137,Bullish,0,focused,AI
STX,"SEAGATE TECHNOLOGY SHAREHOLDER ALERT: CLAIMSFILER REMINDS INVESTORS WITH LOSSES IN EXCESS OF $100,000 of Lead Plaintiff Deadline in Class Action Lawsuit Against Seagate Technology Holdings plc - STX - Seagate Tech Hldgs  ( NASDAQ:STX ) ",https://www.benzinga.com/pressreleases/23/08/g34105475/seagate-technology-shareholder-alert-claimsfiler-reminds-investors-with-losses-in-excess-of-100-00,20230830T011640,Benzinga,"NEW ORLEANS, Aug. 29, 2023 ( GLOBE NEWSWIRE ) -- ClaimsFiler, a FREE shareholder information service, reminds investors that they have until September 8, 2023 to file lead plaintiff applications in a securities class action lawsuit against Seagate Technology Holdings plc STX, if they purchased ...",0.203906,Somewhat-Bullish,0.333257,Somewhat-Bullish,0,focused,AI
STX,7 High-Dividend Stocks Are More Trouble Than They're Worth,https://www.investors.com/etfs-and-funds/sectors/sp500-high-dividend-stocks-are-more-trouble-than-theyre-worth/,20230829T110000,Investors Business Daily,What good is an S&P 500's company's plump dividend if its stock price collapses? Not much.,0.048641,Neutral,0.122894,Somewhat-Bearish,0,broad,
STX,Seagate Technology Upgraded to Hold Rating,https://www.claytoncountyregister.com/news2/seagate-technology-nasdaqstx-rating-increased-to-hold-at-stocknews-com/178980/,20230829T070617,Stocknews.com,"Seagate Technology has been upgraded from a ""sell"" rating to a ""hold"" rating by investment analysts at StockNews.com. This follows several other research firms weighing in on the stock. Although there have been mixed opinions, the company has a consensus rating of ""hold"" and an average target ...",-0.033112,Neutral,0.76367,Neutral,0,broad,
STX,StockNews.com Upgrades Seagate Technology  ( NASDAQ:STX )  to Hold,https://www.defenseworld.net/2023/08/29/stocknews-com-upgrades-seagate-technology-nasdaqstx-to-hold.html,20230829T062642,Stocknews.com,StockNews.com Upgrades Seagate Technology ( NASDAQ:STX ) to ... Defense World ...,0.217754,Somewhat-Bullish,0.819739,Bullish,0,broad,
STX,"ROSEN, TOP RANKED GLOBAL COUNSEL, Encourages Seagate Technology Holdings plc Investors with Losses to Secure Counsel Before Important September 8 Deadline in Securities Class Action - STX - Seagate Tech Hldgs  ( NASDAQ:STX ) ",https://www.benzinga.com/pressreleases/23/08/g34079037/rosen-top-ranked-global-counsel-encourages-seagate-technology-holdings-plc-investors-with-losses-t,20230828T210100,Benzinga,"NEW YORK, Aug. 28, 2023 ( GLOBE NEWSWIRE ) -- WHY: Rosen Law Firm, a global investor rights law firm, reminds purchasers of the common stock of Seagate Technology Holdings plc STX between September 15, 2020 and October 25, 2022, both dates inclusive ( the ""Class Period"" ) , of the important ...",0.064671,Neutral,0.119532,Neutral,0,broad,
STX,SHAREHOLDER ALERT: Levi & Korsinsky Notifies Seagate Technology Holdings plc  ( STX )  Investors of a Class Action Lawsuit and Upcoming Deadline - Seagate Tech Hldgs  ( NASDAQ:STX ) ,https://www.benzinga.com/pressreleases/23/08/g34074161/shareholder-alert-levi-korsinsky-notifies-seagate-technology-holdings-plc-stx-investors-of-a-class,20230828T171700,Benzinga,"NEW YORK, Aug. 28, 2023 ( GLOBE NEWSWIRE ) -- Levi & Korsinsky, LLP notifies investors in Seagate Technology Holdings plc ( ""Seagate"" or the ""Company"" ) STX of a class action securities lawsuit.",-0.069995,Neutral,0.260189,Neutral,0,broad,
STX,"STX SHAREHOLDER ALERT: ROSEN, LEADING INVESTOR COUNSEL, Encourages Seagate Technology Holdings plc Investors to Secure Counsel Before Important Deadline in Securities Class Action - STX",https://www.prnewswire.com/news-releases/stx-shareholder-alert-rosen-leading-investor-counsel-encourages-seagate-technology-holdings-plc-investors-to-secure-counsel-before-important-deadline-in-securities-class-action--stx-301910410.html,20230828T010500,PR Newswire,"STX SHAREHOLDER ALERT: ROSEN, LEADING INVESTOR COUNSEL, Encourages Seagate Technology Holdings ... PR ...",0.122143,Neutral,0.125789,Neutral,0,broad,
STX,"Bragar Eagel & Squire, P.C. Reminds Investors That Class Action Lawsuits Have Been Filed Against BioXcel, Seagate, and Baxter and Encourages Investors to Contact the Firm - BioXcel Therapeutics  ( NASDAQ:BTAI ) , Baxter Intl  ( NYSE:BAX ) ",https://www.benzinga.com/pressreleases/23/08/g34061242/bragar-eagel-squire-p-c-reminds-investors-that-class-action-lawsuits-have-been-filed-against-bioxc,20230828T010000,Benzinga,"NEW YORK, Aug. 27, 2023 ( GLOBE NEWSWIRE ) -- Bragar Eagel & Squire, P.C., a nationally recognized shareholder rights law firm, reminds investors that class actions have been commenced on behalf of stockholders of BioXcel Therapeutics, Inc. BTAI, Seagate Technology Holdings Plc STX, and Baxter ...",-0.007283,Neutral,0.086452,Neutral,0,focused,AI
STX,"SEAGATE INVESTOR ALERT: Securities Litigation Partner James  ( Josh )  Wilson Encourages Investors Who Suffered Losses Exceeding $100,000 In Seagate To Contact Him Directly To Discuss Their Options",https://www.prnewswire.com/news-releases/seagate-investor-alert-securities-litigation-partner-james-josh-wilson-encourages-investors-who-suffered-losses-exceeding-100-000-in-seagate-to-contact-him-directly-to-discuss-their-options-301910494.html,20230826T150000,PR Newswire,SEAGATE INVESTOR ALERT: Securities Litigation Partner James ( Josh ) Wilson Encourages Investors Who Suffered ... PR ...,0.095895,Neutral,0.161349,Neutral,0,broad,
STX,SHAREHOLDER ALERT: Levi & Korsinsky Notifies Seagate Technology Holdings plc  ( STX )  Investors of a Class Action Lawsuit and Upcoming Deadline - Seagate Tech Hldgs  ( NASDAQ:STX ) ,https://www.benzinga.com/pressreleases/23/08/g34028837/shareholder-alert-levi-korsinsky-notifies-seagate-technology-holdings-plc-stx-investors-of-a-class,20230824T165100,Benzinga,"NEW YORK, Aug. 24, 2023 ( GLOBE NEWSWIRE ) -- Levi & Korsinsky, LLP notifies investors in Seagate Technology Holdings plc ( ""Seagate"" or the ""Company"" ) STX of a class action securities lawsuit.",-0.067585,Neutral,0.259267,Neutral,0,broad,
STX,"DEADLINE ALERT for IBRX, BTAI, MNK, STX, BAX: Law Offices of Howard G. Smith Reminds Investors of Class Actions on Behalf of Shareholders - BioXcel Therapeutics  ( NASDAQ:BTAI ) , Baxter Intl  ( NYSE:BAX ) ",https://www.benzinga.com/pressreleases/23/08/g34024971/deadline-alert-for-ibrx-btai-mnk-stx-bax-law-offices-of-howard-g-smith-reminds-investors-of-class-,20230824T140500,Benzinga,"BENSALEM Pa. , Aug. 24, 2023 ( GLOBE NEWSWIRE ) -- Law Offices of Howard G. Smith reminds investors that class action lawsuits have been filed on behalf of shareholders of the following publicly-traded companies. Investors have until the deadlines listed below to file a lead plaintiff motion.",-0.051601,Neutral,0.077719,Neutral,0,focused,AI
STX,"SEAGATE TECHNOLOGY SHAREHOLDER ALERT BY FORMER LOUISIANA ATTORNEY GENERAL: KAHN SWICK & FOTI, LLC REMINDS INVESTORS WITH LOSSES IN EXCESS OF $100,000 of Lead Plaintiff Deadline in Class Action Lawsuit Against Seagate Technology Holdings plc - STX - Seagate Tech Hldgs  ( NASDAQ:STX ) ",https://www.benzinga.com/pressreleases/23/08/g33997182/seagate-technology-shareholder-alert-by-former-louisiana-attorney-general-kahn-swick-foti-llc-remi,20230823T023018,Benzinga,"NEW ORLEANS, Aug. 22, 2023 ( GLOBE NEWSWIRE ) -- Kahn Swick & Foti, LLC ( ""KSF"" ) and KSF partner, former Attorney General of Louisiana, Charles C.",0.033846,Neutral,0.275867,Somewhat-Bullish,0,focused,AI
STX,"ROSEN, A LEADING LAW FIRM, Encourages Seagate Technology Holdings plc Investors to Secure Counsel Before Important Deadline in Securities Class Action - STX - Seagate Tech Hldgs  ( NASDAQ:STX ) ",https://www.benzinga.com/pressreleases/23/08/g33994887/rosen-a-leading-law-firm-encourages-seagate-technology-holdings-plc-investors-to-secure-counsel-be,20230822T210949,Benzinga,"NEW YORK, Aug. 22, 2023 ( GLOBE NEWSWIRE ) -- WHY: Rosen Law Firm, a global investor rights law firm, reminds purchasers of the common stock of Seagate Technology Holdings plc STX between September 15, 2020 and October 25, 2022, both dates inclusive ( the ""Class Period"" ) , of the important ...",0.064671,Neutral,0.119532,Neutral,0,broad,
STX,"DEADLINE ALERT for IBRX, BTAI, MNK, and STX: The Law Offices of Frank R. Cruz Reminds Investors of Class Actions on Behalf of Shareholders - BioXcel Therapeutics  ( NASDAQ:BTAI ) , ImmunityBio  ( NASDAQ:IBRX ) ",https://www.benzinga.com/pressreleases/23/08/g33987265/deadline-alert-for-ibrx-btai-mnk-and-stx-the-law-offices-of-frank-r-cruz-reminds-investors-of-clas,20230822T151100,Benzinga,"LOS ANGELES, Aug. 22, 2023 ( GLOBE NEWSWIRE ) -- The Law Offices of Frank R. Cruz reminds investors that class action lawsuits have been filed on behalf of shareholders of the following publicly-traded companies. Investors have until the deadlines listed below to file a lead plaintiff motion.",-0.108784,Neutral,0.076115,Neutral,0,focused,AI
STX,"Bragar Eagel & Squire, P.C. Reminds Investors That Class Action Lawsuits Have Been Filed Against ImmunityBio, BioXcel, and Seagate and Encourages Investors to Contact the Firm - BioXcel Therapeutics  ( NASDAQ:BTAI ) , ImmunityBio  ( NASDAQ:IBRX ) ",https://www.benzinga.com/pressreleases/23/08/g33975581/bragar-eagel-squire-p-c-reminds-investors-that-class-action-lawsuits-have-been-filed-against-immun,20230822T010000,Benzinga,"NEW YORK, Aug. 21, 2023 ( GLOBE NEWSWIRE ) -- Bragar Eagel & Squire, P.C., a nationally recognized shareholder rights law firm, reminds investors that class actions have been commenced on behalf of stockholders of ImmunityBio, Inc. IBRX, BioXcel Therapeutics, Inc.",-0.01696,Neutral,0.078354,Neutral,0,focused,AI
STX,"ROSEN, GLOBAL INVESTOR COUNSEL, Encourages Seagate Technology Holdings plc Investors to Secure Counsel Before Important Deadline in Securities Class Action - STX",https://markets.businessinsider.com/news/stocks/rosen-global-investor-counsel-encourages-seagate-technology-holdings-plc-investors-to-secure-counsel-before-important-deadline-in-securities-class-action-stx-1032571191,20230821T230000,Business Insider,"ROSEN, GLOBAL INVESTOR COUNSEL, Encourages Seagate Technology Holdings plc Investors to Secure Counsel Before Important Deadline in Securities Class Action ...",0.088632,Neutral,0.124164,Neutral,0,broad,
STX,"STX CLASS ACTION: Hagens Berman, National Trial Attorneys, Encourages Seagate Technology  ( STX )  Investors with Substantial Losses to Contact Firm, Securities Fraud Lawsuit Pending - Seagate Tech Hldgs  ( NASDAQ:STX ) ",https://www.benzinga.com/pressreleases/23/08/g33969305/stx-class-action-hagens-berman-national-trial-attorneys-encourages-seagate-technology-stx-investor,20230821T180404,Benzinga,"SAN FRANCISCO, Aug. 21, 2023 ( GLOBE NEWSWIRE ) -- Hagens Berman urges Seagate Technology Holdings plc STX investors who suffered substantial losses to submit your losses now.",-0.036693,Neutral,0.218817,Somewhat-Bearish,0,broad,
STX,Glancy Prongay & Murray LLP Reminds Investors of Looming Deadline in the Class Action Lawsuit Against Seagate Technology Holdings plc  ( STX )  - Seagate Tech Hldgs  ( NASDAQ:STX ) ,https://www.benzinga.com/pressreleases/23/08/g33965523/glancy-prongay-murray-llp-reminds-investors-of-looming-deadline-in-the-class-action-lawsuit-agains,20230821T150800,Benzinga,"LOS ANGELES, Aug. 21, 2023 ( GLOBE NEWSWIRE ) -- Glancy Prongay & Murray LLP ( ""GPM"" ) reminds investors of the upcoming September 8, 2023 deadline to file a lead plaintiff motion in the class action filed on behalf of investors who purchased or otherwise acquired Seagate Technology Holdings plc ...",-0.052936,Neutral,0.198493,Neutral,0,focused,AI
STX,"STX LOSS ALERT: ROSEN, A TRUSTED AND LEADING LAW FIRM, Encourages Seagate Technology Holdings plc Investors to Secure Counsel Before Important Deadline in Securities Class Action - STX",https://www.prnewswire.com/news-releases/stx-loss-alert-rosen-a-trusted-and-leading-law-firm-encourages-seagate-technology-holdings-plc-investors-to-secure-counsel-before-important-deadline-in-securities-class-action--stx-301904958.html,20230820T200400,PR Newswire,"STX LOSS ALERT: ROSEN, A TRUSTED AND LEADING LAW FIRM, Encourages Seagate Technology Holdings plc ... PR ...",0.122143,Neutral,0.125789,Neutral,0,broad,
STX,SHAREHOLDER ALERT: Pomerantz Law Firm Investigates Claims On Behalf of Investors of Seagate Technology Holdings plc - STX,https://www.benzinga.com/pressreleases/23/08/g33952807/shareholder-alert-pomerantz-law-firm-investigates-claims-on-behalf-of-investors-of-seagate-technol,20230820T175016,Benzinga,"NEW YORK, Aug. 20, 2023 ( GLOBE NEWSWIRE ) -- Pomerantz LLP is investigating claims on behalf of investors of Seagate Technology Holdings plc ( ""Seagate"" or the ""Company"" ) STX. Such investors are advised to contact Robert S. Willoughby at newaction@pomlaw.com or 888-476-6529, ext. 7980.",-0.036184,Neutral,0.240489,Neutral,0,focused,"AI, ML"
STX,"SEAGATE SHAREHOLDER ACTION REMINDER: Securities Litigation Partner James  ( Josh )  Wilson Encourages Investors Who Suffered Losses Exceeding $100,000 In Seagate To Contact Him Directly To Discuss Their Options",https://www.prnewswire.com/news-releases/seagate-shareholder-action-reminder-securities-litigation-partner-james-josh-wilson-encourages-investors-who-suffered-losses-exceeding-100-000-in-seagate-to-contact-him-directly-to-discuss-their-options-301904948.html,20230819T150000,PR Newswire,SEAGATE SHAREHOLDER ACTION REMINDER: Securities Litigation Partner James ( Josh ) Wilson Encourages ... PR ...,0.095895,Neutral,0.161349,Neutral,0,broad,
STX,"SEAGATE TECHNOLOGY SHAREHOLDER ALERT BY FORMER LOUISIANA ATTORNEY GENERAL: KAHN SWICK & FOTI, LLC REMINDS INVESTORS WITH LOSSES IN EXCESS OF $100,000 of Lead Plaintiff Deadline in Class Action Lawsuit Against Seagate Technology Holdings plc - STX",https://www.prnewswire.com/news-releases/seagate-technology-shareholder-alert-by-former-louisiana-attorney-general-kahn-swick--foti-llc-reminds-investors-with-losses-in-excess-of-100-000-of-lead-plaintiff-deadline-in-class-action-lawsuit-against-seagate-technology-ho-301904833.html,20230819T025000,PR Newswire,SEAGATE TECHNOLOGY SHAREHOLDER ALERT BY FORMER LOUISIANA ATTORNEY GENERAL: KAHN SWICK ... PR ...,0.055867,Neutral,0.295867,Somewhat-Bullish,0,focused,AI
STX,SHAREHOLDER ALERT: Pomerantz Law Firm Investigates Claims On Behalf of Investors of Seagate Technology Holdings plc - STX,https://www.prnewswire.com/news-releases/shareholder-alert-pomerantz-law-firm-investigates-claims-on-behalf-of-investors-of-seagate-technology-holdings-plc---stx-301904693.html,20230818T202000,PR Newswire,SHAREHOLDER ALERT: Pomerantz Law Firm Investigates Claims On Behalf of Investors of Seagate Technology ... PR ...,-0.017005,Neutral,0.247838,Neutral,0,focused,AI
STX,STX LAWSUIT ALERT: Levi & Korsinsky Notifies Seagate Technology Holdings plc Investors of a Class Action Lawsuit and Upcoming Deadline - Seagate Tech Hldgs  ( NASDAQ:STX ) ,https://www.benzinga.com/pressreleases/23/08/g33919191/stx-lawsuit-alert-levi-korsinsky-notifies-seagate-technology-holdings-plc-investors-of-a-class-act,20230818T162600,Benzinga,"NEW YORK, Aug. 18, 2023 ( GLOBE NEWSWIRE ) -- Levi & Korsinsky, LLP notifies investors in Seagate Technology Holdings plc ( ""Seagate"" or the ""Company"" ) STX of a class action securities lawsuit.",-0.067585,Neutral,0.259267,Neutral,0,broad,
STX,STX LAWSUIT ALERT: Levi & Korsinsky Notifies Seagate Technology Holdings plc Investors of a Class Action Lawsuit and Upcoming Deadline - Seagate Tech Hldgs  ( NASDAQ:STX ) ,https://www.benzinga.com/pressreleases/23/08/g33919179/stx-lawsuit-alert-levi-korsinsky-notifies-seagate-technology-holdings-plc-investors-of-a-class-act,20230818T162500,Benzinga,"NEW YORK, Aug. 18, 2023 ( GLOBE NEWSWIRE ) -- Levi & Korsinsky, LLP notifies investors in Seagate Technology Holdings plc ( ""Seagate"" or the ""Company"" ) STX of a class action securities lawsuit.",-0.069995,Neutral,0.260189,Neutral,0,broad,
STX,FILING DEADLINE--Kuznicki Law PLLC Announces Class Action on Behalf of Shareholders of Seagate Technology Holdings plc - STX - Seagate Tech Hldgs  ( NASDAQ:STX ) ,https://www.benzinga.com/pressreleases/23/08/g33887539/filing-deadline-kuznicki-law-pllc-announces-class-action-on-behalf-of-shareholders-of-seagate-tech,20230817T024031,Benzinga,"CEDARHURST, N.Y., Aug. 16, 2023 ( GLOBE NEWSWIRE ) -- The securities litigation law firm of Kuznicki Law PLLC issues this alert to shareholders of Seagate Technology Holdings plc STX, if they purchased the Company's shares between September 15, 2020 and October 25, 2022, inclusive ( the ""Class ...",0.133724,Neutral,0.401331,Somewhat-Bullish,0,broad,
STX,"Bragar Eagel & Squire, P.C. Reminds Investors That Class Action Lawsuits Have Been Filed Against ImmunityBio, BioXcel, and Seagate and Encourages Investors to Contact the Firm - BioXcel Therapeutics  ( NASDAQ:BTAI ) , ImmunityBio  ( NASDAQ:IBRX ) ",https://www.benzinga.com/pressreleases/23/08/g33886785/bragar-eagel-squire-p-c-reminds-investors-that-class-action-lawsuits-have-been-filed-against-immun,20230817T010000,Benzinga,"NEW YORK, Aug. 16, 2023 ( GLOBE NEWSWIRE ) -- Bragar Eagel & Squire, P.C., a nationally recognized shareholder rights law firm, reminds investors that class actions have been commenced on behalf of stockholders of ImmunityBio, Inc. IBRX, BioXcel Therapeutics, Inc.",-0.01696,Neutral,0.078354,Neutral,0,focused,AI
STX,"ROSEN, A HIGHLY RECOGNIZED LAW FIRM, Encourages Seagate Technology Holdings plc Investors with Losses to Secure Counsel Before Important Deadline in Securities Class Action - STX",https://markets.businessinsider.com/news/stocks/rosen-a-highly-recognized-law-firm-encourages-seagate-technology-holdings-plc-investors-with-losses-to-secure-counsel-before-important-deadline-in-securities-class-action-stx-1032560763,20230816T163100,Business Insider,"ROSEN, A HIGHLY RECOGNIZED LAW FIRM, Encourages Seagate Technology Holdings plc Investors with Losses to Secure Counsel Before Important Deadline in Securities Class Action ...",0.095762,Neutral,0.122894,Neutral,0,broad,
STX,"SEAGATE TECHNOLOGY SHAREHOLDER ALERT: CLAIMSFILER REMINDS INVESTORS WITH LOSSES IN EXCESS OF $100,000 of Lead Plaintiff Deadline in Class Action Lawsuit Against Seagate Technology Holdings plc - STX - Seagate Tech Hldgs  ( NASDAQ:STX ) ",https://www.benzinga.com/pressreleases/23/08/g33869872/seagate-technology-shareholder-alert-claimsfiler-reminds-investors-with-losses-in-excess-of-100-00,20230816T020501,Benzinga,"NEW ORLEANS, Aug. 15, 2023 ( GLOBE NEWSWIRE ) -- ClaimsFiler, a FREE shareholder information service, reminds investors that they have until September 8, 2023 to file lead plaintiff applications in a securities class action lawsuit against Seagate Technology Holdings plc STX, if they purchased ...",0.203906,Somewhat-Bullish,0.333257,Somewhat-Bullish,0,focused,AI
STX,"DEADLINE ALERT for IBRX, BTAI, MNK, and STX: The Law Offices of Frank R. Cruz Reminds Investors of Class Actions on Behalf of Shareholders - BioXcel Therapeutics  ( NASDAQ:BTAI ) , ImmunityBio  ( NASDAQ:IBRX ) ",https://www.benzinga.com/pressreleases/23/08/g33861517/deadline-alert-for-ibrx-btai-mnk-and-stx-the-law-offices-of-frank-r-cruz-reminds-investors-of-clas,20230815T151500,Benzinga,"LOS ANGELES, Aug. 15, 2023 ( GLOBE NEWSWIRE ) -- The Law Offices of Frank R. Cruz reminds investors that class action lawsuits have been filed on behalf of shareholders of the following publicly-traded companies. Investors have until the deadlines listed below to file a lead plaintiff motion.",-0.108784,Neutral,0.076115,Neutral,0,focused,AI
STX,"These 3 Tech Stocks Delivering High-Dividend Yields Are Recommended By Wall Street's Most Accurate Analysts - Adtran  ( NASDAQ:ADTN ) , IBM  ( NYSE:IBM ) ",https://www.benzinga.com/trading-ideas/long-ideas/23/08/33829678/these-3-tech-stocks-delivering-high-dividend-yields-are-recommended-by-wall-streets-most,20230814T123342,Benzinga,"During times of turbulence and uncertainty in the markets, many investors turn to dividend-yielding stocks. These are often companies that have high free cash flows and reward shareholders with a high dividend payout.",0.078115,Neutral,0.11983,Bullish,0,focused,AI
STX,"ROSEN, A HIGHLY RECOGNIZED LAW FIRM, Encourages Seagate Technology Holdings plc Investors with Losses to Secure Counsel Before Important Deadline in Securities Class Action - STX - Seagate Tech Hldgs  ( NASDAQ:STX ) ",https://www.benzinga.com/pressreleases/23/08/g33807798/rosen-a-highly-recognized-law-firm-encourages-seagate-technology-holdings-plc-investors-with-losse,20230813T160000,Benzinga,"NEW YORK, Aug. 13, 2023 ( GLOBE NEWSWIRE ) -- WHY: Rosen Law Firm, a global investor rights law firm, reminds purchasers of the common stock of Seagate Technology Holdings plc STX between September 15, 2020 and October 25, 2022, both dates inclusive ( the ""Class Period"" ) , of the important ...",0.071823,Neutral,0.118354,Neutral,0,broad,
STX,"ROSEN, TOP RANKED GLOBAL COUNSEL, Encourages Seagate Technology Holdings plc Investors to Secure Counsel Before Important Deadline in Securities Class Action - STX",https://www.prnewswire.com/news-releases/rosen-top-ranked-global-counsel-encourages-seagate-technology-holdings-plc-investors-to-secure-counsel-before-important-deadline-in-securities-class-action--stx-301898898.html,20230812T161200,PR Newswire,"ROSEN, TOP RANKED GLOBAL COUNSEL, Encourages Seagate Technology Holdings plc Investors to Secure ... PR ...",0.12923,Neutral,0.124486,Neutral,0,broad,
STX,"ROSEN, TOP RANKED GLOBAL COUNSEL, Encourages Seagate Technology Holdings plc Investors to Secure Counsel Before Important Deadline in Securities Class Action - STX",https://markets.businessinsider.com/news/stocks/rosen-top-ranked-global-counsel-encourages-seagate-technology-holdings-plc-investors-to-secure-counsel-before-important-deadline-in-securities-class-action-stx-1032548292,20230812T161200,Business Insider,"ROSEN, TOP RANKED GLOBAL COUNSEL, Encourages Seagate Technology Holdings plc Investors to Secure Counsel Before Important Deadline in Securities Class Action ...",0.083937,Neutral,0.127456,Neutral,0,broad,
STX,"SEAGATE DEADLINE NOTICE: Securities Litigation Partner James  ( Josh )  Wilson Encourages Investors Who Suffered Losses Exceeding $100,000 In Seagate To Contact Him Directly To Discuss Their Options",https://www.prnewswire.com/news-releases/seagate-deadline-notice-securities-litigation-partner-james-josh-wilson-encourages-investors-who-suffered-losses-exceeding-100-000-in-seagate-to-contact-him-directly-to-discuss-their-options-301898951.html,20230812T150000,PR Newswire,SEAGATE DEADLINE NOTICE: Securities Litigation Partner James ( Josh ) Wilson Encourages Investors Who Suffered ... PR ...,0.095895,Neutral,0.161349,Neutral,0,broad,
STX,Seagate Deadline Notice,https://markets.businessinsider.com/news/stocks/seagate-deadline-notice-1032548125,20230812T020600,Business Insider,"Securities Litigation Partner James ( Josh ) Wilson Encourages Investors Who Suffered Losses Exceeding $100,000 In Seagate To Contact Him Directly To Discuss Their Options",0.098582,Neutral,0.152821,Neutral,0,broad,
STX,"Bragar Eagel & Squire, P.C. Reminds Investors That Class Action Lawsuits Have Been Filed Against Seagate, Baxter, Danaher, and Syneos and Encourages Investors to Contact the Firm - Baxter Intl  ( NYSE:BAX ) , Danaher  ( NYSE:DHR ) ",https://www.benzinga.com/pressreleases/23/08/g33768199/bragar-eagel-squire-p-c-reminds-investors-that-class-action-lawsuits-have-been-filed-against-seaga,20230812T010000,Benzinga,"NEW YORK, Aug. 11, 2023 ( GLOBE NEWSWIRE ) -- Bragar Eagel & Squire, P.C., a nationally recognized shareholder rights law firm, reminds investors that class actions have been commenced on behalf of stockholders of Seagate Technology Holdings Plc STX, Baxter International, Inc.",-0.100911,Neutral,0.06211,Neutral,0,focused,AI
