ticker,title,url,time_published,source,summary,sentiment_score,sentiment_label,ticker_sentiment_score,ticker_sentiment_label,relevance_score,category,ai_keywords_found
VNET,"Bragar Eagel & Squire, P.C. Reminds Investors That Class Action Lawsuits Have Been Filed Against VNET, Assertio, and Cummins and Encourages Investors to Contact the Firm - Assertio Holdings  ( NASDAQ:ASRT ) , Cummins  ( NYSE:CMI ) ",https://www.benzinga.com/pressreleases/24/02/g36946421/bragar-eagel-squire-p-c-reminds-investors-that-class-action-lawsuits-have-been-filed-against-vnet-,20240206T020000,Benzinga,"NEW YORK, Feb. 05, 2024 ( GLOBE NEWSWIRE ) -- Bragar Eagel & Squire, P.C., a nationally recognized shareholder rights law firm, reminds investors that class actions have been commenced on behalf of stockholders of VNET Group, Inc. VNET, Assertio Holdings, Inc. ASRT, and Cummins Inc.",0.060993,Neutral,0.261117,Somewhat-Bullish,0,focused,AI
VNET,"SHAREHOLDER ALERT: Levi & Korsinsky Notifies VNET Group, Inc.  ( VNET )  Investors of a Class Action Lawsuit and Upcoming Deadline - VNET Gr  ( NASDAQ:VNET ) ",https://www.benzinga.com/pressreleases/24/02/g36937831/shareholder-alert-levi-korsinsky-notifies-vnet-group-inc-vnet-investors-of-a-class-action-lawsuit-,20240205T175400,Benzinga,"NEW YORK, Feb. 05, 2024 ( GLOBE NEWSWIRE ) -- Levi & Korsinsky, LLP notifies investors in VNET Group, Inc. ( ""VNET"" or the ""Company"" ) VNET of a class action securities lawsuit.",0.10721,Neutral,0.704675,Somewhat-Bullish,0,broad,
VNET,"ROSEN, A TOP RANKED LAW FIRM, Encourages VNET Group, Inc. Investors with Losses to Secure Counsel Before Important Deadline in Securities Class Action - VNET",https://www.prnewswire.com/news-releases/rosen-a-top-ranked-law-firm-encourages-vnet-group-inc-investors-with-losses-to-secure-counsel-before-important-deadline-in-securities-class-action--vnet-302052478.html,20240204T180000,PR Newswire,"ROSEN, A TOP RANKED LAW FIRM, Encourages VNET Group, Inc. Investors with Losses to Secure Counsel Before ... PR ...",0.231476,Somewhat-Bullish,0.482304,Somewhat-Bullish,0,broad,
VNET,"ROSEN, GLOBAL INVESTOR COUNSEL, Encourages VNET Group, Inc. Investors to Secure Counsel Before Important Deadline in Securities Class Action - VNET - VNET Gr  ( NASDAQ:VNET ) ",https://www.benzinga.com/pressreleases/24/02/g36923776/rosen-global-investor-counsel-encourages-vnet-group-inc-investors-to-secure-counsel-before-importa,20240203T213000,Benzinga,"NEW YORK, Feb. 03, 2024 ( GLOBE NEWSWIRE ) -- WHY: Rosen Law Firm, a global investor rights law firm, reminds purchasers of securities of VNET Group, Inc. VNET between April 8, 2022 and February 15, 2023, both dates inclusive ( the ""Class Period"" ) , of the important February 26, 2024 lead ...",0.165453,Somewhat-Bullish,0.410697,Neutral,0,broad,
VNET,"SHAREHOLDER ALERT: Pomerantz Law Firm Announces the Filing of a Class Action Against VNET Group, Inc. - VNET - VNET Gr  ( NASDAQ:VNET ) ",https://www.benzinga.com/pressreleases/24/02/g36923423/shareholder-alert-pomerantz-law-firm-announces-the-filing-of-a-class-action-against-vnet-group-inc,20240203T175300,Benzinga,"NEW YORK, Feb. 03, 2024 ( GLOBE NEWSWIRE ) -- Pomerantz LLP announces that a class action lawsuit has been filed against VNET Group, Inc. ( ""VNET"" or the ""Company"" ) VNET. Such investors are advised to contact Danielle Peyton at newaction@pomlaw.com or 646-581-9980, ( or 888.4-POMLAW ) , ...",0.246606,Somewhat-Bullish,0.517168,Bullish,0,focused,"AI, ML"
VNET,VNET SHAREHOLDER ACTION REMINDER: Securities Litigation Partner James (Josh) Wilson Encourages Investors ... - PR Newswire,https://www.prnewswire.com/news-releases/vnet-shareholder-action-reminder-securities-litigation-partner-james-josh-wilson-encourages-investors-who-suffered-losses-exceeding-50-000-in-vnet-to-contact-him-directly-to-discuss-their-options-302051531.html,20240202T164500,PR Newswire,VNET SHAREHOLDER ACTION REMINDER: Securities Litigation Partner James ( Josh ) Wilson Encourages Investors ... PR ...,0.284822,Somewhat-Bullish,0.461468,Somewhat-Bullish,0,broad,
VNET,"SHAREHOLDER ALERT: The Gross Law Firm Notifies Shareholders of VNET Group, Inc. of a Class Action Lawsuit and a Lead Plaintiff Deadline of February 26, 2024 -  ( NASDAQ: VNET ) ",https://www.prnewswire.com/news-releases/shareholder-alert-the-gross-law-firm-notifies-shareholders-of-vnet-group-inc-of-a-class-action-lawsuit-and-a-lead-plaintiff-deadline-of-february-26-2024--nasdaq-vnet-302051289.html,20240202T104500,PR Newswire,"SHAREHOLDER ALERT: The Gross Law Firm Notifies Shareholders of VNET Group, Inc. of a Class Action Lawsuit and ... PR ...",0.00753,Neutral,0.653656,Somewhat-Bullish,0,focused,AI
VNET,"VNET INVESTOR DEADLINE APPROACHING: Faruqi & Faruqi Securities Litigation Partner James  ( Josh )  Wilson Encourages Investors Who Suffered Losses Exceeding $50,000 In VNET To Contact Him Directly To Discuss Their Options - VNET Gr  ( NASDAQ:VNET ) ",https://www.benzinga.com/pressreleases/24/02/g36903506/vnet-investor-deadline-approaching-faruqi-faruqi-securities-litigation-partner-james-josh-wilson-e,20240202T023000,Benzinga,"If you suffered losses exceeding $50,000 investing in VNET stock or options between April 8, 2022 and February 15, 2023 and would like to discuss your legal rights, call Faruqi & Faruqi partner Josh Wilson directly at 877-247-4292 or 212-983-9330 ( Ext. 1310 ) .",0.286691,Somewhat-Bullish,0.481677,Somewhat-Bullish,0,broad,
VNET,"Bragar Eagel & Squire, P.C. Reminds Investors That Class Action Lawsuits Have Been Filed Against Estee, VNET, Assertio, and Cummins and Encourages Investors to Contact the Firm - Assertio Holdings  ( NASDAQ:ASRT ) , Cummins  ( NYSE:CMI ) ",https://www.benzinga.com/pressreleases/24/02/g36903365/bragar-eagel-squire-p-c-reminds-investors-that-class-action-lawsuits-have-been-filed-against-estee,20240202T020000,Benzinga,"NEW YORK, Feb. 01, 2024 ( GLOBE NEWSWIRE ) -- Bragar Eagel & Squire, P.C., a nationally recognized shareholder rights law firm, reminds investors that class actions have been commenced on behalf of stockholders of Estee Lauder Companies Inc. EL, VNET Group, Inc. VNET, Assertio Holdings, Inc.",0.046438,Neutral,0.240489,Somewhat-Bullish,0,focused,AI
VNET,"DEADLINE ALERT for VNET, MSS, and ASRT: The Law Offices of Frank R. Cruz Reminds Investors of Class Actions on Behalf of Shareholders - Assertio Holdings  ( NASDAQ:ASRT ) , Maison Solutions  ( NASDAQ:MSS ) ",https://www.benzinga.com/pressreleases/24/02/g36893492/deadline-alert-for-vnet-mss-and-asrt-the-law-offices-of-frank-r-cruz-reminds-investors-of-class-ac,20240201T170600,Benzinga,"LOS ANGELES, Feb. 01, 2024 ( GLOBE NEWSWIRE ) -- The Law Offices of Frank R. Cruz reminds investors that class action lawsuits have been filed on behalf of shareholders of the following publicly-traded companies. Investors have until the deadlines listed below to file a lead plaintiff motion.",0.024545,Neutral,0.323927,Neutral,0,focused,AI
VNET,"ROSEN, A RANKED AND LEADING FIRM, Encourages VNET Group, Inc. Investors to Secure Counsel Before Important Deadline in Securities Class Action - VNET - VNET Gr  ( NASDAQ:VNET ) ",https://www.benzinga.com/pressreleases/24/01/g36858289/rosen-a-ranked-and-leading-firm-encourages-vnet-group-inc-investors-to-secure-counsel-before-impor,20240131T012600,Benzinga,"NEW YORK, Jan. 30, 2024 ( GLOBE NEWSWIRE ) -- WHY: Rosen Law Firm, a global investor rights law firm, reminds purchasers of securities of VNET Group, Inc. VNET between April 8, 2022 and February 15, 2023, both dates inclusive ( the ""Class Period"" ) , of the important February 26, 2024 lead ...",0.165453,Somewhat-Bullish,0.410697,Neutral,0,broad,
VNET,"Glancy Prongay & Murray LLP Reminds Investors of Looming Deadline in the Class Action Lawsuit Against VNET Group, Inc.  ( VNET )  - VNET Gr  ( NASDAQ:VNET ) ",https://www.benzinga.com/pressreleases/24/01/g36851442/glancy-prongay-murray-llp-reminds-investors-of-looming-deadline-in-the-class-action-lawsuit-agains,20240130T180202,Benzinga,"LOS ANGELES, Jan. 30, 2024 ( GLOBE NEWSWIRE ) -- Glancy Prongay & Murray LLP ( ""GPM"" ) reminds investors of the upcoming February 26, 2024 deadline to file a lead plaintiff motion in the class action filed on behalf of investors who purchased or otherwise acquired VNET Group, Inc. ( ""VNET"" or ...",0.205444,Somewhat-Bullish,0.505628,Somewhat-Bullish,0,focused,AI
VNET,"SHAREHOLDER ALERT: Levi & Korsinsky Notifies VNET Group, Inc.  ( VNET )  Investors of a Class Action Lawsuit and Upcoming Deadline - VNET Gr  ( NASDAQ:VNET ) ",https://www.benzinga.com/pressreleases/24/01/g36829613/shareholder-alert-levi-korsinsky-notifies-vnet-group-inc-vnet-investors-of-a-class-action-lawsuit-,20240129T173400,Benzinga,"NEW YORK, Jan. 29, 2024 ( GLOBE NEWSWIRE ) -- Levi & Korsinsky, LLP notifies investors in VNET Group, Inc. ( ""VNET"" or the ""Company"" ) VNET of a class action securities lawsuit.",0.10721,Neutral,0.704675,Somewhat-Bullish,0,broad,
VNET,"ROSEN, TOP RANKED GLOBAL COUNSEL, Encourages VNET Group, Inc. Investors with Losses to Secure Counsel Before Important Deadline in Securities Class Action - VNET",https://www.prnewswire.com/news-releases/rosen-top-ranked-global-counsel-encourages-vnet-group-inc-investors-with-losses-to-secure-counsel-before-important-deadline-in-securities-class-action--vnet-302046365.html,20240129T060000,PR Newswire,"ROSEN, TOP RANKED GLOBAL COUNSEL, Encourages VNET Group, Inc. Investors with Losses to Secure Counsel ... PR ...",0.231476,Somewhat-Bullish,0.482304,Somewhat-Bullish,0,broad,
VNET,"Bragar Eagel & Squire, P.C. Reminds Investors That Class Action Lawsuits Have Been Filed Against Estee, VNET, Assertio, and Cummins and Encourages Investors to Contact the Firm - Assertio Holdings  ( NASDAQ:ASRT ) , Cummins  ( NYSE:CMI ) ",https://www.benzinga.com/pressreleases/24/01/g36818618/bragar-eagel-squire-p-c-reminds-investors-that-class-action-lawsuits-have-been-filed-against-estee,20240129T020000,Benzinga,"NEW YORK, Jan. 28, 2024 ( GLOBE NEWSWIRE ) -- Bragar Eagel & Squire, P.C., a nationally recognized shareholder rights law firm, reminds investors that class actions have been commenced on behalf of stockholders of Estee Lauder Companies Inc. EL, VNET Group, Inc. VNET, Assertio Holdings, Inc.",0.046438,Neutral,0.240489,Somewhat-Bullish,0,focused,AI
VNET,"SHAREHOLDER ACTION ALERT: The Schall Law Firm Encourages Investors in VNET Group, Inc. with Losses of $100,000 to Contact the Firm",https://markets.businessinsider.com/news/stocks/shareholder-action-alert-the-schall-law-firm-encourages-investors-in-vnet-group-inc-with-losses-of-100-000-to-contact-the-firm-1033002508,20240127T045500,Business Insider,"LOS ANGELES, CA / ACCESSWIRE / January 26, 2024 / The Schall Law Firm, a national shareholder rights litigation firm, reminds investors of a class action lawsuit against VNET Group, Inc. ( ""VNET"" or ""the Company"" ) ( NASDAQ:VNET ) for violations of 10 ( b ) and 20 ( a ) of the Securities ...",-0.078198,Neutral,0.490323,Somewhat-Bearish,0,focused,AI
VNET,"SHAREHOLDER ALERT: Pomerantz Law Firm Announces the Filing of a Class Action Against VNET Group, Inc. - VNET - VNET Gr  ( NASDAQ:VNET ) ",https://www.benzinga.com/pressreleases/24/01/g36803535/shareholder-alert-pomerantz-law-firm-announces-the-filing-of-a-class-action-against-vnet-group-inc,20240126T155126,Benzinga,"NEW YORK, Jan. 26, 2024 ( GLOBE NEWSWIRE ) -- Pomerantz LLP announces that a class action lawsuit has been filed against VNET Group, Inc. ( ""VNET"" or the ""Company"" ) VNET. Such investors are advised to contact Danielle Peyton at newaction@pomlaw.com or 646-581-9980, ( or 888.4-POMLAW ) , ...",0.246606,Somewhat-Bullish,0.517168,Bullish,0,focused,"AI, ML"
VNET,"SHAREHOLDER ALERT: The Gross Law Firm Notifies Shareholders of VNET Group, Inc. of a Class Action Lawsuit and a Lead Plaintiff Deadline of February 26, 2024 -  ( NASDAQ: VNET ) ",https://www.prnewswire.com/news-releases/shareholder-alert-the-gross-law-firm-notifies-shareholders-of-vnet-group-inc-of-a-class-action-lawsuit-and-a-lead-plaintiff-deadline-of-february-26-2024--nasdaq-vnet-302045285.html,20240126T104500,PR Newswire,"SHAREHOLDER ALERT: The Gross Law Firm Notifies Shareholders of VNET Group, Inc. of a Class Action Lawsuit and ... PR ...",0.00753,Neutral,0.653656,Somewhat-Bullish,0,focused,AI
VNET,"ROSEN, A GLOBALLY RECOGNIZED LAW FIRM, Encourages VNET Group, Inc. Investors with Losses to Secure Counsel Before Important Deadline in Securities Class Action - VNET - VNET Gr  ( NASDAQ:VNET ) ",https://www.benzinga.com/pressreleases/24/01/g36794708/rosen-a-globally-recognized-law-firm-encourages-vnet-group-inc-investors-with-losses-to-secure-cou,20240126T013200,Benzinga,"NEW YORK, Jan. 25, 2024 ( GLOBE NEWSWIRE ) -- WHY: Rosen Law Firm, a global investor rights law firm, reminds purchasers of securities of VNET Group, Inc. VNET between April 8, 2022 and February 15, 2023, both dates inclusive ( the ""Class Period"" ) , of the important February 26, 2024 lead ...",0.165453,Somewhat-Bullish,0.410697,Neutral,0,broad,
VNET,"SHAREHOLDER ALERT: Levi & Korsinsky Notifies VNET Group, Inc. ( VNET )  Investors of a Class Action Lawsuit and Upcoming Deadline - VNET Gr  ( NASDAQ:VNET ) ",https://www.benzinga.com/pressreleases/24/01/g36786444/shareholder-alert-levi-korsinsky-notifies-vnet-group-inc-vnet-investors-of-a-class-action-lawsuit-,20240125T180100,Benzinga,"NEW YORK, Jan. 25, 2024 ( GLOBE NEWSWIRE ) -- Levi & Korsinsky, LLP notifies investors in VNET Group, Inc. ( ""VNET"" or the ""Company"" ) VNET of a class action securities lawsuit.",0.10721,Neutral,0.704675,Somewhat-Bullish,0,broad,
VNET,VNET INVESTOR DEADLINE APPROACHING: Securities Litigation Partner James (Josh) Wilson Encourages Investors ... - PR Newswire,https://www.prnewswire.com/news-releases/vnet-investor-deadline-approaching-securities-litigation-partner-james-josh-wilson-encourages-investors-who-suffered-losses-exceeding-50-000-in-vnet-to-contact-him-directly-to-discuss-their-options-302044084.html,20240125T173000,PR Newswire,VNET INVESTOR DEADLINE APPROACHING: Securities Litigation Partner James ( Josh ) Wilson Encourages Investors ... PR ...,0.291308,Somewhat-Bullish,0.462395,Somewhat-Bullish,0,broad,
VNET,"DEADLINE ALERT for VNET, MSS, DADA, and CMI: The Law Offices of Frank R. Cruz Reminds Investors of Class Actions on Behalf of Shareholders - Dada Nexus  ( NASDAQ:DADA ) , Cummins  ( NYSE:CMI ) ",https://www.benzinga.com/pressreleases/24/01/g36785203/deadline-alert-for-vnet-mss-dada-and-cmi-the-law-offices-of-frank-r-cruz-reminds-investors-of-clas,20240125T170700,Benzinga,"LOS ANGELES, Jan. 25, 2024 ( GLOBE NEWSWIRE ) -- The Law Offices of Frank R. Cruz reminds investors that class action lawsuits have been filed on behalf of shareholders of the following publicly-traded companies. Investors have until the deadlines listed below to file a lead plaintiff motion.",0.002459,Neutral,0.308504,Neutral,0,focused,AI
VNET,"Glancy Prongay & Murray LLP Reminds Investors of Looming Deadline in the Class Action Lawsuit Against VNET Group, Inc.  ( VNET )  - VNET Gr  ( NASDAQ:VNET ) ",https://www.benzinga.com/pressreleases/24/01/g36781755/glancy-prongay-murray-llp-reminds-investors-of-looming-deadline-in-the-class-action-lawsuit-agains,20240125T150000,Benzinga,"LOS ANGELES, Jan. 25, 2024 ( GLOBE NEWSWIRE ) -- Glancy Prongay & Murray LLP ( ""GPM"" ) reminds investors of the upcoming February 26, 2024 deadline to file a lead plaintiff motion in the class action filed on behalf of investors who purchased or otherwise acquired VNET Group, Inc. ( ""VNET"" or ...",0.205444,Somewhat-Bullish,0.505628,Somewhat-Bullish,0,focused,AI
VNET,"Bragar Eagel & Squire, P.C. Reminds Investors That Class Action Lawsuits Have Been Filed Against Estee, VNET, and Assertio and Encourages Investors to Contact the Firm - Estee Lauder Cos  ( NYSE:EL ) , Assertio Holdings  ( NASDAQ:ASRT ) ",https://www.benzinga.com/pressreleases/24/01/g36771587/bragar-eagel-squire-p-c-reminds-investors-that-class-action-lawsuits-have-been-filed-against-estee,20240125T020000,Benzinga,"NEW YORK, Jan. 24, 2024 ( GLOBE NEWSWIRE ) -- Bragar Eagel & Squire, P.C., a nationally recognized shareholder rights law firm, reminds investors that class actions have been commenced on behalf of stockholders of Estee Lauder Companies Inc. EL, VNET Group, Inc. VNET, and Assertio Holdings, Inc.",0.068116,Neutral,0.259881,Somewhat-Bullish,0,focused,AI
VNET,"VNET Group, Inc.  ( NASDAQ: VNET )  Securities Fraud: Contact Berger Montague To Discuss Your Rights - VNET Gr  ( NASDAQ:VNET ) ",https://www.benzinga.com/pressreleases/24/01/g36715982/vnet-group-inc-nasdaq-vnet-securities-fraud-contact-berger-montague-to-discuss-your-rights,20240122T140600,Benzinga,"PHILADELPHIA, Jan. 22, 2024 ( GLOBE NEWSWIRE ) -- Attention VNET Group, Inc. ( ""VNET"" ) VNET Investors: A securities fraud class action lawsuit has been filed against VNET on behalf of purchasers of VNET securities between April 8, 2022 and February 15, 2023, inclusive ( the ""Class Period"" ) .",0.262339,Somewhat-Bullish,0.578355,Bullish,0,focused,AI
VNET,"Bragar Eagel & Squire, P.C. Reminds Investors That Class Action Lawsuits Have Been Filed Against Dollar General, Estee, VNET, and Assertio and Encourages Investors to Contact the Firm - Assertio Holdings  ( NASDAQ:ASRT ) , Dollar Gen  ( NYSE:DG ) ",https://www.benzinga.com/pressreleases/24/01/g36708087/bragar-eagel-squire-p-c-reminds-investors-that-class-action-lawsuits-have-been-filed-against-dolla,20240121T020000,Benzinga,"NEW YORK, Jan. 20, 2024 ( GLOBE NEWSWIRE ) -- Bragar Eagel & Squire, P.C., a nationally recognized shareholder rights law firm, reminds investors that class actions have been commenced on behalf of stockholders of Dollar General Corporation DG, Estee Lauder Companies Inc. EL, VNET Group, Inc.",-0.021974,Neutral,0.18706,Somewhat-Bullish,0,focused,AI
VNET,"ROSEN, TRUSTED INVESTOR COUNSEL, Encourages VNET Group, Inc. Investors to Secure Counsel Before Important Deadline in Securities Class Action - VNET - VNET Gr  ( NASDAQ:VNET ) ",https://www.benzinga.com/pressreleases/24/01/g36707514/rosen-trusted-investor-counsel-encourages-vnet-group-inc-investors-to-secure-counsel-before-import,20240120T180100,Benzinga,"NEW YORK, Jan. 20, 2024 ( GLOBE NEWSWIRE ) -- WHY: Rosen Law Firm, a global investor rights law firm, reminds purchasers of securities of VNET Group, Inc. VNET between April 8, 2022 and February 15, 2023, both dates inclusive ( the ""Class Period"" ) , of the important February 26, 2024 lead ...",0.165453,Somewhat-Bullish,0.410697,Neutral,0,broad,
VNET,"ROSEN, A LONGSTANDING LAW FIRM, Encourages VNET Group, Inc. Investors with Losses to Secure Counsel Before Important Deadline in Securities Class Action - VNET",https://www.prnewswire.com/news-releases/rosen-a-longstanding-law-firm-encourages-vnet-group-inc-investors-with-losses-to-secure-counsel-before-important-deadline-in-securities-class-action--vnet-302039693.html,20240119T212900,PR Newswire,"ROSEN, A LONGSTANDING LAW FIRM, Encourages VNET Group, Inc. Investors with Losses to Secure Counsel ... PR ...",0.231476,Somewhat-Bullish,0.483434,Somewhat-Bullish,0,broad,
VNET,"DEADLINE ALERT for GDHG, INSP, DRVN, VNET: Law Offices of Howard G. Smith Reminds Investors of Class Actions on Behalf of Shareholders - Driven Brands Hldgs  ( NASDAQ:DRVN ) , Golden Heaven Group Hldgs  ( NASDAQ:GDHG ) ",https://www.benzinga.com/pressreleases/24/01/g36701540/deadline-alert-for-gdhg-insp-drvn-vnet-law-offices-of-howard-g-smith-reminds-investors-of-class-ac,20240119T203939,Benzinga,"BENSALEM, Pa., Jan. 19, 2024 ( GLOBE NEWSWIRE ) -- Law Offices of Howard G. Smith reminds investors that class action lawsuits have been filed on behalf of shareholders of the following publicly-traded companies. Investors have until the deadlines listed below to file a lead plaintiff motion.",0.036936,Neutral,0.22595,Neutral,0,focused,AI
VNET,"NASDAQ: VNET INVESTOR ALERT: Berger Montague Advises VNET Group, Inc.  ( NASDAQ: VNET )  Investors of February 26, 2024 Deadline - VNET Gr  ( NASDAQ:VNET ) ",https://www.benzinga.com/pressreleases/24/01/g36698401/nasdaq-vnet-investor-alert-berger-montague-advises-vnet-group-inc-nasdaq-vnet-investors-of-februar,20240119T170600,Benzinga,"PHILADELPHIA, Jan. 19, 2024 ( GLOBE NEWSWIRE ) -- Nationally recognized law firm Berger Montague PC advises investors that a securities fraud class action lawsuit has been filed against VNET Group, Inc. ( ""VNET"" ) VNET on behalf of purchasers of VNET securities between April 8, 2022 and February ...",0.227719,Somewhat-Bullish,0.639616,Somewhat-Bullish,0,focused,AI
VNET,"DEADLINE ALERT for VNET, MSS, DADA, and MBLY: The Law Offices of Frank R. Cruz Reminds Investors of Class Actions on Behalf of Shareholders - Dada Nexus  ( NASDAQ:DADA ) , Mobileye Global  ( NASDAQ:MBLY ) ",https://www.benzinga.com/pressreleases/24/01/g36697547/deadline-alert-for-vnet-mss-dada-and-mbly-the-law-offices-of-frank-r-cruz-reminds-investors-of-cla,20240119T161000,Benzinga,"LOS ANGELES, Jan. 19, 2024 ( GLOBE NEWSWIRE ) -- The Law Offices of Frank R. Cruz reminds investors that class action lawsuits have been filed on behalf of shareholders of the following publicly-traded companies. Investors have until the deadlines listed below to file a lead plaintiff motion.",0.002459,Neutral,0.307731,Neutral,0,focused,AI
VNET,"SHAREHOLDER ALERT: The Gross Law Firm Notifies Shareholders of VNET Group, Inc. of a Class Action Lawsuit and a Lead Plaintiff Deadline of February 26, 2024 -  ( NASDAQ: VNET ) ",https://www.prnewswire.com/news-releases/shareholder-alert-the-gross-law-firm-notifies-shareholders-of-vnet-group-inc-of-a-class-action-lawsuit-and-a-lead-plaintiff-deadline-of-february-26-2024--nasdaq-vnet-302038961.html,20240119T104500,PR Newswire,"SHAREHOLDER ALERT: The Gross Law Firm Notifies Shareholders of VNET Group, Inc. of a Class Action Lawsuit and ... PR ...",0.00753,Neutral,0.653656,Somewhat-Bullish,0,focused,AI
VNET,"SHAREHOLDER ALERT: Pomerantz Law Firm Announces the Filing of a Class Action Against VNET Group, Inc. - VNET - VNET Gr  ( NASDAQ:VNET ) ",https://www.benzinga.com/pressreleases/24/01/g36685222/shareholder-alert-pomerantz-law-firm-announces-the-filing-of-a-class-action-against-vnet-group-inc,20240118T202444,Benzinga,"NEW YORK, January 18, 2024 ( GLOBENEWSWIRE ) , Jan. 18, 2024 ( GLOBE NEWSWIRE ) -- Pomerantz LLP announces that a class action lawsuit has been filed against VNET Group, Inc. ( ""VNET"" or the ""Company"" ) VNET. Such investors are advised to contact Danielle Peyton at newaction@pomlaw.com or ...",0.244197,Somewhat-Bullish,0.514619,Bullish,0,focused,"AI, ML"
VNET,"SHAREHOLDER ALERT: Levi & Korsinsky Notifies VNET Group, Inc.  ( VNET )  Investors of a Class Action Lawsuit and Upcoming Deadline - VNET Gr  ( NASDAQ:VNET ) ",https://www.benzinga.com/pressreleases/24/01/g36683328/shareholder-alert-levi-korsinsky-notifies-vnet-group-inc-vnet-investors-of-a-class-action-lawsuit-,20240118T181100,Benzinga,"NEW YORK, Jan. 18, 2024 ( GLOBE NEWSWIRE ) -- Levi & Korsinsky, LLP notifies investors in VNET Group, Inc. ( ""VNET"" or the ""Company"" ) VNET of a class action securities lawsuit.",0.10721,Neutral,0.704675,Somewhat-Bullish,0,broad,
VNET,"VNET SHAREHOLDER NOTICE: Faruqi & Faruqi, LLP Securities Litigation Partner James  ( Josh )  Wilson Encourages Investors Who Suffered Losses Exceeding $50,000 In VNET To Contact Him Directly To Discuss Their Options - VNET Gr  ( NASDAQ:VNET ) ",https://www.benzinga.com/pressreleases/24/01/g36663414/vnet-shareholder-notice-faruqi-faruqi-llp-securities-litigation-partner-james-josh-wilson-encourag,20240117T163000,Benzinga,"If you suffered losses exceeding $50,000 investing in VNET stock or options between April 8, 2022 and February 15, 2023 and would like to discuss your legal rights, call Faruqi & Faruqi partner Josh Wilson directly at 877-247-4292 or 212-983-9330 ( Ext. 1310 ) .",0.286691,Somewhat-Bullish,0.481677,Somewhat-Bullish,0,broad,
VNET,"Bragar Eagel & Squire, P.C. Reminds Investors That Class Action Lawsuits Have Been Filed Against Dollar General, Estee, VNET, and Assertio and Encourages Investors to Contact the Firm - Dollar Gen  ( NYSE:DG ) , Assertio Holdings  ( NASDAQ:ASRT ) ",https://www.benzinga.com/pressreleases/24/01/g36653473/bragar-eagel-squire-p-c-reminds-investors-that-class-action-lawsuits-have-been-filed-against-dolla,20240117T020000,Benzinga,"NEW YORK, Jan. 16, 2024 ( GLOBE NEWSWIRE ) -- Bragar Eagel & Squire, P.C., a nationally recognized shareholder rights law firm, reminds investors that class actions have been commenced on behalf of stockholders of Dollar General Corporation DG, Estee Lauder Companies Inc. EL, VNET Group, Inc.",-0.021974,Neutral,0.18706,Somewhat-Bullish,0,focused,AI
VNET,"ROSEN, TRUSTED INVESTOR COUNSEL, Encourages VNET Group, Inc. Investors with Losses to Secure Counsel Before Important Deadline in Securities Class Action - VNET - VNET Gr  ( NASDAQ:VNET ) ",https://www.benzinga.com/pressreleases/24/01/g36648874/rosen-trusted-investor-counsel-encourages-vnet-group-inc-investors-with-losses-to-secure-counsel-b,20240116T195600,Benzinga,"NEW YORK, Jan. 16, 2024 ( GLOBE NEWSWIRE ) -- WHY: Rosen Law Firm, a global investor rights law firm, reminds purchasers of securities of VNET Group, Inc. VNET between April 8, 2022 and February 15, 2023, both dates inclusive ( the ""Class Period"" ) , of the important February 26, 2024 lead ...",0.165453,Somewhat-Bullish,0.410697,Neutral,0,broad,
