ticker,title,url,time_published,source,summary,sentiment_score,sentiment_label,ticker_sentiment_score,ticker_sentiment_label,relevance_score,category,ai_keywords_found
VRNT,Ada appoints new Chief Marketing Officer and VP of People to help scale company growth and culture,https://www.newswire.ca/news-releases/ada-appoints-new-chief-marketing-officer-and-vp-of-people-to-help-scale-company-growth-and-culture-814119760.html,20221130T140000,Canada Newswire,Industry veterans Diego Lomanto and Ruby White join to accelerate Ada's go-to-market strategy and people and culture initiatives,0.309306,Somewhat-Bullish,0.059636,Neutral,0,broad,
VRNT,The Growing Prevalence Of Social Media Fraud Is Expected To Drive The Open Source Intelligence Market As Per The Business Research Company's Open Source Intelligence Global Market Report 2022,https://www.benzinga.com/pressreleases/22/11/g29873167/the-growing-prevalence-of-social-media-fraud-is-expected-to-drive-the-open-source-intelligence-mar,20221128T163000,Benzinga,"LONDON, Nov. 28, 2022 ( GLOBE NEWSWIRE ) -- Avail a limited period discount of 33% on our uniquely designed Opportunities and Strategies market research reports. Contact us today and make winning strategies!",0.147387,Neutral,0.03804,Neutral,0,focused,AI
VRNT,Magic Software  ( MGIC )  Q3 Earnings and Revenues Top Estimates,https://www.zacks.com/stock/news/2017808/magic-software-mgic-q3-earnings-and-revenues-top-estimates,20221114T141507,Zacks Commentary,"Magic Software (MGIC) delivered earnings and revenue surprises of 3.70% and 9.31%, respectively, for the quarter ended September 2022. Do the numbers hold clues to what lies ahead for the stock?",0.169192,Somewhat-Bullish,0.205225,Neutral,0,broad,
VRNT,The Rising Adoption Of CRM Systems By Hospitals Is Expected To Drive The Healthcare CRM Market As Per The Business Research Company's Healthcare CRM Global Market Report 2022,https://www.benzinga.com/pressreleases/22/11/g29525777/the-rising-adoption-of-crm-systems-by-hospitals-is-expected-to-drive-the-healthcare-crm-market-as-,20221102T153000,Benzinga,"LONDON, Nov. 02, 2022 ( GLOBE NEWSWIRE ) -- Avail a limited period discount of 33% on our uniquely designed Opportunities and Strategies market research reports. Contact us today and make winning strategies!",0.264764,Somewhat-Bullish,0.038655,Neutral,0,focused,AI
VRNT,Speech Analytics Market Worth $14.1 Billion by 2029- Exclusive Report by Meticulous Research®,https://www.benzinga.com/pressreleases/22/10/g29306617/speech-analytics-market-worth-14-1-billion-by-2029-exclusive-report-by-meticulous-research,20221018T132238,Benzinga,"Redding, California, Oct. 18, 2022 ( GLOBE NEWSWIRE ) -- According to a new market research report titled, 'Speech Analytics Market by Component, Application, Organization Size, Deployment Mode, End-use Industry ( IT & Telecommunication, BFSI, Retail & Consumer Goods, Healthcare & Life Sciences, ...",0.261207,Somewhat-Bullish,0.018257,Neutral,0,focused,AI
VRNT,"Recession Stalwart Could Double, IT Vendor Analyst Says After CEO Meeting - Verint Systems  ( NASDAQ:VRNT ) ",https://www.benzinga.com/news/22/10/29271894/recession-stalwart-could-double-it-vendor-analyst-says-after-ceo-meeting,20221014T182245,Benzinga,Needham analyst Ryan MacDonald reiterated a Buy rating on Verint Systems Inc VRNT and a $61 price target. The re-rating followed his recent investor meetings with company CEO Dan Bodner.,0.175317,Somewhat-Bullish,0.882468,Bullish,0,broad,
VRNT,Verint Systems  ( NASDAQ:VRNT )  Research Coverage Started at StockNews.com,https://www.etfdailynews.com/2022/10/12/verint-systems-nasdaqvrnt-research-coverage-started-at-stocknews-com/,20221012T235603,Stocknews.com,"Stock analysts at StockNews.com started coverage on shares of Verint Systems ( NASDAQ:VRNT - Get Rating ) in a research note issued on Wednesday. The firm set a ""hold"" rating on the technology company's stock.",0.340067,Somewhat-Bullish,0.683639,Bullish,0,broad,
VRNT,Artificial Intelligence  ( AI )  Market in BFSI Sector to Record USD 32.97 Billion growth between 2021 and 2026; Major Opportunities with Alphabet Inc. and Amazon.com Inc. -- Technavio,https://www.prnewswire.com/news-releases/artificial-intelligence-ai-market-in-bfsi-sector-to-record-usd-32-97-billion-growth-between-2021-and-2026-major-opportunities-with-alphabet-inc-and-amazoncom-inc--technavio-301639081.html,20221004T051500,PR Newswire,Artificial Intelligence ( AI ) Market in BFSI Sector to Record USD 32.97 Billion growth between 2021 and 2026. Major Opportunities with Alphabet Inc. and Amazon.com Inc. -- Technavio PR ...,0.317996,Somewhat-Bullish,0.042571,Somewhat-Bullish,0,focused,"artificial intelligence, AI"
VRNT,"Natural Language Processing  ( NLP )  Market Worth USD 341.7 Billion, with a 27.6% CAGR by 2030 - Report by Market Research Future  ( MRFR ) ",https://www.benzinga.com/pressreleases/22/09/g29075238/natural-language-processing-nlp-market-worth-usd-341-7-billion-with-a-27-6-cagr-by-2030-report-by-,20220929T140218,Benzinga,"New York, US, Sept. 29, 2022 ( GLOBE NEWSWIRE ) -- According to a comprehensive research report by Market Research Future ( MRFR ) , ""Natural Language Processing Market research report: by Technology, by type, by Service, by deployment - Forecast till 2030"", the market is anticipated to acquire ...",0.394871,Bullish,0.031038,Neutral,0,focused,"natural language processing, NLP"
VRNT,The Customer Analytics Market Is Expected To Grow At A 19% Rate With The Rising Demand For Improved Customer Satisfaction As Per The Business Research Company's Customer Analytics Global Market Report 2022,https://www.benzinga.com/pressreleases/22/09/g28934680/the-customer-analytics-market-is-expected-to-grow-at-a-19-rate-with-the-rising-demand-for-improved,20220920T153000,Benzinga,"LONDON, Sept. 20, 2022 ( GLOBE NEWSWIRE ) -- According to The Business Research Company's research report on the customer analytics market, the rising demand for improved customer satisfaction is significantly contributing to the growth of the customer analytics market.",0.312993,Somewhat-Bullish,0.036476,Neutral,0,broad,
VRNT,"Global Open Source Intelligence  ( OSINT )  Market Size Worth $36,241.24 Billion by 2030 at a 28.33% CAGR: Custom Market Insights  ( Share, Report, Outlook, Growth, Trends, Segmentation ) ",https://www.benzinga.com/pressreleases/22/09/g28851625/global-open-source-intelligence-osint-market-size-worth-36-241-24-billion-by-2030-at-a-28-33-cagr-,20220913T153952,Benzinga,"Sandy, Utah, USA, Sept. 13, 2022 ( GLOBE NEWSWIRE ) -- Custom Market Insights has published a new research report titled ""Open-Source Intelligence Market Size, Share, Growth Analysis Report By Technique ( Text Analytics, Social Media Analytics, Video Analytics, Security Analytics, Geospatial ...",0.389787,Bullish,0.021877,Neutral,0,broad,
VRNT,"American Eagle Outfitters  ( NYSE:AEO ) , Bilibili  ( NASDAQ:BILI )  - McCormick, Dave & Buster's Entertainment And Other Big Losers From Thursday",https://www.benzinga.com/news/22/09/28807309/mccormick-dave-busters-entertainment-and-other-big-losers-from-thursday,20220909T091859,Benzinga,"U.S. stocks closed higher with the Dow Jones surging around 193 points on Thursday. Here is the list of some big stocks moving lower in the previous session. Globalstar, Inc. GSAT fell 18.9% to settle at $1.67 amid possible profit taking.",-0.159514,Somewhat-Bearish,0.179788,Bearish,0,focused,AI
VRNT,"Apellis Pharmaceuticals  ( NASDAQ:APLS ) , American Eagle Outfitters  ( NYSE:AEO )  - Moderna To $165? Plus This Analyst Cuts PT On FedEx",https://www.benzinga.com/news/22/09/28795006/moderna-to-165-plus-this-analyst-cuts-pt-on-fedex,20220908T134629,Benzinga,"Deutsche Bank raised the price target on Moderna, Inc. MRNA from $155 to $165. Deutsche Bank analyst Emmanuel Papadakis also upgraded the stock from Hold to Buy. Moderna shares rose 2.8% to trade at $138.70 on Thursday. Wedbush lowered the price target for Verint Systems Inc. VRNT from $65 to $56.",0.108108,Neutral,0.388879,Neutral,0,focused,AI
VRNT,"Adobe  ( NASDAQ:ADBE ) , HubSpot  ( NYSE:HUBS )  - These Analysts Slash Price Targets On NIO, Plus Wells Fargo Predicts $120 For PayPal",https://www.benzinga.com/news/22/09/28792398/these-analysts-slash-price-targets-on-nio-plus-wells-fargo-predicts-120-for-paypal,20220908T122019,Benzinga,Mizuho cut the price target for NIO Inc. NIO from $48 to $42. NIO shares rose 0.1% to $17.50 in pre-market trading. Citigroup cut the price target on NIO Inc. NIO from $41.1 to $31.3. NIO shares rose 0.1% to $17.50 in pre-market trading. Wells Fargo cut Shopify Inc. SHOP price target from $43 to ...,-0.024085,Neutral,0.331765,Somewhat-Bullish,0,broad,
VRNT,Verint Systems  ( VRNT )  Surpasses Q2 Earnings Estimates,https://www.zacks.com/stock/news/1977731/verint-systems-vrnt-surpasses-q2-earnings-estimates,20220907T214504,Zacks Commentary,"Verint (VRNT) delivered earnings and revenue surprises of 5.66% and 1.08%, respectively, for the quarter ended July 2022. Do the numbers hold clues to what lies ahead for the stock?",0.164922,Somewhat-Bullish,0.138464,Somewhat-Bullish,0,broad,
VRNT,Verint Systems Stock Earns Relative Strength Rating Upgrade; Hits Key Threshold,https://www.investors.com/news/technology/verint-systems-stock-earns-relative-strength-rating-upgrade-hits-key-threshold/,20220825T185800,Investors Business Daily,Verint Systems Stock Earns Relative Strength Rating Upgrade. Hits Key Threshold Investor's Business Daily ...,0.310884,Somewhat-Bullish,0.52759,Bullish,0,focused,AI
VRNT,American Software  ( AMSWA )  Q1 Earnings Beat Estimates,https://www.zacks.com/stock/news/1972138/american-software-amswa-q1-earnings-beat-estimates,20220824T212509,Zacks Commentary,"American Software (AMSWA) delivered earnings and revenue surprises of 28.57% and 0.35%, respectively, for the quarter ended July 2022. Do the numbers hold clues to what lies ahead for the stock?",0.141873,Neutral,0.201803,Neutral,0,broad,
VRNT,StockNews.com Downgrades Verint Systems  ( NASDAQ:VRNT )  to Hold,https://www.defenseworld.net/2022/08/23/stocknews-com-downgrades-verint-systems-nasdaqvrnt-to-hold.html,20220823T062042,Stocknews.com,"Verint Systems ( NASDAQ:VRNT - Get Rating ) was downgraded by equities researchers at StockNews.com from a ""buy"" rating to a ""hold"" rating in a note issued to investors on Tuesday.",0.249616,Somewhat-Bullish,0.791558,Bullish,0,broad,
VRNT,Verint Systems  ( NASDAQ:VRNT )  Rating Lowered to Hold at StockNews.com,https://www.defenseworld.net/2022/08/14/verint-systems-nasdaqvrnt-rating-lowered-to-hold-at-stocknews-com.html,20220814T055441,Stocknews.com,"Verint Systems ( NASDAQ:VRNT - Get Rating ) was downgraded by stock analysts at StockNews.com from a ""buy"" rating to a ""hold"" rating in a research note issued to investors on Friday. VRNT has been the topic of several other research reports.",0.321693,Somewhat-Bullish,0.746105,Bullish,0,broad,
VRNT,Seven ways to modernize a company's call center,https://www.fastcompany.com/90778008/seven-ways-to-modernize-a-companys-call-center,20220812T170058,Fast Company,"To improve the quality of a company's call center, it's important to consider the B2B or B2C audience that the staff is serving. Investing in the latest software tools and offering ongoing training will reiterate core values and elevate the employees' abilities to handle unique challenges and ...",0.408158,Bullish,0.071784,Somewhat-Bullish,0,focused,AI
VRNT,DecisionPoint Systems Inc.  ( DPSI )  Beats Q2 Earnings and Revenue Estimates,https://www.zacks.com/stock/news/1967496/decisionpoint-systems-inc-dpsi-beats-q2-earnings-and-revenue-estimates,20220811T222507,Zacks Commentary,"DecisionPoint Systems Inc. (DPSI) delivered earnings and revenue surprises of 233.33% and 27.94%, respectively, for the quarter ended June 2022. Do the numbers hold clues to what lies ahead for the stock?",0.142022,Neutral,0.202932,Neutral,0,broad,
VRNT,"The Customer Engagement Solution Market Is Expected To Grow At A 12% Rate, Driven By The High Penetration Of The Internet As Per The Business Research Company's Customer Engagement Solution Global Market Report 2022",https://www.benzinga.com/pressreleases/22/08/g28421088/the-customer-engagement-solution-market-is-expected-to-grow-at-a-12-rate-driven-by-the-high-penetr,20220809T153000,Benzinga,"LONDON, Aug. 09, 2022 ( GLOBE NEWSWIRE ) -- According to The Business Research Company's research report on the customer engagement solution market, the high penetration of the internet is expected to propel the growth of the customer engagement solutions market going forward.",0.380616,Bullish,0.065416,Somewhat-Bullish,0,broad,
VRNT,"Back Office Workforce Management Market Size to hit $6.71Bn, Globally, by 2028 - Exclusive Report by The Insight Partners",https://www.benzinga.com/pressreleases/22/07/g28226449/back-office-workforce-management-market-size-to-hit-6-71bn-globally-by-2028-exclusive-report-by-th,20220727T142606,Benzinga,"New York, July 27, 2022 ( GLOBE NEWSWIRE ) -- The Insight Partners published latest research study on ""Back Office Workforce Management Market Forecast to 2028 - COVID-19 Impact and Global Analysis By Solution ( Robotic Automation Process, Performance Management, Back Office Optimization, ...",0.311076,Somewhat-Bullish,0.022038,Neutral,0,focused,automation
VRNT,Verizon And 2 Other Stocks Insiders Are Selling,https://www.benzinga.com/news/22/07/27998241/verizon-and-2-other-stocks-insiders-are-selling,20220708T114216,Benzinga,"US jobs report for June is scheduled for release at 8:30 a.m. ET. Analysts expect a 270,000 rise for nonfarm payrolls in June, compared with a better-than-expected 390,000 growth in May. Investors, meanwhile, focused on some notable insider trades.",-0.048648,Neutral,0.378428,Neutral,0,broad,
VRNT,"Verint Systems  ( NASDAQ:VRNT )  Raised to ""Buy"" at StockNews.com",https://www.defenseworld.net/2022/07/07/verint-systems-nasdaqvrnt-raised-to-buy-at-stocknews-com.html,20220707T074841,Stocknews.com,StockNews.com upgraded shares of Verint Systems ( NASDAQ:VRNT - Get Rating ) from a hold rating to a buy rating in a research report report published on Wednesday. VRNT has been the topic of several other research reports.,0.038096,Neutral,0.809146,Neutral,0,focused,AI
VRNT,"With 11.0% CAGR, Speech to Text API Market Size Worth USD 3,036.5 Million in 2028",https://www.benzinga.com/pressreleases/22/07/g27951040/with-11-0-cagr-speech-to-text-api-market-size-worth-usd-3-036-5-million-in-2028,20220705T120436,Benzinga,"Pune, India, July 05, 2022 ( GLOBE NEWSWIRE ) -- According to Fortune Business Insights, the global Speech to Text API Market size was USD 1,321.5 million in 2019 and is projected to reach USD 3,036.5 million by 2028, exhibiting a CAGR of 11.0% during the forecast period [2022-2028].The global ...",0.019219,Neutral,0.03097,Neutral,0,broad,
VRNT,14 ways AI is changing the way leaders do business,https://www.fastcompany.com/90761452/14-ways-ai-is-changing-the-way-leaders-do-business,20220629T170000,Fast Company,"Whether it's lightening the load for staff members who desire to focus on more meaningful assignments or it's developing a quicker strategy to turnaround data analysis results you're ready to discuss with the team, AI can serve a crucial purpose in helping the business to steadily move forward, ...",0.225483,Somewhat-Bullish,0.047315,Somewhat-Bullish,0,focused,AI
VRNT,14 factors that can impact the success of your growth strategy,https://www.fastcompany.com/90763862/14-factors-that-can-impact-the-success-of-your-growth-strategy,20220627T170059,Fast Company,"Whatever the method, having a solid growth strategy in place, and the resources to execute it, is key for any company. To that end, 14 Fast Company Executive Board members share growth strategies that work immediately and how to implement them. Social Impact is key to growth in 2022.",0.06515,Neutral,0.046806,Neutral,0,broad,
VRNT,"Valued to be $2.7 Billion by 2026, Healthcare Virtual Assistants Slated for Robust Growth Worldwide",https://www.prnewswire.com/news-releases/valued-to-be-2-7-billion-by-2026--healthcare-virtual-assistants-slated-for-robust-growth-worldwide-301574682.html,20220627T110000,PR Newswire,"• Access to our digital archives and MarketGlass Research Platform Companies: 33 - Players covered include ADA Digital Health. Amazon. Babylon Healthcare Services Limited. CSS Corporation. Egain Corporation. Floatbot.AI. Healthtap, Inc. Infermedica. Kognito Solutions, LLC. Medrespond LLC.",0.00069,Neutral,0.058918,Neutral,0,focused,AI
VRNT,Physical Security Information Management  ( PSIM )  Market Size to Grow by USD 3.21 bn | AxxonSoft Inc. and Everbridge Inc. Among Key Vendors | Technavio,https://www.prnewswire.com/news-releases/physical-security-information-management-psim-market-size-to-grow-by-usd-3-21-bn--axxonsoft-inc-and-everbridge-inc-among-key-vendors--technavio-301573923.html,20220624T235000,PR Newswire,"The physical security information management ( PSIM ) market report provides complete insights on key vendors, including AxxonSoft Inc., Everbridge Inc., Genetec Inc., Hexagon AB, Johnson Controls International Plc, NICE Ltd., Robert Bosch GmbH, Siemens AG, Verint Systems Inc., and Vidsys Inc.",0.054679,Neutral,0.060206,Neutral,0,broad,
VRNT,Does Verint  ( VRNT )  Have the Potential to Rally 28% as Wall Street Analysts Expect?,https://www.zacks.com/stock/news/1937424/does-verint-vrnt-have-the-potential-to-rally-28-as-wall-street-analysts-expect,20220610T135511,Zacks Commentary,"The average of price targets set by Wall Street analysts indicates a potential upside of 28.4% in Verint (VRNT). While the effectiveness of this highly sought-after metric is questionable, the positive trend in earnings estimate revisions might translate into an upside in the stock.",-0.019138,Neutral,0.326355,Somewhat-Bullish,0,broad,
VRNT,A Peek Into The Markets: US Stock Futures Down Ahead Of Wholesale Inventories Data,https://www.benzinga.com/news/earnings/22/06/27602659/a-peek-into-the-markets-us-stock-futures-down-ahead-of-wholesale-inventories-data,20220608T092349,Benzinga,"U.S. stock futures traded lower in early pre-market trade after the Dow Jones jumped by more than 250 points in the previous session. Investors are awaiting earnings results from Campbell Soup Company CPB, ABM Industries Incorporated ABM and Thor Industries, Inc. THO.",-0.010663,Neutral,0.149377,Bullish,0,focused,AI
VRNT,"5 Stocks To Watch For June 8, 2022",https://www.benzinga.com/news/earnings/22/06/27602022/5-stocks-to-watch-for-june-8-2022,20220608T070110,Benzinga,"Some of the stocks that may grab investor focus today are: Wall Street expects Campbell Soup Company CPB to report quarterly earnings at $0.61 per share on revenue of $2.05 billion before the opening bell. Campbell Soup shares rose 0.6% to $46.87 in after-hours trading. Novavax, Inc.",0.018228,Neutral,0.50011,Somewhat-Bullish,0,broad,
VRNT,Verint Systems  ( VRNT )  Q1 2023 Earnings Call Transcript,https://www.fool.com/earnings/call-transcripts/2022/06/07/verint-systems-vrnt-q1-2023-earnings-call-transcri/,20220607T233035,Motley Fool,"VRNT earnings call for the period ending March 31, 2022.",0.1071,Neutral,0.006569,Bullish,0,broad,
VRNT,Verint Systems  ( VRNT )  Beats Q1 Earnings and Revenue Estimates,https://www.zacks.com/stock/news/1935772/verint-systems-vrnt-beats-q1-earnings-and-revenue-estimates,20220607T212505,Zacks Commentary,"Verint (VRNT) delivered earnings and revenue surprises of 8.33% and 1.89%, respectively, for the quarter ended April 2022. Do the numbers hold clues to what lies ahead for the stock?",0.008702,Neutral,0.127625,Neutral,0,broad,
VRNT,Verint: Fiscal Q1 Earnings Snapshot,https://apnews.com/article/verint-systems-inc-melville-new-york-earnings-business-f62b0893340fab798ca87c3861154b44,20220607T201905,Associated Press,"MELVILLE, N.Y. ( AP ) _ Verint Systems Inc. ( VRNT ) on Tuesday reported fiscal first-quarter net income of $286,000. On a per-share basis, the Melville, New York-based company said it had profit of 8 cents. Earnings, adjusted for one-time gains and costs, came to 52 cents per share.",0.019032,Neutral,0.798255,Neutral,0,focused,AI
VRNT,Can Tech Help Build A Market Bottom?,https://www.benzinga.com/news/earnings/22/06/27569741/can-tech-help-build-a-market-bottom,20220606T151850,Benzinga,"Image sourced from Unsplash This post contains sponsored advertising content. This content is for informational purposes only and not intended to be investing advice. ( Monday Market Open ) The bulls appear ready to make another run at the March lows around the 4,200 level as the S&P 500 futures g",-0.189315,Somewhat-Bearish,0.061331,Neutral,0,focused,AI
VRNT,"Investing Action Plan: Apple WWDC, CPI Data, Thor Industries and Nio Earnings",https://www.investors.com/research/investing-action-plan/stock-market-investing-action-plan-apple-wwdc-cpi-data-thor-industries-and-nio-earnings/,20220603T220200,Investors Business Daily,"A crotchety week on the stock market left the big benchmarks lower for the week, but with the Nasdaq composite and the S&P 500 both maintaining support at their 21-day exponential moving averages. That provides a nice starting point for the coming week, kicked off by Apple with its Worldwide ...",-0.037421,Neutral,0.060236,Neutral,0,focused,AI
VRNT,Investors set their sights on upcoming inflation report as the bear market rally falters,https://www.cnbc.com/2022/06/03/investors-set-their-sights-on-upcoming-inflation-report-as-the-bear-market-rally-falters.html,20220603T174655,CNBC,"The stock market may try to regain its footing in the next few sessions, even as a fresh inflation report looms large at the end of the week.",-0.15322,Somewhat-Bearish,0.048611,Neutral,0,focused,AI
VRNT,StoneCo Ltd.  ( STNE )  Beats Q1 Earnings and Revenue Estimates,https://www.zacks.com/stock/news/1933346/stoneco-ltd-stne-beats-q1-earnings-and-revenue-estimates,20220602T221503,Zacks Commentary,"StoneCo Ltd. (STNE) delivered earnings and revenue surprises of 33.33% and 64.80%, respectively, for the quarter ended March 2022. Do the numbers hold clues to what lies ahead for the stock?",-0.004049,Neutral,0.188928,Neutral,0,broad,
VRNT,High-Yield Credit Spreads Suggest That Investors Remain In 'Risk Off' Mode,https://www.benzinga.com/news/earnings/22/06/27524269/high-yield-credit-spreads-suggest-that-investors-remain-in-risk-off-mode,20220602T144037,Benzinga,Image sourced from Pixabay This post contains sponsored advertising content. This content is for informational purposes only and not intended to be investing advice. ( Thursday Market Open ) Investors are poised to take another run at those March lows because S&P 500 futures are pointing to a high,-0.294559,Somewhat-Bearish,0.046403,Neutral,0,focused,AI
VRNT,13 ways global expansion improves business opportunities,https://www.fastcompany.com/90752274/13-ways-global-expansion-improves-business-opportunities,20220602T130053,Fast Company,"It's been a tough economic time across most industries these past years during COVID, but if you have the wherewithal to take your company global, then you'll be doing yourself a big favor.",0.285341,Somewhat-Bullish,0.042609,Somewhat-Bullish,0,broad,
VRNT,Descartes Systems  ( DSGX )  Q1 Earnings and Revenues Top Estimates,https://www.zacks.com/stock/news/1932681/descartes-systems-dsgx-q1-earnings-and-revenues-top-estimates,20220601T222503,Zacks Commentary,"Descartes Systems (DSGX) delivered earnings and revenue surprises of 3.85% and 2.73%, respectively, for the quarter ended April 2022. Do the numbers hold clues to what lies ahead for the stock?",-0.010409,Neutral,0.189274,Somewhat-Bearish,0,broad,
VRNT,Oil Prices Have Inched Above March And May Highs As OPEC+ Weighs The Russia Problem,https://www.benzinga.com/news/earnings/22/06/27502030/oil-prices-have-inched-above-march-and-may-highs-as-opec-weighs-the-russia-problem,20220601T144825,Benzinga,"Image sourced from Pixabay This post contains sponsored advertising content. This content is for informational purposes only and not intended to be investing advice. ( Wednesday Market Open ) A better-than-expected earnings report from Salesforce.com ( NYSE: CRM ) is leading stocks higher, gaini",-0.294233,Somewhat-Bearish,0.066496,Neutral,0,focused,AI
VRNT,Key Indexes Fall In Premarket Action,https://www.benzinga.com/news/earnings/22/05/27479767/key-indexes-fall-in-premarket-action,20220531T163343,Benzinga,Image sourced from Unsplash This post contains sponsored advertising content. This content is for informational purposes only and not intended to be investing advice. ( Tuesday Market Open ) Stock futures slid in Tuesday's premarket trading to open a shortened trading week amid plenty of overnight,-0.126047,Neutral,0.056923,Neutral,0,focused,AI
VRNT,"Customer Engagement Solutions Market Size to Grow by USD 7.69 Billion | By Component and Geography | Growth, Trends, and Forecasts  ( 2022 - 2026 ) ",https://www.prnewswire.com/news-releases/customer-engagement-solutions-market-size-to-grow-by-usd-7-69-billion--by-component-and-geography--growth-trends-and-forecasts-2022---2026-301550217.html,20220519T093000,PR Newswire,,0.005909,Neutral,0.038849,Neutral,0,broad,
VRNT,Synopsys  ( SNPS )  Q2 Earnings and Revenues Surpass Estimates,https://www.zacks.com/stock/news/1926242/synopsys-snps-q2-earnings-and-revenues-surpass-estimates,20220518T212506,Zacks Commentary,"Synopsys (SNPS) delivered earnings and revenue surprises of 5.49% and 2.12%, respectively, for the quarter ended April 2022. Do the numbers hold clues to what lies ahead for the stock?",0.002374,Neutral,0.188683,Somewhat-Bearish,0,broad,
