ticker,title,url,time_published,source,summary,sentiment_score,sentiment_label,ticker_sentiment_score,ticker_sentiment_label,relevance_score,category,ai_keywords_found
VRNT,"$HAREHOLDER ALERT: The M&A Class Action Launches Legal Inquiry for the Merger - VRNT, MESA, GHLD, and TCBC",https://www.benzinga.com/pressreleases/25/10/g48114323/hareholder-alert-the-m-a-class-action-launches-legal-inquiry-for-the-merger-vrnt-mesa-ghld-and-tcb,20251008T213000,Benzinga,"NEW YORK, Oct. 08, 2025 ( GLOBE NEWSWIRE ) -- Class Action Attorney Juan Monteverde with Monteverde & Associates PC ( the ""M&A Class Action Firm"" ) , has recovered millions of dollars for shareholders and is recognized as a Top 50 Firm in the 2024 ISS Securities Class Action Services Report.",0.225261,Somewhat-Bullish,0.250386,Somewhat-Bullish,0,broad,
VRNT,"SHAREHOLDER RIGHTS ALERT: Halper Sadeh LLC Investigates DAY, BRNS, ETNB, VRNT on Behalf of Shareholders - Barinthus Biotherapeutics  ( NASDAQ:BRNS ) , Dayforce  ( NYSE:DAY ) ",https://www.benzinga.com/pressreleases/25/10/g48105558/shareholder-rights-alert-halper-sadeh-llc-investigates-day-brns-etnb-vrnt-on-behalf-of-shareholder,20251008T160401,Benzinga,"NEW YORK, Oct. 08, 2025 ( GLOBE NEWSWIRE ) -- Halper Sadeh LLC, an investor rights law firm, is investigating the following companies for potential violations of the federal securities laws and/or breaches of fiduciary duties to shareholders relating to:",0.218449,Somewhat-Bullish,0.093289,Somewhat-Bullish,0,broad,
VRNT,"BRODSKY & SMITH SHAREHOLDER UPDATE: Notifying Investors of the Following Investigations: 89bio, Inc.  ( Nasdaq - ETNB ) , Barinthus Biotherapeutics plc  ( Nasdaq - BRNS ) , Verint Systems Inc.  ( Nasdaq - VRNT ) , Dayforce, Inc.  ( NYSE- DAY )  - Roche Holding  ( OTC:RHHBY ) ",https://www.benzinga.com/pressreleases/25/10/g48104026/brodsky-smith-shareholder-update-notifying-investors-of-the-following-investigations-89bio-inc-nas,20251008T152255,Benzinga,"BALA CYNWYD, Pa., Oct. 08, 2025 ( GLOBE NEWSWIRE ) -- Brodsky & Smith reminds investors of the following investigations. If you own shares and wish to discuss the investigation, contact Jason Brodsky ( jbrodsky@brodskysmith.com ) or Marc Ackerman ( mackerman@brodskysmith.com ) at 855-576-4847.",0.250685,Somewhat-Bullish,0.076115,Neutral,0,broad,
VRNT,"$HAREHOLDER ALERT: The M&A Class Action Firm Is Investigating the Merger - GTLS, SCPH, VTLE, and VRNT",https://www.benzinga.com/pressreleases/25/09/g47681272/hareholder-alert-the-m-a-class-action-firm-is-investigating-the-merger-gtls-scph-vtle-and-vrnt,20250915T213000,Benzinga,"NEW YORK, Sept. 15, 2025 ( GLOBE NEWSWIRE ) -- Class Action Attorney Juan Monteverde with Monteverde & Associates PC ( the ""M&A Class Action Firm"" ) , has recovered millions of dollars for shareholders and is recognized as a Top 50 Firm in the 2024 ISS Securities Class Action Services Report.",0.241182,Somewhat-Bullish,0.252987,Somewhat-Bullish,0,broad,
VRNT,Verint Systems  ( VRNT )  Q2 Earnings and Revenues Beat Estimates,https://www.zacks.com/stock/news/2746342/verint-systems-vrnt-q2-earnings-and-revenues-beat-estimates,20250902T211502,Zacks Commentary,"Verint (VRNT) delivered earnings and revenue surprises of +26.92% and +3.71%, respectively, for the quarter ended July 2025. Do the numbers hold clues to what lies ahead for the stock?",0.157279,Somewhat-Bullish,0.138863,Neutral,0,broad,
VRNT,Verint Reports 33% EPS Drop in Fiscal Q2,https://www.fool.com/data-news/2025/09/02/verint-reports-33-eps-drop-in-fiscal-q2/,20250902T205753,Motley Fool,"Verint Systems ( NASDAQ:VRNT ) , a software company best known for its work in automating customer experience ( CX ) operations with artificial intelligence, reported earnings on September 2, 2025. The key news in this release was that GAAP revenue fell 1.0% year over year to $208 million, but ...",0.158356,Somewhat-Bullish,0.201523,Somewhat-Bullish,0,focused,artificial intelligence
VRNT,"SHAREHOLDER INVESTIGATION: Halper Sadeh LLC Investigates WOW, DAY, VRNT, SHCO on Behalf of Shareholders - Soho House  ( NYSE:SHCO ) , Dayforce  ( NYSE:DAY ) ",https://www.benzinga.com/pressreleases/25/08/g47382474/shareholder-investigation-halper-sadeh-llc-investigates-wow-day-vrnt-shco-on-behalf-of-shareholder,20250828T115853,Benzinga,"NEW YORK, Aug. 28, 2025 ( GLOBE NEWSWIRE ) -- Halper Sadeh LLC, an investor rights law firm, is investigating the following companies for potential violations of the federal securities laws and/or breaches of fiduciary duties to shareholders relating to: WideOpenWest, Inc.",0.147077,Neutral,0.108466,Somewhat-Bullish,0,broad,
VRNT,"BRODSKY & SMITH SHAREHOLDER UPDATE: Notifying Investors of the Following Investigations: Verint Systems Inc.  ( Nasdaq - VRNT ) , Dayforce, Inc.  ( NYSE - DAY ) , WideOpenWest, Inc.  ( NYSE - WOW ) , Y-mAbs Therapeutics, Inc.  ( Nasdaq - YMAB ) ",https://www.benzinga.com/pressreleases/25/08/g47344355/brodsky-smith-shareholder-update-notifying-investors-of-the-following-investigations-verint-system,20250826T195601,Benzinga,"BALA CYNWYD, Pa., Aug. 26, 2025 ( GLOBE NEWSWIRE ) -- Brodsky & Smith reminds investors of the following investigations. If you own shares and wish to discuss the investigation, contact Jason Brodsky ( jbrodsky@brodskysmith.com ) or Marc Ackerman ( mackerman@brodskysmith.com ) at 855-576-4847.",0.226595,Somewhat-Bullish,0.089129,Neutral,0,broad,
VRNT,"This Skechers Analyst Is No Longer Bullish; Here Are Top 5 Downgrades For Tuesday - Genesco  ( NYSE:GCO ) , Albemarle  ( NYSE:ALB ) ",https://www.benzinga.com/analyst-stock-ratings/downgrades/25/08/47333000/this-skechers-analyst-is-no-longer-bullish-here-are-top-5-downgrades-for-tuesday,20250826T141207,Benzinga,"Top Wall Street analysts changed their outlook on these top names. For a complete view of all analyst rating changes, including upgrades, downgrades and initiations, please see our analyst ratings page. RBC Capital analyst Dan Bergstrom downgraded the rating for Verint Systems Inc.",0.189586,Somewhat-Bullish,0.414559,Somewhat-Bullish,0,broad,
VRNT,"Nvidia To Rally Around 19%? Here Are 10 Top Analyst Forecasts For Monday - BJ's Wholesale Club Hldgs  ( NYSE:BJ ) , American Eagle Outfitters  ( NYSE:AEO ) ",https://www.benzinga.com/analyst-stock-ratings/price-target/25/08/47317370/nvidia-to-rally-around-19-here-are-10-top-analyst-forecasts-for-monday-2,20250825T190021,Benzinga,"Top Wall Street analysts changed their outlook on these top names. For a complete view of all analyst rating changes, including upgrades and downgrades, please see our analyst ratings page. BMO Capital raised Gold Fields Limited GFI price target from $24 to $32.",0.144135,Neutral,0.163909,Neutral,0,focused,AI
VRNT,"This Quest Diagnostics Analyst Is No Longer Bullish; Here Are Top 5 Downgrades For Monday - Quest Diagnostics  ( NYSE:DGX ) , American Eagle Outfitters  ( NYSE:AEO ) ",https://www.benzinga.com/analyst-stock-ratings/downgrades/25/08/47316456/this-quest-diagnostics-analyst-is-no-longer-bullish-here-are-top-5-downgrades-fo,20250825T180942,Benzinga,"Top Wall Street analysts changed their outlook on these top names. For a complete view of all analyst rating changes, including upgrades, downgrades and initiations, please see our analyst ratings page. DA Davidson analyst Matt Summerville downgraded Symbotic Inc.",0.192834,Somewhat-Bullish,0.295867,Neutral,0,broad,
VRNT,VRNT Alert: Monsey Firm of Wohl & Fruchter Investigating Fairness of the Sale of Verint Systems to Thoma Bravo - Verint Systems  ( NASDAQ:VRNT ) ,https://www.benzinga.com/pressreleases/25/08/g47314842/vrnt-alert-monsey-firm-of-wohl-fruchter-investigating-fairness-of-the-sale-of-verint-systems-to-th,20250825T170715,Benzinga,"MONSEY, N.Y., Aug. 25, 2025 ( GLOBE NEWSWIRE ) -- The law firm of Wohl & Fruchter LLP is investigating the fairness of the sale of Verint Systems, Inc. VRNT ( ""Verint"" ) for $20.50 per share in cash to Thoma Bravo.",0.152702,Somewhat-Bullish,0.24289,Somewhat-Bullish,0,focused,AI
VRNT,Johnson Fistel Investigates Fairness of Proposed Sale of Verint - Verint Systems  ( NASDAQ:VRNT ) ,https://www.benzinga.com/pressreleases/25/08/g47308933/johnson-fistel-investigates-fairness-of-proposed-sale-of-verint,20250825T140450,Benzinga,"SAN DIEGO, Aug. 25, 2025 ( GLOBE NEWSWIRE ) -- Shareholder rights law firm Johnson Fistel, PLLP has launched an investigation into whether the board members of Verint Systems Inc. VRNT breached their fiduciary duties in connection with the proposed sale of the Company to Thoma Bravo.",0.325918,Somewhat-Bullish,0.244518,Somewhat-Bullish,0,focused,AI
VRNT,What's Going On With Verint Systems Stock Monday? - Verint Systems  ( NASDAQ:VRNT ) ,https://www.benzinga.com/m-a/25/08/47308902/verint-systems-to-go-private-in-2-billion-thoma-bravo-buyout,20250825T140417,Benzinga,"Verint to be acquired by Thoma Bravo in a $2 billion all-cash deal, taking the company private. Shareholders will receive $20.50 per share, an 18% premium to pre-sale speculation trading levels. See the 6X seasonal strategy set to target this fall's biggest opportunities. Details here →",0.332954,Somewhat-Bullish,0.309539,Bullish,0,focused,AI
VRNT,"Verint Systems, Vital Energy And Other Big Stocks Moving Higher In Monday's Pre-Market Session - Daqo New Energy  ( NYSE:DQ ) , Canopy Growth  ( NASDAQ:CGC ) ",https://www.benzinga.com/trading-ideas/movers/25/08/47303846/verint-systems-vital-energy-and-other-big-stocks-moving-lower-in-mondays-pre-market-session,20250825T103854,Benzinga,"U.S. stock futures were lower this morning, with the Dow futures falling around 100 points on Monday. Shares of Verint Systems Inc. VRNT rose sharply in the pre-market trading session after Bloomberg reported that Thoma Bravo is nearing a deal for the company.",0.138484,Neutral,0.329551,Somewhat-Bullish,0,broad,
VRNT,"ESS Tech, Inc.  ( GWH )  Reports Q2 Loss, Lags Revenue Estimates",https://www.zacks.com/stock/news/2713905/ess-tech-inc-gwh-reports-q2-loss-lags-revenue-estimates,20250814T214002,Zacks Commentary,"ESS Tech (GWH) delivered earnings and revenue surprises of -2.27% and -1.75%, respectively, for the quarter ended June 2025. Do the numbers hold clues to what lies ahead for the stock?",0.110406,Neutral,0.204647,Neutral,0,broad,
VRNT,GoDaddy  ( GDDY )  Q2 Earnings and Revenues Top Estimates,https://www.zacks.com/stock/news/2680503/godaddy-gddy-q2-earnings-and-revenues-top-estimates,20250807T212002,Zacks Commentary,"GoDaddy (GDDY) delivered earnings and revenue surprises of +5.22% and +1.12%, respectively, for the quarter ended June 2025. Do the numbers hold clues to what lies ahead for the stock?",0.157281,Somewhat-Bullish,0.205225,Neutral,0,broad,
VRNT,"Buy Mid-Cap AI Stock FIVN on Solid Q2 Earnings, Outlook & Valuation",https://www.zacks.com/stock/news/2661848/buy-mid-cap-ai-stock-fivn-on-solid-q2-earnings-outlook-valuation,20250804T122700,Zacks Commentary,"FIVN posts record Q2 revenue, boosts AI growth, and trades at a steep valuation discount, making it a mid-cap AI standout.",0.264901,Somewhat-Bullish,0.092036,Somewhat-Bullish,0,focused,AI
VRNT,"This Verint Analyst Begins Coverage On A Bullish Note; Here Are Top 5 Initiations For Friday - Clearside Biomedical  ( NASDAQ:CLSD ) , American Healthcare REIT  ( NYSE:AHR ) ",https://www.benzinga.com/analyst-stock-ratings/initiation/25/07/46491314/this-verint-analyst-begins-coverage-on-a-bullish-note-here-are-top-5-initiations,20250718T131715,Benzinga,"Top Wall Street analysts changed their outlook on these top names. For a complete view of all analyst rating changes, including upgrades, downgrades and initiations, please see our analyst ratings page. Baird analyst Wesley Golladay initiated coverage on American Healthcare REIT, Inc.",0.238385,Somewhat-Bullish,0.231332,Neutral,0,focused,AI
VRNT,"Deal Dispatch: Trump Gets Paramount To Pay Up, M&A Dips - Juniper Networks Inc Com  ( NYSE:JNPR ) , Hewlett Packard  ( NYSE:HPE ) ",https://www.benzinga.com/m-a/25/07/46261516/deal-dispatch-trump-paramount-mergers-acquisitions-volume-down,20250704T154254,Benzinga,"M&A volumes globally continue to decline, according to PwC's Brian Levy. Dan Rather calls Paramount's $16-million settlement ""a sad day for journalism"" and ""a sad day for '60 Minutes' and CBS News."" Market-moving news hits Benzinga Pro first-get a 30-minute edge and save 60% this 4th of July.",0.114728,Neutral,0.082111,Neutral,0,broad,
VRNT,Why Greenbrier Shares Are Trading Higher By Over 13%; Here Are 20 Stocks Moving Premarket - Argo Blockchain  ( NASDAQ:ARBK ) ,https://www.benzinga.com/trading-ideas/movers/25/07/46215102/why-greenbrier-shares-are-trading-higher-by-over-13-here-are-20-stocks-moving-premarket,20250702T095500,Benzinga,"Shares of The Greenbrier Companies, Inc. ( NYSE: GBX ) rose sharply in today's pre-market trading after the company posted stronger-than-expected results for the third quarter. The company posted quarterly earnings of $1.86 per share, beating market estimates of 98 cents per share.",0.089999,Neutral,0.171485,Neutral,0,focused,AI
VRNT,Verint  ( VRNT )  Q1 2026 Earnings Call Transcript,https://www.fool.com/earnings/call-transcripts/2025/06/04/verint-vrnt-q1-2026-earnings-call-transcript/,20250604T215407,Motley Fool,"Image source: The Motley Fool.Wednesday, June 4, 2025 at 4:30 p.m. ETChief Executive Officer - Dan BodnerContinue reading ...",0.295639,Somewhat-Bullish,0.174167,Somewhat-Bullish,0,broad,
VRNT,Verint Systems  ( VRNT )  Misses Q1 Earnings Estimates,https://www.zacks.com/stock/news/2484881/verint-systems-vrnt-misses-q1-earnings-estimates,20250604T211504,Zacks Commentary,"Verint (VRNT) delivered earnings and revenue surprises of -3.33% and 6.71%, respectively, for the quarter ended April 2025. Do the numbers hold clues to what lies ahead for the stock?",0.173164,Somewhat-Bullish,0.140485,Neutral,0,broad,
VRNT,"Verint Stock Jumps After Q1 Beat, Confident FY26 Guidance - Verint Systems  ( NASDAQ:VRNT ) ",https://www.benzinga.com/markets/earnings/25/06/45781756/verint-stock-jumps-after-q1-beat-confident-fy26-guidance,20250604T205703,Benzinga,"Verint stock surges after Q1 earnings and revenue beat estimates, and full-year EPS guidance tops Wall Street expectations. AI-driven business growth remained strong, with AI ARR up 24% year-over-year and now making up nearly half of total ARR. Rebound or breakdown?",0.291159,Somewhat-Bullish,0.377142,Bullish,0,focused,AI
VRNT,Verint Systems Likely To Report Lower Q1 Earnings; These Most Accurate Analysts Revise Forecasts Ahead Of Earnings Call - Verint Systems  ( NASDAQ:VRNT ) ,https://www.benzinga.com/analyst-stock-ratings/price-target/25/06/45764879/verint-systems-likely-to-report-lower-q1-earnings-these-most-accurate-analysts,20250604T084829,Benzinga,"Verint Systems Inc. VRNT will release its first-quarter earnings results after the closing bell on Wednesday, June 4. Analysts expect the Melville, New York-based company to report quarterly earnings at 23 cents per share, down from 59 cents per share in the year-ago period.",0.202061,Somewhat-Bullish,0.542261,Bullish,0,broad,
VRNT,Synopsys  ( SNPS )  Tops Q2 Earnings and Revenue Estimates,https://www.zacks.com/stock/news/2478535/synopsys-snps-tops-q2-earnings-and-revenue-estimates,20250528T211505,Zacks Commentary,"Synopsys (SNPS) delivered earnings and revenue surprises of 8.26% and 0.16%, respectively, for the quarter ended April 2025. Do the numbers hold clues to what lies ahead for the stock?",0.175183,Somewhat-Bullish,0.205225,Neutral,0,broad,
VRNT,MKS Instruments  ( MKSI )  Beats Q1 Earnings and Revenue Estimates,https://www.zacks.com/stock/news/2464619/mks-instruments-mksi-beats-q1-earnings-and-revenue-estimates,20250507T222507,Zacks Commentary,"MKS Instruments (MKSI) delivered earnings and revenue surprises of 20.42% and 0.27%, respectively, for the quarter ended March 2025. Do the numbers hold clues to what lies ahead for the stock?",0.116515,Neutral,0.201803,Neutral,0,broad,
VRNT,Progress Congratulates Chairman Jack Egan on NACD New England Leadership in Corporate Governance Award,https://www.globenewswire.com/news-release/2025/04/24/3067467/0/en/Progress-Congratulates-Chairman-Jack-Egan-on-NACD-New-England-Leadership-in-Corporate-Governance-Award.html,20250424T130000,GlobeNewswire,"Progress announced that its Board Chair, John R. ""Jack"" Egan, has been honored with the Leadership in Corporate Governance Award by the NACDNE.",0.599989,Bullish,0.102888,Somewhat-Bullish,0,focused,AI
VRNT,"Bitcoin Falls To $85K, Altcoins Drop Ahead Of Inflation Data; Trump's Tariffs May Raise $800B, But Risks Loom; Tesla Faces EV Incentive Cuts In UK After Canada - Top Headlines While The U.S. Slept",https://www.benzinga.com/markets/cryptocurrency/25/03/44537960/bitcoin-falls-to-85k-altcoins-drop-ahead-of-inflation-data-trumps-tariffs-may-raise-800b-b,20250328T143947,Benzinga,"Galaxy Digital To Pay $200 Million In Terra-LUNA Settlement With New York Attorney General Bitcoin Down To $85,000, Ethereum, XRP Slide 5% Before Key Inflation Data Trump's SEC Pick Paul Atkins Says His 'Top Priority' Will Be 'Rational' Crypto Regulations, Marking Shift From Gary Gensler's Approach",0.066135,Neutral,0.049221,Somewhat-Bearish,0,focused,AI
VRNT,"Company News for Mar 28, 2025",https://www.zacks.com/stock/news/2436751/company-news-for-mar-28-2025,20250328T133500,Zacks Commentary,Companies in the News Are: ...,0.28123,Somewhat-Bullish,0.541149,Neutral,0,broad,
VRNT,"US Stocks Likely To Open Lower, Analysts Warn 'Prolonged Uncertainty Could Hurt Both US And Global Risk Assets' - Braze  ( NASDAQ:BRZE ) , AAR  ( NYSE:AIR ) ",https://www.benzinga.com/general/market-summary/25/03/44531466/us-stocks-likely-to-open-lower-analysts-warn-prolonged-uncertainty-could-hurt-both-us-and-,20250328T093122,Benzinga,U.S. stock futures fell on Friday after two consecutive days of decline on Wednesday and Thursday. Futures of major benchmark indices were lower in premarket trading. Stocks slid as investors digested the new auto tariffs levied on foreign cars and auto parts.,0.041437,Neutral,0.070414,Neutral,0,focused,AI
VRNT,"Dow Dips 150 Points Following Trump's Auto Tariffs, Verint Systems Slides On Q4 Miss: Greed Index Remains In 'Fear' Zone - Mercedes-Benz Group  ( OTC:MBGAF ) , Katapult Holdings  ( NASDAQ:KPLT ) ",https://www.benzinga.com/news/earnings/25/03/44529927/dow-dips-150-points-following-trumps-auto-tariffs-verint-systems-slides-on-q4-miss-greed-index-rema,20250328T060822,Benzinga,"The CNN Money Fear and Greed index showed almost no change in the overall market sentiment, while the index remained in the ""Fear"" zone on Thursday. U.S. stocks settled lower on Thursday, with the Dow Jones index falling more than 150 points during the session as investors assessed recent ...",-0.096648,Neutral,0.166743,Neutral,0,focused,AI
VRNT,These Analysts Slash Their Forecasts On Verint Systems Following Downbeat Earnings - Verint Systems  ( NASDAQ:VRNT ) ,https://www.benzinga.com/25/03/44516704/these-analysts-slash-their-forecasts-on-verint-systems-following-downbeat-earnings,20250327T145824,Benzinga,Verint Systems Inc. VRNT on Wednesday reported worse-than-expected fourth-quarter financial results and issued FY26 EPS guidance with its midpoint below estimates. Verint Systems reported quarterly earnings of 99 cents per share which missed the analyst consensus estimate of $1.27 per share.,0.344259,Somewhat-Bullish,0.434142,Neutral,0,broad,
VRNT,"Verint Systems Posts Downbeat Results, Joins Nio, General Motors And Other Big Stocks Moving Lower In Thursday's Pre-Market Session - Celanese  ( NYSE:CE ) , Coda Octopus Group  ( NASDAQ:CODA ) ",https://www.benzinga.com/25/03/44512498/verint-systems-posts-downbeat-results-joins-nio-general-motors-and-other-big-stocks-moving-lower-in-thursdays-pre,20250327T122158,Benzinga,"U.S. stock futures were mixed this morning, with the Dow futures gaining around 0.2% on Thursday. Shares of Verint Systems Inc. VRNT fell sharply in today's pre-market trading after the company reported worse-than-expected fourth-quarter financial results and issued FY26 EPS guidance with its ...",-0.08019,Neutral,0.285526,Neutral,0,focused,AI
VRNT,Verint Systems  ( VRNT )  Q4 Earnings and Revenues Lag Estimates,https://www.zacks.com/stock/news/2435828/verint-systems-vrnt-q4-earnings-and-revenues-lag-estimates,20250326T212005,Zacks Commentary,"Verint (VRNT) delivered earnings and revenue surprises of -22.05% and 8.43%, respectively, for the quarter ended January 2025. Do the numbers hold clues to what lies ahead for the stock?",0.125637,Neutral,0.14131,Neutral,0,broad,
VRNT,Gear Up for Verint  ( VRNT )  Q4 Earnings: Wall Street Estimates for Key Metrics,https://www.zacks.com/stock/news/2433302/gear-up-for-verint-vrnt-q4-earnings-wall-street-estimates-for-key-metrics,20250321T131521,Zacks Commentary,"Besides Wall Street's top -and-bottom-line estimates for Verint (VRNT), review projections for some of its key metrics to gain a deeper understanding of how the company might have fared during the quarter ended January 2025.",0.197051,Somewhat-Bullish,0.24289,Somewhat-Bullish,0,focused,AI
VRNT,Sapiens Cloud Adopted by Hiscox UK: Should You Watch the Stock?,https://www.zacks.com/stock/news/2430382/sapiens-cloud-adopted-by-hiscox-uk-should-you-watch-the-stock,20250314T160800,Zacks Commentary,"Hiscox UK transitions to SPNS's insurance platform, boosting efficiency. Yet, currency headwinds raise concerns.",0.369957,Bullish,0.16171,Somewhat-Bullish,0,focused,AI
VRNT,Intuit Falls 13% in a Year: Is it the Right Time to Buy the Stock?,https://www.zacks.com/stock/news/2428498/intuit-falls-13-in-a-year-is-it-the-right-time-to-buy-the-stock,20250311T151100,Zacks Commentary,"INTU forms key partnerships and integrates AI into its services, which investors should see as a compelling entry point.",0.392227,Bullish,0.132368,Neutral,0,focused,AI
VRNT,BlackBerry's QNX Division Launches GEDP to Accelerate Innovation,https://www.zacks.com/stock/news/2428373/blackberrys-qnx-division-launches-gedp-to-accelerate-innovation,20250311T135000,Zacks Commentary,"BB's QNX unveils QNX GEDP, a powerful platform for fast, scalable and secure embedded system development.",0.299689,Somewhat-Bullish,0.187827,Neutral,0,broad,
VRNT,Magic Software  ( MGIC )  Q4 Earnings Miss Estimates,https://www.zacks.com/stock/news/2428294/magic-software-mgic-q4-earnings-miss-estimates,20250311T134502,Zacks Commentary,"Magic Software (MGIC) delivered earnings and revenue surprises of -4% and 4.07%, respectively, for the quarter ended December 2024. Do the numbers hold clues to what lies ahead for the stock?",0.191491,Somewhat-Bullish,0.205225,Neutral,0,broad,
VRNT,4 Top Value Stocks to Invest in as the Market Battles Tariff Concerns,https://www.zacks.com/stock/news/2425716/4-top-value-stocks-to-invest-in-as-the-market-battles-tariff-concerns,20250305T120300,Zacks Commentary,"Value investing is essentially about selecting cheap but fundamentally sound stocks. ENS, SON, VRNT and GM boast low P/CF ratios.",0.217417,Somewhat-Bullish,0.194763,Neutral,0,broad,
VRNT,SAP Stock Jumps 32% in Six Months: What Should Investors Do?,https://www.zacks.com/stock/news/2424990/sap-stock-jumps-32-in-six-months-what-should-investors-do,20250304T124500,Zacks Commentary,SAP's performance is driven by strengthening its cloud business. Global macroeconomic weakness and tough competition in the cloud space are concerns.,0.173959,Somewhat-Bullish,0.122894,Neutral,0,broad,
VRNT,ACI Worldwide  ( ACIW )  Q4 Earnings and Revenues Surpass Estimates,https://www.zacks.com/stock/news/2422528/aci-worldwide-aciw-q4-earnings-and-revenues-surpass-estimates,20250227T121504,Zacks Commentary,"ACI Worldwide (ACIW) delivered earnings and revenue surprises of 36.71% and 0.51%, respectively, for the quarter ended December 2024. Do the numbers hold clues to what lies ahead for the stock?",0.152703,Somewhat-Bullish,0.205807,Neutral,0,broad,
VRNT,Itron  ( ITRI )  Q4 Earnings and Revenues Top Estimates,https://www.zacks.com/stock/news/2421226/itron-itri-q4-earnings-and-revenues-top-estimates,20250225T144503,Zacks Commentary,"Itron (ITRI) delivered earnings and revenue surprises of 28.57% and 1.59%, respectively, for the quarter ended December 2024. Do the numbers hold clues to what lies ahead for the stock?",0.159571,Somewhat-Bullish,0.205225,Neutral,0,broad,
VRNT,VRNT vs. INTU: Which Stock Is the Better Value Option?,https://www.zacks.com/stock/news/2418932/vrnt-vs-intu-which-stock-is-the-better-value-option,20250220T164017,Zacks Commentary,Investors looking for stocks in the Computer - Software sector might want to consider either Verint Systems ( VRNT Quick QuoteVRNT - ) or Intuit ( INTU Quick QuoteINTU - ) . But which of these two stocks presents investors with the better value opportunity right now? Let's take a closer look.,0.489345,Bullish,0.77735,Bullish,0,broad,
VRNT,Gilat Unveils Defense Division to Strengthen SATCOM Solutions,https://www.zacks.com/stock/news/2418531/gilat-unveils-defense-division-to-strengthen-satcom-solutions,20250220T141900,Zacks Commentary,GILT launches Defense Division to meet the rising demand for secure government and military SATCOM solutions.,0.357365,Bullish,0.206245,Neutral,0,broad,
VRNT,"The Zacks Analyst Blog Salesforce, Qualcomm, Verint, Varonis and S&P Global",https://www.zacks.com/stock/news/2412399/the-zacks-analyst-blog-salesforce-qualcomm-verint-varonis-and-sp-global,20250210T085700,Zacks Commentary,"Salesforce, Qualcomm, Verint, Varonis and S&P Global are included in this Analyst Blog.",0.308214,Somewhat-Bullish,0.229149,Neutral,0,broad,
VRNT,5 Big Data Providers to Buy on Lucrative Short-Term Upside Potential,https://www.zacks.com/stock/news/2411786/5-big-data-providers-to-buy-on-lucrative-short-term-upside-potential,20250207T125500,Zacks Commentary,"Five Big Data stocks have strong revenue and earnings growth potential for 2025. These are: CRM, QCOM, VRNT, VRNS, SPGI.",0.312683,Somewhat-Bullish,0.213853,Neutral,0,broad,
