ticker,title,url,time_published,source,summary,sentiment_score,sentiment_label,ticker_sentiment_score,ticker_sentiment_label,relevance_score,category,ai_keywords_found
VRNT,Elan Moriah Implements A Sell Strategy: Offloads $468K In Verint Systems Stock - Verint Systems  ( NASDAQ:VRNT ) ,https://www.benzinga.com/insights/news/24/04/38071699/elan-moriah-implements-a-sell-strategy-offloads-468k-in-verint-systems-stock,20240403T150052,Benzinga,"On April 2, a recent SEC filing unveiled that Elan Moriah, President at Verint Systems VRNT made an insider sell. What Happened: A Form 4 filing with the U.S. Securities and Exchange Commission on Tuesday outlined that Moriah executed a sale of 14,353 shares of Verint Systems with a total value ...",0.215421,Somewhat-Bullish,0.411656,Bullish,0,broad,
VRNT,"Dell, TJX And 2 Other Stocks Insiders Are Selling - Apollo Global Management  ( NYSE:APO ) , Dell Technologies  ( NYSE:DELL ) ",https://www.benzinga.com/news/24/03/37889597/dell-tjx-and-2-other-stocks-insiders-are-selling,20240322T121941,Benzinga,"The Nasdaq 100 closed higher by around 80 points on Thursday. Investors, meanwhile, focused on some notable insider trades. When insiders sell shares, it could be a preplanned sale, or could indicate their concern in the company's prospects or that they view the stock as being overpriced.",0.273952,Somewhat-Bullish,0.337427,Bullish,0,broad,
VRNT,"Intelligent Virtual Assistant Market size is set to grow by USD 5000.82 mn from 2024-2028,Increasing demand for ... - PR Newswire",https://www.prnewswire.com/news-releases/intelligent-virtual-assistant-market-size-is-set-to-grow-by-usd-5000-82-mn-from-2024-2028-increasing-demand-for-enhanced-customer-service-in-businesses-boost-the-market--technavio-302094097.html,20240320T233200,PR Newswire,"Intelligent Virtual Assistant Market size is set to grow by USD 5000.82 mn from 2024-2028,Increasing demand for ... PR ...",0.405467,Bullish,0.03478,Neutral,0,focused,intelligent
VRNT,"Verint Systems  ( NASDAQ:VRNT )  Upgraded to ""Buy"" at StockNews.com",https://www.americanbankingnews.com/2024/03/14/verint-systems-nasdaqvrnt-upgraded-to-buy-at-stocknews-com.html,20240314T062609,Stocknews.com,"Verint Systems ( NASDAQ:VRNT ) Upgraded to ""Buy"" at ...",0.35679,Bullish,0.685724,Bullish,0,broad,
VRNT,"Verint Systems  ( NASDAQ:VRNT )  Upgraded to ""Buy"" at StockNews.com",https://www.defenseworld.net/2024/03/14/verint-systems-nasdaqvrnt-upgraded-to-buy-at-stocknews-com.html,20240314T062444,Stocknews.com,"Verint Systems ( NASDAQ:VRNT - Get Free Report ) was upgraded by equities research analysts at StockNews.com from a ""hold"" rating to a ""buy"" rating in a research note issued to investors on Thursday. VRNT has been the topic of a number of other research reports.",0.400003,Bullish,0.62523,Bullish,0,broad,
VRNT,"Verint Systems  ( NASDAQ:VRNT )  Downgraded to ""Hold"" at StockNews.com",https://www.defenseworld.net/2024/03/07/verint-systems-nasdaqvrnt-downgraded-to-hold-at-stocknews-com.html,20240307T095044,Stocknews.com,StockNews.com cut shares of Verint Systems ( NASDAQ:VRNT - Free Report ) from a buy rating to a hold rating in a report issued on Wednesday.,0.355118,Bullish,0.732595,Bullish,0,broad,
VRNT,Stocks Generating Improved Relative Strength: Verint Systems,https://www.investors.com/ibd-data-stories/stocks-generating-improved-relative-strength-verint-systems/,20240212T080000,Investors Business Daily,"Verint Systems ( VRNT ) saw a positive improvement to its Relative Strength ( RS ) Rating on Monday, with an increase from 69 to 74. X When looking for the best stocks to buy and watch, one factor to watch closely is relative price strength.",0.401959,Bullish,0.605266,Bullish,0,broad,
VRNT,"Comcast, Discover Financial And 2 Other Stocks Insiders Are Selling - Discover Finl  ( NYSE:DFS ) , Comcast  ( NASDAQ:CMCSA ) ",https://www.benzinga.com/news/24/01/36864072/comcast-discover-financial-and-2-other-stocks-insiders-are-selling,20240131T123304,Benzinga,"The Nasdaq 100 closed lower by more than 100 points on Tuesday. Investors, meanwhile, focused on some notable insider trades. When insiders sell shares, it could be a preplanned sale, or could indicate their concern in the company's prospects or that they view the stock as being overpriced.",0.171498,Somewhat-Bullish,0.417304,Bullish,0,broad,
VRNT,VRNT vs. INTU: Which Stock Is the Better Value Option?,https://www.zacks.com/stock/news/2218107/vrnt-vs-intu-which-stock-is-the-better-value-option,20240130T164010,Zacks Commentary,Investors looking for stocks in the Computer - Software sector might want to consider either Verint Systems ( VRNT Quick QuoteVRNT - ) or Intuit ( INTU Quick QuoteINTU - ) . But which of these two companies is the best option for those looking for undervalued stocks? Let's take a closer look.,0.461033,Bullish,0.773597,Bullish,0,broad,
VRNT,VRNT or SNPS: Which Is the Better Value Stock Right Now?,https://www.zacks.com/stock/news/2209639/vrnt-or-snps-which-is-the-better-value-stock-right-now,20240112T164009,Zacks Commentary,VRNT vs. SNPS: Which Stock Is the Better Value Option?,0.457323,Bullish,0.807885,Bullish,0,broad,
VRNT,"Verint Systems  ( NASDAQ:VRNT )  Upgraded to ""Buy"" by StockNews.com",https://www.defenseworld.net/2024/01/12/verint-systems-nasdaqvrnt-upgraded-to-buy-by-stocknews-com.html,20240112T062246,Stocknews.com,"Verint Systems ( NASDAQ:VRNT - Get Free Report ) was upgraded by research analysts at StockNews.com from a ""hold"" rating to a ""buy"" rating in a report issued on Friday. A number of other equities analysts also recently issued reports on the stock.",0.302548,Somewhat-Bullish,0.675683,Bullish,0,broad,
VRNT,"Workforce Management Software Market size to grow by USD 2.30 billion between 2022 - 2027, Growth Driven by ... - PR Newswire",https://www.prnewswire.com/news-releases/workforce-management-software-market-size-to-grow-by-usd-2-30-billion-between-2022---2027--growth-driven-by-need-for-regulatory-compliance---technavio-302026348.html,20240105T223500,PR Newswire,"Workforce Management Software Market size to grow by USD 2.30 billion between 2022 - 2027, Growth Driven by ... PR ...",0.273668,Somewhat-Bullish,0.054236,Neutral,0,broad,
VRNT,Verint Systems  ( NASDAQ:VRNT )  Lowered to Hold at StockNews.com,https://www.defenseworld.net/2024/01/05/verint-systems-nasdaqvrnt-lowered-to-hold-at-stocknews-com.html,20240105T093248,Stocknews.com,StockNews.com cut shares of Verint Systems ( NASDAQ:VRNT - Free Report ) from a buy rating to a hold rating in a research note published on Thursday. Other analysts also recently issued reports about the company.,0.331028,Somewhat-Bullish,0.740604,Bullish,0,broad,
VRNT,Massive Insider Trade At Verint Systems - Verint Systems  ( NASDAQ:VRNT ) ,https://www.benzinga.com/news/23/12/36326259/massive-insider-trade-at-verint-systems,20231220T150338,Benzinga,"Peter Fante, Chief Administrative Officer at Verint Systems VRNT, executed a substantial insider sell on December 19, according to an SEC filing. What Happened: Fante's decision to sell 3,370 shares of Verint Systems was revealed in a Form 4 filing with the U.S. Securities and Exchange Commission ...",0.2979,Somewhat-Bullish,0.308504,Bullish,0,broad,
VRNT,President At Verint Systems Sells $135K Of Stock - Verint Systems  ( NASDAQ:VRNT ) ,https://www.benzinga.com/news/23/12/36326258/president-at-verint-systems-sells-135k-of-stock,20231220T150333,Benzinga,"Disclosed on December 19, Elan Moriah, President at Verint Systems VRNT, executed a substantial insider sell as per the latest SEC filing. What Happened: Moriah's decision to sell 4,944 shares of Verint Systems was revealed in a Form 4 filing with the U.S. Securities and Exchange Commission on ...",0.320919,Somewhat-Bullish,0.318074,Bullish,0,broad,
VRNT,"Verint Systems  ( NASDAQ:VRNT )  Upgraded by StockNews.com to ""Buy""",https://www.defenseworld.net/2023/12/10/verint-systems-nasdaqvrnt-upgraded-by-stocknews-com-to-buy.html,20231210T073109,Stocknews.com,"Verint Systems ( NASDAQ:VRNT - Get Free Report ) was upgraded by investment analysts at StockNews.com from a ""hold"" rating to a ""buy"" rating in a research note issued on Friday. Other research analysts have also issued reports about the company.",0.280876,Somewhat-Bullish,0.72148,Bullish,0,broad,
VRNT,"Company News for Dec 8, 2023",https://www.zacks.com/stock/news/2195478/company-news-for-dec-8-2023,20231208T144500,Zacks Commentary,Companies In The Article Are: ...,-0.002446,Neutral,0.608634,Somewhat-Bullish,0,broad,
VRNT,"Verint Reports Strong Earnings, Joins Semtech, Alphabet And Other Big Stocks Moving Higher On Thursday - Altimmune  ( NASDAQ:ALT ) , AbbVie  ( NYSE:ABBV ) ",https://www.benzinga.com/news/23/12/36135689/verint-reports-strong-earnings-joins-semtech-alphabet-and-other-big-stocks-moving-higher-on-thursday,20231207T151742,Benzinga,"U.S. stocks traded mostly higher, with the Nasdaq Composite gaining more than 100 points on Thursday. Shares of Verint Systems Inc. VRNT rose sharply during Thursday's session after the company reported better-than-expected third-quarter financial results and issued guidance.",0.388,Bullish,0.177802,Bullish,0,focused,AI
VRNT,"Top 5 Tech Stocks You May Want To Dump In December - Neonode  ( NASDAQ:NEON ) , Porch Group  ( NASDAQ:PRCH ) ",https://www.benzinga.com/news/23/12/36132432/top-5-tech-stocks-you-may-want-to-dump-in-december,20231207T132517,Benzinga,"As of Dec. 7, 2023, five stocks in the information technology sector could be flashing a real warning to investors who value momentum as a key criteria in their trading decisions. The RSI is a momentum indicator, which compares a stock's strength on days when prices go up to its strength on days ...",0.306459,Somewhat-Bullish,0.144275,Somewhat-Bullish,0,broad,
VRNT,"Dollar General, Broadcom And 3 Stocks To Watch Heading Into Thursday - Broadcom  ( NASDAQ:AVGO ) , Couchbase  ( NASDAQ:BASE ) ",https://www.benzinga.com/news/earnings/23/12/36127577/dollar-general-broadcom-and-3-stocks-to-watch-heading-into-thursday,20231207T080652,Benzinga,"With U.S. stock futures trading lower this morning on Thursday, some of the stocks that may grab investor focus today are as follows: Wall Street expects Dollar General Corporation DG to report quarterly earnings at $1.19 per share on revenue of $9.65 billion before the opening bell.",0.30727,Somewhat-Bullish,0.371523,Bullish,0,broad,
VRNT,Verint Likely To Report Lower Q3 Earnings; These Most Accurate Analysts Revise Forecasts Ahead Of Earnings Call - Verint Systems  ( NASDAQ:VRNT ) ,https://www.benzinga.com/news/earnings/23/12/36116038/verint-likely-to-report-lower-q3-earnings-these-most-accurate-analysts-revise-forecasts-ahead-of-ea,20231206T160743,Benzinga,"Verint Systems Inc. VRNT is projected to release financial results for its third quarter, after the closing bell on Dec. 6, 2023. Analysts expect the company to post quarterly earnings at 57 cents per share, down from year-ago earnings of 69 cents per share.",0.087013,Neutral,0.608634,Neutral,0,broad,
VRNT,Ooma  ( OOMA )  Q3 Earnings Match Estimates,https://www.zacks.com/stock/news/2193834/ooma-ooma-q3-earnings-match-estimates,20231205T222503,Zacks Commentary,"Ooma (OOMA) delivered earnings and revenue surprises of 0% and 0.70%, respectively, for the quarter ended October 2023. Do the numbers hold clues to what lies ahead for the stock?",0.136469,Neutral,0.207571,Neutral,0,broad,
VRNT,Curious about Verint  ( VRNT )  Q3 Performance? Explore Wall Street Estimates for Key Metrics,https://www.zacks.com/stock/news/2192366/curious-about-verint-vrnt-q3-performance-explore-wall-street-estimates-for-key-metrics,20231201T163200,Zacks Commentary,Get a deeper insight into the potential performance of Verint (VRNT) for the quarter ended October 2023 by going beyond Wall Street's top -and-bottom-line estimates and examining the estimates for some of its key metrics.,0.086315,Neutral,0.224903,Neutral,0,broad,
VRNT,Intuit  ( INTU )  Beats Q1 Earnings and Revenue Estimates,https://www.zacks.com/stock/news/2190542/intuit-intu-beats-q1-earnings-and-revenue-estimates,20231128T221502,Zacks Commentary,"Intuit (INTU) delivered earnings and revenue surprises of 24.75% and 3.60%, respectively, for the quarter ended October 2023. Do the numbers hold clues to what lies ahead for the stock?",0.175184,Somewhat-Bullish,0.205807,Neutral,0,broad,
VRNT,CRM in Healthcare Market to grow by USD 8.01 billion from 2022 to 2027|The growing adoption of cloud-based CRM ... - PR Newswire,https://www.prnewswire.com/news-releases/crm-in-healthcare-market-to-grow-by-usd-8-01-billion-from-2022-to-2027the-growing-adoption-of-cloud-based-crm-solutions-is-an-emerging-trend-supporting-market-growth---technavio-301969500.html,20231027T020000,PR Newswire,CRM in Healthcare Market to grow by USD 8.01 billion from 2022 to 2027|The growing adoption of cloud-based CRM ... PR ...,0.373383,Bullish,0.037563,Neutral,0,broad,
VRNT,"Top 5 Tech Stocks Which Could Rescue Your Portfolio This Month - SEALSQ  ( NASDAQ:LAES ) , Cerence  ( NASDAQ:CRNC ) ",https://www.benzinga.com/trading-ideas/long-ideas/23/10/35391558/top-5-tech-stocks-which-could-rescue-your-portfolio-this-month,20231024T121731,Benzinga,"The most oversold stocks in the information technology sector presents an opportunity to buy into undervalued companies. The RSI is a momentum indicator, which compares a stock's strength on days when prices go up to its strength on days when prices go down.",0.20474,Somewhat-Bullish,0.159569,Neutral,0,broad,
VRNT,JH Kwon Joins Bright Pattern to Lead Korea Business Development & Channel Sales,https://www.prnewswire.com/in/news-releases/jh-kwon-joins-bright-pattern-to-lead-korea-business-development--channel-sales-301961934.html,20231020T004000,PR Newswire,"Bright Pattern, a global provider of omnichannel contact center software, is pleased to welcome JH Kwon to spearhead the Go-To-Market Team in Korea SOUTH SAN FRANCISCO, Calif., Oct. 20, 2023 /PRNewswire/ -- Bright Pattern is proud to announce the addition of JH Kwon to the Bright Pattern team.",0.536126,Bullish,0.100729,Somewhat-Bullish,0,broad,
VRNT,JH Kwon Joins Bright Pattern to Lead Korea Business Development & Channel Sales,https://www.newswire.ca/news-releases/jh-kwon-joins-bright-pattern-to-lead-korea-business-development-amp-channel-sales-845814330.html,20231020T004000,Canada Newswire,"Bright Pattern, a global provider of omnichannel contact center software, is pleased to welcome JH Kwon to spearhead the Go-To-Market Team in Korea SOUTH SAN FRANCISCO, Calif., Oct. 19, 2023 /CNW/ -- Bright Pattern is proud to announce the addition of JH Kwon to the Bright Pattern team.",0.536126,Bullish,0.100729,Somewhat-Bullish,0,broad,
VRNT,"Global Customer Experience  ( CX )  Management Markets, 2023-2028: Asia Pacific Emerges as a Hub for Customer-Centric Strategies, Increasing Focus on Enhancing Customer Loyalty Spurs Demand",https://www.prnewswire.com/news-releases/global-customer-experience-cx-management-markets-2023-2028-asia-pacific-emerges-as-a-hub-for-customer-centric-strategies-increasing-focus-on-enhancing-customer-loyalty-spurs-demand-301961820.html,20231019T101500,PR Newswire,"Global Customer Experience ( CX ) Management Markets, 2023-2028: Asia Pacific Emerges as a Hub for Customer ... PR ...",0.447317,Bullish,0.040416,Somewhat-Bullish,0,broad,
VRNT,"Customer Experience Management Market worth $20.4 billion by 2028, growing at a CAGR of 12.2%: Report by MarketsandMarkets™",https://www.benzinga.com/pressreleases/23/10/g35194133/customer-experience-management-market-worth-20-4-billion-by-2028-growing-at-a-cagr-of-12-2-report-,20231011T140000,Benzinga,"Chicago, Oct. 11, 2023 ( GLOBE NEWSWIRE ) -- The global Customer Experience Management Market is estimated to be worth USD 11.4 billion in 2023 and is projected to reach USD 20.4 billion by 2028, at a CAGR of 12.2% during the forecast period, according to a new report by MarketsandMarkets™.",0.530526,Bullish,0.071357,Neutral,0,broad,
VRNT,"Customer Engagement Solutions Market to grow by USD 11.60 billion from 2022 to 2027, Growth Driven by Increasing ... - PR Newswire",https://www.prnewswire.com/news-releases/customer-engagement-solutions-market-to-grow-by-usd-11-60-billion-from-2022-to-2027--growth-driven-by-increasing-adoption-of-e-commerce-business-models--technavio-301949133.html,20231006T223500,PR Newswire,"Customer Engagement Solutions Market to grow by USD 11.60 billion from 2022 to 2027, Growth Driven by Increasing ... PR ...",0.395354,Bullish,0.056407,Neutral,0,broad,
VRNT,Verint Systems  ( NASDAQ:VRNT )  Receives New Coverage from Analysts at StockNews.com,https://www.defenseworld.net/2023/10/06/verint-systems-nasdaqvrnt-receives-new-coverage-from-analysts-at-stocknews-com.html,20231006T054046,Stocknews.com,Verint Systems ( NASDAQ:VRNT ) Receives New Coverage from ... Defense World ...,0.291358,Somewhat-Bullish,0.726769,Bullish,0,broad,
VRNT,"Stocks That Hit 52-Week Lows On Thursday - PRA Group  ( NASDAQ:PRAA ) , Perimeter Solutions  ( NYSE:PRM ) ",https://www.benzinga.com/news/23/10/35111787/stocks-that-hit-52-week-lows-on-thursday,20231005T172202,Benzinga,"On Thursday, 369 companies hit new 52-week lows. The largest company in terms of market cap to set a new 52-week low was Coca-Cola KO. The smallest company by market cap to hit a new 52-week low was Neptune Wellness Solns NEPT.",-0.11524,Neutral,0.013047,Neutral,0,broad,
VRNT,Half-Yearly Results,https://www.globenewswire.com/news-release/2023/09/21/2747533/0/en/Half-Yearly-Results.html,20230921T163000,GlobeNewswire,Octopus Titan ...,0.224723,Somewhat-Bullish,0.010117,Neutral,0,broad,
VRNT,StockNews.com Downgrades Verint Systems  ( NASDAQ:VRNT )  to Hold,https://www.defenseworld.net/2023/09/08/stocknews-com-downgrades-verint-systems-nasdaqvrnt-to-hold.html,20230908T092043,Stocknews.com,StockNews.com Downgrades Verint Systems ( NASDAQ:VRNT ) to ... Defense World ...,0.361495,Bullish,0.775813,Bullish,0,broad,
VRNT,Why Verint Systems Stock Dropped Today,https://www.fool.com/investing/2023/09/07/why-verint-systems-stock-dropped-today/,20230907T192640,Motley Fool,The customer engagement solutions leader delivered weaker-than-expected quarterly results. Here's what investors need to know.,0.090834,Neutral,0.305058,Somewhat-Bullish,0,broad,
VRNT,"Stocks making the biggest moves midday: ChargePoint Holdings, Seagate Technology, C3.ai and more",https://www.cnbc.com/2023/09/07/stocks-making-the-biggest-moves-midday-chargepoint-holdings-seagate-technology-c3ai-and-more-.html,20230907T164250,CNBC,These are the stocks posting the largest moves in midday trading.,0.029107,Neutral,0.061949,Neutral,0,focused,AI
VRNT,Jim Cramer's top 10 things to watch in the stock market Thursday,https://www.cnbc.com/2023/09/07/jim-cramers-top-10-things-to-watch-in-the-stock-market-thursday.html,20230907T130907,CNBC,"Stocks are poised to open lower Thursday, while the market looks to China's reported ban on iPhones for government workers.",0.160311,Somewhat-Bullish,0.13347,Neutral,0,broad,
VRNT,These Analysts Cut Their Forecasts On Verint Systems Following Weak Q2 Results - Verint Systems  ( NASDAQ:VRNT ) ,https://www.benzinga.com/news/earnings/23/09/34316790/these-analysts-cut-their-forecasts-on-verint-systems-following-weak-q2-results,20230907T124359,Benzinga,"Verint Systems Inc. VRNT reported weaker-than-expected second-quarter results. Verint posted quarterly earnings of 48 cents per share, missing market expectations of 57 cents per share. The company's quarterly sales came in at $210.41 million versus estimates of $225.10 million.",0.116017,Neutral,0.904419,Neutral,0,broad,
VRNT,"Why WestRock Shares Are Trading Higher By 12%; Here Are 20 Stocks Moving Premarket - Alarum Technologies  ( NASDAQ:ALAR ) , Amkor Tech  ( NASDAQ:AMKR ) ",https://www.benzinga.com/news/23/09/34315309/why-westrock-shares-are-trading-higher-by-12-here-are-20-stocks-moving-premarket,20230907T121013,Benzinga,"American Rebel Holdings, Inc. AREB rose 39.7% to $1.25 in pre-market trading. American Rebel announced Wednesday, that its safe subsidiary Champion Safe was bombarded with calls from safe dealers and customers looking for alternatives to safes made by Liberty Safe. Artelo Biosciences, Inc.",0.068936,Neutral,0.16117,Somewhat-Bearish,0,broad,
VRNT,"Stocks making the biggest moves premarket: Apple, WestRock, McDonald's and more",https://www.cnbc.com/2023/09/07/stocks-making-the-biggest-moves-premarket-aapl-wrk-mcd.html,20230907T120349,CNBC,These are the companies making headlines in premarket trading Thursday.,0.014571,Neutral,0.07423,Neutral,0,broad,
VRNT,"Roku To Rally Around 17%? Here Are 10 Other Analyst Forecasts For Thursday - Crocs  ( NASDAQ:CROX ) , American Eagle Outfitters  ( NYSE:AEO ) ",https://www.benzinga.com/news/23/09/34313962/roku-to-rally-around-17-here-are-10-other-analyst-forecasts-for-thursday,20230907T114447,Benzinga,"Needham cut the price target for Verint Systems Inc. VRNT from $50 to $40. Needham analyst Ryan MacDonald maintained a Buy rating. Verint shares fell 17.8% to $25.35 in pre-market trading. Raymond James slashed Dave & Buster's Entertainment, Inc. PLAY price target from $60 to $55.",0.095076,Neutral,0.183198,Neutral,0,focused,AI
VRNT,"Yext, Verint Systems And Other Big Stocks Moving Lower In Thursday's Pre-Market Session - C3.ai  ( NYSE:AI ) , Amkor Tech  ( NASDAQ:AMKR ) ",https://www.benzinga.com/news/23/09/34312047/yext-verint-systems-and-other-big-stocks-moving-lower-in-thursdays-pre-market-session,20230907T110047,Benzinga,"U.S. stock futures traded lower this morning on Thursday. Here are some big stocks recording losses in today's pre-market trading session. Sportsman's Warehouse Holdings, Inc. SPWH tumbled 25.8% to $3.34 in pre-market trading after the company posted downbeat second-quarter results.",-0.15954,Somewhat-Bearish,0.308891,Bearish,0,focused,AI
VRNT,Verint Systems  ( VRNT )  Misses Q2 Earnings and Revenue Estimates,https://www.zacks.com/stock/news/2145648/verint-systems-vrnt-misses-q2-earnings-and-revenue-estimates,20230906T212507,Zacks Commentary,"Verint (VRNT) delivered earnings and revenue surprises of -18.64% and 6.90%, respectively, for the quarter ended July 2023. Do the numbers hold clues to what lies ahead for the stock?",0.152883,Somewhat-Bullish,0.138863,Neutral,0,broad,
VRNT,"Stocks making the biggest moves after hours: GameStop, American Eagle Outfitters and more",https://www.cnbc.com/2023/09/06/stocks-making-the-biggest-moves-after-hours-gme-aeo-chpt-ai.html,20230906T211424,CNBC,These are the stocks posting the largest moves in extended trading.,-0.009531,Neutral,0.117486,Neutral,0,broad,
VRNT,Verint Systems Gears Up For Q2 Print; Here's A Look At Recent Price Target Changes By The Most Accurate Analysts - Verint Systems  ( NASDAQ:VRNT ) ,https://www.benzinga.com/news/earnings/23/09/34264540/verint-systems-gears-up-for-q2-print-heres-a-look-at-recent-price-target-changes-by-the-most-accura,20230906T070725,Benzinga,"Verint Systems Inc. VRNT is expected to report financial results for its second quarter, after the closing bell on Sept. 6, 2023. Analysts expect the company to post quarterly earnings at 57 cents per share, up from year-ago earnings of 56 cents per share.",0.081751,Neutral,0.528475,Neutral,0,broad,
VRNT,VMware  ( VMW )  Q2 Earnings and Revenues Beat Estimates,https://www.zacks.com/stock/news/2143266/vmware-vmw-q2-earnings-and-revenues-beat-estimates,20230831T212506,Zacks Commentary,"VMware (VMW) delivered earnings and revenue surprises of 10.24% and 0.58%, respectively, for the quarter ended July 2023. Do the numbers hold clues to what lies ahead for the stock?",0.168699,Somewhat-Bullish,0.20698,Neutral,0,broad,
VRNT,MSFT: 3 Software Superstars to Download in September,https://stocknews.com/news/msft-pega-vrnt-mco-3-software-superstars-to-download-in-september/,20230831T155509,Stocknews.com,"The utilization of Artificial Intelligence ( AI ) is consistently surging across a wide array of industries and sectors. As businesses become increasingly aware of AI's substantial capacity to foster innovation and enhance efficiency, the demand for AI-based software solutions is bound to ...",0.397454,Bullish,0.189484,Somewhat-Bullish,0,focused,"artificial intelligence, AI"
VRNT,Hewlett Packard Enterprise  ( HPE )  Tops Q3 Earnings and Revenue Estimates,https://www.zacks.com/stock/news/2142158/hewlett-packard-enterprise-hpe-tops-q3-earnings-and-revenue-estimates,20230829T212506,Zacks Commentary,"HP Enterprise (HPE) delivered earnings and revenue surprises of 6.52% and 0.35%, respectively, for the quarter ended July 2023. Do the numbers hold clues to what lies ahead for the stock?",0.191079,Somewhat-Bullish,0.199584,Neutral,0,broad,
VRNT,Customer Experience Management Market worth $20.4 billion by 2028 - Exclusive Report by MarketsandMarkets™,https://www.prnewswire.com/news-releases/customer-experience-management-market-worth-20-4-billion-by-2028---exclusive-report-by-marketsandmarkets-301907749.html,20230823T143000,PR Newswire,"CHICAGO, Aug. 23, 2023 /PRNewswire/ -- Future trends in the Customer Experience Management ( CXM ) market will include hyper-personalization, omnichannel integration, AI-powered interactions, ethical data use, and a concentration on predictive analytics and emotion analysis.",0.362122,Bullish,0.043579,Neutral,0,focused,"AI, predictive analytics"
VRNT,Customer Experience Management Market to grow by USD 12.55 billion from 2022 to 2027 | Increasing focus on ... - PR Newswire,https://www.prnewswire.com/news-releases/customer-experience-management-market-to-grow-by-usd-12-55-billion-from-2022-to-2027--increasing-focus-on-customer-centricity-among-organizations-to-boost-the-market--technavio-301902765.html,20230817T110000,PR Newswire,Customer Experience Management Market to grow by USD 12.55 billion from 2022 to 2027 | Increasing focus on ... PR ...,0.289086,Somewhat-Bullish,0.056943,Neutral,0,broad,
