ticker,title,url,time_published,source,summary,sentiment_score,sentiment_label,ticker_sentiment_score,ticker_sentiment_label,relevance_score,category,ai_keywords_found
VRNT,Pick These 4 Low P/CF Value Stocks to Strengthen Your Portfolio,https://www.zacks.com/stock/news/2409966/pick-these-4-low-pcf-value-stocks-to-strengthen-your-portfolio,20250205T140600,Zacks Commentary,"Value investing is essentially about selecting stocks that are usually cheap but fundamentally sound. ENS, VRNT, TSN & GM boast a low P/CF ratio.",0.301997,Somewhat-Bullish,0.180012,Somewhat-Bullish,0,broad,
VRNT,VRNT vs. INTU: Which Stock Should Value Investors Buy Now?,https://www.zacks.com/stock/news/2409408/vrnt-vs-intu-which-stock-should-value-investors-buy-now,20250204T164009,Zacks Commentary,VRNT vs. INTU: Which Stock Is the Better Value Option?,0.450912,Bullish,0.757528,Bullish,0,broad,
VRNT,BlackBerry Completes Sale of Cylance Endpoint to Arctic Wolf,https://www.zacks.com/stock/news/2409126/blackberry-completes-sale-of-cylance-endpoint-to-arctic-wolf,20250204T142700,Zacks Commentary,BB sells its Cylance endpoint security assets to Arctic Wolf for $160 million in cash and equity.,0.314455,Somewhat-Bullish,0.230782,Neutral,0,broad,
VRNT,Do Options Traders Know Something About Verint Systems  ( VRNT )  Stock We Don't?,https://www.zacks.com/stock/news/2401233/do-options-traders-know-something-about-verint-systems-vrnt-stock-we-dont,20250122T143400,Zacks Commentary,Investors need to pay close attention to Verint Systems (VRNT) stock based on the movements in the options market lately.,0.047874,Neutral,0.555911,Neutral,0,broad,
VRNT,Should You Hold NICE Stock Despite 20% Decline Over the Past Year?,https://www.zacks.com/stock/news/2396826/should-you-hold-nice-stock-despite-20-decline-over-the-past-year,20250114T183300,Zacks Commentary,NICE thrives on AI advancements and cloud demand but faces hurdles from tough market competition.,0.253567,Somewhat-Bullish,0.118064,Neutral,0,focused,AI
VRNT,Verint Systems Chief Financial Officer Trades Company's Stock - Verint Systems  ( NASDAQ:VRNT ) ,https://www.benzinga.com/insights/news/24/12/42619061/verint-systems-chief-financial-officer-trades-companys-stock,20241220T150104,Benzinga,"Grant A Highlander, Chief Financial Officer at Verint Systems VRNT, executed a substantial insider sell on December 19, according to an SEC filing. What Happened: A Form 4 filing with the U.S.",0.303945,Somewhat-Bullish,0.390613,Bullish,0,broad,
VRNT,"Company News for Dec 6, 2024",https://www.zacks.com/stock/news/2380255/company-news-for-dec-6-2024,20241206T145200,Zacks Commentary,Companies in The News Are: ...,0.263135,Somewhat-Bullish,0.552443,Bullish,0,broad,
VRNT,"America's Car-Mart Posts Upbeat Sales, Joins Methode Electronics, Verint Systems, Brown-Forman And Other Big Stocks Moving Higher On Thursday - Archer Aviation  ( NYSE:ACHR ) , American Airlines Gr  ( NASDAQ:AAL ) ",https://www.benzinga.com/24/12/42341999/americas-car-mart-posts-upbeat-sales-joins-methode-electronics-verint-systems-brown-forman-and-other-big-stocks-m,20241205T151555,Benzinga,"U.S. stocks were higher, with the Dow Jones index gaining more than 150 points on Wednesday. Shares of America's Car-Mart, Inc. CRMT rose sharply during Thursday's session after the company reported better-than-expected quarterly sales results.",0.429252,Bullish,0.174587,Somewhat-Bullish,0,focused,AI
VRNT,"Why Verint Systems Shares Are Trading Higher By Around 23%; Here Are 20 Stocks Moving Premarket - Alset  ( NASDAQ:AEI ) , American Eagle Outfitters  ( NYSE:AEO ) ",https://www.benzinga.com/24/12/42334389/why-verint-systems-shares-are-trading-higher-by-around-23-here-are-20-stocks-moving-premarket,20241205T110155,Benzinga,"Shares of Verint Systems Inc. VRNT rose sharply in today's pre-market trading after the company reported a year-over-year increase in third-quarter financial results. Verint Systems posted adjusted earnings of 39 cents per share, up from year-ago earnings of 12 cents per share.",0.162806,Somewhat-Bullish,0.288893,Somewhat-Bullish,0,broad,
VRNT,Verint Systems  ( VRNT )  Beats Q3 Earnings and Revenue Estimates,https://www.zacks.com/stock/news/2379187/verint-systems-vrnt-beats-q3-earnings-and-revenue-estimates,20241204T223004,Zacks Commentary,"Verint (VRNT) delivered earnings and revenue surprises of 25.58% and 6.65%, respectively, for the quarter ended October 2024. Do the numbers hold clues to what lies ahead for the stock?",0.15498,Somewhat-Bullish,0.138066,Neutral,0,broad,
VRNT,Curious about Verint  ( VRNT )  Q3 Performance? Explore Wall Street Estimates for Key Metrics,https://www.zacks.com/stock/news/2376484/curious-about-verint-vrnt-q3-performance-explore-wall-street-estimates-for-key-metrics,20241128T141524,Zacks Commentary,"Looking beyond Wall Street's top -and-bottom-line estimate forecasts for Verint (VRNT), delve into some of its key metrics to gain a deeper insight into the company's potential performance for the quarter ended October 2024.",0.121351,Neutral,0.234684,Neutral,0,focused,AI
VRNT,Autodesk Stock Price Increases 27% YTD: How Should You Play It?,https://www.zacks.com/stock/news/2373567/autodesk-stock-price-increases-27-ytd-how-should-you-play-it,20241121T165000,Zacks Commentary,"ADSK's stretched valuation keeps investors on the sideline, while Maintenance revenues and intense competition are headwinds.",0.255636,Somewhat-Bullish,0.121343,Neutral,0,focused,AI
VRNT,Globant  ( GLOB )  Matches Q3 Earnings Estimates,https://www.zacks.com/stock/news/2370707/globant-glob-matches-q3-earnings-estimates,20241114T225502,Zacks Commentary,"Globant (GLOB) delivered earnings and revenue surprises of 0% and 0.05%, respectively, for the quarter ended September 2024. Do the numbers hold clues to what lies ahead for the stock?",0.154555,Somewhat-Bullish,0.20698,Neutral,0,broad,
VRNT,Cisco Systems  ( CSCO )  Surpasses Q1 Earnings and Revenue Estimates,https://www.zacks.com/stock/news/2370011/cisco-systems-csco-surpasses-q1-earnings-and-revenue-estimates,20241113T222007,Zacks Commentary,"Cisco (CSCO) delivered earnings and revenue surprises of 4.60% and 0.57%, respectively, for the quarter ended October 2024. Do the numbers hold clues to what lies ahead for the stock?",0.163801,Somewhat-Bullish,0.202932,Neutral,0,broad,
VRNT,Sapiens  ( SPNS )  Meets Q3 Earnings Estimates,https://www.zacks.com/stock/news/2367890/sapiens-spns-meets-q3-earnings-estimates,20241111T121004,Zacks Commentary,"Sapiens (SPNS) delivered earnings and revenue surprises of 0% and 2.36%, respectively, for the quarter ended September 2024. Do the numbers hold clues to what lies ahead for the stock?",0.165963,Somewhat-Bullish,0.20997,Neutral,0,broad,
VRNT,"Can ADSK's AI-Powered Product Enhancements Push the Stock Higher? - Ansys  ( NASDAQ:ANSS ) , Autodesk  ( NASDAQ:ADSK ) ",https://www.benzinga.com/news/earnings/24/10/41387251/can-adsks-ai-powered-product-enhancements-push-the-stock-higher,20241017T193511,Benzinga,Autodesk ADSK recently announced AI-integrated product developments across segments to enhance performance and efficiency. It aims to simplify complexities related to the manufacturing and designing of products by introducing AI capabilities to Fusion and Alias.,0.357348,Bullish,0.092569,Neutral,0,focused,AI
VRNT,Can ADSK's AI-Powered Product Enhancements Push the Stock Higher?,https://www.zacks.com/stock/news/2352533/can-adsks-ai-powered-product-enhancements-push-the-stock-higher,20241017T153900,Zacks Commentary,Autodesk's new AI-integrated product enhancement across segments is expected to increase efficiency. Creative portfolio tool development bodes well for investors.,0.339992,Somewhat-Bullish,0.094576,Neutral,0,focused,AI
VRNT,Top 3 Tech Stocks That Could Lead To Your Biggest Gains This Month - CoreCard  ( NYSE:CCRD ) ,https://www.benzinga.com/trading-ideas/long-ideas/24/10/41268521/top-3-tech-stocks-that-could-lead-to-your-biggest-gains-this-month,20241010T111101,Benzinga,"The most oversold stocks in the information technology sector presents an opportunity to buy into undervalued companies. The RSI is a momentum indicator, which compares a stock's strength on days when prices go up to its strength on days when prices go down.",0.143748,Neutral,0.241284,Neutral,0,focused,AI
VRNT,Customer Journey Analytics Market is Expected to Expand at a Stellar 20.2% CAGR through 2031 | SkyQuest Technology,https://www.benzinga.com/pressreleases/24/10/g41183030/customer-journey-analytics-market-is-expected-to-expand-at-a-stellar-20-2-cagr-through-2031-skyque,20241004T120000,Benzinga,"Westford,USA, Oct. 04, 2024 ( GLOBE NEWSWIRE ) -- SkyQuest projects that the Customer Journey Analytics market will attain a value of USD 64.21 billion by 2031, with a CAGR of 20.2% over the forecast period ( 2024-2031 ) .",0.34742,Somewhat-Bullish,0.065685,Neutral,0,focused,AI
VRNT,Top 5 Tech Stocks That May Rocket Higher This Month - eGain  ( NASDAQ:EGAN ) ,https://www.benzinga.com/trading-ideas/long-ideas/24/09/41023910/top-5-tech-stocks-that-may-rocket-higher-this-month,20240925T125507,Benzinga,"The most oversold stocks in the information technology sector presents an opportunity to buy into undervalued companies. The RSI is a momentum indicator, which compares a stock's strength on days when prices go up to its strength on days when prices go down.",0.278547,Somewhat-Bullish,0.166551,Somewhat-Bullish,0,focused,AI
VRNT,Short Seller Targets Verint Systems Stock As AI Threat Emerges: 'The Future Is Certainly Not Verint' - Verint Systems  ( NASDAQ:VRNT ) ,https://www.benzinga.com/news/24/09/40942923/short-seller-targets-verint-systems-stock-as-ai-threat-emerges-the-future-is-certainly-not-verint,20240919T155104,Benzinga,Verint Systems Inc VRNT shares are in the spotlight Thursday after The Bear Cave released a bearish report on the contact center company. What To Know: Short-selling firm The Bear Cave has customer experience ( CX ) automation company Verint Systems in its crosshairs.,0.055193,Neutral,0.527969,Neutral,0,focused,"AI, automation"
VRNT,Why Artificial Intelligence Stock Verint Systems Dived by 11% on Thursday,https://www.fool.com/investing/2024/09/05/why-verint-systems-stock-dived-by-11-on-thursday/,20240905T223024,Motley Fool,"Trailing quarterly performance didn't impress the market, and full-year guidance didn't blow anyone away either.",0.34653,Somewhat-Bullish,0.239305,Neutral,0,focused,"artificial intelligence, AI"
VRNT,Verint Q2 Earnings: Taking a Look at Key Metrics Versus Estimates - Verint Systems  ( NASDAQ:VRNT ) ,https://www.benzinga.com/news/earnings/24/09/40721047/verint-q2-earnings-taking-a-look-at-key-metrics-versus-estimates,20240905T192734,Benzinga,"Verint Systems VRNT reported $210.17 million in revenue for the quarter ended July 2024, representing a year-over-year decline of 0.1%. EPS of $0.49 for the same period compares to $0.48 a year ago. The reported revenue compares to the Zacks Consensus Estimate of $213.22 million, representing a ...",0.223557,Somewhat-Bullish,0.240489,Somewhat-Bearish,0,broad,
VRNT,These Analysts cUT Their Forecasts On Verint Systems Following Downbeat Q2 Results - Verint Systems  ( NASDAQ:VRNT ) ,https://www.benzinga.com/news/earnings/24/09/40737739/these-analysts-cut-their-forecasts-on-verint-systems-following-downbeat-q2-results,20240905T175326,Benzinga,Verint Systems Inc. VRNT reported worse-than-expected second-quarter financial results and announced a new $200 million stock buyback program on Wednesday. Verint reported quarterly earnings of 49 cents per share which missed the analyst consensus estimate of 53 cents per share.,0.292071,Somewhat-Bullish,0.331765,Neutral,0,broad,
VRNT,"Verint Reports Downbeat Results, Joins C3.ai, Credo Technology And Other Big Stocks Moving Lower In Thursday's Pre-Market Session - Verint Systems  ( NASDAQ:VRNT ) ",https://www.benzinga.com/news/24/09/40728813/verint-reports-downbeat-results-joins-c3-ai-credo-technology-and-other-big-stocks-moving-lower-in-th,20240905T122853,Benzinga,"U.S. stock futures were mixed this morning, with the Nasdaq futures dipping around 50 points on Thursday. Shares of Verint Systems Inc. VRNT fell sharply in today's pre-market trading after the company reported worse-than-expected second-quarter financial results and announced a new $200 million ...",0.012254,Neutral,0.470174,Neutral,0,focused,AI
VRNT,Why Modular Medical Shares Are Trading Higher By Around 29%; Here Are 20 Stocks Moving Premarket - Modular Medical  ( NASDAQ:MODD ) ,https://www.benzinga.com/pre-market-outlook/24/09/40724911/why-modular-medical-shares-are-trading-higher-by-around-29-here-are-20-stocks-moving-premarket,20240905T093304,Benzinga,"Shares of Modular Medical, Inc. MODD rose sharply in today's pre-market trading. The company announced the FDA clearance of the MODD1 insulin pump. Modular Medical shares jumped 29.1% to $2.53 in the pre-market trading. Here are some other stocks moving in pre-market trading.",0.165396,Somewhat-Bullish,0.162802,Neutral,0,broad,
VRNT,"SAIC, Hewlett Packard Enterprise And 3 Stocks To Watch Heading Into Thursday - Science Applications Intl  ( NASDAQ:SAIC ) ",https://www.benzinga.com/news/earnings/24/09/40723544/saic-hewlett-packard-enterprise-and-3-stocks-to-watch-heading-into-thursday,20240905T064743,Benzinga,"With U.S. stock futures trading slightly lower this morning on Thursday, some of the stocks that may grab investor focus today are as follows: Wall Street expects Science Applications International Corporation SAIC to report quarterly earnings at $1.86 per share on revenue of $1.79 billion before ...",0.253042,Somewhat-Bullish,0.255641,Neutral,0,focused,AI
VRNT,Verint Systems  ( VRNT )  Lags Q2 Earnings and Revenue Estimates,https://www.zacks.com/stock/news/2331704/verint-systems-vrnt-lags-q2-earnings-and-revenue-estimates,20240904T211507,Zacks Commentary,"Verint (VRNT) delivered earnings and revenue surprises of -7.55% and 1.43%, respectively, for the quarter ended July 2024. Do the numbers hold clues to what lies ahead for the stock?",0.161745,Somewhat-Bullish,0.140485,Neutral,0,broad,
VRNT,"Canaan  ( CAN )  Reports Q2 Loss, Tops Revenue Estimates",https://www.zacks.com/stock/news/2322394/canaan-can-reports-q2-loss-tops-revenue-estimates,20240815T110502,Zacks Commentary,"Canaan (CAN) delivered earnings and revenue surprises of 50% and 38.46%, respectively, for the quarter ended June 2024. Do the numbers hold clues to what lies ahead for the stock?",0.112148,Neutral,0.20997,Neutral,0,broad,
VRNT,"Rigetti Computing, Inc.  ( RGTI )  Reports Q2 Loss, Lags Revenue Estimates",https://www.zacks.com/stock/news/2319512/rigetti-computing-inc-rgti-reports-q2-loss-lags-revenue-estimates,20240808T212009,Zacks Commentary,"Rigetti Computing (RGTI) delivered earnings and revenue surprises of 30% and 12.58%, respectively, for the quarter ended June 2024. Do the numbers hold clues to what lies ahead for the stock?",0.112363,Neutral,0.208166,Neutral,0,broad,
VRNT,"Lawful Interception (LI) Market size is set to grow by USD 14.35 billion from 2024-2028, Increasing vulnerability to crime and terrorism to boost the market growth, Technavio - PR Newswire",https://www.prnewswire.com/news-releases/lawful-interception-li-market-size-is-set-to-grow-by-usd-14-35-billion-from-2024-2028--increasing-vulnerability-to-crime-and-terrorism-to-boost-the-market-growth-technavio-302195118.html,20240712T214500,PR Newswire,"Lawful Interception ( LI ) Market size is set to grow by USD 14.35 billion from 2024-2028, Increasing vulnerability to crime and terrorism to boost the market growth, Technavio PR ...",0.190595,Somewhat-Bullish,0.030485,Neutral,0,broad,
VRNT,Verint Systems Sees Relative Strength Rating Improve To 71,https://www.investors.com/ibd-data-stories/verint-systems-sees-relative-strength-rating-improve-to-71/,20240712T070000,Investors Business Daily,"Verint Systems ( VRNT ) had its Relative Strength ( RS ) Rating upgraded from 64 to 71 Friday - a welcome improvement, but still below the 80 or higher score you look for.",0.48874,Bullish,0.651499,Bullish,0,broad,
VRNT,Insider Selling: Dan Bodner Unloads $12.66M Of Verint Systems Stock - Verint Systems  ( NASDAQ:VRNT ) ,https://www.benzinga.com/insights/news/24/06/39482848/insider-selling-dan-bodner-unloads-12-66m-of-verint-systems-stock,20240625T150147,Benzinga,"Dan Bodner, Chairman & CEO at Verint Systems VRNT, reported an insider sell on June 24, according to a new SEC filing. What Happened: A Form 4 filing from the U.S. Securities and Exchange Commission on Monday showed that Bodner sold 375,000 shares of Verint Systems.",0.264279,Somewhat-Bullish,0.350564,Bullish,0,focused,AI
VRNT,Verint Systems Insider Trades Send A Signal - Verint Systems  ( NASDAQ:VRNT ) ,https://www.benzinga.com/insights/news/24/06/39434702/verint-systems-insider-trades-send-a-signal,20240621T150254,Benzinga,"Elan Moriah, President at Verint Systems VRNT, executed a substantial insider sell on June 20, according to an SEC filing. What Happened: A Form 4 filing from the U.S. Securities and Exchange Commission on Thursday showed that Moriah sold 4,954 shares of Verint Systems.",0.292052,Somewhat-Bullish,0.295867,Bullish,0,broad,
VRNT,Verint Systems Chairman & CEO Sold $500K In Company Stock - Verint Systems  ( NASDAQ:VRNT ) ,https://www.benzinga.com/insights/news/24/06/39434700/verint-systems-chairman-ceo-sold-500k-in-company-stock,20240621T150250,Benzinga,"Revealing a significant insider sell on June 20, Dan Bodner, Chairman & CEO at Verint Systems VRNT, as per the latest SEC filing. What Happened: After conducting a thorough analysis, Bodner sold 14,277 shares of Verint Systems. This information was disclosed in a Form 4 filing with the U.S.",0.310403,Somewhat-Bullish,0.411656,Bullish,0,focused,AI
VRNT,"Ollie's Bargain Outlet Posts Upbeat Earnings, Joins Verint Systems, Guidewire Software And Other Big Stocks Moving Higher On Wednesday - Ollie's Bargain Outlet  ( NASDAQ:OLLI ) ",https://www.benzinga.com/news/24/06/39186219/ollies-bargain-outlet-posts-upbeat-earnings-joins-verint-systems-guidewire-software-and-other-big-st,20240605T142346,Benzinga,"U.S. stocks were mixed, with the Dow Jones index falling more than 100 points on Wednesday. Shares of Ollie's Bargain Outlet Holdings, Inc. OLLI rose sharply during Wednesday's session following better-than-expected first-quarter earnings.",0.345066,Somewhat-Bullish,0.136888,Bullish,0,focused,AI
VRNT,Verint Systems  ( VRNT )  Surpasses Q1 Earnings and Revenue Estimates,https://www.zacks.com/stock/news/2283604/verint-systems-vrnt-surpasses-q1-earnings-and-revenue-estimates,20240604T211504,Zacks Commentary,"Verint (VRNT) delivered earnings and revenue surprises of 9.26% and 3.06%, respectively, for the quarter ended April 2024. Do the numbers hold clues to what lies ahead for the stock?",0.157386,Somewhat-Bullish,0.140485,Neutral,0,broad,
VRNT,"Workforce Management Software Market size is set to grow by USD 3.07 billion from 2024-2028, Regulatory ... - PR Newswire",https://www.prnewswire.com/news-releases/workforce-management-software-market-size-is-set-to-grow-by-usd-3-07-billion-from-2024-2028--regulatory-compliance-associated-with-workforce-management-to-boost-the-market-growth-technavio-302159378.html,20240531T093600,PR Newswire,"Workforce Management Software Market size is set to grow by USD 3.07 billion from 2024-2028, Regulatory ... PR ...",0.383733,Bullish,0.037504,Neutral,0,broad,
VRNT,Countdown to Verint  ( VRNT )  Q1 Earnings: A Look at Estimates Beyond Revenue and EPS,https://www.zacks.com/stock/news/2281219/countdown-to-verint-vrnt-q1-earnings-a-look-at-estimates-beyond-revenue-and-eps,20240530T131507,Zacks Commentary,Get a deeper insight into the potential performance of Verint (VRNT) for the quarter ended April 2024 by going beyond Wall Street's top -and-bottom-line estimates and examining the estimates for some of its key metrics.,0.18029,Somewhat-Bullish,0.236972,Somewhat-Bullish,0,broad,
VRNT,"Stratasys  ( SSYS )  Reports Q1 Loss, Misses Revenue Estimates",https://www.zacks.com/stock/news/2280917/stratasys-ssys-reports-q1-loss-misses-revenue-estimates,20240529T213004,Zacks Commentary,"Stratasys (SSYS) delivered earnings and revenue surprises of 50% and 2.36%, respectively, for the quarter ended March 2024. Do the numbers hold clues to what lies ahead for the stock?",0.127825,Neutral,0.204072,Neutral,0,broad,
VRNT,Synopsys  ( SNPS )  Q2 Earnings and Revenues Lag Estimates,https://www.zacks.com/stock/news/2277561/synopsys-snps-q2-earnings-and-revenues-lag-estimates,20240522T212002,Zacks Commentary,"Synopsys (SNPS) delivered earnings and revenue surprises of -0.99% and 3.83%, respectively, for the quarter ended April 2024. Do the numbers hold clues to what lies ahead for the stock?",0.157158,Somewhat-Bullish,0.205225,Neutral,0,broad,
VRNT,Correction: Final Results,https://www.globenewswire.com/news-release/2024/05/03/2875304/0/en/Correction-Final-Results.html,20240503T171000,GlobeNewswire,This announcement replaces the Final Results announcement released at 18:00 on 24 April 2024 which included an incorrect reference to the dividend being paid on 24 May 2024 to shareholders on the register as at 5 May 2024.,0.247612,Somewhat-Bullish,0.004782,Neutral,0,focused,AI
VRNT,Enterprise AI Market to Be Worth $171.2 Billion by 2031--Exclusive Report by Meticulous Research®,https://www.prnewswire.com/news-releases/enterprise-ai-market-to-be-worth-171-2-billion-by-2031exclusive-report-by-meticulous-research-302134856.html,20240502T164500,PR Newswire,"REDDING, Calif., May 2, 2024 /PRNewswire/ -- According to a new market research report titled, 'Enterprise AI Market by Offering ( Solutions, Services ) , Deployment Mode, Organization Size, Technology ( ML, NLP ) , End-use Industry ( IT & Telecom, Healthcare, Retail & E-commerce, Media & ...",0.333471,Somewhat-Bullish,0.024347,Neutral,0,focused,"AI, ML, NLP"
VRNT,"Voice and Speech Analytics Market size is set to grow by USD 2.56 billion from 2023-2027, growth in emotion analytics ... - PR Newswire",https://www.prnewswire.com/news-releases/voice-and-speech-analytics-market-size-is-set-to-grow-by-usd-2-56-billion-from-2023-2027--growth-in-emotion-analytics-to-boost-the-market-growth-technavio-302129558.html,20240429T184500,PR Newswire,"Voice and Speech Analytics Market size is set to grow by USD 2.56 billion from 2023-2027, growth in emotion analytics ... PR ...",0.317644,Somewhat-Bullish,0.075516,Neutral,0,broad,
VRNT,Final Results,https://www.globenewswire.com/news-release/2024/04/24/2868955/0/en/Final-Results.html,20240424T170000,GlobeNewswire,OCTOPUS TITAN ...,0.24988,Somewhat-Bullish,0.004812,Neutral,0,broad,
VRNT,Savvy Security Establishes Executive Advisory Board Amid Significant First-Year Growth,https://www.benzinga.com/pressreleases/24/04/g38403363/savvy-security-establishes-executive-advisory-board-amid-significant-first-year-growth,20240424T130000,Benzinga,"TEL AVIV, Israel, April 24, 2024 ( GLOBE NEWSWIRE ) -- Savvy, an identity-first software-as-a-service ( SaaS ) security platform provider, today announced it has established an executive advisory board made up of seasoned industry leaders spanning enterprise software, identity, security and risk ...",0.194917,Somewhat-Bullish,0.025139,Neutral,0,broad,
VRNT,"Delta Air Lines, McDonald's And 2 Other Stocks Insiders Are Selling - Delta Air Lines  ( NYSE:DAL ) , McDonald's  ( NYSE:MCD ) ",https://www.benzinga.com/news/24/04/38401948/delta-air-lines-mcdonalds-and-2-other-stocks-insiders-are-selling,20240424T121044,Benzinga,"The Nasdaq 100 closed higher by around 1.5% on Tuesday. Investors, meanwhile, focused on some notable insider trades. When insiders sell shares, it could be a preplanned sale, or could indicate their concern in the company's prospects or that they view the stock as being overpriced.",0.22917,Somewhat-Bullish,0.342093,Bullish,0,focused,AI
VRNT,Richard N Nottenburg Executes Sell Order: Offloads $164K In Verint Systems Stock - Verint Systems  ( NASDAQ:VRNT ) ,https://www.benzinga.com/insights/news/24/04/38273628/richard-n-nottenburg-executes-sell-order-offloads-164k-in-verint-systems-stock,20240416T150057,Benzinga,"It was reported on April 15, that Richard N Nottenburg, Board Member at Verint Systems VRNT executed a significant insider sell, according to an SEC filing. What Happened: Nottenburg opted to sell 5,274 shares of Verint Systems, according to a Form 4 filing with the U.S.",0.290078,Somewhat-Bullish,0.244723,Bullish,0,broad,
VRNT,Stocks With Rising Relative Strength: Verint Systems,https://www.investors.com/ibd-data-stories/stocks-with-rising-relative-strength-verint-systems-3/,20240410T070000,Investors Business Daily,"The Relative Strength ( RS ) Rating for Verint Systems ( VRNT ) moved into a new percentile Wednesday, as it got a lift from 67 to 75. X This exclusive rating from Investor's Business Daily identifies market leadership with a 1 ( worst ) to 99 ( best ) score.",0.230034,Somewhat-Bullish,0.580018,Somewhat-Bullish,0,focused,AI
VRNT,Insider Unloading: Peter Fante Sells $261K Worth Of Verint Systems Shares - Verint Systems  ( NASDAQ:VRNT ) ,https://www.benzinga.com/insights/news/24/04/38111822/insider-unloading-peter-fante-sells-261k-worth-of-verint-systems-shares,20240405T150049,Benzinga,"It was reported on April 4, that Peter Fante, Chief Administrative Officer at Verint Systems VRNT executed a significant insider sell, according to an SEC filing. What Happened: A Form 4 filing from the U.S. Securities and Exchange Commission on Thursday showed that Fante sold 8,329 shares of ...",0.301848,Somewhat-Bullish,0.458593,Bullish,0,broad,
VRNT,VRNT or INTU: Which Is the Better Value Stock Right Now?,https://www.zacks.com/stock/news/2249925/vrnt-or-intu-which-is-the-better-value-stock-right-now,20240403T154011,Zacks Commentary,VRNT vs. INTU: Which Stock Is the Better Value Option?,0.48754,Bullish,0.792512,Bullish,0,broad,
